{"timestamp":1758473208002,"isoTimestamp":"2025-09-21T16:46:48.002Z","type":"console","operation":"CONSOLE_LOGS","entity":"frontend","count":20,"messages":[{"timestamp":1758473207992,"isoTimestamp":"2025-09-21T16:46:47.992Z","level":"log","message":"ðŸŒ² Rendering node: partner-3 Microsoft Azure partner","args":["ðŸŒ² Rendering node:","partner-3","Microsoft Azure","partner"],"source":"frontend"},{"timestamp":1758473207992,"isoTimestamp":"2025-09-21T16:46:47.992Z","level":"log","message":"ðŸŒ² Rendering node: partner-4 IBM Cloud partner","args":["ðŸŒ² Rendering node:","partner-4","IBM Cloud","partner"],"source":"frontend"},{"timestamp":1758473207992,"isoTimestamp":"2025-09-21T16:46:47.992Z","level":"log","message":"ðŸŒ² Rendering node: partner-5 Oracle Cloud partner","args":["ðŸŒ² Rendering node:","partner-5","Oracle Cloud","partner"],"source":"frontend"},{"timestamp":1758473207993,"isoTimestamp":"2025-09-21T16:46:47.993Z","level":"log","message":"ðŸŒ² Rendering node: partner-6 Alibaba Cloud partner","args":["ðŸŒ² Rendering node:","partner-6","Alibaba Cloud","partner"],"source":"frontend"},{"timestamp":1758473207993,"isoTimestamp":"2025-09-21T16:46:47.993Z","level":"log","message":"ðŸŒ² Rendering node: partner-7 DigitalOcean partner","args":["ðŸŒ² Rendering node:","partner-7","DigitalOcean","partner"],"source":"frontend"},{"timestamp":1758473207993,"isoTimestamp":"2025-09-21T16:46:47.993Z","level":"log","message":"ðŸŒ² Rendering node: partner-8 Akamai Connected Cloud (Linode) partner","args":["ðŸŒ² Rendering node:","partner-8","Akamai Connected Cloud (Linode)","partner"],"source":"frontend"},{"timestamp":1758473207994,"isoTimestamp":"2025-09-21T16:46:47.994Z","level":"log","message":"ðŸŒ² Rendering node: partner-9 Vultr partner","args":["ðŸŒ² Rendering node:","partner-9","Vultr","partner"],"source":"frontend"},{"timestamp":1758473207994,"isoTimestamp":"2025-09-21T16:46:47.994Z","level":"log","message":"ðŸŒ² Rendering node: partner-10 OVHcloud partner","args":["ðŸŒ² Rendering node:","partner-10","OVHcloud","partner"],"source":"frontend"},{"timestamp":1758473207994,"isoTimestamp":"2025-09-21T16:46:47.994Z","level":"log","message":"ðŸŒ² Rendering node: partner-11 Hetzner partner","args":["ðŸŒ² Rendering node:","partner-11","Hetzner","partner"],"source":"frontend"},{"timestamp":1758473207995,"isoTimestamp":"2025-09-21T16:46:47.995Z","level":"log","message":"ðŸŒ² Rendering node: partner-12 Equinix Metal partner","args":["ðŸŒ² Rendering node:","partner-12","Equinix Metal","partner"],"source":"frontend"},{"timestamp":1758473207995,"isoTimestamp":"2025-09-21T16:46:47.995Z","level":"log","message":"ðŸŒ² Rendering node: partner-13 Cloudflare partner","args":["ðŸŒ² Rendering node:","partner-13","Cloudflare","partner"],"source":"frontend"},{"timestamp":1758473207995,"isoTimestamp":"2025-09-21T16:46:47.995Z","level":"log","message":"ðŸŒ² Rendering node: partner-14 Contabo partner","args":["ðŸŒ² Rendering node:","partner-14","Contabo","partner"],"source":"frontend"},{"timestamp":1758473207996,"isoTimestamp":"2025-09-21T16:46:47.996Z","level":"log","message":"ðŸŒ² Rendering node: partner-15 Scaleway partner","args":["ðŸŒ² Rendering node:","partner-15","Scaleway","partner"],"source":"frontend"},{"timestamp":1758473207996,"isoTimestamp":"2025-09-21T16:46:47.996Z","level":"log","message":"ðŸŒ² Rendering node: partner-16 Dell Technologies partner","args":["ðŸŒ² Rendering node:","partner-16","Dell Technologies","partner"],"source":"frontend"},{"timestamp":1758473207996,"isoTimestamp":"2025-09-21T16:46:47.996Z","level":"log","message":"ðŸŒ² Rendering node: partner-17 Hewlett Packard Enterprise partner","args":["ðŸŒ² Rendering node:","partner-17","Hewlett Packard Enterprise","partner"],"source":"frontend"},{"timestamp":1758473207996,"isoTimestamp":"2025-09-21T16:46:47.996Z","level":"log","message":"ðŸŒ² Rendering node: partner-18 Cisco Systems partner","args":["ðŸŒ² Rendering node:","partner-18","Cisco Systems","partner"],"source":"frontend"},{"timestamp":1758473207997,"isoTimestamp":"2025-09-21T16:46:47.997Z","level":"log","message":"ðŸŒ² Rendering node: partner-19 Juniper Networks partner","args":["ðŸŒ² Rendering node:","partner-19","Juniper Networks","partner"],"source":"frontend"},{"timestamp":1758473207997,"isoTimestamp":"2025-09-21T16:46:47.997Z","level":"log","message":"ðŸŒ² Rendering node: partner-20 VMware partner","args":["ðŸŒ² Rendering node:","partner-20","VMware","partner"],"source":"frontend"},{"timestamp":1758473207997,"isoTimestamp":"2025-09-21T16:46:47.997Z","level":"log","message":"ðŸŒ² Rendering node: partner-21 Red Hat partner","args":["ðŸŒ² Rendering node:","partner-21","Red Hat","partner"],"source":"frontend"},{"timestamp":1758473207998,"isoTimestamp":"2025-09-21T16:46:47.998Z","level":"log","message":"ðŸŒ² Rendering node: partner-22 Canonical (Ubuntu) partner","args":["ðŸŒ² Rendering node:","partner-22","Canonical (Ubuntu)","partner"],"source":"frontend"}],"metadata":{"source":"frontend","sessionId":"unknown"}}
{"timestamp":1758473208011,"isoTimestamp":"2025-09-21T16:46:48.011Z","type":"console","operation":"CONSOLE_LOGS","entity":"frontend","count":20,"messages":[{"timestamp":1758473207998,"isoTimestamp":"2025-09-21T16:46:47.998Z","level":"log","message":"ðŸŒ² Rendering node: partner-23 ACME Corporation partner","args":["ðŸŒ² Rendering node:","partner-23","ACME Corporation","partner"],"source":"frontend"},{"timestamp":1758473207998,"isoTimestamp":"2025-09-21T16:46:47.998Z","level":"log","message":"ðŸŒ² Rendering node: partner-24 Telcobright partner","args":["ðŸŒ² Rendering node:","partner-24","Telcobright","partner"],"source":"frontend"},{"timestamp":1758473207999,"isoTimestamp":"2025-09-21T16:46:47.999Z","level":"log","message":"ðŸŒ² Rendering node: partner-25 Tech Solutions Inc partner","args":["ðŸŒ² Rendering node:","partner-25","Tech Solutions Inc","partner"],"source":"frontend"},{"timestamp":1758473207999,"isoTimestamp":"2025-09-21T16:46:47.999Z","level":"log","message":"ðŸŒ² Rendering node: partner-26 Global Systems Ltd partner","args":["ðŸŒ² Rendering node:","partner-26","Global Systems Ltd","partner"],"source":"frontend"},{"timestamp":1758473207999,"isoTimestamp":"2025-09-21T16:46:47.999Z","level":"log","message":"ðŸŒ² Rendering node: partner-27 Cloud Dynamics partner","args":["ðŸŒ² Rendering node:","partner-27","Cloud Dynamics","partner"],"source":"frontend"},{"timestamp":1758473208004,"isoTimestamp":"2025-09-21T16:46:48.004Z","level":"log","message":"ðŸ“Š renderTreeItems called with 27 nodes: [\n  {\n    \"id\": \"partner-1\",\n    \"name\": \"Amazon Web Services (AWS)\",\n    \"type\": \"partner\",\n    \"data\": {\n      \"id\": 1,\n      \"name\": \"amazon\",\n      \"displayName\": \"Amazon Web Services (AWS)\",\n      \"type\": \"cloud-provider\",\n      \"roles\": [\n        \"cloud-provider\",\n        \"vendor\"\n      ],\n      \"status\": \"ACTIVE\",\n      \"contactEmail\": \"billing@aws.amazon.com\",\n      \"website\": \"https://aws.amazon.com\"\n    },\n    \"children\": []\n  },\n  {\n    \"id\": \"partner-2\",\n    \"name\": \"Google Cloud Platform\",\n    \"type\": \"partner\",\n    \"data\": {\n      \"id\": 2,\n      \"name\": \"google\",\n      \"displayName\": \"Google Cloud Platform\",\n      \"type\": \"cloud-provider\",\n      \"roles\": [\n        \"cloud-provider\",\n        \"vendor\"\n      ],\n      \"status\": \"ACTIVE\",\n      \"contactEmail\": \"billing@cloud.google.com\",\n      \"website\": \"https://cloud.google.com\"\n    },\n    \"children\": []\n  },\n  {\n    \"id\": \"partner-3\",\n    \"name\": \"Microsoft Azure\",\n    \"type\": \"partner\",\n    \"data\": {\n      \"id\": 3,\n      \"name\": \"microsoft\",\n      \"displayName\": \"Microsoft Azure\",\n      \"type\": \"cloud-provider\",\n      \"roles\": [\n        \"cloud-provider\",\n        \"vendor\"\n      ],\n      \"status\": \"ACTIVE\",\n      \"contactEmail\": \"billing@azure.microsoft.com\",\n      \"website\": \"https://azure.microsoft.com\"\n    },\n    \"children\": []\n  },\n  {\n    \"id\": \"partner-4\",\n    \"name\": \"IBM Cloud\",\n    \"type\": \"partner\",\n    \"data\": {\n      \"id\": 4,\n      \"name\": \"ibm\",\n      \"displayName\": \"IBM Cloud\",\n      \"type\": \"cloud-provider\",\n      \"roles\": [\n        \"cloud-provider\",\n        \"vendor\"\n      ],\n      \"status\": \"ACTIVE\",\n      \"contactEmail\": \"billing@ibm.com\",\n      \"website\": \"https://www.ibm.com/cloud\"\n    },\n    \"children\": []\n  },\n  {\n    \"id\": \"partner-5\",\n    \"name\": \"Oracle Cloud\",\n    \"type\": \"partner\",\n    \"data\": {\n      \"id\": 5,\n      \"name\": \"oracle\",\n      \"displayName\": \"Oracle Cloud\",\n      \"type\": \"cloud-provider\",\n      \"roles\": [\n        \"cloud-provider\",\n        \"vendor\"\n      ],\n      \"status\": \"ACTIVE\",\n      \"contactEmail\": \"billing@oracle.com\",\n      \"website\": \"https://www.oracle.com/cloud\"\n    },\n    \"children\": []\n  },\n  {\n    \"id\": \"partner-6\",\n    \"name\": \"Alibaba Cloud\",\n    \"type\": \"partner\",\n    \"data\": {\n      \"id\": 6,\n      \"name\": \"alibaba\",\n      \"displayName\": \"Alibaba Cloud\",\n      \"type\": \"cloud-provider\",\n      \"roles\": [\n        \"cloud-provider\",\n        \"vendor\"\n      ],\n      \"status\": \"ACTIVE\",\n      \"contactEmail\": \"billing@alibabacloud.com\",\n      \"website\": \"https://www.alibabacloud.com\"\n    },\n    \"children\": []\n  },\n  {\n    \"id\": \"partner-7\",\n    \"name\": \"DigitalOcean\",\n    \"type\": \"partner\",\n    \"data\": {\n      \"id\": 7,\n      \"name\": \"digitalocean\",\n      \"displayName\": \"DigitalOcean\",\n      \"type\": \"cloud-provider\",\n      \"roles\": [\n        \"cloud-provider\",\n        \"vendor\"\n      ],\n      \"status\": \"ACTIVE\",\n      \"contactEmail\": \"billing@digitalocean.com\",\n      \"website\": \"https://www.digitalocean.com\"\n    },\n    \"children\": []\n  },\n  {\n    \"id\": \"partner-8\",\n    \"name\": \"Akamai Connected Cloud (Linode)\",\n    \"type\": \"partner\",\n    \"data\": {\n      \"id\": 8,\n      \"name\": \"linode\",\n      \"displayName\": \"Akamai Connected Cloud (Linode)\",\n      \"type\": \"cloud-provider\",\n      \"roles\": [\n        \"cloud-provider\",\n        \"vendor\"\n      ],\n      \"status\": \"ACTIVE\",\n      \"contactEmail\": \"billing@linode.com\",\n      \"website\": \"https://www.linode.com\"\n    },\n    \"children\": []\n  },\n  {\n    \"id\": \"partner-9\",\n    \"name\": \"Vultr\",\n    \"type\": \"partner\",\n    \"data\": {\n      \"id\": 9,\n      \"name\": \"vultr\",\n      \"displayName\": \"Vultr\",\n      \"type\": \"cloud-provider\",\n      \"roles\": [\n        \"cloud-provider\",\n        \"vendor\"\n      ],\n      \"status\": \"ACTIVE\",\n      \"contactEmail\": \"billing@vultr.com\",\n      \"website\": \"https://www.vultr.com\"\n    },\n    \"children\": []\n  },\n  {\n    \"id\": \"partner-10\",\n    \"name\": \"OVHcloud\",\n    \"type\": \"partner\",\n    \"data\": {\n      \"id\": 10,\n      \"name\": \"ovhcloud\",\n      \"displayName\": \"OVHcloud\",\n      \"type\": \"cloud-provider\",\n      \"roles\": [\n        \"cloud-provider\",\n        \"vendor\"\n      ],\n      \"status\": \"ACTIVE\",\n      \"contactEmail\": \"billing@ovhcloud.com\",\n      \"website\": \"https://www.ovhcloud.com\"\n    },\n    \"children\": []\n  },\n  {\n    \"id\": \"partner-11\",\n    \"name\": \"Hetzner\",\n    \"type\": \"partner\",\n    \"data\": {\n      \"id\": 11,\n      \"name\": \"hetzner\",\n      \"displayName\": \"Hetzner\",\n      \"type\": \"cloud-provider\",\n      \"roles\": [\n        \"cloud-provider\",\n        \"vendor\"\n      ],\n      \"status\": \"ACTIVE\",\n      \"contactEmail\": \"billing@hetzner.com\",\n      \"website\": \"https://www.hetzner.com\"\n    },\n    \"children\": []\n  },\n  {\n    \"id\": \"partner-12\",\n    \"name\": \"Equinix Metal\",\n    \"type\": \"partner\",\n    \"data\": {\n      \"id\": 12,\n      \"name\": \"equinix\",\n      \"displayName\": \"Equinix Metal\",\n      \"type\": \"cloud-provider\",\n      \"roles\": [\n        \"cloud-provider\",\n        \"vendor\"\n      ],\n      \"status\": \"ACTIVE\",\n      \"contactEmail\": \"billing@equinix.com\",\n      \"website\": \"https://metal.equinix.com\"\n    },\n    \"children\": []\n  },\n  {\n    \"id\": \"partner-13\",\n    \"name\": \"Cloudflare\",\n    \"type\": \"partner\",\n    \"data\": {\n      \"id\": 13,\n      \"name\": \"cloudflare\",\n      \"displayName\": \"Cloudflare\",\n      \"type\": \"cloud-provider\",\n      \"roles\": [\n        \"cloud-provider\",\n        \"vendor\"\n      ],\n      \"status\": \"ACTIVE\",\n      \"contactEmail\": \"billing@cloudflare.com\",\n      \"website\": \"https://www.cloudflare.com\"\n    },\n    \"children\": []\n  },\n  {\n    \"id\": \"partner-14\",\n    \"name\": \"Contabo\",\n    \"type\": \"partner\",\n    \"data\": {\n      \"id\": 14,\n      \"name\": \"contabo\",\n      \"displayName\": \"Contabo\",\n      \"type\": \"cloud-provider\",\n      \"roles\": [\n        \"cloud-provider\",\n        \"vendor\"\n      ],\n      \"status\": \"ACTIVE\",\n      \"contactEmail\": \"billing@contabo.com\",\n      \"website\": \"https://contabo.com\"\n    },\n    \"children\": []\n  },\n  {\n    \"id\": \"partner-15\",\n    \"name\": \"Scaleway\",\n    \"type\": \"partner\",\n    \"data\": {\n      \"id\": 15,\n      \"name\": \"scaleway\",\n      \"displayName\": \"Scaleway\",\n      \"type\": \"cloud-provider\",\n      \"roles\": [\n        \"cloud-provider\",\n        \"vendor\"\n      ],\n      \"status\": \"ACTIVE\",\n      \"contactEmail\": \"billing@scaleway.com\",\n      \"website\": \"https://www.scaleway.com\"\n    },\n    \"children\": []\n  },\n  {\n    \"id\": \"partner-16\",\n    \"name\": \"Dell Technologies\",\n    \"type\": \"partner\",\n    \"data\": {\n      \"id\": 16,\n      \"name\": \"dell\",\n      \"displayName\": \"Dell Technologies\",\n      \"type\": \"vendor\",\n      \"roles\": [\n        \"hardware-vendor\",\n        \"vendor\"\n      ],\n      \"status\": \"ACTIVE\",\n      \"contactEmail\": \"sales@dell.com\",\n      \"website\": \"https://www.dell.com\"\n    },\n    \"children\": []\n  },\n  {\n    \"id\": \"partner-17\",\n    \"name\": \"Hewlett Packard Enterprise\",\n    \"type\": \"partner\",\n    \"data\": {\n      \"id\": 17,\n      \"name\": \"hp\",\n      \"displayName\": \"Hewlett Packard Enterprise\",\n      \"type\": \"vendor\",\n      \"roles\": [\n        \"hardware-vendor\",\n        \"vendor\"\n      ],\n      \"status\": \"ACTIVE\",\n      \"contactEmail\": \"sales@hpe.com\",\n      \"website\": \"https://www.hpe.com\"\n    },\n    \"children\": []\n  },\n  {\n    \"id\": \"partner-18\",\n    \"name\": \"Cisco Systems\",\n    \"type\": \"partner\",\n    \"data\": {\n      \"id\": 18,\n      \"name\": \"cisco\",\n      \"displayName\": \"Cisco Systems\",\n      \"type\": \"vendor\",\n      \"roles\": [\n        \"network-vendor\",\n        \"vendor\"\n      ],\n      \"status\": \"ACTIVE\",\n      \"contactEmail\": \"sales@cisco.com\",\n      \"website\": \"https://www.cisco.com\"\n    },\n    \"children\": []\n  },\n  {\n    \"id\": \"partner-19\",\n    \"name\": \"Juniper Networks\",\n    \"type\": \"partner\",\n    \"data\": {\n      \"id\": 19,\n      \"name\": \"juniper\",\n      \"displayName\": \"Juniper Networks\",\n      \"type\": \"vendor\",\n      \"roles\": [\n        \"network-vendor\",\n        \"vendor\"\n      ],\n      \"status\": \"ACTIVE\",\n      \"contactEmail\": \"sales@juniper.net\",\n      \"website\": \"https://www.juniper.net\"\n    },\n    \"children\": []\n  },\n  {\n    \"id\": \"partner-20\",\n    \"name\": \"VMware\",\n    \"type\": \"partner\",\n    \"data\": {\n      \"id\": 20,\n      \"name\": \"vmware\",\n      \"displayName\": \"VMware\",\n      \"type\": \"vendor\",\n      \"roles\": [\n        \"software-vendor\",\n        \"vendor\"\n      ],\n      \"status\": \"ACTIVE\",\n      \"contactEmail\": \"sales@vmware.com\",\n      \"website\": \"https://www.vmware.com\"\n    },\n    \"children\": []\n  },\n  {\n    \"id\": \"partner-21\",\n    \"name\": \"Red Hat\",\n    \"type\": \"partner\",\n    \"data\": {\n      \"id\": 21,\n      \"name\": \"redhat\",\n      \"displayName\": \"Red Hat\",\n      \"type\": \"vendor\",\n      \"roles\": [\n        \"software-vendor\",\n        \"vendor\"\n      ],\n      \"status\": \"ACTIVE\",\n      \"contactEmail\": \"sales@redhat.com\",\n      \"website\": \"https://www.redhat.com\"\n    },\n    \"children\": []\n  },\n  {\n    \"id\": \"partner-22\",\n    \"name\": \"Canonical (Ubuntu)\",\n    \"type\": \"partner\",\n    \"data\": {\n      \"id\": 22,\n      \"name\": \"canonical\",\n      \"displayName\": \"Canonical (Ubuntu)\",\n      \"type\": \"vendor\",\n      \"roles\": [\n        \"software-vendor\",\n        \"vendor\"\n      ],\n      \"status\": \"ACTIVE\",\n      \"contactEmail\": \"sales@canonical.com\",\n      \"website\": \"https://canonical.com\"\n    },\n    \"children\": []\n  },\n  {\n    \"id\": \"partner-23\",\n    \"name\": \"ACME Corporation\",\n    \"type\": \"partner\",\n    \"data\": {\n      \"id\": 23,\n      \"name\": \"acme-corp\",\n      \"displayName\": \"ACME Corporation\",\n      \"type\": \"customer\",\n      \"roles\": [\n        \"customer\"\n      ],\n      \"status\": \"ACTIVE\",\n      \"contactEmail\": \"contact@acme.com\",\n      \"website\": \"https://acme.com\"\n    },\n    \"children\": []\n  },\n  {\n    \"id\": \"partner-24\",\n    \"name\": \"Telcobright\",\n    \"type\": \"partner\",\n    \"data\": {\n      \"id\": 24,\n      \"name\": \"telcobright\",\n      \"displayName\": \"Telcobright\",\n      \"type\": \"service-provider\",\n      \"roles\": [\n        \"self\"\n      ],\n      \"status\": \"ACTIVE\",\n      \"contactEmail\": \"admin@telcobright.com\",\n      \"website\": \"https://telcobright.com\"\n    },\n    \"children\": []\n  },\n  {\n    \"id\": \"partner-25\",\n    \"name\": \"Tech Solutions Inc\",\n    \"type\": \"partner\",\n    \"data\": {\n      \"id\": 25,\n      \"name\": \"tech-solutions\",\n      \"displayName\": \"Tech Solutions Inc\",\n      \"type\": \"VENDOR\",\n      \"roles\": [\n        \"vendor\"\n      ],\n      \"status\": \"ACTIVE\",\n      \"contactEmail\": \"info@techsolutions.com\",\n      \"website\": \"https://www.techsolutions.com\"\n    },\n    \"children\": []\n  },\n  {\n    \"id\": \"partner-26\",\n    \"name\": \"Global Systems Ltd\",\n    \"type\": \"partner\",\n    \"data\": {\n      \"id\": 26,\n      \"name\": \"global-systems\",\n      \"displayName\": \"Global Systems Ltd\",\n      \"type\": \"CUSTOMER\",\n      \"roles\": [\n        \"customer\"\n      ],\n      \"status\": \"ACTIVE\",\n      \"contactEmail\": \"support@globalsystems.com\",\n      \"website\": \"https://www.globalsystems.com\"\n    },\n    \"children\": []\n  },\n  {\n    \"id\": \"partner-27\",\n    \"name\": \"Cloud Dynamics\",\n    \"type\": \"partner\",\n    \"data\": {\n      \"id\": 27,\n      \"name\": \"cloud-dynamics\",\n      \"displayName\": \"Cloud Dynamics\",\n      \"type\": \"VENDOR\",\n      \"roles\": [\n        \"vendor\"\n      ],\n      \"status\": \"ACTIVE\",\n      \"contactEmail\": \"hello@clouddynamics.io\",\n      \"website\": \"https://www.clouddynamics.io\"\n    },\n    \"children\": []\n  }\n]","args":["ðŸ“Š renderTreeItems called with",27,"nodes:",[{"id":"partner-1","name":"Amazon Web Services (AWS)","type":"partner","data":{"id":1,"name":"amazon","displayName":"Amazon Web Services (AWS)","type":"cloud-provider","roles":["cloud-provider","vendor"],"status":"ACTIVE","contactEmail":"billing@aws.amazon.com","website":"https://aws.amazon.com"},"children":[]},{"id":"partner-2","name":"Google Cloud Platform","type":"partner","data":{"id":2,"name":"google","displayName":"Google Cloud Platform","type":"cloud-provider","roles":["cloud-provider","vendor"],"status":"ACTIVE","contactEmail":"billing@cloud.google.com","website":"https://cloud.google.com"},"children":[]},{"id":"partner-3","name":"Microsoft Azure","type":"partner","data":{"id":3,"name":"microsoft","displayName":"Microsoft Azure","type":"cloud-provider","roles":["cloud-provider","vendor"],"status":"ACTIVE","contactEmail":"billing@azure.microsoft.com","website":"https://azure.microsoft.com"},"children":[]},{"id":"partner-4","name":"IBM Cloud","type":"partner","data":{"id":4,"name":"ibm","displayName":"IBM Cloud","type":"cloud-provider","roles":["cloud-provider","vendor"],"status":"ACTIVE","contactEmail":"billing@ibm.com","website":"https://www.ibm.com/cloud"},"children":[]},{"id":"partner-5","name":"Oracle Cloud","type":"partner","data":{"id":5,"name":"oracle","displayName":"Oracle Cloud","type":"cloud-provider","roles":["cloud-provider","vendor"],"status":"ACTIVE","contactEmail":"billing@oracle.com","website":"https://www.oracle.com/cloud"},"children":[]},{"id":"partner-6","name":"Alibaba Cloud","type":"partner","data":{"id":6,"name":"alibaba","displayName":"Alibaba Cloud","type":"cloud-provider","roles":["cloud-provider","vendor"],"status":"ACTIVE","contactEmail":"billing@alibabacloud.com","website":"https://www.alibabacloud.com"},"children":[]},{"id":"partner-7","name":"DigitalOcean","type":"partner","data":{"id":7,"name":"digitalocean","displayName":"DigitalOcean","type":"cloud-provider","roles":["cloud-provider","vendor"],"status":"ACTIVE","contactEmail":"billing@digitalocean.com","website":"https://www.digitalocean.com"},"children":[]},{"id":"partner-8","name":"Akamai Connected Cloud (Linode)","type":"partner","data":{"id":8,"name":"linode","displayName":"Akamai Connected Cloud (Linode)","type":"cloud-provider","roles":["cloud-provider","vendor"],"status":"ACTIVE","contactEmail":"billing@linode.com","website":"https://www.linode.com"},"children":[]},{"id":"partner-9","name":"Vultr","type":"partner","data":{"id":9,"name":"vultr","displayName":"Vultr","type":"cloud-provider","roles":["cloud-provider","vendor"],"status":"ACTIVE","contactEmail":"billing@vultr.com","website":"https://www.vultr.com"},"children":[]},{"id":"partner-10","name":"OVHcloud","type":"partner","data":{"id":10,"name":"ovhcloud","displayName":"OVHcloud","type":"cloud-provider","roles":["cloud-provider","vendor"],"status":"ACTIVE","contactEmail":"billing@ovhcloud.com","website":"https://www.ovhcloud.com"},"children":[]},{"id":"partner-11","name":"Hetzner","type":"partner","data":{"id":11,"name":"hetzner","displayName":"Hetzner","type":"cloud-provider","roles":["cloud-provider","vendor"],"status":"ACTIVE","contactEmail":"billing@hetzner.com","website":"https://www.hetzner.com"},"children":[]},{"id":"partner-12","name":"Equinix Metal","type":"partner","data":{"id":12,"name":"equinix","displayName":"Equinix Metal","type":"cloud-provider","roles":["cloud-provider","vendor"],"status":"ACTIVE","contactEmail":"billing@equinix.com","website":"https://metal.equinix.com"},"children":[]},{"id":"partner-13","name":"Cloudflare","type":"partner","data":{"id":13,"name":"cloudflare","displayName":"Cloudflare","type":"cloud-provider","roles":["cloud-provider","vendor"],"status":"ACTIVE","contactEmail":"billing@cloudflare.com","website":"https://www.cloudflare.com"},"children":[]},{"id":"partner-14","name":"Contabo","type":"partner","data":{"id":14,"name":"contabo","displayName":"Contabo","type":"cloud-provider","roles":["cloud-provider","vendor"],"status":"ACTIVE","contactEmail":"billing@contabo.com","website":"https://contabo.com"},"children":[]},{"id":"partner-15","name":"Scaleway","type":"partner","data":{"id":15,"name":"scaleway","displayName":"Scaleway","type":"cloud-provider","roles":["cloud-provider","vendor"],"status":"ACTIVE","contactEmail":"billing@scaleway.com","website":"https://www.scaleway.com"},"children":[]},{"id":"partner-16","name":"Dell Technologies","type":"partner","data":{"id":16,"name":"dell","displayName":"Dell Technologies","type":"vendor","roles":["hardware-vendor","vendor"],"status":"ACTIVE","contactEmail":"sales@dell.com","website":"https://www.dell.com"},"children":[]},{"id":"partner-17","name":"Hewlett Packard Enterprise","type":"partner","data":{"id":17,"name":"hp","displayName":"Hewlett Packard Enterprise","type":"vendor","roles":["hardware-vendor","vendor"],"status":"ACTIVE","contactEmail":"sales@hpe.com","website":"https://www.hpe.com"},"children":[]},{"id":"partner-18","name":"Cisco Systems","type":"partner","data":{"id":18,"name":"cisco","displayName":"Cisco Systems","type":"vendor","roles":["network-vendor","vendor"],"status":"ACTIVE","contactEmail":"sales@cisco.com","website":"https://www.cisco.com"},"children":[]},{"id":"partner-19","name":"Juniper Networks","type":"partner","data":{"id":19,"name":"juniper","displayName":"Juniper Networks","type":"vendor","roles":["network-vendor","vendor"],"status":"ACTIVE","contactEmail":"sales@juniper.net","website":"https://www.juniper.net"},"children":[]},{"id":"partner-20","name":"VMware","type":"partner","data":{"id":20,"name":"vmware","displayName":"VMware","type":"vendor","roles":["software-vendor","vendor"],"status":"ACTIVE","contactEmail":"sales@vmware.com","website":"https://www.vmware.com"},"children":[]},{"id":"partner-21","name":"Red Hat","type":"partner","data":{"id":21,"name":"redhat","displayName":"Red Hat","type":"vendor","roles":["software-vendor","vendor"],"status":"ACTIVE","contactEmail":"sales@redhat.com","website":"https://www.redhat.com"},"children":[]},{"id":"partner-22","name":"Canonical (Ubuntu)","type":"partner","data":{"id":22,"name":"canonical","displayName":"Canonical (Ubuntu)","type":"vendor","roles":["software-vendor","vendor"],"status":"ACTIVE","contactEmail":"sales@canonical.com","website":"https://canonical.com"},"children":[]},{"id":"partner-23","name":"ACME Corporation","type":"partner","data":{"id":23,"name":"acme-corp","displayName":"ACME Corporation","type":"customer","roles":["customer"],"status":"ACTIVE","contactEmail":"contact@acme.com","website":"https://acme.com"},"children":[]},{"id":"partner-24","name":"Telcobright","type":"partner","data":{"id":24,"name":"telcobright","displayName":"Telcobright","type":"service-provider","roles":["self"],"status":"ACTIVE","contactEmail":"admin@telcobright.com","website":"https://telcobright.com"},"children":[]},{"id":"partner-25","name":"Tech Solutions Inc","type":"partner","data":{"id":25,"name":"tech-solutions","displayName":"Tech Solutions Inc","type":"VENDOR","roles":["vendor"],"status":"ACTIVE","contactEmail":"info@techsolutions.com","website":"https://www.techsolutions.com"},"children":[]},{"id":"partner-26","name":"Global Systems Ltd","type":"partner","data":{"id":26,"name":"global-systems","displayName":"Global Systems Ltd","type":"CUSTOMER","roles":["customer"],"status":"ACTIVE","contactEmail":"support@globalsystems.com","website":"https://www.globalsystems.com"},"children":[]},{"id":"partner-27","name":"Cloud Dynamics","type":"partner","data":{"id":27,"name":"cloud-dynamics","displayName":"Cloud Dynamics","type":"VENDOR","roles":["vendor"],"status":"ACTIVE","contactEmail":"hello@clouddynamics.io","website":"https://www.clouddynamics.io"},"children":[]}]],"source":"frontend"},{"timestamp":1758473208005,"isoTimestamp":"2025-09-21T16:46:48.005Z","level":"log","message":"ðŸŒ² Rendering node: partner-1 Amazon Web Services (AWS) partner","args":["ðŸŒ² Rendering node:","partner-1","Amazon Web Services (AWS)","partner"],"source":"frontend"},{"timestamp":1758473208005,"isoTimestamp":"2025-09-21T16:46:48.005Z","level":"log","message":"ðŸŒ² Rendering node: partner-2 Google Cloud Platform partner","args":["ðŸŒ² Rendering node:","partner-2","Google Cloud Platform","partner"],"source":"frontend"},{"timestamp":1758473208006,"isoTimestamp":"2025-09-21T16:46:48.006Z","level":"log","message":"ðŸŒ² Rendering node: partner-3 Microsoft Azure partner","args":["ðŸŒ² Rendering node:","partner-3","Microsoft Azure","partner"],"source":"frontend"},{"timestamp":1758473208006,"isoTimestamp":"2025-09-21T16:46:48.006Z","level":"log","message":"ðŸŒ² Rendering node: partner-4 IBM Cloud partner","args":["ðŸŒ² Rendering node:","partner-4","IBM Cloud","partner"],"source":"frontend"},{"timestamp":1758473208006,"isoTimestamp":"2025-09-21T16:46:48.006Z","level":"log","message":"ðŸŒ² Rendering node: partner-5 Oracle Cloud partner","args":["ðŸŒ² Rendering node:","partner-5","Oracle Cloud","partner"],"source":"frontend"},{"timestamp":1758473208006,"isoTimestamp":"2025-09-21T16:46:48.006Z","level":"log","message":"ðŸŒ² Rendering node: partner-6 Alibaba Cloud partner","args":["ðŸŒ² Rendering node:","partner-6","Alibaba Cloud","partner"],"source":"frontend"},{"timestamp":1758473208007,"isoTimestamp":"2025-09-21T16:46:48.007Z","level":"log","message":"ðŸŒ² Rendering node: partner-7 DigitalOcean partner","args":["ðŸŒ² Rendering node:","partner-7","DigitalOcean","partner"],"source":"frontend"},{"timestamp":1758473208007,"isoTimestamp":"2025-09-21T16:46:48.007Z","level":"log","message":"ðŸŒ² Rendering node: partner-8 Akamai Connected Cloud (Linode) partner","args":["ðŸŒ² Rendering node:","partner-8","Akamai Connected Cloud (Linode)","partner"],"source":"frontend"},{"timestamp":1758473208007,"isoTimestamp":"2025-09-21T16:46:48.007Z","level":"log","message":"ðŸŒ² Rendering node: partner-9 Vultr partner","args":["ðŸŒ² Rendering node:","partner-9","Vultr","partner"],"source":"frontend"},{"timestamp":1758473208008,"isoTimestamp":"2025-09-21T16:46:48.008Z","level":"log","message":"ðŸŒ² Rendering node: partner-10 OVHcloud partner","args":["ðŸŒ² Rendering node:","partner-10","OVHcloud","partner"],"source":"frontend"},{"timestamp":1758473208008,"isoTimestamp":"2025-09-21T16:46:48.008Z","level":"log","message":"ðŸŒ² Rendering node: partner-11 Hetzner partner","args":["ðŸŒ² Rendering node:","partner-11","Hetzner","partner"],"source":"frontend"},{"timestamp":1758473208008,"isoTimestamp":"2025-09-21T16:46:48.008Z","level":"log","message":"ðŸŒ² Rendering node: partner-12 Equinix Metal partner","args":["ðŸŒ² Rendering node:","partner-12","Equinix Metal","partner"],"source":"frontend"},{"timestamp":1758473208008,"isoTimestamp":"2025-09-21T16:46:48.008Z","level":"log","message":"ðŸŒ² Rendering node: partner-13 Cloudflare partner","args":["ðŸŒ² Rendering node:","partner-13","Cloudflare","partner"],"source":"frontend"},{"timestamp":1758473208009,"isoTimestamp":"2025-09-21T16:46:48.009Z","level":"log","message":"ðŸŒ² Rendering node: partner-14 Contabo partner","args":["ðŸŒ² Rendering node:","partner-14","Contabo","partner"],"source":"frontend"}],"metadata":{"source":"frontend","sessionId":"unknown"}}
{"timestamp":1758473208065,"isoTimestamp":"2025-09-21T16:46:48.065Z","type":"console","operation":"CONSOLE_LOGS","entity":"frontend","count":13,"messages":[{"timestamp":1758473208009,"isoTimestamp":"2025-09-21T16:46:48.009Z","level":"log","message":"ðŸŒ² Rendering node: partner-15 Scaleway partner","args":["ðŸŒ² Rendering node:","partner-15","Scaleway","partner"],"source":"frontend"},{"timestamp":1758473208010,"isoTimestamp":"2025-09-21T16:46:48.010Z","level":"log","message":"ðŸŒ² Rendering node: partner-16 Dell Technologies partner","args":["ðŸŒ² Rendering node:","partner-16","Dell Technologies","partner"],"source":"frontend"},{"timestamp":1758473208010,"isoTimestamp":"2025-09-21T16:46:48.010Z","level":"log","message":"ðŸŒ² Rendering node: partner-17 Hewlett Packard Enterprise partner","args":["ðŸŒ² Rendering node:","partner-17","Hewlett Packard Enterprise","partner"],"source":"frontend"},{"timestamp":1758473208010,"isoTimestamp":"2025-09-21T16:46:48.010Z","level":"log","message":"ðŸŒ² Rendering node: partner-18 Cisco Systems partner","args":["ðŸŒ² Rendering node:","partner-18","Cisco Systems","partner"],"source":"frontend"},{"timestamp":1758473208010,"isoTimestamp":"2025-09-21T16:46:48.010Z","level":"log","message":"ðŸŒ² Rendering node: partner-19 Juniper Networks partner","args":["ðŸŒ² Rendering node:","partner-19","Juniper Networks","partner"],"source":"frontend"},{"timestamp":1758473208011,"isoTimestamp":"2025-09-21T16:46:48.011Z","level":"log","message":"ðŸŒ² Rendering node: partner-20 VMware partner","args":["ðŸŒ² Rendering node:","partner-20","VMware","partner"],"source":"frontend"},{"timestamp":1758473208011,"isoTimestamp":"2025-09-21T16:46:48.011Z","level":"log","message":"ðŸŒ² Rendering node: partner-21 Red Hat partner","args":["ðŸŒ² Rendering node:","partner-21","Red Hat","partner"],"source":"frontend"},{"timestamp":1758473208011,"isoTimestamp":"2025-09-21T16:46:48.011Z","level":"log","message":"ðŸŒ² Rendering node: partner-22 Canonical (Ubuntu) partner","args":["ðŸŒ² Rendering node:","partner-22","Canonical (Ubuntu)","partner"],"source":"frontend"},{"timestamp":1758473208011,"isoTimestamp":"2025-09-21T16:46:48.011Z","level":"log","message":"ðŸŒ² Rendering node: partner-23 ACME Corporation partner","args":["ðŸŒ² Rendering node:","partner-23","ACME Corporation","partner"],"source":"frontend"},{"timestamp":1758473208012,"isoTimestamp":"2025-09-21T16:46:48.012Z","level":"log","message":"ðŸŒ² Rendering node: partner-24 Telcobright partner","args":["ðŸŒ² Rendering node:","partner-24","Telcobright","partner"],"source":"frontend"},{"timestamp":1758473208012,"isoTimestamp":"2025-09-21T16:46:48.012Z","level":"log","message":"ðŸŒ² Rendering node: partner-25 Tech Solutions Inc partner","args":["ðŸŒ² Rendering node:","partner-25","Tech Solutions Inc","partner"],"source":"frontend"},{"timestamp":1758473208012,"isoTimestamp":"2025-09-21T16:46:48.012Z","level":"log","message":"ðŸŒ² Rendering node: partner-26 Global Systems Ltd partner","args":["ðŸŒ² Rendering node:","partner-26","Global Systems Ltd","partner"],"source":"frontend"},{"timestamp":1758473208012,"isoTimestamp":"2025-09-21T16:46:48.012Z","level":"log","message":"ðŸŒ² Rendering node: partner-27 Cloud Dynamics partner","args":["ðŸŒ² Rendering node:","partner-27","Cloud Dynamics","partner"],"source":"frontend"}],"metadata":{"source":"frontend","sessionId":"unknown"}}
