{"timestamp":1758473410192,"isoTimestamp":"2025-09-21T16:50:10.192Z","type":"console","operation":"CONSOLE_LOGS","entity":"frontend","count":2,"messages":[{"timestamp":1758473407395,"isoTimestamp":"2025-09-21T16:50:07.395Z","level":"error","message":"üåâ Claude Bridge error: {\n  \"isTrusted\": true\n}","args":["üåâ Claude Bridge error:",{"isTrusted":true}],"source":"frontend","stackTrace":"Error\n    at console.error (http://localhost:3010/static/js/bundle.js:182043:39)\n    at ws.onerror (http://localhost:3010/static/js/bundle.js:162334:19)"},{"timestamp":1758473407409,"isoTimestamp":"2025-09-21T16:50:07.409Z","level":"error","message":"üåâ Claude Bridge error: {\n  \"isTrusted\": true\n}","args":["üåâ Claude Bridge error:",{"isTrusted":true}],"source":"frontend","stackTrace":"Error\n    at console.error (http://localhost:3010/static/js/bundle.js:182043:39)\n    at ws.onerror (http://localhost:3010/static/js/bundle.js:162334:19)"}],"metadata":{"source":"frontend","sessionId":"unknown"}}
{"timestamp":1758473410473,"isoTimestamp":"2025-09-21T16:50:10.473Z","type":"console","operation":"CONSOLE_LOGS","entity":"frontend","count":20,"messages":[{"timestamp":1758473410398,"isoTimestamp":"2025-09-21T16:50:10.398Z","level":"error","message":"üåâ Claude Bridge error: {\n  \"isTrusted\": true\n}","args":["üåâ Claude Bridge error:",{"isTrusted":true}],"source":"frontend","stackTrace":"Error\n    at console.error (http://localhost:3010/static/js/bundle.js:182043:39)\n    at ws.onerror (http://localhost:3010/static/js/bundle.js:162334:19)"},{"timestamp":1758473410411,"isoTimestamp":"2025-09-21T16:50:10.411Z","level":"error","message":"üåâ Claude Bridge error: {\n  \"isTrusted\": true\n}","args":["üåâ Claude Bridge error:",{"isTrusted":true}],"source":"frontend","stackTrace":"Error\n    at console.error (http://localhost:3010/static/js/bundle.js:182043:39)\n    at ws.onerror (http://localhost:3010/static/js/bundle.js:162334:19)"},{"timestamp":1758473410467,"isoTimestamp":"2025-09-21T16:50:10.467Z","level":"error","message":"[EventBusWebSocketHandler] Query failed: {}","args":["[EventBusWebSocketHandler] Query failed:",{}],"source":"frontend","stackTrace":"Error: Query timeout\n    at http://localhost:3010/static/js/bundle.js:183049:18"},{"timestamp":1758473410467,"isoTimestamp":"2025-09-21T16:50:10.467Z","level":"warn","message":"[EventBusWebSocketHandler] Invalid event received: d15ccfcb-3a96-4ff7-8fb0-914c5829024b","args":["[EventBusWebSocketHandler] Invalid event received:","d15ccfcb-3a96-4ff7-8fb0-914c5829024b"],"source":"frontend"},{"timestamp":1758473410467,"isoTimestamp":"2025-09-21T16:50:10.467Z","level":"warn","message":"[EventBusWebSocketHandler] Invalid event received: *","args":["[EventBusWebSocketHandler] Invalid event received:","*"],"source":"frontend"},{"timestamp":1758473410467,"isoTimestamp":"2025-09-21T16:50:10.467Z","level":"log","message":"[LocalEventBus] Published: {\n  \"id\": \"d15ccfcb-3a96-4ff7-8fb0-914c5829024b\",\n  \"timestamp\": 1758473410467,\n  \"type\": \"query\",\n  \"operation\": \"RESPONSE\",\n  \"entity\": \"environmentassociation\",\n  \"payload\": null,\n  \"metadata\": {\n    \"duration\": 30000\n  },\n  \"success\": false,\n  \"error\": \"Query timeout\"\n}","args":["[LocalEventBus] Published:",{"id":"d15ccfcb-3a96-4ff7-8fb0-914c5829024b","timestamp":1758473410467,"type":"query","operation":"RESPONSE","entity":"environmentassociation","payload":null,"metadata":{"duration":30000},"success":false,"error":"Query timeout"}],"source":"frontend"},{"timestamp":1758473410467,"isoTimestamp":"2025-09-21T16:50:10.467Z","level":"error","message":"Query execution error: {}","args":["Query execution error:",{}],"source":"frontend","stackTrace":"Error: Query timeout\n    at responseHandler (http://localhost:3010/static/js/bundle.js:183479:20)\n    at http://localhost:3010/static/js/bundle.js:81809:9\n    at Array.map (<anonymous>)\n    at Object.emit (http://localhost:3010/static/js/bundle.js:81808:22)\n    at LocalEventBus.publish (http://localhost:3010/static/js/bundle.js:183313:18)\n    at WebSocketEventBus.publish (http://localhost:3010/static/js/bundle.js:183445:19)\n    at EventBusWebSocketHandler.handleQueryRequest (http://localhost:3010/static/js/bundle.js:183677:21)\n    at async http://localhost:3010/static/js/bundle.js:183639:9"},{"timestamp":1758473410468,"isoTimestamp":"2025-09-21T16:50:10.468Z","level":"warn","message":"[EventBusWebSocketHandler] Invalid event received: d15ccfcb-3a96-4ff7-8fb0-914c5829024b","args":["[EventBusWebSocketHandler] Invalid event received:","d15ccfcb-3a96-4ff7-8fb0-914c5829024b"],"source":"frontend"},{"timestamp":1758473410468,"isoTimestamp":"2025-09-21T16:50:10.468Z","level":"warn","message":"[EventBusWebSocketHandler] Invalid event received: *","args":["[EventBusWebSocketHandler] Invalid event received:","*"],"source":"frontend"},{"timestamp":1758473410468,"isoTimestamp":"2025-09-21T16:50:10.468Z","level":"log","message":"[LocalEventBus] Published: {\n  \"id\": \"d15ccfcb-3a96-4ff7-8fb0-914c5829024b\",\n  \"timestamp\": 1758473410468,\n  \"type\": \"query\",\n  \"operation\": \"QUERY_ERROR\",\n  \"entity\": \"environmentassociation\",\n  \"payload\": {},\n  \"metadata\": {\n    \"endpoint\": \"/stellar/query\",\n    \"method\": \"POST\",\n    \"duration\": 30001\n  },\n  \"success\": false,\n  \"error\": \"Query timeout\"\n}","args":["[LocalEventBus] Published:",{"id":"d15ccfcb-3a96-4ff7-8fb0-914c5829024b","timestamp":1758473410468,"type":"query","operation":"QUERY_ERROR","entity":"environmentassociation","payload":{},"metadata":{"endpoint":"/stellar/query","method":"POST","duration":30001},"success":false,"error":"Query timeout"}],"source":"frontend"},{"timestamp":1758473410468,"isoTimestamp":"2025-09-21T16:50:10.468Z","level":"log","message":"üîç StellarStore executeQuery response: {\n  \"success\": false,\n  \"error\": \"Query timeout\"\n}","args":["üîç StellarStore executeQuery response:",{"success":false,"error":"Query timeout"}],"source":"frontend"},{"timestamp":1758473410468,"isoTimestamp":"2025-09-21T16:50:10.468Z","level":"log","message":"üìä Unified data: [\n  {\n    \"id\": 1,\n    \"name\": \"amazon\",\n    \"displayName\": \"Amazon Web Services (AWS)\",\n    \"contactEmail\": \"billing@aws.amazon.com\",\n    \"website\": \"https://aws.amazon.com\",\n    \"type\": \"cloud-provider\",\n    \"roles\": [\n      \"cloud-provider\",\n      \"vendor\"\n    ],\n    \"status\": \"ACTIVE\"\n  },\n  {\n    \"id\": 2,\n    \"name\": \"google\",\n    \"displayName\": \"Google Cloud Platform\",\n    \"contactEmail\": \"billing@cloud.google.com\",\n    \"website\": \"https://cloud.google.com\",\n    \"type\": \"cloud-provider\",\n    \"roles\": [\n      \"cloud-provider\",\n      \"vendor\"\n    ],\n    \"status\": \"ACTIVE\"\n  },\n  {\n    \"id\": 3,\n    \"name\": \"microsoft\",\n    \"displayName\": \"Microsoft Azure\",\n    \"contactEmail\": \"billing@azure.microsoft.com\",\n    \"website\": \"https://azure.microsoft.com\",\n    \"type\": \"cloud-provider\",\n    \"roles\": [\n      \"cloud-provider\",\n      \"vendor\"\n    ],\n    \"status\": \"ACTIVE\"\n  },\n  {\n    \"id\": 4,\n    \"name\": \"ibm\",\n    \"displayName\": \"IBM Cloud\",\n    \"contactEmail\": \"billing@ibm.com\",\n    \"website\": \"https://www.ibm.com/cloud\",\n    \"type\": \"cloud-provider\",\n    \"roles\": [\n      \"cloud-provider\",\n      \"vendor\"\n    ],\n    \"status\": \"ACTIVE\"\n  },\n  {\n    \"id\": 5,\n    \"name\": \"oracle\",\n    \"displayName\": \"Oracle Cloud\",\n    \"contactEmail\": \"billing@oracle.com\",\n    \"website\": \"https://www.oracle.com/cloud\",\n    \"type\": \"cloud-provider\",\n    \"roles\": [\n      \"cloud-provider\",\n      \"vendor\"\n    ],\n    \"status\": \"ACTIVE\"\n  },\n  {\n    \"id\": 6,\n    \"name\": \"alibaba\",\n    \"displayName\": \"Alibaba Cloud\",\n    \"contactEmail\": \"billing@alibabacloud.com\",\n    \"website\": \"https://www.alibabacloud.com\",\n    \"type\": \"cloud-provider\",\n    \"roles\": [\n      \"cloud-provider\",\n      \"vendor\"\n    ],\n    \"status\": \"ACTIVE\"\n  },\n  {\n    \"id\": 7,\n    \"name\": \"digitalocean\",\n    \"displayName\": \"DigitalOcean\",\n    \"contactEmail\": \"billing@digitalocean.com\",\n    \"website\": \"https://www.digitalocean.com\",\n    \"type\": \"cloud-provider\",\n    \"roles\": [\n      \"cloud-provider\",\n      \"vendor\"\n    ],\n    \"status\": \"ACTIVE\"\n  },\n  {\n    \"id\": 8,\n    \"name\": \"linode\",\n    \"displayName\": \"Akamai Connected Cloud (Linode)\",\n    \"contactEmail\": \"billing@linode.com\",\n    \"website\": \"https://www.linode.com\",\n    \"type\": \"cloud-provider\",\n    \"roles\": [\n      \"cloud-provider\",\n      \"vendor\"\n    ],\n    \"status\": \"ACTIVE\"\n  },\n  {\n    \"id\": 9,\n    \"name\": \"vultr\",\n    \"displayName\": \"Vultr\",\n    \"contactEmail\": \"billing@vultr.com\",\n    \"website\": \"https://www.vultr.com\",\n    \"type\": \"cloud-provider\",\n    \"roles\": [\n      \"cloud-provider\",\n      \"vendor\"\n    ],\n    \"status\": \"ACTIVE\"\n  },\n  {\n    \"id\": 10,\n    \"name\": \"ovhcloud\",\n    \"displayName\": \"OVHcloud\",\n    \"contactEmail\": \"billing@ovhcloud.com\",\n    \"website\": \"https://www.ovhcloud.com\",\n    \"type\": \"cloud-provider\",\n    \"roles\": [\n      \"cloud-provider\",\n      \"vendor\"\n    ],\n    \"status\": \"ACTIVE\"\n  },\n  {\n    \"id\": 11,\n    \"name\": \"hetzner\",\n    \"displayName\": \"Hetzner\",\n    \"contactEmail\": \"billing@hetzner.com\",\n    \"website\": \"https://www.hetzner.com\",\n    \"type\": \"cloud-provider\",\n    \"roles\": [\n      \"cloud-provider\",\n      \"vendor\"\n    ],\n    \"status\": \"ACTIVE\"\n  },\n  {\n    \"id\": 12,\n    \"name\": \"equinix\",\n    \"displayName\": \"Equinix Metal\",\n    \"contactEmail\": \"billing@equinix.com\",\n    \"website\": \"https://metal.equinix.com\",\n    \"type\": \"cloud-provider\",\n    \"roles\": [\n      \"cloud-provider\",\n      \"vendor\"\n    ],\n    \"status\": \"ACTIVE\"\n  },\n  {\n    \"id\": 13,\n    \"name\": \"cloudflare\",\n    \"displayName\": \"Cloudflare\",\n    \"contactEmail\": \"billing@cloudflare.com\",\n    \"website\": \"https://www.cloudflare.com\",\n    \"type\": \"cloud-provider\",\n    \"roles\": [\n      \"cloud-provider\",\n      \"vendor\"\n    ],\n    \"status\": \"ACTIVE\"\n  },\n  {\n    \"id\": 14,\n    \"name\": \"contabo\",\n    \"displayName\": \"Contabo\",\n    \"contactEmail\": \"billing@contabo.com\",\n    \"website\": \"https://contabo.com\",\n    \"type\": \"cloud-provider\",\n    \"roles\": [\n      \"cloud-provider\",\n      \"vendor\"\n    ],\n    \"status\": \"ACTIVE\"\n  },\n  {\n    \"id\": 15,\n    \"name\": \"scaleway\",\n    \"displayName\": \"Scaleway\",\n    \"contactEmail\": \"billing@scaleway.com\",\n    \"website\": \"https://www.scaleway.com\",\n    \"type\": \"cloud-provider\",\n    \"roles\": [\n      \"cloud-provider\",\n      \"vendor\"\n    ],\n    \"status\": \"ACTIVE\"\n  },\n  {\n    \"id\": 16,\n    \"name\": \"dell\",\n    \"displayName\": \"Dell Technologies\",\n    \"contactEmail\": \"sales@dell.com\",\n    \"website\": \"https://www.dell.com\",\n    \"type\": \"vendor\",\n    \"roles\": [\n      \"hardware-vendor\",\n      \"vendor\"\n    ],\n    \"status\": \"ACTIVE\"\n  },\n  {\n    \"id\": 17,\n    \"name\": \"hp\",\n    \"displayName\": \"Hewlett Packard Enterprise\",\n    \"contactEmail\": \"sales@hpe.com\",\n    \"website\": \"https://www.hpe.com\",\n    \"type\": \"vendor\",\n    \"roles\": [\n      \"hardware-vendor\",\n      \"vendor\"\n    ],\n    \"status\": \"ACTIVE\"\n  },\n  {\n    \"id\": 18,\n    \"name\": \"cisco\",\n    \"displayName\": \"Cisco Systems\",\n    \"contactEmail\": \"sales@cisco.com\",\n    \"website\": \"https://www.cisco.com\",\n    \"type\": \"vendor\",\n    \"roles\": [\n      \"network-vendor\",\n      \"vendor\"\n    ],\n    \"status\": \"ACTIVE\"\n  },\n  {\n    \"id\": 19,\n    \"name\": \"juniper\",\n    \"displayName\": \"Juniper Networks\",\n    \"contactEmail\": \"sales@juniper.net\",\n    \"website\": \"https://www.juniper.net\",\n    \"type\": \"vendor\",\n    \"roles\": [\n      \"network-vendor\",\n      \"vendor\"\n    ],\n    \"status\": \"ACTIVE\"\n  },\n  {\n    \"id\": 20,\n    \"name\": \"vmware\",\n    \"displayName\": \"VMware\",\n    \"contactEmail\": \"sales@vmware.com\",\n    \"website\": \"https://www.vmware.com\",\n    \"type\": \"vendor\",\n    \"roles\": [\n      \"software-vendor\",\n      \"vendor\"\n    ],\n    \"status\": \"ACTIVE\"\n  },\n  {\n    \"id\": 21,\n    \"name\": \"redhat\",\n    \"displayName\": \"Red Hat\",\n    \"contactEmail\": \"sales@redhat.com\",\n    \"website\": \"https://www.redhat.com\",\n    \"type\": \"vendor\",\n    \"roles\": [\n      \"software-vendor\",\n      \"vendor\"\n    ],\n    \"status\": \"ACTIVE\"\n  },\n  {\n    \"id\": 22,\n    \"name\": \"canonical\",\n    \"displayName\": \"Canonical (Ubuntu)\",\n    \"contactEmail\": \"sales@canonical.com\",\n    \"website\": \"https://canonical.com\",\n    \"type\": \"vendor\",\n    \"roles\": [\n      \"software-vendor\",\n      \"vendor\"\n    ],\n    \"status\": \"ACTIVE\"\n  },\n  {\n    \"id\": 23,\n    \"name\": \"acme-corp\",\n    \"displayName\": \"ACME Corporation\",\n    \"contactEmail\": \"contact@acme.com\",\n    \"website\": \"https://acme.com\",\n    \"type\": \"customer\",\n    \"roles\": [\n      \"customer\"\n    ],\n    \"status\": \"ACTIVE\",\n    \"updatedAt\": \"2025-09-18T19:10:33\"\n  },\n  {\n    \"id\": 24,\n    \"name\": \"telcobright\",\n    \"displayName\": \"Telcobright\",\n    \"contactEmail\": \"admin@telcobright.com\",\n    \"website\": \"https://telcobright.com\",\n    \"type\": \"service-provider\",\n    \"roles\": [\n      \"self\"\n    ],\n    \"status\": \"ACTIVE\"\n  },\n  {\n    \"id\": 25,\n    \"name\": \"tech-solutions\",\n    \"displayName\": \"Tech Solutions Inc\",\n    \"contactEmail\": \"info@techsolutions.com\",\n    \"website\": \"https://www.techsolutions.com\",\n    \"type\": \"VENDOR\",\n    \"roles\": [\n      \"vendor\"\n    ],\n    \"status\": \"ACTIVE\",\n    \"createdAt\": \"2025-09-18T19:09:57\",\n    \"updatedAt\": \"2025-09-18T19:10:33\"\n  },\n  {\n    \"id\": 26,\n    \"name\": \"global-systems\",\n    \"displayName\": \"Global Systems Ltd\",\n    \"contactEmail\": \"support@globalsystems.com\",\n    \"website\": \"https://www.globalsystems.com\",\n    \"type\": \"CUSTOMER\",\n    \"roles\": [\n      \"customer\"\n    ],\n    \"status\": \"ACTIVE\",\n    \"createdAt\": \"2025-09-18T19:09:57\",\n    \"updatedAt\": \"2025-09-18T19:10:33\"\n  },\n  {\n    \"id\": 27,\n    \"name\": \"cloud-dynamics\",\n    \"displayName\": \"Cloud Dynamics\",\n    \"contactEmail\": \"hello@clouddynamics.io\",\n    \"website\": \"https://www.clouddynamics.io\",\n    \"type\": \"VENDOR\",\n    \"roles\": [\n      \"vendor\"\n    ],\n    \"status\": \"ACTIVE\",\n    \"createdAt\": \"2025-09-18T19:09:57\",\n    \"updatedAt\": \"2025-09-18T19:10:33\"\n  }\n]","args":["üìä Unified data:","[\n  {\n    \"id\": 1,\n    \"name\": \"amazon\",\n    \"displayName\": \"Amazon Web Services (AWS)\",\n    \"contactEmail\": \"billing@aws.amazon.com\",\n    \"website\": \"https://aws.amazon.com\",\n    \"type\": \"cloud-provider\",\n    \"roles\": [\n      \"cloud-provider\",\n      \"vendor\"\n    ],\n    \"status\": \"ACTIVE\"\n  },\n  {\n    \"id\": 2,\n    \"name\": \"google\",\n    \"displayName\": \"Google Cloud Platform\",\n    \"contactEmail\": \"billing@cloud.google.com\",\n    \"website\": \"https://cloud.google.com\",\n    \"type\": \"cloud-provider\",\n    \"roles\": [\n      \"cloud-provider\",\n      \"vendor\"\n    ],\n    \"status\": \"ACTIVE\"\n  },\n  {\n    \"id\": 3,\n    \"name\": \"microsoft\",\n    \"displayName\": \"Microsoft Azure\",\n    \"contactEmail\": \"billing@azure.microsoft.com\",\n    \"website\": \"https://azure.microsoft.com\",\n    \"type\": \"cloud-provider\",\n    \"roles\": [\n      \"cloud-provider\",\n      \"vendor\"\n    ],\n    \"status\": \"ACTIVE\"\n  },\n  {\n    \"id\": 4,\n    \"name\": \"ibm\",\n    \"displayName\": \"IBM Cloud\",\n    \"contactEmail\": \"billing@ibm.com\",\n    \"website\": \"https://www.ibm.com/cloud\",\n    \"type\": \"cloud-provider\",\n    \"roles\": [\n      \"cloud-provider\",\n      \"vendor\"\n    ],\n    \"status\": \"ACTIVE\"\n  },\n  {\n    \"id\": 5,\n    \"name\": \"oracle\",\n    \"displayName\": \"Oracle Cloud\",\n    \"contactEmail\": \"billing@oracle.com\",\n    \"website\": \"https://www.oracle.com/cloud\",\n    \"type\": \"cloud-provider\",\n    \"roles\": [\n      \"cloud-provider\",\n      \"vendor\"\n    ],\n    \"status\": \"ACTIVE\"\n  },\n  {\n    \"id\": 6,\n    \"name\": \"alibaba\",\n    \"displayName\": \"Alibaba Cloud\",\n    \"contactEmail\": \"billing@alibabacloud.com\",\n    \"website\": \"https://www.alibabacloud.com\",\n    \"type\": \"cloud-provider\",\n    \"roles\": [\n      \"cloud-provider\",\n      \"vendor\"\n    ],\n    \"status\": \"ACTIVE\"\n  },\n  {\n    \"id\": 7,\n    \"name\": \"digitalocean\",\n    \"displayName\": \"DigitalOcean\",\n    \"contactEmail\": \"billing@digitalocean.com\",\n    \"website\": \"https://www.digitalocean.com\",\n    \"type\": \"cloud-provider\",\n    \"roles\": [\n      \"cloud-provider\",\n      \"vendor\"\n    ],\n    \"status\": \"ACTIVE\"\n  },\n  {\n    \"id\": 8,\n    \"name\": \"linode\",\n    \"displayName\": \"Akamai Connected Cloud (Linode)\",\n    \"contactEmail\": \"billing@linode.com\",\n    \"website\": \"https://www.linode.com\",\n    \"type\": \"cloud-provider\",\n    \"roles\": [\n      \"cloud-provider\",\n      \"vendor\"\n    ],\n    \"status\": \"ACTIVE\"\n  },\n  {\n    \"id\": 9,\n    \"name\": \"vultr\",\n    \"displayName\": \"Vultr\",\n    \"contactEmail\": \"billing@vultr.com\",\n    \"website\": \"https://www.vultr.com\",\n    \"type\": \"cloud-provider\",\n    \"roles\": [\n      \"cloud-provider\",\n      \"vendor\"\n    ],\n    \"status\": \"ACTIVE\"\n  },\n  {\n    \"id\": 10,\n    \"name\": \"ovhcloud\",\n    \"displayName\": \"OVHcloud\",\n    \"contactEmail\": \"billing@ovhcloud.com\",\n    \"website\": \"https://www.ovhcloud.com\",\n    \"type\": \"cloud-provider\",\n    \"roles\": [\n      \"cloud-provider\",\n      \"vendor\"\n    ],\n    \"status\": \"ACTIVE\"\n  },\n  {\n    \"id\": 11,\n    \"name\": \"hetzner\",\n    \"displayName\": \"Hetzner\",\n    \"contactEmail\": \"billing@hetzner.com\",\n    \"website\": \"https://www.hetzner.com\",\n    \"type\": \"cloud-provider\",\n    \"roles\": [\n      \"cloud-provider\",\n      \"vendor\"\n    ],\n    \"status\": \"ACTIVE\"\n  },\n  {\n    \"id\": 12,\n    \"name\": \"equinix\",\n    \"displayName\": \"Equinix Metal\",\n    \"contactEmail\": \"billing@equinix.com\",\n    \"website\": \"https://metal.equinix.com\",\n    \"type\": \"cloud-provider\",\n    \"roles\": [\n      \"cloud-provider\",\n      \"vendor\"\n    ],\n    \"status\": \"ACTIVE\"\n  },\n  {\n    \"id\": 13,\n    \"name\": \"cloudflare\",\n    \"displayName\": \"Cloudflare\",\n    \"contactEmail\": \"billing@cloudflare.com\",\n    \"website\": \"https://www.cloudflare.com\",\n    \"type\": \"cloud-provider\",\n    \"roles\": [\n      \"cloud-provider\",\n      \"vendor\"\n    ],\n    \"status\": \"ACTIVE\"\n  },\n  {\n    \"id\": 14,\n    \"name\": \"contabo\",\n    \"displayName\": \"Contabo\",\n    \"contactEmail\": \"billing@contabo.com\",\n    \"website\": \"https://contabo.com\",\n    \"type\": \"cloud-provider\",\n    \"roles\": [\n      \"cloud-provider\",\n      \"vendor\"\n    ],\n    \"status\": \"ACTIVE\"\n  },\n  {\n    \"id\": 15,\n    \"name\": \"scaleway\",\n    \"displayName\": \"Scaleway\",\n    \"contactEmail\": \"billing@scaleway.com\",\n    \"website\": \"https://www.scaleway.com\",\n    \"type\": \"cloud-provider\",\n    \"roles\": [\n      \"cloud-provider\",\n      \"vendor\"\n    ],\n    \"status\": \"ACTIVE\"\n  },\n  {\n    \"id\": 16,\n    \"name\": \"dell\",\n    \"displayName\": \"Dell Technologies\",\n    \"contactEmail\": \"sales@dell.com\",\n    \"website\": \"https://www.dell.com\",\n    \"type\": \"vendor\",\n    \"roles\": [\n      \"hardware-vendor\",\n      \"vendor\"\n    ],\n    \"status\": \"ACTIVE\"\n  },\n  {\n    \"id\": 17,\n    \"name\": \"hp\",\n    \"displayName\": \"Hewlett Packard Enterprise\",\n    \"contactEmail\": \"sales@hpe.com\",\n    \"website\": \"https://www.hpe.com\",\n    \"type\": \"vendor\",\n    \"roles\": [\n      \"hardware-vendor\",\n      \"vendor\"\n    ],\n    \"status\": \"ACTIVE\"\n  },\n  {\n    \"id\": 18,\n    \"name\": \"cisco\",\n    \"displayName\": \"Cisco Systems\",\n    \"contactEmail\": \"sales@cisco.com\",\n    \"website\": \"https://www.cisco.com\",\n    \"type\": \"vendor\",\n    \"roles\": [\n      \"network-vendor\",\n      \"vendor\"\n    ],\n    \"status\": \"ACTIVE\"\n  },\n  {\n    \"id\": 19,\n    \"name\": \"juniper\",\n    \"displayName\": \"Juniper Networks\",\n    \"contactEmail\": \"sales@juniper.net\",\n    \"website\": \"https://www.juniper.net\",\n    \"type\": \"vendor\",\n    \"roles\": [\n      \"network-vendor\",\n      \"vendor\"\n    ],\n    \"status\": \"ACTIVE\"\n  },\n  {\n    \"id\": 20,\n    \"name\": \"vmware\",\n    \"displayName\": \"VMware\",\n    \"contactEmail\": \"sales@vmware.com\",\n    \"website\": \"https://www.vmware.com\",\n    \"type\": \"vendor\",\n    \"roles\": [\n      \"software-vendor\",\n      \"vendor\"\n    ],\n    \"status\": \"ACTIVE\"\n  },\n  {\n    \"id\": 21,\n    \"name\": \"redhat\",\n    \"displayName\": \"Red Hat\",\n    \"contactEmail\": \"sales@redhat.com\",\n    \"website\": \"https://www.redhat.com\",\n    \"type\": \"vendor\",\n    \"roles\": [\n      \"software-vendor\",\n      \"vendor\"\n    ],\n    \"status\": \"ACTIVE\"\n  },\n  {\n    \"id\": 22,\n    \"name\": \"canonical\",\n    \"displayName\": \"Canonical (Ubuntu)\",\n    \"contactEmail\": \"sales@canonical.com\",\n    \"website\": \"https://canonical.com\",\n    \"type\": \"vendor\",\n    \"roles\": [\n      \"software-vendor\",\n      \"vendor\"\n    ],\n    \"status\": \"ACTIVE\"\n  },\n  {\n    \"id\": 23,\n    \"name\": \"acme-corp\",\n    \"displayName\": \"ACME Corporation\",\n    \"contactEmail\": \"contact@acme.com\",\n    \"website\": \"https://acme.com\",\n    \"type\": \"customer\",\n    \"roles\": [\n      \"customer\"\n    ],\n    \"status\": \"ACTIVE\",\n    \"updatedAt\": \"2025-09-18T19:10:33\"\n  },\n  {\n    \"id\": 24,\n    \"name\": \"telcobright\",\n    \"displayName\": \"Telcobright\",\n    \"contactEmail\": \"admin@telcobright.com\",\n    \"website\": \"https://telcobright.com\",\n    \"type\": \"service-provider\",\n    \"roles\": [\n      \"self\"\n    ],\n    \"status\": \"ACTIVE\"\n  },\n  {\n    \"id\": 25,\n    \"name\": \"tech-solutions\",\n    \"displayName\": \"Tech Solutions Inc\",\n    \"contactEmail\": \"info@techsolutions.com\",\n    \"website\": \"https://www.techsolutions.com\",\n    \"type\": \"VENDOR\",\n    \"roles\": [\n      \"vendor\"\n    ],\n    \"status\": \"ACTIVE\",\n    \"createdAt\": \"2025-09-18T19:09:57\",\n    \"updatedAt\": \"2025-09-18T19:10:33\"\n  },\n  {\n    \"id\": 26,\n    \"name\": \"global-systems\",\n    \"displayName\": \"Global Systems Ltd\",\n    \"contactEmail\": \"support@globalsystems.com\",\n    \"website\": \"https://www.globalsystems.com\",\n    \"type\": \"CUSTOMER\",\n    \"roles\": [\n      \"customer\"\n    ],\n    \"status\": \"ACTIVE\",\n    \"createdAt\": \"2025-09-18T19:09:57\",\n    \"updatedAt\": \"2025-09-18T19:10:33\"\n  },\n  {\n    \"id\": 27,\n    \"name\": \"cloud-dynamics\",\n    \"displayName\": \"Cloud Dynamics\",\n    \"contactEmail\": \"hello@clouddynamics.io\",\n    \"website\": \"https://www.clouddynamics.io\",\n    \"type\": \"VENDOR\",\n    \"roles\": [\n      \"vendor\"\n    ],\n    \"status\": \"ACTIVE\",\n    \"createdAt\": \"2025-09-18T19:09:57\",\n    \"updatedAt\": \"2025-09-18T19:10:33\"\n  }\n]"],"source":"frontend"},{"timestamp":1758473410468,"isoTimestamp":"2025-09-21T16:50:10.468Z","level":"log","message":"üìä Compute associations: []","args":["üìä Compute associations:",[]],"source":"frontend"},{"timestamp":1758473410469,"isoTimestamp":"2025-09-21T16:50:10.469Z","level":"log","message":"üéØ transformStellarToTree called with: [\n  {\n    \"id\": 1,\n    \"name\": \"amazon\",\n    \"displayName\": \"Amazon Web Services (AWS)\",\n    \"contactEmail\": \"billing@aws.amazon.com\",\n    \"website\": \"https://aws.amazon.com\",\n    \"type\": \"cloud-provider\",\n    \"roles\": [\n      \"cloud-provider\",\n      \"vendor\"\n    ],\n    \"status\": \"ACTIVE\"\n  },\n  {\n    \"id\": 2,\n    \"name\": \"google\",\n    \"displayName\": \"Google Cloud Platform\",\n    \"contactEmail\": \"billing@cloud.google.com\",\n    \"website\": \"https://cloud.google.com\",\n    \"type\": \"cloud-provider\",\n    \"roles\": [\n      \"cloud-provider\",\n      \"vendor\"\n    ],\n    \"status\": \"ACTIVE\"\n  },\n  {\n    \"id\": 3,\n    \"name\": \"microsoft\",\n    \"displayName\": \"Microsoft Azure\",\n    \"contactEmail\": \"billing@azure.microsoft.com\",\n    \"website\": \"https://azure.microsoft.com\",\n    \"type\": \"cloud-provider\",\n    \"roles\": [\n      \"cloud-provider\",\n      \"vendor\"\n    ],\n    \"status\": \"ACTIVE\"\n  },\n  {\n    \"id\": 4,\n    \"name\": \"ibm\",\n    \"displayName\": \"IBM Cloud\",\n    \"contactEmail\": \"billing@ibm.com\",\n    \"website\": \"https://www.ibm.com/cloud\",\n    \"type\": \"cloud-provider\",\n    \"roles\": [\n      \"cloud-provider\",\n      \"vendor\"\n    ],\n    \"status\": \"ACTIVE\"\n  },\n  {\n    \"id\": 5,\n    \"name\": \"oracle\",\n    \"displayName\": \"Oracle Cloud\",\n    \"contactEmail\": \"billing@oracle.com\",\n    \"website\": \"https://www.oracle.com/cloud\",\n    \"type\": \"cloud-provider\",\n    \"roles\": [\n      \"cloud-provider\",\n      \"vendor\"\n    ],\n    \"status\": \"ACTIVE\"\n  },\n  {\n    \"id\": 6,\n    \"name\": \"alibaba\",\n    \"displayName\": \"Alibaba Cloud\",\n    \"contactEmail\": \"billing@alibabacloud.com\",\n    \"website\": \"https://www.alibabacloud.com\",\n    \"type\": \"cloud-provider\",\n    \"roles\": [\n      \"cloud-provider\",\n      \"vendor\"\n    ],\n    \"status\": \"ACTIVE\"\n  },\n  {\n    \"id\": 7,\n    \"name\": \"digitalocean\",\n    \"displayName\": \"DigitalOcean\",\n    \"contactEmail\": \"billing@digitalocean.com\",\n    \"website\": \"https://www.digitalocean.com\",\n    \"type\": \"cloud-provider\",\n    \"roles\": [\n      \"cloud-provider\",\n      \"vendor\"\n    ],\n    \"status\": \"ACTIVE\"\n  },\n  {\n    \"id\": 8,\n    \"name\": \"linode\",\n    \"displayName\": \"Akamai Connected Cloud (Linode)\",\n    \"contactEmail\": \"billing@linode.com\",\n    \"website\": \"https://www.linode.com\",\n    \"type\": \"cloud-provider\",\n    \"roles\": [\n      \"cloud-provider\",\n      \"vendor\"\n    ],\n    \"status\": \"ACTIVE\"\n  },\n  {\n    \"id\": 9,\n    \"name\": \"vultr\",\n    \"displayName\": \"Vultr\",\n    \"contactEmail\": \"billing@vultr.com\",\n    \"website\": \"https://www.vultr.com\",\n    \"type\": \"cloud-provider\",\n    \"roles\": [\n      \"cloud-provider\",\n      \"vendor\"\n    ],\n    \"status\": \"ACTIVE\"\n  },\n  {\n    \"id\": 10,\n    \"name\": \"ovhcloud\",\n    \"displayName\": \"OVHcloud\",\n    \"contactEmail\": \"billing@ovhcloud.com\",\n    \"website\": \"https://www.ovhcloud.com\",\n    \"type\": \"cloud-provider\",\n    \"roles\": [\n      \"cloud-provider\",\n      \"vendor\"\n    ],\n    \"status\": \"ACTIVE\"\n  },\n  {\n    \"id\": 11,\n    \"name\": \"hetzner\",\n    \"displayName\": \"Hetzner\",\n    \"contactEmail\": \"billing@hetzner.com\",\n    \"website\": \"https://www.hetzner.com\",\n    \"type\": \"cloud-provider\",\n    \"roles\": [\n      \"cloud-provider\",\n      \"vendor\"\n    ],\n    \"status\": \"ACTIVE\"\n  },\n  {\n    \"id\": 12,\n    \"name\": \"equinix\",\n    \"displayName\": \"Equinix Metal\",\n    \"contactEmail\": \"billing@equinix.com\",\n    \"website\": \"https://metal.equinix.com\",\n    \"type\": \"cloud-provider\",\n    \"roles\": [\n      \"cloud-provider\",\n      \"vendor\"\n    ],\n    \"status\": \"ACTIVE\"\n  },\n  {\n    \"id\": 13,\n    \"name\": \"cloudflare\",\n    \"displayName\": \"Cloudflare\",\n    \"contactEmail\": \"billing@cloudflare.com\",\n    \"website\": \"https://www.cloudflare.com\",\n    \"type\": \"cloud-provider\",\n    \"roles\": [\n      \"cloud-provider\",\n      \"vendor\"\n    ],\n    \"status\": \"ACTIVE\"\n  },\n  {\n    \"id\": 14,\n    \"name\": \"contabo\",\n    \"displayName\": \"Contabo\",\n    \"contactEmail\": \"billing@contabo.com\",\n    \"website\": \"https://contabo.com\",\n    \"type\": \"cloud-provider\",\n    \"roles\": [\n      \"cloud-provider\",\n      \"vendor\"\n    ],\n    \"status\": \"ACTIVE\"\n  },\n  {\n    \"id\": 15,\n    \"name\": \"scaleway\",\n    \"displayName\": \"Scaleway\",\n    \"contactEmail\": \"billing@scaleway.com\",\n    \"website\": \"https://www.scaleway.com\",\n    \"type\": \"cloud-provider\",\n    \"roles\": [\n      \"cloud-provider\",\n      \"vendor\"\n    ],\n    \"status\": \"ACTIVE\"\n  },\n  {\n    \"id\": 16,\n    \"name\": \"dell\",\n    \"displayName\": \"Dell Technologies\",\n    \"contactEmail\": \"sales@dell.com\",\n    \"website\": \"https://www.dell.com\",\n    \"type\": \"vendor\",\n    \"roles\": [\n      \"hardware-vendor\",\n      \"vendor\"\n    ],\n    \"status\": \"ACTIVE\"\n  },\n  {\n    \"id\": 17,\n    \"name\": \"hp\",\n    \"displayName\": \"Hewlett Packard Enterprise\",\n    \"contactEmail\": \"sales@hpe.com\",\n    \"website\": \"https://www.hpe.com\",\n    \"type\": \"vendor\",\n    \"roles\": [\n      \"hardware-vendor\",\n      \"vendor\"\n    ],\n    \"status\": \"ACTIVE\"\n  },\n  {\n    \"id\": 18,\n    \"name\": \"cisco\",\n    \"displayName\": \"Cisco Systems\",\n    \"contactEmail\": \"sales@cisco.com\",\n    \"website\": \"https://www.cisco.com\",\n    \"type\": \"vendor\",\n    \"roles\": [\n      \"network-vendor\",\n      \"vendor\"\n    ],\n    \"status\": \"ACTIVE\"\n  },\n  {\n    \"id\": 19,\n    \"name\": \"juniper\",\n    \"displayName\": \"Juniper Networks\",\n    \"contactEmail\": \"sales@juniper.net\",\n    \"website\": \"https://www.juniper.net\",\n    \"type\": \"vendor\",\n    \"roles\": [\n      \"network-vendor\",\n      \"vendor\"\n    ],\n    \"status\": \"ACTIVE\"\n  },\n  {\n    \"id\": 20,\n    \"name\": \"vmware\",\n    \"displayName\": \"VMware\",\n    \"contactEmail\": \"sales@vmware.com\",\n    \"website\": \"https://www.vmware.com\",\n    \"type\": \"vendor\",\n    \"roles\": [\n      \"software-vendor\",\n      \"vendor\"\n    ],\n    \"status\": \"ACTIVE\"\n  },\n  {\n    \"id\": 21,\n    \"name\": \"redhat\",\n    \"displayName\": \"Red Hat\",\n    \"contactEmail\": \"sales@redhat.com\",\n    \"website\": \"https://www.redhat.com\",\n    \"type\": \"vendor\",\n    \"roles\": [\n      \"software-vendor\",\n      \"vendor\"\n    ],\n    \"status\": \"ACTIVE\"\n  },\n  {\n    \"id\": 22,\n    \"name\": \"canonical\",\n    \"displayName\": \"Canonical (Ubuntu)\",\n    \"contactEmail\": \"sales@canonical.com\",\n    \"website\": \"https://canonical.com\",\n    \"type\": \"vendor\",\n    \"roles\": [\n      \"software-vendor\",\n      \"vendor\"\n    ],\n    \"status\": \"ACTIVE\"\n  },\n  {\n    \"id\": 23,\n    \"name\": \"acme-corp\",\n    \"displayName\": \"ACME Corporation\",\n    \"contactEmail\": \"contact@acme.com\",\n    \"website\": \"https://acme.com\",\n    \"type\": \"customer\",\n    \"roles\": [\n      \"customer\"\n    ],\n    \"status\": \"ACTIVE\",\n    \"updatedAt\": \"2025-09-18T19:10:33\"\n  },\n  {\n    \"id\": 24,\n    \"name\": \"telcobright\",\n    \"displayName\": \"Telcobright\",\n    \"contactEmail\": \"admin@telcobright.com\",\n    \"website\": \"https://telcobright.com\",\n    \"type\": \"service-provider\",\n    \"roles\": [\n      \"self\"\n    ],\n    \"status\": \"ACTIVE\"\n  },\n  {\n    \"id\": 25,\n    \"name\": \"tech-solutions\",\n    \"displayName\": \"Tech Solutions Inc\",\n    \"contactEmail\": \"info@techsolutions.com\",\n    \"website\": \"https://www.techsolutions.com\",\n    \"type\": \"VENDOR\",\n    \"roles\": [\n      \"vendor\"\n    ],\n    \"status\": \"ACTIVE\",\n    \"createdAt\": \"2025-09-18T19:09:57\",\n    \"updatedAt\": \"2025-09-18T19:10:33\"\n  },\n  {\n    \"id\": 26,\n    \"name\": \"global-systems\",\n    \"displayName\": \"Global Systems Ltd\",\n    \"contactEmail\": \"support@globalsystems.com\",\n    \"website\": \"https://www.globalsystems.com\",\n    \"type\": \"CUSTOMER\",\n    \"roles\": [\n      \"customer\"\n    ],\n    \"status\": \"ACTIVE\",\n    \"createdAt\": \"2025-09-18T19:09:57\",\n    \"updatedAt\": \"2025-09-18T19:10:33\"\n  },\n  {\n    \"id\": 27,\n    \"name\": \"cloud-dynamics\",\n    \"displayName\": \"Cloud Dynamics\",\n    \"contactEmail\": \"hello@clouddynamics.io\",\n    \"website\": \"https://www.clouddynamics.io\",\n    \"type\": \"VENDOR\",\n    \"roles\": [\n      \"vendor\"\n    ],\n    \"status\": \"ACTIVE\",\n    \"createdAt\": \"2025-09-18T19:09:57\",\n    \"updatedAt\": \"2025-09-18T19:10:33\"\n  }\n] environments: []","args":["üéØ transformStellarToTree called with:",[{"id":1,"name":"amazon","displayName":"Amazon Web Services (AWS)","contactEmail":"billing@aws.amazon.com","website":"https://aws.amazon.com","type":"cloud-provider","roles":["cloud-provider","vendor"],"status":"ACTIVE"},{"id":2,"name":"google","displayName":"Google Cloud Platform","contactEmail":"billing@cloud.google.com","website":"https://cloud.google.com","type":"cloud-provider","roles":["cloud-provider","vendor"],"status":"ACTIVE"},{"id":3,"name":"microsoft","displayName":"Microsoft Azure","contactEmail":"billing@azure.microsoft.com","website":"https://azure.microsoft.com","type":"cloud-provider","roles":["cloud-provider","vendor"],"status":"ACTIVE"},{"id":4,"name":"ibm","displayName":"IBM Cloud","contactEmail":"billing@ibm.com","website":"https://www.ibm.com/cloud","type":"cloud-provider","roles":["cloud-provider","vendor"],"status":"ACTIVE"},{"id":5,"name":"oracle","displayName":"Oracle Cloud","contactEmail":"billing@oracle.com","website":"https://www.oracle.com/cloud","type":"cloud-provider","roles":["cloud-provider","vendor"],"status":"ACTIVE"},{"id":6,"name":"alibaba","displayName":"Alibaba Cloud","contactEmail":"billing@alibabacloud.com","website":"https://www.alibabacloud.com","type":"cloud-provider","roles":["cloud-provider","vendor"],"status":"ACTIVE"},{"id":7,"name":"digitalocean","displayName":"DigitalOcean","contactEmail":"billing@digitalocean.com","website":"https://www.digitalocean.com","type":"cloud-provider","roles":["cloud-provider","vendor"],"status":"ACTIVE"},{"id":8,"name":"linode","displayName":"Akamai Connected Cloud (Linode)","contactEmail":"billing@linode.com","website":"https://www.linode.com","type":"cloud-provider","roles":["cloud-provider","vendor"],"status":"ACTIVE"},{"id":9,"name":"vultr","displayName":"Vultr","contactEmail":"billing@vultr.com","website":"https://www.vultr.com","type":"cloud-provider","roles":["cloud-provider","vendor"],"status":"ACTIVE"},{"id":10,"name":"ovhcloud","displayName":"OVHcloud","contactEmail":"billing@ovhcloud.com","website":"https://www.ovhcloud.com","type":"cloud-provider","roles":["cloud-provider","vendor"],"status":"ACTIVE"},{"id":11,"name":"hetzner","displayName":"Hetzner","contactEmail":"billing@hetzner.com","website":"https://www.hetzner.com","type":"cloud-provider","roles":["cloud-provider","vendor"],"status":"ACTIVE"},{"id":12,"name":"equinix","displayName":"Equinix Metal","contactEmail":"billing@equinix.com","website":"https://metal.equinix.com","type":"cloud-provider","roles":["cloud-provider","vendor"],"status":"ACTIVE"},{"id":13,"name":"cloudflare","displayName":"Cloudflare","contactEmail":"billing@cloudflare.com","website":"https://www.cloudflare.com","type":"cloud-provider","roles":["cloud-provider","vendor"],"status":"ACTIVE"},{"id":14,"name":"contabo","displayName":"Contabo","contactEmail":"billing@contabo.com","website":"https://contabo.com","type":"cloud-provider","roles":["cloud-provider","vendor"],"status":"ACTIVE"},{"id":15,"name":"scaleway","displayName":"Scaleway","contactEmail":"billing@scaleway.com","website":"https://www.scaleway.com","type":"cloud-provider","roles":["cloud-provider","vendor"],"status":"ACTIVE"},{"id":16,"name":"dell","displayName":"Dell Technologies","contactEmail":"sales@dell.com","website":"https://www.dell.com","type":"vendor","roles":["hardware-vendor","vendor"],"status":"ACTIVE"},{"id":17,"name":"hp","displayName":"Hewlett Packard Enterprise","contactEmail":"sales@hpe.com","website":"https://www.hpe.com","type":"vendor","roles":["hardware-vendor","vendor"],"status":"ACTIVE"},{"id":18,"name":"cisco","displayName":"Cisco Systems","contactEmail":"sales@cisco.com","website":"https://www.cisco.com","type":"vendor","roles":["network-vendor","vendor"],"status":"ACTIVE"},{"id":19,"name":"juniper","displayName":"Juniper Networks","contactEmail":"sales@juniper.net","website":"https://www.juniper.net","type":"vendor","roles":["network-vendor","vendor"],"status":"ACTIVE"},{"id":20,"name":"vmware","displayName":"VMware","contactEmail":"sales@vmware.com","website":"https://www.vmware.com","type":"vendor","roles":["software-vendor","vendor"],"status":"ACTIVE"},{"id":21,"name":"redhat","displayName":"Red Hat","contactEmail":"sales@redhat.com","website":"https://www.redhat.com","type":"vendor","roles":["software-vendor","vendor"],"status":"ACTIVE"},{"id":22,"name":"canonical","displayName":"Canonical (Ubuntu)","contactEmail":"sales@canonical.com","website":"https://canonical.com","type":"vendor","roles":["software-vendor","vendor"],"status":"ACTIVE"},{"id":23,"name":"acme-corp","displayName":"ACME Corporation","contactEmail":"contact@acme.com","website":"https://acme.com","type":"customer","roles":["customer"],"status":"ACTIVE","updatedAt":"2025-09-18T19:10:33"},{"id":24,"name":"telcobright","displayName":"Telcobright","contactEmail":"admin@telcobright.com","website":"https://telcobright.com","type":"service-provider","roles":["self"],"status":"ACTIVE"},{"id":25,"name":"tech-solutions","displayName":"Tech Solutions Inc","contactEmail":"info@techsolutions.com","website":"https://www.techsolutions.com","type":"VENDOR","roles":["vendor"],"status":"ACTIVE","createdAt":"2025-09-18T19:09:57","updatedAt":"2025-09-18T19:10:33"},{"id":26,"name":"global-systems","displayName":"Global Systems Ltd","contactEmail":"support@globalsystems.com","website":"https://www.globalsystems.com","type":"CUSTOMER","roles":["customer"],"status":"ACTIVE","createdAt":"2025-09-18T19:09:57","updatedAt":"2025-09-18T19:10:33"},{"id":27,"name":"cloud-dynamics","displayName":"Cloud Dynamics","contactEmail":"hello@clouddynamics.io","website":"https://www.clouddynamics.io","type":"VENDOR","roles":["vendor"],"status":"ACTIVE","createdAt":"2025-09-18T19:09:57","updatedAt":"2025-09-18T19:10:33"}],"environments:",[]],"source":"frontend"},{"timestamp":1758473410469,"isoTimestamp":"2025-09-21T16:50:10.469Z","level":"log","message":"üìä transformStellarToTree: Processing 27 partners","args":["üìä transformStellarToTree: Processing 27 partners"],"source":"frontend"},{"timestamp":1758473410469,"isoTimestamp":"2025-09-21T16:50:10.469Z","level":"log","message":"  üè¢ Processing partner 1: amazon","args":["  üè¢ Processing partner 1:","amazon"],"source":"frontend"},{"timestamp":1758473410469,"isoTimestamp":"2025-09-21T16:50:10.469Z","level":"log","message":"  üè¢ Processing partner 2: google","args":["  üè¢ Processing partner 2:","google"],"source":"frontend"},{"timestamp":1758473410469,"isoTimestamp":"2025-09-21T16:50:10.469Z","level":"log","message":"  üè¢ Processing partner 3: microsoft","args":["  üè¢ Processing partner 3:","microsoft"],"source":"frontend"},{"timestamp":1758473410469,"isoTimestamp":"2025-09-21T16:50:10.469Z","level":"log","message":"  üè¢ Processing partner 4: ibm","args":["  üè¢ Processing partner 4:","ibm"],"source":"frontend"},{"timestamp":1758473410470,"isoTimestamp":"2025-09-21T16:50:10.470Z","level":"log","message":"  üè¢ Processing partner 5: oracle","args":["  üè¢ Processing partner 5:","oracle"],"source":"frontend"}],"metadata":{"source":"frontend","sessionId":"unknown"}}
{"timestamp":1758473410473,"isoTimestamp":"2025-09-21T16:50:10.473Z","type":"console","operation":"CONSOLE_LOGS","entity":"frontend","count":20,"messages":[{"timestamp":1758473410471,"isoTimestamp":"2025-09-21T16:50:10.471Z","level":"log","message":"  üè¢ Processing partner 6: alibaba","args":["  üè¢ Processing partner 6:","alibaba"],"source":"frontend"},{"timestamp":1758473410471,"isoTimestamp":"2025-09-21T16:50:10.471Z","level":"log","message":"  üè¢ Processing partner 7: digitalocean","args":["  üè¢ Processing partner 7:","digitalocean"],"source":"frontend"},{"timestamp":1758473410471,"isoTimestamp":"2025-09-21T16:50:10.471Z","level":"log","message":"  üè¢ Processing partner 8: linode","args":["  üè¢ Processing partner 8:","linode"],"source":"frontend"},{"timestamp":1758473410471,"isoTimestamp":"2025-09-21T16:50:10.471Z","level":"log","message":"  üè¢ Processing partner 9: vultr","args":["  üè¢ Processing partner 9:","vultr"],"source":"frontend"},{"timestamp":1758473410471,"isoTimestamp":"2025-09-21T16:50:10.471Z","level":"log","message":"  üè¢ Processing partner 10: ovhcloud","args":["  üè¢ Processing partner 10:","ovhcloud"],"source":"frontend"},{"timestamp":1758473410471,"isoTimestamp":"2025-09-21T16:50:10.471Z","level":"log","message":"  üè¢ Processing partner 11: hetzner","args":["  üè¢ Processing partner 11:","hetzner"],"source":"frontend"},{"timestamp":1758473410471,"isoTimestamp":"2025-09-21T16:50:10.471Z","level":"log","message":"  üè¢ Processing partner 12: equinix","args":["  üè¢ Processing partner 12:","equinix"],"source":"frontend"},{"timestamp":1758473410471,"isoTimestamp":"2025-09-21T16:50:10.471Z","level":"log","message":"  üè¢ Processing partner 13: cloudflare","args":["  üè¢ Processing partner 13:","cloudflare"],"source":"frontend"},{"timestamp":1758473410471,"isoTimestamp":"2025-09-21T16:50:10.471Z","level":"log","message":"  üè¢ Processing partner 14: contabo","args":["  üè¢ Processing partner 14:","contabo"],"source":"frontend"},{"timestamp":1758473410471,"isoTimestamp":"2025-09-21T16:50:10.471Z","level":"log","message":"  üè¢ Processing partner 15: scaleway","args":["  üè¢ Processing partner 15:","scaleway"],"source":"frontend"},{"timestamp":1758473410471,"isoTimestamp":"2025-09-21T16:50:10.471Z","level":"log","message":"  üè¢ Processing partner 16: dell","args":["  üè¢ Processing partner 16:","dell"],"source":"frontend"},{"timestamp":1758473410471,"isoTimestamp":"2025-09-21T16:50:10.471Z","level":"log","message":"  üè¢ Processing partner 17: hp","args":["  üè¢ Processing partner 17:","hp"],"source":"frontend"},{"timestamp":1758473410471,"isoTimestamp":"2025-09-21T16:50:10.471Z","level":"log","message":"  üè¢ Processing partner 18: cisco","args":["  üè¢ Processing partner 18:","cisco"],"source":"frontend"},{"timestamp":1758473410471,"isoTimestamp":"2025-09-21T16:50:10.471Z","level":"log","message":"  üè¢ Processing partner 19: juniper","args":["  üè¢ Processing partner 19:","juniper"],"source":"frontend"},{"timestamp":1758473410471,"isoTimestamp":"2025-09-21T16:50:10.471Z","level":"log","message":"  üè¢ Processing partner 20: vmware","args":["  üè¢ Processing partner 20:","vmware"],"source":"frontend"},{"timestamp":1758473410471,"isoTimestamp":"2025-09-21T16:50:10.471Z","level":"log","message":"  üè¢ Processing partner 21: redhat","args":["  üè¢ Processing partner 21:","redhat"],"source":"frontend"},{"timestamp":1758473410471,"isoTimestamp":"2025-09-21T16:50:10.471Z","level":"log","message":"  üè¢ Processing partner 22: canonical","args":["  üè¢ Processing partner 22:","canonical"],"source":"frontend"},{"timestamp":1758473410471,"isoTimestamp":"2025-09-21T16:50:10.471Z","level":"log","message":"  üè¢ Processing partner 23: acme-corp","args":["  üè¢ Processing partner 23:","acme-corp"],"source":"frontend"},{"timestamp":1758473410471,"isoTimestamp":"2025-09-21T16:50:10.471Z","level":"log","message":"  üè¢ Processing partner 24: telcobright","args":["  üè¢ Processing partner 24:","telcobright"],"source":"frontend"},{"timestamp":1758473410471,"isoTimestamp":"2025-09-21T16:50:10.471Z","level":"log","message":"  üè¢ Processing partner 25: tech-solutions","args":["  üè¢ Processing partner 25:","tech-solutions"],"source":"frontend"}],"metadata":{"source":"frontend","sessionId":"unknown"}}
{"timestamp":1758473410489,"isoTimestamp":"2025-09-21T16:50:10.489Z","type":"console","operation":"CONSOLE_LOGS","entity":"frontend","count":20,"messages":[{"timestamp":1758473410471,"isoTimestamp":"2025-09-21T16:50:10.471Z","level":"log","message":"  üè¢ Processing partner 26: global-systems","args":["  üè¢ Processing partner 26:","global-systems"],"source":"frontend"},{"timestamp":1758473410471,"isoTimestamp":"2025-09-21T16:50:10.471Z","level":"log","message":"  üè¢ Processing partner 27: cloud-dynamics","args":["  üè¢ Processing partner 27:","cloud-dynamics"],"source":"frontend"},{"timestamp":1758473410472,"isoTimestamp":"2025-09-21T16:50:10.472Z","level":"log","message":"‚úÖ transformStellarToTree result: [\n  {\n    \"id\": \"partner-1\",\n    \"name\": \"Amazon Web Services (AWS)\",\n    \"type\": \"partner\",\n    \"data\": {\n      \"id\": 1,\n      \"name\": \"amazon\",\n      \"displayName\": \"Amazon Web Services (AWS)\",\n      \"type\": \"cloud-provider\",\n      \"roles\": [\n        \"cloud-provider\",\n        \"vendor\"\n      ],\n      \"status\": \"ACTIVE\",\n      \"contactEmail\": \"billing@aws.amazon.com\",\n      \"website\": \"https://aws.amazon.com\"\n    },\n    \"children\": []\n  },\n  {\n    \"id\": \"partner-2\",\n    \"name\": \"Google Cloud Platform\",\n    \"type\": \"partner\",\n    \"data\": {\n      \"id\": 2,\n      \"name\": \"google\",\n      \"displayName\": \"Google Cloud Platform\",\n      \"type\": \"cloud-provider\",\n      \"roles\": [\n        \"cloud-provider\",\n        \"vendor\"\n      ],\n      \"status\": \"ACTIVE\",\n      \"contactEmail\": \"billing@cloud.google.com\",\n      \"website\": \"https://cloud.google.com\"\n    },\n    \"children\": []\n  },\n  {\n    \"id\": \"partner-3\",\n    \"name\": \"Microsoft Azure\",\n    \"type\": \"partner\",\n    \"data\": {\n      \"id\": 3,\n      \"name\": \"microsoft\",\n      \"displayName\": \"Microsoft Azure\",\n      \"type\": \"cloud-provider\",\n      \"roles\": [\n        \"cloud-provider\",\n        \"vendor\"\n      ],\n      \"status\": \"ACTIVE\",\n      \"contactEmail\": \"billing@azure.microsoft.com\",\n      \"website\": \"https://azure.microsoft.com\"\n    },\n    \"children\": []\n  },\n  {\n    \"id\": \"partner-4\",\n    \"name\": \"IBM Cloud\",\n    \"type\": \"partner\",\n    \"data\": {\n      \"id\": 4,\n      \"name\": \"ibm\",\n      \"displayName\": \"IBM Cloud\",\n      \"type\": \"cloud-provider\",\n      \"roles\": [\n        \"cloud-provider\",\n        \"vendor\"\n      ],\n      \"status\": \"ACTIVE\",\n      \"contactEmail\": \"billing@ibm.com\",\n      \"website\": \"https://www.ibm.com/cloud\"\n    },\n    \"children\": []\n  },\n  {\n    \"id\": \"partner-5\",\n    \"name\": \"Oracle Cloud\",\n    \"type\": \"partner\",\n    \"data\": {\n      \"id\": 5,\n      \"name\": \"oracle\",\n      \"displayName\": \"Oracle Cloud\",\n      \"type\": \"cloud-provider\",\n      \"roles\": [\n        \"cloud-provider\",\n        \"vendor\"\n      ],\n      \"status\": \"ACTIVE\",\n      \"contactEmail\": \"billing@oracle.com\",\n      \"website\": \"https://www.oracle.com/cloud\"\n    },\n    \"children\": []\n  },\n  {\n    \"id\": \"partner-6\",\n    \"name\": \"Alibaba Cloud\",\n    \"type\": \"partner\",\n    \"data\": {\n      \"id\": 6,\n      \"name\": \"alibaba\",\n      \"displayName\": \"Alibaba Cloud\",\n      \"type\": \"cloud-provider\",\n      \"roles\": [\n        \"cloud-provider\",\n        \"vendor\"\n      ],\n      \"status\": \"ACTIVE\",\n      \"contactEmail\": \"billing@alibabacloud.com\",\n      \"website\": \"https://www.alibabacloud.com\"\n    },\n    \"children\": []\n  },\n  {\n    \"id\": \"partner-7\",\n    \"name\": \"DigitalOcean\",\n    \"type\": \"partner\",\n    \"data\": {\n      \"id\": 7,\n      \"name\": \"digitalocean\",\n      \"displayName\": \"DigitalOcean\",\n      \"type\": \"cloud-provider\",\n      \"roles\": [\n        \"cloud-provider\",\n        \"vendor\"\n      ],\n      \"status\": \"ACTIVE\",\n      \"contactEmail\": \"billing@digitalocean.com\",\n      \"website\": \"https://www.digitalocean.com\"\n    },\n    \"children\": []\n  },\n  {\n    \"id\": \"partner-8\",\n    \"name\": \"Akamai Connected Cloud (Linode)\",\n    \"type\": \"partner\",\n    \"data\": {\n      \"id\": 8,\n      \"name\": \"linode\",\n      \"displayName\": \"Akamai Connected Cloud (Linode)\",\n      \"type\": \"cloud-provider\",\n      \"roles\": [\n        \"cloud-provider\",\n        \"vendor\"\n      ],\n      \"status\": \"ACTIVE\",\n      \"contactEmail\": \"billing@linode.com\",\n      \"website\": \"https://www.linode.com\"\n    },\n    \"children\": []\n  },\n  {\n    \"id\": \"partner-9\",\n    \"name\": \"Vultr\",\n    \"type\": \"partner\",\n    \"data\": {\n      \"id\": 9,\n      \"name\": \"vultr\",\n      \"displayName\": \"Vultr\",\n      \"type\": \"cloud-provider\",\n      \"roles\": [\n        \"cloud-provider\",\n        \"vendor\"\n      ],\n      \"status\": \"ACTIVE\",\n      \"contactEmail\": \"billing@vultr.com\",\n      \"website\": \"https://www.vultr.com\"\n    },\n    \"children\": []\n  },\n  {\n    \"id\": \"partner-10\",\n    \"name\": \"OVHcloud\",\n    \"type\": \"partner\",\n    \"data\": {\n      \"id\": 10,\n      \"name\": \"ovhcloud\",\n      \"displayName\": \"OVHcloud\",\n      \"type\": \"cloud-provider\",\n      \"roles\": [\n        \"cloud-provider\",\n        \"vendor\"\n      ],\n      \"status\": \"ACTIVE\",\n      \"contactEmail\": \"billing@ovhcloud.com\",\n      \"website\": \"https://www.ovhcloud.com\"\n    },\n    \"children\": []\n  },\n  {\n    \"id\": \"partner-11\",\n    \"name\": \"Hetzner\",\n    \"type\": \"partner\",\n    \"data\": {\n      \"id\": 11,\n      \"name\": \"hetzner\",\n      \"displayName\": \"Hetzner\",\n      \"type\": \"cloud-provider\",\n      \"roles\": [\n        \"cloud-provider\",\n        \"vendor\"\n      ],\n      \"status\": \"ACTIVE\",\n      \"contactEmail\": \"billing@hetzner.com\",\n      \"website\": \"https://www.hetzner.com\"\n    },\n    \"children\": []\n  },\n  {\n    \"id\": \"partner-12\",\n    \"name\": \"Equinix Metal\",\n    \"type\": \"partner\",\n    \"data\": {\n      \"id\": 12,\n      \"name\": \"equinix\",\n      \"displayName\": \"Equinix Metal\",\n      \"type\": \"cloud-provider\",\n      \"roles\": [\n        \"cloud-provider\",\n        \"vendor\"\n      ],\n      \"status\": \"ACTIVE\",\n      \"contactEmail\": \"billing@equinix.com\",\n      \"website\": \"https://metal.equinix.com\"\n    },\n    \"children\": []\n  },\n  {\n    \"id\": \"partner-13\",\n    \"name\": \"Cloudflare\",\n    \"type\": \"partner\",\n    \"data\": {\n      \"id\": 13,\n      \"name\": \"cloudflare\",\n      \"displayName\": \"Cloudflare\",\n      \"type\": \"cloud-provider\",\n      \"roles\": [\n        \"cloud-provider\",\n        \"vendor\"\n      ],\n      \"status\": \"ACTIVE\",\n      \"contactEmail\": \"billing@cloudflare.com\",\n      \"website\": \"https://www.cloudflare.com\"\n    },\n    \"children\": []\n  },\n  {\n    \"id\": \"partner-14\",\n    \"name\": \"Contabo\",\n    \"type\": \"partner\",\n    \"data\": {\n      \"id\": 14,\n      \"name\": \"contabo\",\n      \"displayName\": \"Contabo\",\n      \"type\": \"cloud-provider\",\n      \"roles\": [\n        \"cloud-provider\",\n        \"vendor\"\n      ],\n      \"status\": \"ACTIVE\",\n      \"contactEmail\": \"billing@contabo.com\",\n      \"website\": \"https://contabo.com\"\n    },\n    \"children\": []\n  },\n  {\n    \"id\": \"partner-15\",\n    \"name\": \"Scaleway\",\n    \"type\": \"partner\",\n    \"data\": {\n      \"id\": 15,\n      \"name\": \"scaleway\",\n      \"displayName\": \"Scaleway\",\n      \"type\": \"cloud-provider\",\n      \"roles\": [\n        \"cloud-provider\",\n        \"vendor\"\n      ],\n      \"status\": \"ACTIVE\",\n      \"contactEmail\": \"billing@scaleway.com\",\n      \"website\": \"https://www.scaleway.com\"\n    },\n    \"children\": []\n  },\n  {\n    \"id\": \"partner-16\",\n    \"name\": \"Dell Technologies\",\n    \"type\": \"partner\",\n    \"data\": {\n      \"id\": 16,\n      \"name\": \"dell\",\n      \"displayName\": \"Dell Technologies\",\n      \"type\": \"vendor\",\n      \"roles\": [\n        \"hardware-vendor\",\n        \"vendor\"\n      ],\n      \"status\": \"ACTIVE\",\n      \"contactEmail\": \"sales@dell.com\",\n      \"website\": \"https://www.dell.com\"\n    },\n    \"children\": []\n  },\n  {\n    \"id\": \"partner-17\",\n    \"name\": \"Hewlett Packard Enterprise\",\n    \"type\": \"partner\",\n    \"data\": {\n      \"id\": 17,\n      \"name\": \"hp\",\n      \"displayName\": \"Hewlett Packard Enterprise\",\n      \"type\": \"vendor\",\n      \"roles\": [\n        \"hardware-vendor\",\n        \"vendor\"\n      ],\n      \"status\": \"ACTIVE\",\n      \"contactEmail\": \"sales@hpe.com\",\n      \"website\": \"https://www.hpe.com\"\n    },\n    \"children\": []\n  },\n  {\n    \"id\": \"partner-18\",\n    \"name\": \"Cisco Systems\",\n    \"type\": \"partner\",\n    \"data\": {\n      \"id\": 18,\n      \"name\": \"cisco\",\n      \"displayName\": \"Cisco Systems\",\n      \"type\": \"vendor\",\n      \"roles\": [\n        \"network-vendor\",\n        \"vendor\"\n      ],\n      \"status\": \"ACTIVE\",\n      \"contactEmail\": \"sales@cisco.com\",\n      \"website\": \"https://www.cisco.com\"\n    },\n    \"children\": []\n  },\n  {\n    \"id\": \"partner-19\",\n    \"name\": \"Juniper Networks\",\n    \"type\": \"partner\",\n    \"data\": {\n      \"id\": 19,\n      \"name\": \"juniper\",\n      \"displayName\": \"Juniper Networks\",\n      \"type\": \"vendor\",\n      \"roles\": [\n        \"network-vendor\",\n        \"vendor\"\n      ],\n      \"status\": \"ACTIVE\",\n      \"contactEmail\": \"sales@juniper.net\",\n      \"website\": \"https://www.juniper.net\"\n    },\n    \"children\": []\n  },\n  {\n    \"id\": \"partner-20\",\n    \"name\": \"VMware\",\n    \"type\": \"partner\",\n    \"data\": {\n      \"id\": 20,\n      \"name\": \"vmware\",\n      \"displayName\": \"VMware\",\n      \"type\": \"vendor\",\n      \"roles\": [\n        \"software-vendor\",\n        \"vendor\"\n      ],\n      \"status\": \"ACTIVE\",\n      \"contactEmail\": \"sales@vmware.com\",\n      \"website\": \"https://www.vmware.com\"\n    },\n    \"children\": []\n  },\n  {\n    \"id\": \"partner-21\",\n    \"name\": \"Red Hat\",\n    \"type\": \"partner\",\n    \"data\": {\n      \"id\": 21,\n      \"name\": \"redhat\",\n      \"displayName\": \"Red Hat\",\n      \"type\": \"vendor\",\n      \"roles\": [\n        \"software-vendor\",\n        \"vendor\"\n      ],\n      \"status\": \"ACTIVE\",\n      \"contactEmail\": \"sales@redhat.com\",\n      \"website\": \"https://www.redhat.com\"\n    },\n    \"children\": []\n  },\n  {\n    \"id\": \"partner-22\",\n    \"name\": \"Canonical (Ubuntu)\",\n    \"type\": \"partner\",\n    \"data\": {\n      \"id\": 22,\n      \"name\": \"canonical\",\n      \"displayName\": \"Canonical (Ubuntu)\",\n      \"type\": \"vendor\",\n      \"roles\": [\n        \"software-vendor\",\n        \"vendor\"\n      ],\n      \"status\": \"ACTIVE\",\n      \"contactEmail\": \"sales@canonical.com\",\n      \"website\": \"https://canonical.com\"\n    },\n    \"children\": []\n  },\n  {\n    \"id\": \"partner-23\",\n    \"name\": \"ACME Corporation\",\n    \"type\": \"partner\",\n    \"data\": {\n      \"id\": 23,\n      \"name\": \"acme-corp\",\n      \"displayName\": \"ACME Corporation\",\n      \"type\": \"customer\",\n      \"roles\": [\n        \"customer\"\n      ],\n      \"status\": \"ACTIVE\",\n      \"contactEmail\": \"contact@acme.com\",\n      \"website\": \"https://acme.com\"\n    },\n    \"children\": []\n  },\n  {\n    \"id\": \"partner-24\",\n    \"name\": \"Telcobright\",\n    \"type\": \"partner\",\n    \"data\": {\n      \"id\": 24,\n      \"name\": \"telcobright\",\n      \"displayName\": \"Telcobright\",\n      \"type\": \"service-provider\",\n      \"roles\": [\n        \"self\"\n      ],\n      \"status\": \"ACTIVE\",\n      \"contactEmail\": \"admin@telcobright.com\",\n      \"website\": \"https://telcobright.com\"\n    },\n    \"children\": []\n  },\n  {\n    \"id\": \"partner-25\",\n    \"name\": \"Tech Solutions Inc\",\n    \"type\": \"partner\",\n    \"data\": {\n      \"id\": 25,\n      \"name\": \"tech-solutions\",\n      \"displayName\": \"Tech Solutions Inc\",\n      \"type\": \"VENDOR\",\n      \"roles\": [\n        \"vendor\"\n      ],\n      \"status\": \"ACTIVE\",\n      \"contactEmail\": \"info@techsolutions.com\",\n      \"website\": \"https://www.techsolutions.com\"\n    },\n    \"children\": []\n  },\n  {\n    \"id\": \"partner-26\",\n    \"name\": \"Global Systems Ltd\",\n    \"type\": \"partner\",\n    \"data\": {\n      \"id\": 26,\n      \"name\": \"global-systems\",\n      \"displayName\": \"Global Systems Ltd\",\n      \"type\": \"CUSTOMER\",\n      \"roles\": [\n        \"customer\"\n      ],\n      \"status\": \"ACTIVE\",\n      \"contactEmail\": \"support@globalsystems.com\",\n      \"website\": \"https://www.globalsystems.com\"\n    },\n    \"children\": []\n  },\n  {\n    \"id\": \"partner-27\",\n    \"name\": \"Cloud Dynamics\",\n    \"type\": \"partner\",\n    \"data\": {\n      \"id\": 27,\n      \"name\": \"cloud-dynamics\",\n      \"displayName\": \"Cloud Dynamics\",\n      \"type\": \"VENDOR\",\n      \"roles\": [\n        \"vendor\"\n      ],\n      \"status\": \"ACTIVE\",\n      \"contactEmail\": \"hello@clouddynamics.io\",\n      \"website\": \"https://www.clouddynamics.io\"\n    },\n    \"children\": []\n  }\n]","args":["‚úÖ transformStellarToTree result:","[\n  {\n    \"id\": \"partner-1\",\n    \"name\": \"Amazon Web Services (AWS)\",\n    \"type\": \"partner\",\n    \"data\": {\n      \"id\": 1,\n      \"name\": \"amazon\",\n      \"displayName\": \"Amazon Web Services (AWS)\",\n      \"type\": \"cloud-provider\",\n      \"roles\": [\n        \"cloud-provider\",\n        \"vendor\"\n      ],\n      \"status\": \"ACTIVE\",\n      \"contactEmail\": \"billing@aws.amazon.com\",\n      \"website\": \"https://aws.amazon.com\"\n    },\n    \"children\": []\n  },\n  {\n    \"id\": \"partner-2\",\n    \"name\": \"Google Cloud Platform\",\n    \"type\": \"partner\",\n    \"data\": {\n      \"id\": 2,\n      \"name\": \"google\",\n      \"displayName\": \"Google Cloud Platform\",\n      \"type\": \"cloud-provider\",\n      \"roles\": [\n        \"cloud-provider\",\n        \"vendor\"\n      ],\n      \"status\": \"ACTIVE\",\n      \"contactEmail\": \"billing@cloud.google.com\",\n      \"website\": \"https://cloud.google.com\"\n    },\n    \"children\": []\n  },\n  {\n    \"id\": \"partner-3\",\n    \"name\": \"Microsoft Azure\",\n    \"type\": \"partner\",\n    \"data\": {\n      \"id\": 3,\n      \"name\": \"microsoft\",\n      \"displayName\": \"Microsoft Azure\",\n      \"type\": \"cloud-provider\",\n      \"roles\": [\n        \"cloud-provider\",\n        \"vendor\"\n      ],\n      \"status\": \"ACTIVE\",\n      \"contactEmail\": \"billing@azure.microsoft.com\",\n      \"website\": \"https://azure.microsoft.com\"\n    },\n    \"children\": []\n  },\n  {\n    \"id\": \"partner-4\",\n    \"name\": \"IBM Cloud\",\n    \"type\": \"partner\",\n    \"data\": {\n      \"id\": 4,\n      \"name\": \"ibm\",\n      \"displayName\": \"IBM Cloud\",\n      \"type\": \"cloud-provider\",\n      \"roles\": [\n        \"cloud-provider\",\n        \"vendor\"\n      ],\n      \"status\": \"ACTIVE\",\n      \"contactEmail\": \"billing@ibm.com\",\n      \"website\": \"https://www.ibm.com/cloud\"\n    },\n    \"children\": []\n  },\n  {\n    \"id\": \"partner-5\",\n    \"name\": \"Oracle Cloud\",\n    \"type\": \"partner\",\n    \"data\": {\n      \"id\": 5,\n      \"name\": \"oracle\",\n      \"displayName\": \"Oracle Cloud\",\n      \"type\": \"cloud-provider\",\n      \"roles\": [\n        \"cloud-provider\",\n        \"vendor\"\n      ],\n      \"status\": \"ACTIVE\",\n      \"contactEmail\": \"billing@oracle.com\",\n      \"website\": \"https://www.oracle.com/cloud\"\n    },\n    \"children\": []\n  },\n  {\n    \"id\": \"partner-6\",\n    \"name\": \"Alibaba Cloud\",\n    \"type\": \"partner\",\n    \"data\": {\n      \"id\": 6,\n      \"name\": \"alibaba\",\n      \"displayName\": \"Alibaba Cloud\",\n      \"type\": \"cloud-provider\",\n      \"roles\": [\n        \"cloud-provider\",\n        \"vendor\"\n      ],\n      \"status\": \"ACTIVE\",\n      \"contactEmail\": \"billing@alibabacloud.com\",\n      \"website\": \"https://www.alibabacloud.com\"\n    },\n    \"children\": []\n  },\n  {\n    \"id\": \"partner-7\",\n    \"name\": \"DigitalOcean\",\n    \"type\": \"partner\",\n    \"data\": {\n      \"id\": 7,\n      \"name\": \"digitalocean\",\n      \"displayName\": \"DigitalOcean\",\n      \"type\": \"cloud-provider\",\n      \"roles\": [\n        \"cloud-provider\",\n        \"vendor\"\n      ],\n      \"status\": \"ACTIVE\",\n      \"contactEmail\": \"billing@digitalocean.com\",\n      \"website\": \"https://www.digitalocean.com\"\n    },\n    \"children\": []\n  },\n  {\n    \"id\": \"partner-8\",\n    \"name\": \"Akamai Connected Cloud (Linode)\",\n    \"type\": \"partner\",\n    \"data\": {\n      \"id\": 8,\n      \"name\": \"linode\",\n      \"displayName\": \"Akamai Connected Cloud (Linode)\",\n      \"type\": \"cloud-provider\",\n      \"roles\": [\n        \"cloud-provider\",\n        \"vendor\"\n      ],\n      \"status\": \"ACTIVE\",\n      \"contactEmail\": \"billing@linode.com\",\n      \"website\": \"https://www.linode.com\"\n    },\n    \"children\": []\n  },\n  {\n    \"id\": \"partner-9\",\n    \"name\": \"Vultr\",\n    \"type\": \"partner\",\n    \"data\": {\n      \"id\": 9,\n      \"name\": \"vultr\",\n      \"displayName\": \"Vultr\",\n      \"type\": \"cloud-provider\",\n      \"roles\": [\n        \"cloud-provider\",\n        \"vendor\"\n      ],\n      \"status\": \"ACTIVE\",\n      \"contactEmail\": \"billing@vultr.com\",\n      \"website\": \"https://www.vultr.com\"\n    },\n    \"children\": []\n  },\n  {\n    \"id\": \"partner-10\",\n    \"name\": \"OVHcloud\",\n    \"type\": \"partner\",\n    \"data\": {\n      \"id\": 10,\n      \"name\": \"ovhcloud\",\n      \"displayName\": \"OVHcloud\",\n      \"type\": \"cloud-provider\",\n      \"roles\": [\n        \"cloud-provider\",\n        \"vendor\"\n      ],\n      \"status\": \"ACTIVE\",\n      \"contactEmail\": \"billing@ovhcloud.com\",\n      \"website\": \"https://www.ovhcloud.com\"\n    },\n    \"children\": []\n  },\n  {\n    \"id\": \"partner-11\",\n    \"name\": \"Hetzner\",\n    \"type\": \"partner\",\n    \"data\": {\n      \"id\": 11,\n      \"name\": \"hetzner\",\n      \"displayName\": \"Hetzner\",\n      \"type\": \"cloud-provider\",\n      \"roles\": [\n        \"cloud-provider\",\n        \"vendor\"\n      ],\n      \"status\": \"ACTIVE\",\n      \"contactEmail\": \"billing@hetzner.com\",\n      \"website\": \"https://www.hetzner.com\"\n    },\n    \"children\": []\n  },\n  {\n    \"id\": \"partner-12\",\n    \"name\": \"Equinix Metal\",\n    \"type\": \"partner\",\n    \"data\": {\n      \"id\": 12,\n      \"name\": \"equinix\",\n      \"displayName\": \"Equinix Metal\",\n      \"type\": \"cloud-provider\",\n      \"roles\": [\n        \"cloud-provider\",\n        \"vendor\"\n      ],\n      \"status\": \"ACTIVE\",\n      \"contactEmail\": \"billing@equinix.com\",\n      \"website\": \"https://metal.equinix.com\"\n    },\n    \"children\": []\n  },\n  {\n    \"id\": \"partner-13\",\n    \"name\": \"Cloudflare\",\n    \"type\": \"partner\",\n    \"data\": {\n      \"id\": 13,\n      \"name\": \"cloudflare\",\n      \"displayName\": \"Cloudflare\",\n      \"type\": \"cloud-provider\",\n      \"roles\": [\n        \"cloud-provider\",\n        \"vendor\"\n      ],\n      \"status\": \"ACTIVE\",\n      \"contactEmail\": \"billing@cloudflare.com\",\n      \"website\": \"https://www.cloudflare.com\"\n    },\n    \"children\": []\n  },\n  {\n    \"id\": \"partner-14\",\n    \"name\": \"Contabo\",\n    \"type\": \"partner\",\n    \"data\": {\n      \"id\": 14,\n      \"name\": \"contabo\",\n      \"displayName\": \"Contabo\",\n      \"type\": \"cloud-provider\",\n      \"roles\": [\n        \"cloud-provider\",\n        \"vendor\"\n      ],\n      \"status\": \"ACTIVE\",\n      \"contactEmail\": \"billing@contabo.com\",\n      \"website\": \"https://contabo.com\"\n    },\n    \"children\": []\n  },\n  {\n    \"id\": \"partner-15\",\n    \"name\": \"Scaleway\",\n    \"type\": \"partner\",\n    \"data\": {\n      \"id\": 15,\n      \"name\": \"scaleway\",\n      \"displayName\": \"Scaleway\",\n      \"type\": \"cloud-provider\",\n      \"roles\": [\n        \"cloud-provider\",\n        \"vendor\"\n      ],\n      \"status\": \"ACTIVE\",\n      \"contactEmail\": \"billing@scaleway.com\",\n      \"website\": \"https://www.scaleway.com\"\n    },\n    \"children\": []\n  },\n  {\n    \"id\": \"partner-16\",\n    \"name\": \"Dell Technologies\",\n    \"type\": \"partner\",\n    \"data\": {\n      \"id\": 16,\n      \"name\": \"dell\",\n      \"displayName\": \"Dell Technologies\",\n      \"type\": \"vendor\",\n      \"roles\": [\n        \"hardware-vendor\",\n        \"vendor\"\n      ],\n      \"status\": \"ACTIVE\",\n      \"contactEmail\": \"sales@dell.com\",\n      \"website\": \"https://www.dell.com\"\n    },\n    \"children\": []\n  },\n  {\n    \"id\": \"partner-17\",\n    \"name\": \"Hewlett Packard Enterprise\",\n    \"type\": \"partner\",\n    \"data\": {\n      \"id\": 17,\n      \"name\": \"hp\",\n      \"displayName\": \"Hewlett Packard Enterprise\",\n      \"type\": \"vendor\",\n      \"roles\": [\n        \"hardware-vendor\",\n        \"vendor\"\n      ],\n      \"status\": \"ACTIVE\",\n      \"contactEmail\": \"sales@hpe.com\",\n      \"website\": \"https://www.hpe.com\"\n    },\n    \"children\": []\n  },\n  {\n    \"id\": \"partner-18\",\n    \"name\": \"Cisco Systems\",\n    \"type\": \"partner\",\n    \"data\": {\n      \"id\": 18,\n      \"name\": \"cisco\",\n      \"displayName\": \"Cisco Systems\",\n      \"type\": \"vendor\",\n      \"roles\": [\n        \"network-vendor\",\n        \"vendor\"\n      ],\n      \"status\": \"ACTIVE\",\n      \"contactEmail\": \"sales@cisco.com\",\n      \"website\": \"https://www.cisco.com\"\n    },\n    \"children\": []\n  },\n  {\n    \"id\": \"partner-19\",\n    \"name\": \"Juniper Networks\",\n    \"type\": \"partner\",\n    \"data\": {\n      \"id\": 19,\n      \"name\": \"juniper\",\n      \"displayName\": \"Juniper Networks\",\n      \"type\": \"vendor\",\n      \"roles\": [\n        \"network-vendor\",\n        \"vendor\"\n      ],\n      \"status\": \"ACTIVE\",\n      \"contactEmail\": \"sales@juniper.net\",\n      \"website\": \"https://www.juniper.net\"\n    },\n    \"children\": []\n  },\n  {\n    \"id\": \"partner-20\",\n    \"name\": \"VMware\",\n    \"type\": \"partner\",\n    \"data\": {\n      \"id\": 20,\n      \"name\": \"vmware\",\n      \"displayName\": \"VMware\",\n      \"type\": \"vendor\",\n      \"roles\": [\n        \"software-vendor\",\n        \"vendor\"\n      ],\n      \"status\": \"ACTIVE\",\n      \"contactEmail\": \"sales@vmware.com\",\n      \"website\": \"https://www.vmware.com\"\n    },\n    \"children\": []\n  },\n  {\n    \"id\": \"partner-21\",\n    \"name\": \"Red Hat\",\n    \"type\": \"partner\",\n    \"data\": {\n      \"id\": 21,\n      \"name\": \"redhat\",\n      \"displayName\": \"Red Hat\",\n      \"type\": \"vendor\",\n      \"roles\": [\n        \"software-vendor\",\n        \"vendor\"\n      ],\n      \"status\": \"ACTIVE\",\n      \"contactEmail\": \"sales@redhat.com\",\n      \"website\": \"https://www.redhat.com\"\n    },\n    \"children\": []\n  },\n  {\n    \"id\": \"partner-22\",\n    \"name\": \"Canonical (Ubuntu)\",\n    \"type\": \"partner\",\n    \"data\": {\n      \"id\": 22,\n      \"name\": \"canonical\",\n      \"displayName\": \"Canonical (Ubuntu)\",\n      \"type\": \"vendor\",\n      \"roles\": [\n        \"software-vendor\",\n        \"vendor\"\n      ],\n      \"status\": \"ACTIVE\",\n      \"contactEmail\": \"sales@canonical.com\",\n      \"website\": \"https://canonical.com\"\n    },\n    \"children\": []\n  },\n  {\n    \"id\": \"partner-23\",\n    \"name\": \"ACME Corporation\",\n    \"type\": \"partner\",\n    \"data\": {\n      \"id\": 23,\n      \"name\": \"acme-corp\",\n      \"displayName\": \"ACME Corporation\",\n      \"type\": \"customer\",\n      \"roles\": [\n        \"customer\"\n      ],\n      \"status\": \"ACTIVE\",\n      \"contactEmail\": \"contact@acme.com\",\n      \"website\": \"https://acme.com\"\n    },\n    \"children\": []\n  },\n  {\n    \"id\": \"partner-24\",\n    \"name\": \"Telcobright\",\n    \"type\": \"partner\",\n    \"data\": {\n      \"id\": 24,\n      \"name\": \"telcobright\",\n      \"displayName\": \"Telcobright\",\n      \"type\": \"service-provider\",\n      \"roles\": [\n        \"self\"\n      ],\n      \"status\": \"ACTIVE\",\n      \"contactEmail\": \"admin@telcobright.com\",\n      \"website\": \"https://telcobright.com\"\n    },\n    \"children\": []\n  },\n  {\n    \"id\": \"partner-25\",\n    \"name\": \"Tech Solutions Inc\",\n    \"type\": \"partner\",\n    \"data\": {\n      \"id\": 25,\n      \"name\": \"tech-solutions\",\n      \"displayName\": \"Tech Solutions Inc\",\n      \"type\": \"VENDOR\",\n      \"roles\": [\n        \"vendor\"\n      ],\n      \"status\": \"ACTIVE\",\n      \"contactEmail\": \"info@techsolutions.com\",\n      \"website\": \"https://www.techsolutions.com\"\n    },\n    \"children\": []\n  },\n  {\n    \"id\": \"partner-26\",\n    \"name\": \"Global Systems Ltd\",\n    \"type\": \"partner\",\n    \"data\": {\n      \"id\": 26,\n      \"name\": \"global-systems\",\n      \"displayName\": \"Global Systems Ltd\",\n      \"type\": \"CUSTOMER\",\n      \"roles\": [\n        \"customer\"\n      ],\n      \"status\": \"ACTIVE\",\n      \"contactEmail\": \"support@globalsystems.com\",\n      \"website\": \"https://www.globalsystems.com\"\n    },\n    \"children\": []\n  },\n  {\n    \"id\": \"partner-27\",\n    \"name\": \"Cloud Dynamics\",\n    \"type\": \"partner\",\n    \"data\": {\n      \"id\": 27,\n      \"name\": \"cloud-dynamics\",\n      \"displayName\": \"Cloud Dynamics\",\n      \"type\": \"VENDOR\",\n      \"roles\": [\n        \"vendor\"\n      ],\n      \"status\": \"ACTIVE\",\n      \"contactEmail\": \"hello@clouddynamics.io\",\n      \"website\": \"https://www.clouddynamics.io\"\n    },\n    \"children\": []\n  }\n]"],"source":"frontend"},{"timestamp":1758473410476,"isoTimestamp":"2025-09-21T16:50:10.476Z","level":"log","message":"üå≤ Unified tree: [\n  {\n    \"id\": \"partner-1\",\n    \"name\": \"Amazon Web Services (AWS)\",\n    \"type\": \"partner\",\n    \"data\": {\n      \"id\": 1,\n      \"name\": \"amazon\",\n      \"displayName\": \"Amazon Web Services (AWS)\",\n      \"type\": \"cloud-provider\",\n      \"roles\": [\n        \"cloud-provider\",\n        \"vendor\"\n      ],\n      \"status\": \"ACTIVE\",\n      \"contactEmail\": \"billing@aws.amazon.com\",\n      \"website\": \"https://aws.amazon.com\"\n    },\n    \"children\": []\n  },\n  {\n    \"id\": \"partner-2\",\n    \"name\": \"Google Cloud Platform\",\n    \"type\": \"partner\",\n    \"data\": {\n      \"id\": 2,\n      \"name\": \"google\",\n      \"displayName\": \"Google Cloud Platform\",\n      \"type\": \"cloud-provider\",\n      \"roles\": [\n        \"cloud-provider\",\n        \"vendor\"\n      ],\n      \"status\": \"ACTIVE\",\n      \"contactEmail\": \"billing@cloud.google.com\",\n      \"website\": \"https://cloud.google.com\"\n    },\n    \"children\": []\n  },\n  {\n    \"id\": \"partner-3\",\n    \"name\": \"Microsoft Azure\",\n    \"type\": \"partner\",\n    \"data\": {\n      \"id\": 3,\n      \"name\": \"microsoft\",\n      \"displayName\": \"Microsoft Azure\",\n      \"type\": \"cloud-provider\",\n      \"roles\": [\n        \"cloud-provider\",\n        \"vendor\"\n      ],\n      \"status\": \"ACTIVE\",\n      \"contactEmail\": \"billing@azure.microsoft.com\",\n      \"website\": \"https://azure.microsoft.com\"\n    },\n    \"children\": []\n  },\n  {\n    \"id\": \"partner-4\",\n    \"name\": \"IBM Cloud\",\n    \"type\": \"partner\",\n    \"data\": {\n      \"id\": 4,\n      \"name\": \"ibm\",\n      \"displayName\": \"IBM Cloud\",\n      \"type\": \"cloud-provider\",\n      \"roles\": [\n        \"cloud-provider\",\n        \"vendor\"\n      ],\n      \"status\": \"ACTIVE\",\n      \"contactEmail\": \"billing@ibm.com\",\n      \"website\": \"https://www.ibm.com/cloud\"\n    },\n    \"children\": []\n  },\n  {\n    \"id\": \"partner-5\",\n    \"name\": \"Oracle Cloud\",\n    \"type\": \"partner\",\n    \"data\": {\n      \"id\": 5,\n      \"name\": \"oracle\",\n      \"displayName\": \"Oracle Cloud\",\n      \"type\": \"cloud-provider\",\n      \"roles\": [\n        \"cloud-provider\",\n        \"vendor\"\n      ],\n      \"status\": \"ACTIVE\",\n      \"contactEmail\": \"billing@oracle.com\",\n      \"website\": \"https://www.oracle.com/cloud\"\n    },\n    \"children\": []\n  },\n  {\n    \"id\": \"partner-6\",\n    \"name\": \"Alibaba Cloud\",\n    \"type\": \"partner\",\n    \"data\": {\n      \"id\": 6,\n      \"name\": \"alibaba\",\n      \"displayName\": \"Alibaba Cloud\",\n      \"type\": \"cloud-provider\",\n      \"roles\": [\n        \"cloud-provider\",\n        \"vendor\"\n      ],\n      \"status\": \"ACTIVE\",\n      \"contactEmail\": \"billing@alibabacloud.com\",\n      \"website\": \"https://www.alibabacloud.com\"\n    },\n    \"children\": []\n  },\n  {\n    \"id\": \"partner-7\",\n    \"name\": \"DigitalOcean\",\n    \"type\": \"partner\",\n    \"data\": {\n      \"id\": 7,\n      \"name\": \"digitalocean\",\n      \"displayName\": \"DigitalOcean\",\n      \"type\": \"cloud-provider\",\n      \"roles\": [\n        \"cloud-provider\",\n        \"vendor\"\n      ],\n      \"status\": \"ACTIVE\",\n      \"contactEmail\": \"billing@digitalocean.com\",\n      \"website\": \"https://www.digitalocean.com\"\n    },\n    \"children\": []\n  },\n  {\n    \"id\": \"partner-8\",\n    \"name\": \"Akamai Connected Cloud (Linode)\",\n    \"type\": \"partner\",\n    \"data\": {\n      \"id\": 8,\n      \"name\": \"linode\",\n      \"displayName\": \"Akamai Connected Cloud (Linode)\",\n      \"type\": \"cloud-provider\",\n      \"roles\": [\n        \"cloud-provider\",\n        \"vendor\"\n      ],\n      \"status\": \"ACTIVE\",\n      \"contactEmail\": \"billing@linode.com\",\n      \"website\": \"https://www.linode.com\"\n    },\n    \"children\": []\n  },\n  {\n    \"id\": \"partner-9\",\n    \"name\": \"Vultr\",\n    \"type\": \"partner\",\n    \"data\": {\n      \"id\": 9,\n      \"name\": \"vultr\",\n      \"displayName\": \"Vultr\",\n      \"type\": \"cloud-provider\",\n      \"roles\": [\n        \"cloud-provider\",\n        \"vendor\"\n      ],\n      \"status\": \"ACTIVE\",\n      \"contactEmail\": \"billing@vultr.com\",\n      \"website\": \"https://www.vultr.com\"\n    },\n    \"children\": []\n  },\n  {\n    \"id\": \"partner-10\",\n    \"name\": \"OVHcloud\",\n    \"type\": \"partner\",\n    \"data\": {\n      \"id\": 10,\n      \"name\": \"ovhcloud\",\n      \"displayName\": \"OVHcloud\",\n      \"type\": \"cloud-provider\",\n      \"roles\": [\n        \"cloud-provider\",\n        \"vendor\"\n      ],\n      \"status\": \"ACTIVE\",\n      \"contactEmail\": \"billing@ovhcloud.com\",\n      \"website\": \"https://www.ovhcloud.com\"\n    },\n    \"children\": []\n  },\n  {\n    \"id\": \"partner-11\",\n    \"name\": \"Hetzner\",\n    \"type\": \"partner\",\n    \"data\": {\n      \"id\": 11,\n      \"name\": \"hetzner\",\n      \"displayName\": \"Hetzner\",\n      \"type\": \"cloud-provider\",\n      \"roles\": [\n        \"cloud-provider\",\n        \"vendor\"\n      ],\n      \"status\": \"ACTIVE\",\n      \"contactEmail\": \"billing@hetzner.com\",\n      \"website\": \"https://www.hetzner.com\"\n    },\n    \"children\": []\n  },\n  {\n    \"id\": \"partner-12\",\n    \"name\": \"Equinix Metal\",\n    \"type\": \"partner\",\n    \"data\": {\n      \"id\": 12,\n      \"name\": \"equinix\",\n      \"displayName\": \"Equinix Metal\",\n      \"type\": \"cloud-provider\",\n      \"roles\": [\n        \"cloud-provider\",\n        \"vendor\"\n      ],\n      \"status\": \"ACTIVE\",\n      \"contactEmail\": \"billing@equinix.com\",\n      \"website\": \"https://metal.equinix.com\"\n    },\n    \"children\": []\n  },\n  {\n    \"id\": \"partner-13\",\n    \"name\": \"Cloudflare\",\n    \"type\": \"partner\",\n    \"data\": {\n      \"id\": 13,\n      \"name\": \"cloudflare\",\n      \"displayName\": \"Cloudflare\",\n      \"type\": \"cloud-provider\",\n      \"roles\": [\n        \"cloud-provider\",\n        \"vendor\"\n      ],\n      \"status\": \"ACTIVE\",\n      \"contactEmail\": \"billing@cloudflare.com\",\n      \"website\": \"https://www.cloudflare.com\"\n    },\n    \"children\": []\n  },\n  {\n    \"id\": \"partner-14\",\n    \"name\": \"Contabo\",\n    \"type\": \"partner\",\n    \"data\": {\n      \"id\": 14,\n      \"name\": \"contabo\",\n      \"displayName\": \"Contabo\",\n      \"type\": \"cloud-provider\",\n      \"roles\": [\n        \"cloud-provider\",\n        \"vendor\"\n      ],\n      \"status\": \"ACTIVE\",\n      \"contactEmail\": \"billing@contabo.com\",\n      \"website\": \"https://contabo.com\"\n    },\n    \"children\": []\n  },\n  {\n    \"id\": \"partner-15\",\n    \"name\": \"Scaleway\",\n    \"type\": \"partner\",\n    \"data\": {\n      \"id\": 15,\n      \"name\": \"scaleway\",\n      \"displayName\": \"Scaleway\",\n      \"type\": \"cloud-provider\",\n      \"roles\": [\n        \"cloud-provider\",\n        \"vendor\"\n      ],\n      \"status\": \"ACTIVE\",\n      \"contactEmail\": \"billing@scaleway.com\",\n      \"website\": \"https://www.scaleway.com\"\n    },\n    \"children\": []\n  },\n  {\n    \"id\": \"partner-16\",\n    \"name\": \"Dell Technologies\",\n    \"type\": \"partner\",\n    \"data\": {\n      \"id\": 16,\n      \"name\": \"dell\",\n      \"displayName\": \"Dell Technologies\",\n      \"type\": \"vendor\",\n      \"roles\": [\n        \"hardware-vendor\",\n        \"vendor\"\n      ],\n      \"status\": \"ACTIVE\",\n      \"contactEmail\": \"sales@dell.com\",\n      \"website\": \"https://www.dell.com\"\n    },\n    \"children\": []\n  },\n  {\n    \"id\": \"partner-17\",\n    \"name\": \"Hewlett Packard Enterprise\",\n    \"type\": \"partner\",\n    \"data\": {\n      \"id\": 17,\n      \"name\": \"hp\",\n      \"displayName\": \"Hewlett Packard Enterprise\",\n      \"type\": \"vendor\",\n      \"roles\": [\n        \"hardware-vendor\",\n        \"vendor\"\n      ],\n      \"status\": \"ACTIVE\",\n      \"contactEmail\": \"sales@hpe.com\",\n      \"website\": \"https://www.hpe.com\"\n    },\n    \"children\": []\n  },\n  {\n    \"id\": \"partner-18\",\n    \"name\": \"Cisco Systems\",\n    \"type\": \"partner\",\n    \"data\": {\n      \"id\": 18,\n      \"name\": \"cisco\",\n      \"displayName\": \"Cisco Systems\",\n      \"type\": \"vendor\",\n      \"roles\": [\n        \"network-vendor\",\n        \"vendor\"\n      ],\n      \"status\": \"ACTIVE\",\n      \"contactEmail\": \"sales@cisco.com\",\n      \"website\": \"https://www.cisco.com\"\n    },\n    \"children\": []\n  },\n  {\n    \"id\": \"partner-19\",\n    \"name\": \"Juniper Networks\",\n    \"type\": \"partner\",\n    \"data\": {\n      \"id\": 19,\n      \"name\": \"juniper\",\n      \"displayName\": \"Juniper Networks\",\n      \"type\": \"vendor\",\n      \"roles\": [\n        \"network-vendor\",\n        \"vendor\"\n      ],\n      \"status\": \"ACTIVE\",\n      \"contactEmail\": \"sales@juniper.net\",\n      \"website\": \"https://www.juniper.net\"\n    },\n    \"children\": []\n  },\n  {\n    \"id\": \"partner-20\",\n    \"name\": \"VMware\",\n    \"type\": \"partner\",\n    \"data\": {\n      \"id\": 20,\n      \"name\": \"vmware\",\n      \"displayName\": \"VMware\",\n      \"type\": \"vendor\",\n      \"roles\": [\n        \"software-vendor\",\n        \"vendor\"\n      ],\n      \"status\": \"ACTIVE\",\n      \"contactEmail\": \"sales@vmware.com\",\n      \"website\": \"https://www.vmware.com\"\n    },\n    \"children\": []\n  },\n  {\n    \"id\": \"partner-21\",\n    \"name\": \"Red Hat\",\n    \"type\": \"partner\",\n    \"data\": {\n      \"id\": 21,\n      \"name\": \"redhat\",\n      \"displayName\": \"Red Hat\",\n      \"type\": \"vendor\",\n      \"roles\": [\n        \"software-vendor\",\n        \"vendor\"\n      ],\n      \"status\": \"ACTIVE\",\n      \"contactEmail\": \"sales@redhat.com\",\n      \"website\": \"https://www.redhat.com\"\n    },\n    \"children\": []\n  },\n  {\n    \"id\": \"partner-22\",\n    \"name\": \"Canonical (Ubuntu)\",\n    \"type\": \"partner\",\n    \"data\": {\n      \"id\": 22,\n      \"name\": \"canonical\",\n      \"displayName\": \"Canonical (Ubuntu)\",\n      \"type\": \"vendor\",\n      \"roles\": [\n        \"software-vendor\",\n        \"vendor\"\n      ],\n      \"status\": \"ACTIVE\",\n      \"contactEmail\": \"sales@canonical.com\",\n      \"website\": \"https://canonical.com\"\n    },\n    \"children\": []\n  },\n  {\n    \"id\": \"partner-23\",\n    \"name\": \"ACME Corporation\",\n    \"type\": \"partner\",\n    \"data\": {\n      \"id\": 23,\n      \"name\": \"acme-corp\",\n      \"displayName\": \"ACME Corporation\",\n      \"type\": \"customer\",\n      \"roles\": [\n        \"customer\"\n      ],\n      \"status\": \"ACTIVE\",\n      \"contactEmail\": \"contact@acme.com\",\n      \"website\": \"https://acme.com\"\n    },\n    \"children\": []\n  },\n  {\n    \"id\": \"partner-24\",\n    \"name\": \"Telcobright\",\n    \"type\": \"partner\",\n    \"data\": {\n      \"id\": 24,\n      \"name\": \"telcobright\",\n      \"displayName\": \"Telcobright\",\n      \"type\": \"service-provider\",\n      \"roles\": [\n        \"self\"\n      ],\n      \"status\": \"ACTIVE\",\n      \"contactEmail\": \"admin@telcobright.com\",\n      \"website\": \"https://telcobright.com\"\n    },\n    \"children\": []\n  },\n  {\n    \"id\": \"partner-25\",\n    \"name\": \"Tech Solutions Inc\",\n    \"type\": \"partner\",\n    \"data\": {\n      \"id\": 25,\n      \"name\": \"tech-solutions\",\n      \"displayName\": \"Tech Solutions Inc\",\n      \"type\": \"VENDOR\",\n      \"roles\": [\n        \"vendor\"\n      ],\n      \"status\": \"ACTIVE\",\n      \"contactEmail\": \"info@techsolutions.com\",\n      \"website\": \"https://www.techsolutions.com\"\n    },\n    \"children\": []\n  },\n  {\n    \"id\": \"partner-26\",\n    \"name\": \"Global Systems Ltd\",\n    \"type\": \"partner\",\n    \"data\": {\n      \"id\": 26,\n      \"name\": \"global-systems\",\n      \"displayName\": \"Global Systems Ltd\",\n      \"type\": \"CUSTOMER\",\n      \"roles\": [\n        \"customer\"\n      ],\n      \"status\": \"ACTIVE\",\n      \"contactEmail\": \"support@globalsystems.com\",\n      \"website\": \"https://www.globalsystems.com\"\n    },\n    \"children\": []\n  },\n  {\n    \"id\": \"partner-27\",\n    \"name\": \"Cloud Dynamics\",\n    \"type\": \"partner\",\n    \"data\": {\n      \"id\": 27,\n      \"name\": \"cloud-dynamics\",\n      \"displayName\": \"Cloud Dynamics\",\n      \"type\": \"VENDOR\",\n      \"roles\": [\n        \"vendor\"\n      ],\n      \"status\": \"ACTIVE\",\n      \"contactEmail\": \"hello@clouddynamics.io\",\n      \"website\": \"https://www.clouddynamics.io\"\n    },\n    \"children\": []\n  }\n]","args":["üå≤ Unified tree:","[\n  {\n    \"id\": \"partner-1\",\n    \"name\": \"Amazon Web Services (AWS)\",\n    \"type\": \"partner\",\n    \"data\": {\n      \"id\": 1,\n      \"name\": \"amazon\",\n      \"displayName\": \"Amazon Web Services (AWS)\",\n      \"type\": \"cloud-provider\",\n      \"roles\": [\n        \"cloud-provider\",\n        \"vendor\"\n      ],\n      \"status\": \"ACTIVE\",\n      \"contactEmail\": \"billing@aws.amazon.com\",\n      \"website\": \"https://aws.amazon.com\"\n    },\n    \"children\": []\n  },\n  {\n    \"id\": \"partner-2\",\n    \"name\": \"Google Cloud Platform\",\n    \"type\": \"partner\",\n    \"data\": {\n      \"id\": 2,\n      \"name\": \"google\",\n      \"displayName\": \"Google Cloud Platform\",\n      \"type\": \"cloud-provider\",\n      \"roles\": [\n        \"cloud-provider\",\n        \"vendor\"\n      ],\n      \"status\": \"ACTIVE\",\n      \"contactEmail\": \"billing@cloud.google.com\",\n      \"website\": \"https://cloud.google.com\"\n    },\n    \"children\": []\n  },\n  {\n    \"id\": \"partner-3\",\n    \"name\": \"Microsoft Azure\",\n    \"type\": \"partner\",\n    \"data\": {\n      \"id\": 3,\n      \"name\": \"microsoft\",\n      \"displayName\": \"Microsoft Azure\",\n      \"type\": \"cloud-provider\",\n      \"roles\": [\n        \"cloud-provider\",\n        \"vendor\"\n      ],\n      \"status\": \"ACTIVE\",\n      \"contactEmail\": \"billing@azure.microsoft.com\",\n      \"website\": \"https://azure.microsoft.com\"\n    },\n    \"children\": []\n  },\n  {\n    \"id\": \"partner-4\",\n    \"name\": \"IBM Cloud\",\n    \"type\": \"partner\",\n    \"data\": {\n      \"id\": 4,\n      \"name\": \"ibm\",\n      \"displayName\": \"IBM Cloud\",\n      \"type\": \"cloud-provider\",\n      \"roles\": [\n        \"cloud-provider\",\n        \"vendor\"\n      ],\n      \"status\": \"ACTIVE\",\n      \"contactEmail\": \"billing@ibm.com\",\n      \"website\": \"https://www.ibm.com/cloud\"\n    },\n    \"children\": []\n  },\n  {\n    \"id\": \"partner-5\",\n    \"name\": \"Oracle Cloud\",\n    \"type\": \"partner\",\n    \"data\": {\n      \"id\": 5,\n      \"name\": \"oracle\",\n      \"displayName\": \"Oracle Cloud\",\n      \"type\": \"cloud-provider\",\n      \"roles\": [\n        \"cloud-provider\",\n        \"vendor\"\n      ],\n      \"status\": \"ACTIVE\",\n      \"contactEmail\": \"billing@oracle.com\",\n      \"website\": \"https://www.oracle.com/cloud\"\n    },\n    \"children\": []\n  },\n  {\n    \"id\": \"partner-6\",\n    \"name\": \"Alibaba Cloud\",\n    \"type\": \"partner\",\n    \"data\": {\n      \"id\": 6,\n      \"name\": \"alibaba\",\n      \"displayName\": \"Alibaba Cloud\",\n      \"type\": \"cloud-provider\",\n      \"roles\": [\n        \"cloud-provider\",\n        \"vendor\"\n      ],\n      \"status\": \"ACTIVE\",\n      \"contactEmail\": \"billing@alibabacloud.com\",\n      \"website\": \"https://www.alibabacloud.com\"\n    },\n    \"children\": []\n  },\n  {\n    \"id\": \"partner-7\",\n    \"name\": \"DigitalOcean\",\n    \"type\": \"partner\",\n    \"data\": {\n      \"id\": 7,\n      \"name\": \"digitalocean\",\n      \"displayName\": \"DigitalOcean\",\n      \"type\": \"cloud-provider\",\n      \"roles\": [\n        \"cloud-provider\",\n        \"vendor\"\n      ],\n      \"status\": \"ACTIVE\",\n      \"contactEmail\": \"billing@digitalocean.com\",\n      \"website\": \"https://www.digitalocean.com\"\n    },\n    \"children\": []\n  },\n  {\n    \"id\": \"partner-8\",\n    \"name\": \"Akamai Connected Cloud (Linode)\",\n    \"type\": \"partner\",\n    \"data\": {\n      \"id\": 8,\n      \"name\": \"linode\",\n      \"displayName\": \"Akamai Connected Cloud (Linode)\",\n      \"type\": \"cloud-provider\",\n      \"roles\": [\n        \"cloud-provider\",\n        \"vendor\"\n      ],\n      \"status\": \"ACTIVE\",\n      \"contactEmail\": \"billing@linode.com\",\n      \"website\": \"https://www.linode.com\"\n    },\n    \"children\": []\n  },\n  {\n    \"id\": \"partner-9\",\n    \"name\": \"Vultr\",\n    \"type\": \"partner\",\n    \"data\": {\n      \"id\": 9,\n      \"name\": \"vultr\",\n      \"displayName\": \"Vultr\",\n      \"type\": \"cloud-provider\",\n      \"roles\": [\n        \"cloud-provider\",\n        \"vendor\"\n      ],\n      \"status\": \"ACTIVE\",\n      \"contactEmail\": \"billing@vultr.com\",\n      \"website\": \"https://www.vultr.com\"\n    },\n    \"children\": []\n  },\n  {\n    \"id\": \"partner-10\",\n    \"name\": \"OVHcloud\",\n    \"type\": \"partner\",\n    \"data\": {\n      \"id\": 10,\n      \"name\": \"ovhcloud\",\n      \"displayName\": \"OVHcloud\",\n      \"type\": \"cloud-provider\",\n      \"roles\": [\n        \"cloud-provider\",\n        \"vendor\"\n      ],\n      \"status\": \"ACTIVE\",\n      \"contactEmail\": \"billing@ovhcloud.com\",\n      \"website\": \"https://www.ovhcloud.com\"\n    },\n    \"children\": []\n  },\n  {\n    \"id\": \"partner-11\",\n    \"name\": \"Hetzner\",\n    \"type\": \"partner\",\n    \"data\": {\n      \"id\": 11,\n      \"name\": \"hetzner\",\n      \"displayName\": \"Hetzner\",\n      \"type\": \"cloud-provider\",\n      \"roles\": [\n        \"cloud-provider\",\n        \"vendor\"\n      ],\n      \"status\": \"ACTIVE\",\n      \"contactEmail\": \"billing@hetzner.com\",\n      \"website\": \"https://www.hetzner.com\"\n    },\n    \"children\": []\n  },\n  {\n    \"id\": \"partner-12\",\n    \"name\": \"Equinix Metal\",\n    \"type\": \"partner\",\n    \"data\": {\n      \"id\": 12,\n      \"name\": \"equinix\",\n      \"displayName\": \"Equinix Metal\",\n      \"type\": \"cloud-provider\",\n      \"roles\": [\n        \"cloud-provider\",\n        \"vendor\"\n      ],\n      \"status\": \"ACTIVE\",\n      \"contactEmail\": \"billing@equinix.com\",\n      \"website\": \"https://metal.equinix.com\"\n    },\n    \"children\": []\n  },\n  {\n    \"id\": \"partner-13\",\n    \"name\": \"Cloudflare\",\n    \"type\": \"partner\",\n    \"data\": {\n      \"id\": 13,\n      \"name\": \"cloudflare\",\n      \"displayName\": \"Cloudflare\",\n      \"type\": \"cloud-provider\",\n      \"roles\": [\n        \"cloud-provider\",\n        \"vendor\"\n      ],\n      \"status\": \"ACTIVE\",\n      \"contactEmail\": \"billing@cloudflare.com\",\n      \"website\": \"https://www.cloudflare.com\"\n    },\n    \"children\": []\n  },\n  {\n    \"id\": \"partner-14\",\n    \"name\": \"Contabo\",\n    \"type\": \"partner\",\n    \"data\": {\n      \"id\": 14,\n      \"name\": \"contabo\",\n      \"displayName\": \"Contabo\",\n      \"type\": \"cloud-provider\",\n      \"roles\": [\n        \"cloud-provider\",\n        \"vendor\"\n      ],\n      \"status\": \"ACTIVE\",\n      \"contactEmail\": \"billing@contabo.com\",\n      \"website\": \"https://contabo.com\"\n    },\n    \"children\": []\n  },\n  {\n    \"id\": \"partner-15\",\n    \"name\": \"Scaleway\",\n    \"type\": \"partner\",\n    \"data\": {\n      \"id\": 15,\n      \"name\": \"scaleway\",\n      \"displayName\": \"Scaleway\",\n      \"type\": \"cloud-provider\",\n      \"roles\": [\n        \"cloud-provider\",\n        \"vendor\"\n      ],\n      \"status\": \"ACTIVE\",\n      \"contactEmail\": \"billing@scaleway.com\",\n      \"website\": \"https://www.scaleway.com\"\n    },\n    \"children\": []\n  },\n  {\n    \"id\": \"partner-16\",\n    \"name\": \"Dell Technologies\",\n    \"type\": \"partner\",\n    \"data\": {\n      \"id\": 16,\n      \"name\": \"dell\",\n      \"displayName\": \"Dell Technologies\",\n      \"type\": \"vendor\",\n      \"roles\": [\n        \"hardware-vendor\",\n        \"vendor\"\n      ],\n      \"status\": \"ACTIVE\",\n      \"contactEmail\": \"sales@dell.com\",\n      \"website\": \"https://www.dell.com\"\n    },\n    \"children\": []\n  },\n  {\n    \"id\": \"partner-17\",\n    \"name\": \"Hewlett Packard Enterprise\",\n    \"type\": \"partner\",\n    \"data\": {\n      \"id\": 17,\n      \"name\": \"hp\",\n      \"displayName\": \"Hewlett Packard Enterprise\",\n      \"type\": \"vendor\",\n      \"roles\": [\n        \"hardware-vendor\",\n        \"vendor\"\n      ],\n      \"status\": \"ACTIVE\",\n      \"contactEmail\": \"sales@hpe.com\",\n      \"website\": \"https://www.hpe.com\"\n    },\n    \"children\": []\n  },\n  {\n    \"id\": \"partner-18\",\n    \"name\": \"Cisco Systems\",\n    \"type\": \"partner\",\n    \"data\": {\n      \"id\": 18,\n      \"name\": \"cisco\",\n      \"displayName\": \"Cisco Systems\",\n      \"type\": \"vendor\",\n      \"roles\": [\n        \"network-vendor\",\n        \"vendor\"\n      ],\n      \"status\": \"ACTIVE\",\n      \"contactEmail\": \"sales@cisco.com\",\n      \"website\": \"https://www.cisco.com\"\n    },\n    \"children\": []\n  },\n  {\n    \"id\": \"partner-19\",\n    \"name\": \"Juniper Networks\",\n    \"type\": \"partner\",\n    \"data\": {\n      \"id\": 19,\n      \"name\": \"juniper\",\n      \"displayName\": \"Juniper Networks\",\n      \"type\": \"vendor\",\n      \"roles\": [\n        \"network-vendor\",\n        \"vendor\"\n      ],\n      \"status\": \"ACTIVE\",\n      \"contactEmail\": \"sales@juniper.net\",\n      \"website\": \"https://www.juniper.net\"\n    },\n    \"children\": []\n  },\n  {\n    \"id\": \"partner-20\",\n    \"name\": \"VMware\",\n    \"type\": \"partner\",\n    \"data\": {\n      \"id\": 20,\n      \"name\": \"vmware\",\n      \"displayName\": \"VMware\",\n      \"type\": \"vendor\",\n      \"roles\": [\n        \"software-vendor\",\n        \"vendor\"\n      ],\n      \"status\": \"ACTIVE\",\n      \"contactEmail\": \"sales@vmware.com\",\n      \"website\": \"https://www.vmware.com\"\n    },\n    \"children\": []\n  },\n  {\n    \"id\": \"partner-21\",\n    \"name\": \"Red Hat\",\n    \"type\": \"partner\",\n    \"data\": {\n      \"id\": 21,\n      \"name\": \"redhat\",\n      \"displayName\": \"Red Hat\",\n      \"type\": \"vendor\",\n      \"roles\": [\n        \"software-vendor\",\n        \"vendor\"\n      ],\n      \"status\": \"ACTIVE\",\n      \"contactEmail\": \"sales@redhat.com\",\n      \"website\": \"https://www.redhat.com\"\n    },\n    \"children\": []\n  },\n  {\n    \"id\": \"partner-22\",\n    \"name\": \"Canonical (Ubuntu)\",\n    \"type\": \"partner\",\n    \"data\": {\n      \"id\": 22,\n      \"name\": \"canonical\",\n      \"displayName\": \"Canonical (Ubuntu)\",\n      \"type\": \"vendor\",\n      \"roles\": [\n        \"software-vendor\",\n        \"vendor\"\n      ],\n      \"status\": \"ACTIVE\",\n      \"contactEmail\": \"sales@canonical.com\",\n      \"website\": \"https://canonical.com\"\n    },\n    \"children\": []\n  },\n  {\n    \"id\": \"partner-23\",\n    \"name\": \"ACME Corporation\",\n    \"type\": \"partner\",\n    \"data\": {\n      \"id\": 23,\n      \"name\": \"acme-corp\",\n      \"displayName\": \"ACME Corporation\",\n      \"type\": \"customer\",\n      \"roles\": [\n        \"customer\"\n      ],\n      \"status\": \"ACTIVE\",\n      \"contactEmail\": \"contact@acme.com\",\n      \"website\": \"https://acme.com\"\n    },\n    \"children\": []\n  },\n  {\n    \"id\": \"partner-24\",\n    \"name\": \"Telcobright\",\n    \"type\": \"partner\",\n    \"data\": {\n      \"id\": 24,\n      \"name\": \"telcobright\",\n      \"displayName\": \"Telcobright\",\n      \"type\": \"service-provider\",\n      \"roles\": [\n        \"self\"\n      ],\n      \"status\": \"ACTIVE\",\n      \"contactEmail\": \"admin@telcobright.com\",\n      \"website\": \"https://telcobright.com\"\n    },\n    \"children\": []\n  },\n  {\n    \"id\": \"partner-25\",\n    \"name\": \"Tech Solutions Inc\",\n    \"type\": \"partner\",\n    \"data\": {\n      \"id\": 25,\n      \"name\": \"tech-solutions\",\n      \"displayName\": \"Tech Solutions Inc\",\n      \"type\": \"VENDOR\",\n      \"roles\": [\n        \"vendor\"\n      ],\n      \"status\": \"ACTIVE\",\n      \"contactEmail\": \"info@techsolutions.com\",\n      \"website\": \"https://www.techsolutions.com\"\n    },\n    \"children\": []\n  },\n  {\n    \"id\": \"partner-26\",\n    \"name\": \"Global Systems Ltd\",\n    \"type\": \"partner\",\n    \"data\": {\n      \"id\": 26,\n      \"name\": \"global-systems\",\n      \"displayName\": \"Global Systems Ltd\",\n      \"type\": \"CUSTOMER\",\n      \"roles\": [\n        \"customer\"\n      ],\n      \"status\": \"ACTIVE\",\n      \"contactEmail\": \"support@globalsystems.com\",\n      \"website\": \"https://www.globalsystems.com\"\n    },\n    \"children\": []\n  },\n  {\n    \"id\": \"partner-27\",\n    \"name\": \"Cloud Dynamics\",\n    \"type\": \"partner\",\n    \"data\": {\n      \"id\": 27,\n      \"name\": \"cloud-dynamics\",\n      \"displayName\": \"Cloud Dynamics\",\n      \"type\": \"VENDOR\",\n      \"roles\": [\n        \"vendor\"\n      ],\n      \"status\": \"ACTIVE\",\n      \"contactEmail\": \"hello@clouddynamics.io\",\n      \"website\": \"https://www.clouddynamics.io\"\n    },\n    \"children\": []\n  }\n]"],"source":"frontend"},{"timestamp":1758473410477,"isoTimestamp":"2025-09-21T16:50:10.477Z","level":"log","message":"üîç fetchInfrastructureData - tree from store: [\n  {\n    \"id\": \"partner-1\",\n    \"name\": \"Amazon Web Services (AWS)\",\n    \"type\": \"partner\",\n    \"data\": {\n      \"id\": 1,\n      \"name\": \"amazon\",\n      \"displayName\": \"Amazon Web Services (AWS)\",\n      \"type\": \"cloud-provider\",\n      \"roles\": [\n        \"cloud-provider\",\n        \"vendor\"\n      ],\n      \"status\": \"ACTIVE\",\n      \"contactEmail\": \"billing@aws.amazon.com\",\n      \"website\": \"https://aws.amazon.com\"\n    },\n    \"children\": []\n  },\n  {\n    \"id\": \"partner-2\",\n    \"name\": \"Google Cloud Platform\",\n    \"type\": \"partner\",\n    \"data\": {\n      \"id\": 2,\n      \"name\": \"google\",\n      \"displayName\": \"Google Cloud Platform\",\n      \"type\": \"cloud-provider\",\n      \"roles\": [\n        \"cloud-provider\",\n        \"vendor\"\n      ],\n      \"status\": \"ACTIVE\",\n      \"contactEmail\": \"billing@cloud.google.com\",\n      \"website\": \"https://cloud.google.com\"\n    },\n    \"children\": []\n  },\n  {\n    \"id\": \"partner-3\",\n    \"name\": \"Microsoft Azure\",\n    \"type\": \"partner\",\n    \"data\": {\n      \"id\": 3,\n      \"name\": \"microsoft\",\n      \"displayName\": \"Microsoft Azure\",\n      \"type\": \"cloud-provider\",\n      \"roles\": [\n        \"cloud-provider\",\n        \"vendor\"\n      ],\n      \"status\": \"ACTIVE\",\n      \"contactEmail\": \"billing@azure.microsoft.com\",\n      \"website\": \"https://azure.microsoft.com\"\n    },\n    \"children\": []\n  },\n  {\n    \"id\": \"partner-4\",\n    \"name\": \"IBM Cloud\",\n    \"type\": \"partner\",\n    \"data\": {\n      \"id\": 4,\n      \"name\": \"ibm\",\n      \"displayName\": \"IBM Cloud\",\n      \"type\": \"cloud-provider\",\n      \"roles\": [\n        \"cloud-provider\",\n        \"vendor\"\n      ],\n      \"status\": \"ACTIVE\",\n      \"contactEmail\": \"billing@ibm.com\",\n      \"website\": \"https://www.ibm.com/cloud\"\n    },\n    \"children\": []\n  },\n  {\n    \"id\": \"partner-5\",\n    \"name\": \"Oracle Cloud\",\n    \"type\": \"partner\",\n    \"data\": {\n      \"id\": 5,\n      \"name\": \"oracle\",\n      \"displayName\": \"Oracle Cloud\",\n      \"type\": \"cloud-provider\",\n      \"roles\": [\n        \"cloud-provider\",\n        \"vendor\"\n      ],\n      \"status\": \"ACTIVE\",\n      \"contactEmail\": \"billing@oracle.com\",\n      \"website\": \"https://www.oracle.com/cloud\"\n    },\n    \"children\": []\n  },\n  {\n    \"id\": \"partner-6\",\n    \"name\": \"Alibaba Cloud\",\n    \"type\": \"partner\",\n    \"data\": {\n      \"id\": 6,\n      \"name\": \"alibaba\",\n      \"displayName\": \"Alibaba Cloud\",\n      \"type\": \"cloud-provider\",\n      \"roles\": [\n        \"cloud-provider\",\n        \"vendor\"\n      ],\n      \"status\": \"ACTIVE\",\n      \"contactEmail\": \"billing@alibabacloud.com\",\n      \"website\": \"https://www.alibabacloud.com\"\n    },\n    \"children\": []\n  },\n  {\n    \"id\": \"partner-7\",\n    \"name\": \"DigitalOcean\",\n    \"type\": \"partner\",\n    \"data\": {\n      \"id\": 7,\n      \"name\": \"digitalocean\",\n      \"displayName\": \"DigitalOcean\",\n      \"type\": \"cloud-provider\",\n      \"roles\": [\n        \"cloud-provider\",\n        \"vendor\"\n      ],\n      \"status\": \"ACTIVE\",\n      \"contactEmail\": \"billing@digitalocean.com\",\n      \"website\": \"https://www.digitalocean.com\"\n    },\n    \"children\": []\n  },\n  {\n    \"id\": \"partner-8\",\n    \"name\": \"Akamai Connected Cloud (Linode)\",\n    \"type\": \"partner\",\n    \"data\": {\n      \"id\": 8,\n      \"name\": \"linode\",\n      \"displayName\": \"Akamai Connected Cloud (Linode)\",\n      \"type\": \"cloud-provider\",\n      \"roles\": [\n        \"cloud-provider\",\n        \"vendor\"\n      ],\n      \"status\": \"ACTIVE\",\n      \"contactEmail\": \"billing@linode.com\",\n      \"website\": \"https://www.linode.com\"\n    },\n    \"children\": []\n  },\n  {\n    \"id\": \"partner-9\",\n    \"name\": \"Vultr\",\n    \"type\": \"partner\",\n    \"data\": {\n      \"id\": 9,\n      \"name\": \"vultr\",\n      \"displayName\": \"Vultr\",\n      \"type\": \"cloud-provider\",\n      \"roles\": [\n        \"cloud-provider\",\n        \"vendor\"\n      ],\n      \"status\": \"ACTIVE\",\n      \"contactEmail\": \"billing@vultr.com\",\n      \"website\": \"https://www.vultr.com\"\n    },\n    \"children\": []\n  },\n  {\n    \"id\": \"partner-10\",\n    \"name\": \"OVHcloud\",\n    \"type\": \"partner\",\n    \"data\": {\n      \"id\": 10,\n      \"name\": \"ovhcloud\",\n      \"displayName\": \"OVHcloud\",\n      \"type\": \"cloud-provider\",\n      \"roles\": [\n        \"cloud-provider\",\n        \"vendor\"\n      ],\n      \"status\": \"ACTIVE\",\n      \"contactEmail\": \"billing@ovhcloud.com\",\n      \"website\": \"https://www.ovhcloud.com\"\n    },\n    \"children\": []\n  },\n  {\n    \"id\": \"partner-11\",\n    \"name\": \"Hetzner\",\n    \"type\": \"partner\",\n    \"data\": {\n      \"id\": 11,\n      \"name\": \"hetzner\",\n      \"displayName\": \"Hetzner\",\n      \"type\": \"cloud-provider\",\n      \"roles\": [\n        \"cloud-provider\",\n        \"vendor\"\n      ],\n      \"status\": \"ACTIVE\",\n      \"contactEmail\": \"billing@hetzner.com\",\n      \"website\": \"https://www.hetzner.com\"\n    },\n    \"children\": []\n  },\n  {\n    \"id\": \"partner-12\",\n    \"name\": \"Equinix Metal\",\n    \"type\": \"partner\",\n    \"data\": {\n      \"id\": 12,\n      \"name\": \"equinix\",\n      \"displayName\": \"Equinix Metal\",\n      \"type\": \"cloud-provider\",\n      \"roles\": [\n        \"cloud-provider\",\n        \"vendor\"\n      ],\n      \"status\": \"ACTIVE\",\n      \"contactEmail\": \"billing@equinix.com\",\n      \"website\": \"https://metal.equinix.com\"\n    },\n    \"children\": []\n  },\n  {\n    \"id\": \"partner-13\",\n    \"name\": \"Cloudflare\",\n    \"type\": \"partner\",\n    \"data\": {\n      \"id\": 13,\n      \"name\": \"cloudflare\",\n      \"displayName\": \"Cloudflare\",\n      \"type\": \"cloud-provider\",\n      \"roles\": [\n        \"cloud-provider\",\n        \"vendor\"\n      ],\n      \"status\": \"ACTIVE\",\n      \"contactEmail\": \"billing@cloudflare.com\",\n      \"website\": \"https://www.cloudflare.com\"\n    },\n    \"children\": []\n  },\n  {\n    \"id\": \"partner-14\",\n    \"name\": \"Contabo\",\n    \"type\": \"partner\",\n    \"data\": {\n      \"id\": 14,\n      \"name\": \"contabo\",\n      \"displayName\": \"Contabo\",\n      \"type\": \"cloud-provider\",\n      \"roles\": [\n        \"cloud-provider\",\n        \"vendor\"\n      ],\n      \"status\": \"ACTIVE\",\n      \"contactEmail\": \"billing@contabo.com\",\n      \"website\": \"https://contabo.com\"\n    },\n    \"children\": []\n  },\n  {\n    \"id\": \"partner-15\",\n    \"name\": \"Scaleway\",\n    \"type\": \"partner\",\n    \"data\": {\n      \"id\": 15,\n      \"name\": \"scaleway\",\n      \"displayName\": \"Scaleway\",\n      \"type\": \"cloud-provider\",\n      \"roles\": [\n        \"cloud-provider\",\n        \"vendor\"\n      ],\n      \"status\": \"ACTIVE\",\n      \"contactEmail\": \"billing@scaleway.com\",\n      \"website\": \"https://www.scaleway.com\"\n    },\n    \"children\": []\n  },\n  {\n    \"id\": \"partner-16\",\n    \"name\": \"Dell Technologies\",\n    \"type\": \"partner\",\n    \"data\": {\n      \"id\": 16,\n      \"name\": \"dell\",\n      \"displayName\": \"Dell Technologies\",\n      \"type\": \"vendor\",\n      \"roles\": [\n        \"hardware-vendor\",\n        \"vendor\"\n      ],\n      \"status\": \"ACTIVE\",\n      \"contactEmail\": \"sales@dell.com\",\n      \"website\": \"https://www.dell.com\"\n    },\n    \"children\": []\n  },\n  {\n    \"id\": \"partner-17\",\n    \"name\": \"Hewlett Packard Enterprise\",\n    \"type\": \"partner\",\n    \"data\": {\n      \"id\": 17,\n      \"name\": \"hp\",\n      \"displayName\": \"Hewlett Packard Enterprise\",\n      \"type\": \"vendor\",\n      \"roles\": [\n        \"hardware-vendor\",\n        \"vendor\"\n      ],\n      \"status\": \"ACTIVE\",\n      \"contactEmail\": \"sales@hpe.com\",\n      \"website\": \"https://www.hpe.com\"\n    },\n    \"children\": []\n  },\n  {\n    \"id\": \"partner-18\",\n    \"name\": \"Cisco Systems\",\n    \"type\": \"partner\",\n    \"data\": {\n      \"id\": 18,\n      \"name\": \"cisco\",\n      \"displayName\": \"Cisco Systems\",\n      \"type\": \"vendor\",\n      \"roles\": [\n        \"network-vendor\",\n        \"vendor\"\n      ],\n      \"status\": \"ACTIVE\",\n      \"contactEmail\": \"sales@cisco.com\",\n      \"website\": \"https://www.cisco.com\"\n    },\n    \"children\": []\n  },\n  {\n    \"id\": \"partner-19\",\n    \"name\": \"Juniper Networks\",\n    \"type\": \"partner\",\n    \"data\": {\n      \"id\": 19,\n      \"name\": \"juniper\",\n      \"displayName\": \"Juniper Networks\",\n      \"type\": \"vendor\",\n      \"roles\": [\n        \"network-vendor\",\n        \"vendor\"\n      ],\n      \"status\": \"ACTIVE\",\n      \"contactEmail\": \"sales@juniper.net\",\n      \"website\": \"https://www.juniper.net\"\n    },\n    \"children\": []\n  },\n  {\n    \"id\": \"partner-20\",\n    \"name\": \"VMware\",\n    \"type\": \"partner\",\n    \"data\": {\n      \"id\": 20,\n      \"name\": \"vmware\",\n      \"displayName\": \"VMware\",\n      \"type\": \"vendor\",\n      \"roles\": [\n        \"software-vendor\",\n        \"vendor\"\n      ],\n      \"status\": \"ACTIVE\",\n      \"contactEmail\": \"sales@vmware.com\",\n      \"website\": \"https://www.vmware.com\"\n    },\n    \"children\": []\n  },\n  {\n    \"id\": \"partner-21\",\n    \"name\": \"Red Hat\",\n    \"type\": \"partner\",\n    \"data\": {\n      \"id\": 21,\n      \"name\": \"redhat\",\n      \"displayName\": \"Red Hat\",\n      \"type\": \"vendor\",\n      \"roles\": [\n        \"software-vendor\",\n        \"vendor\"\n      ],\n      \"status\": \"ACTIVE\",\n      \"contactEmail\": \"sales@redhat.com\",\n      \"website\": \"https://www.redhat.com\"\n    },\n    \"children\": []\n  },\n  {\n    \"id\": \"partner-22\",\n    \"name\": \"Canonical (Ubuntu)\",\n    \"type\": \"partner\",\n    \"data\": {\n      \"id\": 22,\n      \"name\": \"canonical\",\n      \"displayName\": \"Canonical (Ubuntu)\",\n      \"type\": \"vendor\",\n      \"roles\": [\n        \"software-vendor\",\n        \"vendor\"\n      ],\n      \"status\": \"ACTIVE\",\n      \"contactEmail\": \"sales@canonical.com\",\n      \"website\": \"https://canonical.com\"\n    },\n    \"children\": []\n  },\n  {\n    \"id\": \"partner-23\",\n    \"name\": \"ACME Corporation\",\n    \"type\": \"partner\",\n    \"data\": {\n      \"id\": 23,\n      \"name\": \"acme-corp\",\n      \"displayName\": \"ACME Corporation\",\n      \"type\": \"customer\",\n      \"roles\": [\n        \"customer\"\n      ],\n      \"status\": \"ACTIVE\",\n      \"contactEmail\": \"contact@acme.com\",\n      \"website\": \"https://acme.com\"\n    },\n    \"children\": []\n  },\n  {\n    \"id\": \"partner-24\",\n    \"name\": \"Telcobright\",\n    \"type\": \"partner\",\n    \"data\": {\n      \"id\": 24,\n      \"name\": \"telcobright\",\n      \"displayName\": \"Telcobright\",\n      \"type\": \"service-provider\",\n      \"roles\": [\n        \"self\"\n      ],\n      \"status\": \"ACTIVE\",\n      \"contactEmail\": \"admin@telcobright.com\",\n      \"website\": \"https://telcobright.com\"\n    },\n    \"children\": []\n  },\n  {\n    \"id\": \"partner-25\",\n    \"name\": \"Tech Solutions Inc\",\n    \"type\": \"partner\",\n    \"data\": {\n      \"id\": 25,\n      \"name\": \"tech-solutions\",\n      \"displayName\": \"Tech Solutions Inc\",\n      \"type\": \"VENDOR\",\n      \"roles\": [\n        \"vendor\"\n      ],\n      \"status\": \"ACTIVE\",\n      \"contactEmail\": \"info@techsolutions.com\",\n      \"website\": \"https://www.techsolutions.com\"\n    },\n    \"children\": []\n  },\n  {\n    \"id\": \"partner-26\",\n    \"name\": \"Global Systems Ltd\",\n    \"type\": \"partner\",\n    \"data\": {\n      \"id\": 26,\n      \"name\": \"global-systems\",\n      \"displayName\": \"Global Systems Ltd\",\n      \"type\": \"CUSTOMER\",\n      \"roles\": [\n        \"customer\"\n      ],\n      \"status\": \"ACTIVE\",\n      \"contactEmail\": \"support@globalsystems.com\",\n      \"website\": \"https://www.globalsystems.com\"\n    },\n    \"children\": []\n  },\n  {\n    \"id\": \"partner-27\",\n    \"name\": \"Cloud Dynamics\",\n    \"type\": \"partner\",\n    \"data\": {\n      \"id\": 27,\n      \"name\": \"cloud-dynamics\",\n      \"displayName\": \"Cloud Dynamics\",\n      \"type\": \"VENDOR\",\n      \"roles\": [\n        \"vendor\"\n      ],\n      \"status\": \"ACTIVE\",\n      \"contactEmail\": \"hello@clouddynamics.io\",\n      \"website\": \"https://www.clouddynamics.io\"\n    },\n    \"children\": []\n  }\n]","args":["üîç fetchInfrastructureData - tree from store:",[{"id":"partner-1","name":"Amazon Web Services (AWS)","type":"partner","data":{"id":1,"name":"amazon","displayName":"Amazon Web Services (AWS)","type":"cloud-provider","roles":["cloud-provider","vendor"],"status":"ACTIVE","contactEmail":"billing@aws.amazon.com","website":"https://aws.amazon.com"},"children":[]},{"id":"partner-2","name":"Google Cloud Platform","type":"partner","data":{"id":2,"name":"google","displayName":"Google Cloud Platform","type":"cloud-provider","roles":["cloud-provider","vendor"],"status":"ACTIVE","contactEmail":"billing@cloud.google.com","website":"https://cloud.google.com"},"children":[]},{"id":"partner-3","name":"Microsoft Azure","type":"partner","data":{"id":3,"name":"microsoft","displayName":"Microsoft Azure","type":"cloud-provider","roles":["cloud-provider","vendor"],"status":"ACTIVE","contactEmail":"billing@azure.microsoft.com","website":"https://azure.microsoft.com"},"children":[]},{"id":"partner-4","name":"IBM Cloud","type":"partner","data":{"id":4,"name":"ibm","displayName":"IBM Cloud","type":"cloud-provider","roles":["cloud-provider","vendor"],"status":"ACTIVE","contactEmail":"billing@ibm.com","website":"https://www.ibm.com/cloud"},"children":[]},{"id":"partner-5","name":"Oracle Cloud","type":"partner","data":{"id":5,"name":"oracle","displayName":"Oracle Cloud","type":"cloud-provider","roles":["cloud-provider","vendor"],"status":"ACTIVE","contactEmail":"billing@oracle.com","website":"https://www.oracle.com/cloud"},"children":[]},{"id":"partner-6","name":"Alibaba Cloud","type":"partner","data":{"id":6,"name":"alibaba","displayName":"Alibaba Cloud","type":"cloud-provider","roles":["cloud-provider","vendor"],"status":"ACTIVE","contactEmail":"billing@alibabacloud.com","website":"https://www.alibabacloud.com"},"children":[]},{"id":"partner-7","name":"DigitalOcean","type":"partner","data":{"id":7,"name":"digitalocean","displayName":"DigitalOcean","type":"cloud-provider","roles":["cloud-provider","vendor"],"status":"ACTIVE","contactEmail":"billing@digitalocean.com","website":"https://www.digitalocean.com"},"children":[]},{"id":"partner-8","name":"Akamai Connected Cloud (Linode)","type":"partner","data":{"id":8,"name":"linode","displayName":"Akamai Connected Cloud (Linode)","type":"cloud-provider","roles":["cloud-provider","vendor"],"status":"ACTIVE","contactEmail":"billing@linode.com","website":"https://www.linode.com"},"children":[]},{"id":"partner-9","name":"Vultr","type":"partner","data":{"id":9,"name":"vultr","displayName":"Vultr","type":"cloud-provider","roles":["cloud-provider","vendor"],"status":"ACTIVE","contactEmail":"billing@vultr.com","website":"https://www.vultr.com"},"children":[]},{"id":"partner-10","name":"OVHcloud","type":"partner","data":{"id":10,"name":"ovhcloud","displayName":"OVHcloud","type":"cloud-provider","roles":["cloud-provider","vendor"],"status":"ACTIVE","contactEmail":"billing@ovhcloud.com","website":"https://www.ovhcloud.com"},"children":[]},{"id":"partner-11","name":"Hetzner","type":"partner","data":{"id":11,"name":"hetzner","displayName":"Hetzner","type":"cloud-provider","roles":["cloud-provider","vendor"],"status":"ACTIVE","contactEmail":"billing@hetzner.com","website":"https://www.hetzner.com"},"children":[]},{"id":"partner-12","name":"Equinix Metal","type":"partner","data":{"id":12,"name":"equinix","displayName":"Equinix Metal","type":"cloud-provider","roles":["cloud-provider","vendor"],"status":"ACTIVE","contactEmail":"billing@equinix.com","website":"https://metal.equinix.com"},"children":[]},{"id":"partner-13","name":"Cloudflare","type":"partner","data":{"id":13,"name":"cloudflare","displayName":"Cloudflare","type":"cloud-provider","roles":["cloud-provider","vendor"],"status":"ACTIVE","contactEmail":"billing@cloudflare.com","website":"https://www.cloudflare.com"},"children":[]},{"id":"partner-14","name":"Contabo","type":"partner","data":{"id":14,"name":"contabo","displayName":"Contabo","type":"cloud-provider","roles":["cloud-provider","vendor"],"status":"ACTIVE","contactEmail":"billing@contabo.com","website":"https://contabo.com"},"children":[]},{"id":"partner-15","name":"Scaleway","type":"partner","data":{"id":15,"name":"scaleway","displayName":"Scaleway","type":"cloud-provider","roles":["cloud-provider","vendor"],"status":"ACTIVE","contactEmail":"billing@scaleway.com","website":"https://www.scaleway.com"},"children":[]},{"id":"partner-16","name":"Dell Technologies","type":"partner","data":{"id":16,"name":"dell","displayName":"Dell Technologies","type":"vendor","roles":["hardware-vendor","vendor"],"status":"ACTIVE","contactEmail":"sales@dell.com","website":"https://www.dell.com"},"children":[]},{"id":"partner-17","name":"Hewlett Packard Enterprise","type":"partner","data":{"id":17,"name":"hp","displayName":"Hewlett Packard Enterprise","type":"vendor","roles":["hardware-vendor","vendor"],"status":"ACTIVE","contactEmail":"sales@hpe.com","website":"https://www.hpe.com"},"children":[]},{"id":"partner-18","name":"Cisco Systems","type":"partner","data":{"id":18,"name":"cisco","displayName":"Cisco Systems","type":"vendor","roles":["network-vendor","vendor"],"status":"ACTIVE","contactEmail":"sales@cisco.com","website":"https://www.cisco.com"},"children":[]},{"id":"partner-19","name":"Juniper Networks","type":"partner","data":{"id":19,"name":"juniper","displayName":"Juniper Networks","type":"vendor","roles":["network-vendor","vendor"],"status":"ACTIVE","contactEmail":"sales@juniper.net","website":"https://www.juniper.net"},"children":[]},{"id":"partner-20","name":"VMware","type":"partner","data":{"id":20,"name":"vmware","displayName":"VMware","type":"vendor","roles":["software-vendor","vendor"],"status":"ACTIVE","contactEmail":"sales@vmware.com","website":"https://www.vmware.com"},"children":[]},{"id":"partner-21","name":"Red Hat","type":"partner","data":{"id":21,"name":"redhat","displayName":"Red Hat","type":"vendor","roles":["software-vendor","vendor"],"status":"ACTIVE","contactEmail":"sales@redhat.com","website":"https://www.redhat.com"},"children":[]},{"id":"partner-22","name":"Canonical (Ubuntu)","type":"partner","data":{"id":22,"name":"canonical","displayName":"Canonical (Ubuntu)","type":"vendor","roles":["software-vendor","vendor"],"status":"ACTIVE","contactEmail":"sales@canonical.com","website":"https://canonical.com"},"children":[]},{"id":"partner-23","name":"ACME Corporation","type":"partner","data":{"id":23,"name":"acme-corp","displayName":"ACME Corporation","type":"customer","roles":["customer"],"status":"ACTIVE","contactEmail":"contact@acme.com","website":"https://acme.com"},"children":[]},{"id":"partner-24","name":"Telcobright","type":"partner","data":{"id":24,"name":"telcobright","displayName":"Telcobright","type":"service-provider","roles":["self"],"status":"ACTIVE","contactEmail":"admin@telcobright.com","website":"https://telcobright.com"},"children":[]},{"id":"partner-25","name":"Tech Solutions Inc","type":"partner","data":{"id":25,"name":"tech-solutions","displayName":"Tech Solutions Inc","type":"VENDOR","roles":["vendor"],"status":"ACTIVE","contactEmail":"info@techsolutions.com","website":"https://www.techsolutions.com"},"children":[]},{"id":"partner-26","name":"Global Systems Ltd","type":"partner","data":{"id":26,"name":"global-systems","displayName":"Global Systems Ltd","type":"CUSTOMER","roles":["customer"],"status":"ACTIVE","contactEmail":"support@globalsystems.com","website":"https://www.globalsystems.com"},"children":[]},{"id":"partner-27","name":"Cloud Dynamics","type":"partner","data":{"id":27,"name":"cloud-dynamics","displayName":"Cloud Dynamics","type":"VENDOR","roles":["vendor"],"status":"ACTIVE","contactEmail":"hello@clouddynamics.io","website":"https://www.clouddynamics.io"},"children":[]}]],"source":"frontend"},{"timestamp":1758473410478,"isoTimestamp":"2025-09-21T16:50:10.478Z","level":"log","message":"üîç fetchInfrastructureData - partners from store: []","args":["üîç fetchInfrastructureData - partners from store:",[]],"source":"frontend"},{"timestamp":1758473410479,"isoTimestamp":"2025-09-21T16:50:10.479Z","level":"warn","message":"[EventBusWebSocketHandler] Invalid event received: undefined","args":["[EventBusWebSocketHandler] Invalid event received:","undefined"],"source":"frontend"},{"timestamp":1758473410479,"isoTimestamp":"2025-09-21T16:50:10.479Z","level":"warn","message":"[EventBusWebSocketHandler] Invalid event received: *","args":["[EventBusWebSocketHandler] Invalid event received:","*"],"source":"frontend"},{"timestamp":1758473410479,"isoTimestamp":"2025-09-21T16:50:10.479Z","level":"log","message":"[LocalEventBus] Published: {\n  \"type\": \"ERROR\",\n  \"error\": \"Store not found: environmentassociation\",\n  \"timestamp\": 1758473410468\n}","args":["[LocalEventBus] Published:",{"type":"ERROR","error":"Store not found: environmentassociation","timestamp":1758473410468}],"source":"frontend"},{"timestamp":1758473410481,"isoTimestamp":"2025-09-21T16:50:10.481Z","level":"log","message":"üìä renderTreeItems called with 27 nodes: [\n  {\n    \"id\": \"partner-1\",\n    \"name\": \"Amazon Web Services (AWS)\",\n    \"type\": \"partner\",\n    \"data\": {\n      \"id\": 1,\n      \"name\": \"amazon\",\n      \"displayName\": \"Amazon Web Services (AWS)\",\n      \"type\": \"cloud-provider\",\n      \"roles\": [\n        \"cloud-provider\",\n        \"vendor\"\n      ],\n      \"status\": \"ACTIVE\",\n      \"contactEmail\": \"billing@aws.amazon.com\",\n      \"website\": \"https://aws.amazon.com\"\n    },\n    \"children\": []\n  },\n  {\n    \"id\": \"partner-2\",\n    \"name\": \"Google Cloud Platform\",\n    \"type\": \"partner\",\n    \"data\": {\n      \"id\": 2,\n      \"name\": \"google\",\n      \"displayName\": \"Google Cloud Platform\",\n      \"type\": \"cloud-provider\",\n      \"roles\": [\n        \"cloud-provider\",\n        \"vendor\"\n      ],\n      \"status\": \"ACTIVE\",\n      \"contactEmail\": \"billing@cloud.google.com\",\n      \"website\": \"https://cloud.google.com\"\n    },\n    \"children\": []\n  },\n  {\n    \"id\": \"partner-3\",\n    \"name\": \"Microsoft Azure\",\n    \"type\": \"partner\",\n    \"data\": {\n      \"id\": 3,\n      \"name\": \"microsoft\",\n      \"displayName\": \"Microsoft Azure\",\n      \"type\": \"cloud-provider\",\n      \"roles\": [\n        \"cloud-provider\",\n        \"vendor\"\n      ],\n      \"status\": \"ACTIVE\",\n      \"contactEmail\": \"billing@azure.microsoft.com\",\n      \"website\": \"https://azure.microsoft.com\"\n    },\n    \"children\": []\n  },\n  {\n    \"id\": \"partner-4\",\n    \"name\": \"IBM Cloud\",\n    \"type\": \"partner\",\n    \"data\": {\n      \"id\": 4,\n      \"name\": \"ibm\",\n      \"displayName\": \"IBM Cloud\",\n      \"type\": \"cloud-provider\",\n      \"roles\": [\n        \"cloud-provider\",\n        \"vendor\"\n      ],\n      \"status\": \"ACTIVE\",\n      \"contactEmail\": \"billing@ibm.com\",\n      \"website\": \"https://www.ibm.com/cloud\"\n    },\n    \"children\": []\n  },\n  {\n    \"id\": \"partner-5\",\n    \"name\": \"Oracle Cloud\",\n    \"type\": \"partner\",\n    \"data\": {\n      \"id\": 5,\n      \"name\": \"oracle\",\n      \"displayName\": \"Oracle Cloud\",\n      \"type\": \"cloud-provider\",\n      \"roles\": [\n        \"cloud-provider\",\n        \"vendor\"\n      ],\n      \"status\": \"ACTIVE\",\n      \"contactEmail\": \"billing@oracle.com\",\n      \"website\": \"https://www.oracle.com/cloud\"\n    },\n    \"children\": []\n  },\n  {\n    \"id\": \"partner-6\",\n    \"name\": \"Alibaba Cloud\",\n    \"type\": \"partner\",\n    \"data\": {\n      \"id\": 6,\n      \"name\": \"alibaba\",\n      \"displayName\": \"Alibaba Cloud\",\n      \"type\": \"cloud-provider\",\n      \"roles\": [\n        \"cloud-provider\",\n        \"vendor\"\n      ],\n      \"status\": \"ACTIVE\",\n      \"contactEmail\": \"billing@alibabacloud.com\",\n      \"website\": \"https://www.alibabacloud.com\"\n    },\n    \"children\": []\n  },\n  {\n    \"id\": \"partner-7\",\n    \"name\": \"DigitalOcean\",\n    \"type\": \"partner\",\n    \"data\": {\n      \"id\": 7,\n      \"name\": \"digitalocean\",\n      \"displayName\": \"DigitalOcean\",\n      \"type\": \"cloud-provider\",\n      \"roles\": [\n        \"cloud-provider\",\n        \"vendor\"\n      ],\n      \"status\": \"ACTIVE\",\n      \"contactEmail\": \"billing@digitalocean.com\",\n      \"website\": \"https://www.digitalocean.com\"\n    },\n    \"children\": []\n  },\n  {\n    \"id\": \"partner-8\",\n    \"name\": \"Akamai Connected Cloud (Linode)\",\n    \"type\": \"partner\",\n    \"data\": {\n      \"id\": 8,\n      \"name\": \"linode\",\n      \"displayName\": \"Akamai Connected Cloud (Linode)\",\n      \"type\": \"cloud-provider\",\n      \"roles\": [\n        \"cloud-provider\",\n        \"vendor\"\n      ],\n      \"status\": \"ACTIVE\",\n      \"contactEmail\": \"billing@linode.com\",\n      \"website\": \"https://www.linode.com\"\n    },\n    \"children\": []\n  },\n  {\n    \"id\": \"partner-9\",\n    \"name\": \"Vultr\",\n    \"type\": \"partner\",\n    \"data\": {\n      \"id\": 9,\n      \"name\": \"vultr\",\n      \"displayName\": \"Vultr\",\n      \"type\": \"cloud-provider\",\n      \"roles\": [\n        \"cloud-provider\",\n        \"vendor\"\n      ],\n      \"status\": \"ACTIVE\",\n      \"contactEmail\": \"billing@vultr.com\",\n      \"website\": \"https://www.vultr.com\"\n    },\n    \"children\": []\n  },\n  {\n    \"id\": \"partner-10\",\n    \"name\": \"OVHcloud\",\n    \"type\": \"partner\",\n    \"data\": {\n      \"id\": 10,\n      \"name\": \"ovhcloud\",\n      \"displayName\": \"OVHcloud\",\n      \"type\": \"cloud-provider\",\n      \"roles\": [\n        \"cloud-provider\",\n        \"vendor\"\n      ],\n      \"status\": \"ACTIVE\",\n      \"contactEmail\": \"billing@ovhcloud.com\",\n      \"website\": \"https://www.ovhcloud.com\"\n    },\n    \"children\": []\n  },\n  {\n    \"id\": \"partner-11\",\n    \"name\": \"Hetzner\",\n    \"type\": \"partner\",\n    \"data\": {\n      \"id\": 11,\n      \"name\": \"hetzner\",\n      \"displayName\": \"Hetzner\",\n      \"type\": \"cloud-provider\",\n      \"roles\": [\n        \"cloud-provider\",\n        \"vendor\"\n      ],\n      \"status\": \"ACTIVE\",\n      \"contactEmail\": \"billing@hetzner.com\",\n      \"website\": \"https://www.hetzner.com\"\n    },\n    \"children\": []\n  },\n  {\n    \"id\": \"partner-12\",\n    \"name\": \"Equinix Metal\",\n    \"type\": \"partner\",\n    \"data\": {\n      \"id\": 12,\n      \"name\": \"equinix\",\n      \"displayName\": \"Equinix Metal\",\n      \"type\": \"cloud-provider\",\n      \"roles\": [\n        \"cloud-provider\",\n        \"vendor\"\n      ],\n      \"status\": \"ACTIVE\",\n      \"contactEmail\": \"billing@equinix.com\",\n      \"website\": \"https://metal.equinix.com\"\n    },\n    \"children\": []\n  },\n  {\n    \"id\": \"partner-13\",\n    \"name\": \"Cloudflare\",\n    \"type\": \"partner\",\n    \"data\": {\n      \"id\": 13,\n      \"name\": \"cloudflare\",\n      \"displayName\": \"Cloudflare\",\n      \"type\": \"cloud-provider\",\n      \"roles\": [\n        \"cloud-provider\",\n        \"vendor\"\n      ],\n      \"status\": \"ACTIVE\",\n      \"contactEmail\": \"billing@cloudflare.com\",\n      \"website\": \"https://www.cloudflare.com\"\n    },\n    \"children\": []\n  },\n  {\n    \"id\": \"partner-14\",\n    \"name\": \"Contabo\",\n    \"type\": \"partner\",\n    \"data\": {\n      \"id\": 14,\n      \"name\": \"contabo\",\n      \"displayName\": \"Contabo\",\n      \"type\": \"cloud-provider\",\n      \"roles\": [\n        \"cloud-provider\",\n        \"vendor\"\n      ],\n      \"status\": \"ACTIVE\",\n      \"contactEmail\": \"billing@contabo.com\",\n      \"website\": \"https://contabo.com\"\n    },\n    \"children\": []\n  },\n  {\n    \"id\": \"partner-15\",\n    \"name\": \"Scaleway\",\n    \"type\": \"partner\",\n    \"data\": {\n      \"id\": 15,\n      \"name\": \"scaleway\",\n      \"displayName\": \"Scaleway\",\n      \"type\": \"cloud-provider\",\n      \"roles\": [\n        \"cloud-provider\",\n        \"vendor\"\n      ],\n      \"status\": \"ACTIVE\",\n      \"contactEmail\": \"billing@scaleway.com\",\n      \"website\": \"https://www.scaleway.com\"\n    },\n    \"children\": []\n  },\n  {\n    \"id\": \"partner-16\",\n    \"name\": \"Dell Technologies\",\n    \"type\": \"partner\",\n    \"data\": {\n      \"id\": 16,\n      \"name\": \"dell\",\n      \"displayName\": \"Dell Technologies\",\n      \"type\": \"vendor\",\n      \"roles\": [\n        \"hardware-vendor\",\n        \"vendor\"\n      ],\n      \"status\": \"ACTIVE\",\n      \"contactEmail\": \"sales@dell.com\",\n      \"website\": \"https://www.dell.com\"\n    },\n    \"children\": []\n  },\n  {\n    \"id\": \"partner-17\",\n    \"name\": \"Hewlett Packard Enterprise\",\n    \"type\": \"partner\",\n    \"data\": {\n      \"id\": 17,\n      \"name\": \"hp\",\n      \"displayName\": \"Hewlett Packard Enterprise\",\n      \"type\": \"vendor\",\n      \"roles\": [\n        \"hardware-vendor\",\n        \"vendor\"\n      ],\n      \"status\": \"ACTIVE\",\n      \"contactEmail\": \"sales@hpe.com\",\n      \"website\": \"https://www.hpe.com\"\n    },\n    \"children\": []\n  },\n  {\n    \"id\": \"partner-18\",\n    \"name\": \"Cisco Systems\",\n    \"type\": \"partner\",\n    \"data\": {\n      \"id\": 18,\n      \"name\": \"cisco\",\n      \"displayName\": \"Cisco Systems\",\n      \"type\": \"vendor\",\n      \"roles\": [\n        \"network-vendor\",\n        \"vendor\"\n      ],\n      \"status\": \"ACTIVE\",\n      \"contactEmail\": \"sales@cisco.com\",\n      \"website\": \"https://www.cisco.com\"\n    },\n    \"children\": []\n  },\n  {\n    \"id\": \"partner-19\",\n    \"name\": \"Juniper Networks\",\n    \"type\": \"partner\",\n    \"data\": {\n      \"id\": 19,\n      \"name\": \"juniper\",\n      \"displayName\": \"Juniper Networks\",\n      \"type\": \"vendor\",\n      \"roles\": [\n        \"network-vendor\",\n        \"vendor\"\n      ],\n      \"status\": \"ACTIVE\",\n      \"contactEmail\": \"sales@juniper.net\",\n      \"website\": \"https://www.juniper.net\"\n    },\n    \"children\": []\n  },\n  {\n    \"id\": \"partner-20\",\n    \"name\": \"VMware\",\n    \"type\": \"partner\",\n    \"data\": {\n      \"id\": 20,\n      \"name\": \"vmware\",\n      \"displayName\": \"VMware\",\n      \"type\": \"vendor\",\n      \"roles\": [\n        \"software-vendor\",\n        \"vendor\"\n      ],\n      \"status\": \"ACTIVE\",\n      \"contactEmail\": \"sales@vmware.com\",\n      \"website\": \"https://www.vmware.com\"\n    },\n    \"children\": []\n  },\n  {\n    \"id\": \"partner-21\",\n    \"name\": \"Red Hat\",\n    \"type\": \"partner\",\n    \"data\": {\n      \"id\": 21,\n      \"name\": \"redhat\",\n      \"displayName\": \"Red Hat\",\n      \"type\": \"vendor\",\n      \"roles\": [\n        \"software-vendor\",\n        \"vendor\"\n      ],\n      \"status\": \"ACTIVE\",\n      \"contactEmail\": \"sales@redhat.com\",\n      \"website\": \"https://www.redhat.com\"\n    },\n    \"children\": []\n  },\n  {\n    \"id\": \"partner-22\",\n    \"name\": \"Canonical (Ubuntu)\",\n    \"type\": \"partner\",\n    \"data\": {\n      \"id\": 22,\n      \"name\": \"canonical\",\n      \"displayName\": \"Canonical (Ubuntu)\",\n      \"type\": \"vendor\",\n      \"roles\": [\n        \"software-vendor\",\n        \"vendor\"\n      ],\n      \"status\": \"ACTIVE\",\n      \"contactEmail\": \"sales@canonical.com\",\n      \"website\": \"https://canonical.com\"\n    },\n    \"children\": []\n  },\n  {\n    \"id\": \"partner-23\",\n    \"name\": \"ACME Corporation\",\n    \"type\": \"partner\",\n    \"data\": {\n      \"id\": 23,\n      \"name\": \"acme-corp\",\n      \"displayName\": \"ACME Corporation\",\n      \"type\": \"customer\",\n      \"roles\": [\n        \"customer\"\n      ],\n      \"status\": \"ACTIVE\",\n      \"contactEmail\": \"contact@acme.com\",\n      \"website\": \"https://acme.com\"\n    },\n    \"children\": []\n  },\n  {\n    \"id\": \"partner-24\",\n    \"name\": \"Telcobright\",\n    \"type\": \"partner\",\n    \"data\": {\n      \"id\": 24,\n      \"name\": \"telcobright\",\n      \"displayName\": \"Telcobright\",\n      \"type\": \"service-provider\",\n      \"roles\": [\n        \"self\"\n      ],\n      \"status\": \"ACTIVE\",\n      \"contactEmail\": \"admin@telcobright.com\",\n      \"website\": \"https://telcobright.com\"\n    },\n    \"children\": []\n  },\n  {\n    \"id\": \"partner-25\",\n    \"name\": \"Tech Solutions Inc\",\n    \"type\": \"partner\",\n    \"data\": {\n      \"id\": 25,\n      \"name\": \"tech-solutions\",\n      \"displayName\": \"Tech Solutions Inc\",\n      \"type\": \"VENDOR\",\n      \"roles\": [\n        \"vendor\"\n      ],\n      \"status\": \"ACTIVE\",\n      \"contactEmail\": \"info@techsolutions.com\",\n      \"website\": \"https://www.techsolutions.com\"\n    },\n    \"children\": []\n  },\n  {\n    \"id\": \"partner-26\",\n    \"name\": \"Global Systems Ltd\",\n    \"type\": \"partner\",\n    \"data\": {\n      \"id\": 26,\n      \"name\": \"global-systems\",\n      \"displayName\": \"Global Systems Ltd\",\n      \"type\": \"CUSTOMER\",\n      \"roles\": [\n        \"customer\"\n      ],\n      \"status\": \"ACTIVE\",\n      \"contactEmail\": \"support@globalsystems.com\",\n      \"website\": \"https://www.globalsystems.com\"\n    },\n    \"children\": []\n  },\n  {\n    \"id\": \"partner-27\",\n    \"name\": \"Cloud Dynamics\",\n    \"type\": \"partner\",\n    \"data\": {\n      \"id\": 27,\n      \"name\": \"cloud-dynamics\",\n      \"displayName\": \"Cloud Dynamics\",\n      \"type\": \"VENDOR\",\n      \"roles\": [\n        \"vendor\"\n      ],\n      \"status\": \"ACTIVE\",\n      \"contactEmail\": \"hello@clouddynamics.io\",\n      \"website\": \"https://www.clouddynamics.io\"\n    },\n    \"children\": []\n  }\n]","args":["üìä renderTreeItems called with",27,"nodes:",[{"id":"partner-1","name":"Amazon Web Services (AWS)","type":"partner","data":{"id":1,"name":"amazon","displayName":"Amazon Web Services (AWS)","type":"cloud-provider","roles":["cloud-provider","vendor"],"status":"ACTIVE","contactEmail":"billing@aws.amazon.com","website":"https://aws.amazon.com"},"children":[]},{"id":"partner-2","name":"Google Cloud Platform","type":"partner","data":{"id":2,"name":"google","displayName":"Google Cloud Platform","type":"cloud-provider","roles":["cloud-provider","vendor"],"status":"ACTIVE","contactEmail":"billing@cloud.google.com","website":"https://cloud.google.com"},"children":[]},{"id":"partner-3","name":"Microsoft Azure","type":"partner","data":{"id":3,"name":"microsoft","displayName":"Microsoft Azure","type":"cloud-provider","roles":["cloud-provider","vendor"],"status":"ACTIVE","contactEmail":"billing@azure.microsoft.com","website":"https://azure.microsoft.com"},"children":[]},{"id":"partner-4","name":"IBM Cloud","type":"partner","data":{"id":4,"name":"ibm","displayName":"IBM Cloud","type":"cloud-provider","roles":["cloud-provider","vendor"],"status":"ACTIVE","contactEmail":"billing@ibm.com","website":"https://www.ibm.com/cloud"},"children":[]},{"id":"partner-5","name":"Oracle Cloud","type":"partner","data":{"id":5,"name":"oracle","displayName":"Oracle Cloud","type":"cloud-provider","roles":["cloud-provider","vendor"],"status":"ACTIVE","contactEmail":"billing@oracle.com","website":"https://www.oracle.com/cloud"},"children":[]},{"id":"partner-6","name":"Alibaba Cloud","type":"partner","data":{"id":6,"name":"alibaba","displayName":"Alibaba Cloud","type":"cloud-provider","roles":["cloud-provider","vendor"],"status":"ACTIVE","contactEmail":"billing@alibabacloud.com","website":"https://www.alibabacloud.com"},"children":[]},{"id":"partner-7","name":"DigitalOcean","type":"partner","data":{"id":7,"name":"digitalocean","displayName":"DigitalOcean","type":"cloud-provider","roles":["cloud-provider","vendor"],"status":"ACTIVE","contactEmail":"billing@digitalocean.com","website":"https://www.digitalocean.com"},"children":[]},{"id":"partner-8","name":"Akamai Connected Cloud (Linode)","type":"partner","data":{"id":8,"name":"linode","displayName":"Akamai Connected Cloud (Linode)","type":"cloud-provider","roles":["cloud-provider","vendor"],"status":"ACTIVE","contactEmail":"billing@linode.com","website":"https://www.linode.com"},"children":[]},{"id":"partner-9","name":"Vultr","type":"partner","data":{"id":9,"name":"vultr","displayName":"Vultr","type":"cloud-provider","roles":["cloud-provider","vendor"],"status":"ACTIVE","contactEmail":"billing@vultr.com","website":"https://www.vultr.com"},"children":[]},{"id":"partner-10","name":"OVHcloud","type":"partner","data":{"id":10,"name":"ovhcloud","displayName":"OVHcloud","type":"cloud-provider","roles":["cloud-provider","vendor"],"status":"ACTIVE","contactEmail":"billing@ovhcloud.com","website":"https://www.ovhcloud.com"},"children":[]},{"id":"partner-11","name":"Hetzner","type":"partner","data":{"id":11,"name":"hetzner","displayName":"Hetzner","type":"cloud-provider","roles":["cloud-provider","vendor"],"status":"ACTIVE","contactEmail":"billing@hetzner.com","website":"https://www.hetzner.com"},"children":[]},{"id":"partner-12","name":"Equinix Metal","type":"partner","data":{"id":12,"name":"equinix","displayName":"Equinix Metal","type":"cloud-provider","roles":["cloud-provider","vendor"],"status":"ACTIVE","contactEmail":"billing@equinix.com","website":"https://metal.equinix.com"},"children":[]},{"id":"partner-13","name":"Cloudflare","type":"partner","data":{"id":13,"name":"cloudflare","displayName":"Cloudflare","type":"cloud-provider","roles":["cloud-provider","vendor"],"status":"ACTIVE","contactEmail":"billing@cloudflare.com","website":"https://www.cloudflare.com"},"children":[]},{"id":"partner-14","name":"Contabo","type":"partner","data":{"id":14,"name":"contabo","displayName":"Contabo","type":"cloud-provider","roles":["cloud-provider","vendor"],"status":"ACTIVE","contactEmail":"billing@contabo.com","website":"https://contabo.com"},"children":[]},{"id":"partner-15","name":"Scaleway","type":"partner","data":{"id":15,"name":"scaleway","displayName":"Scaleway","type":"cloud-provider","roles":["cloud-provider","vendor"],"status":"ACTIVE","contactEmail":"billing@scaleway.com","website":"https://www.scaleway.com"},"children":[]},{"id":"partner-16","name":"Dell Technologies","type":"partner","data":{"id":16,"name":"dell","displayName":"Dell Technologies","type":"vendor","roles":["hardware-vendor","vendor"],"status":"ACTIVE","contactEmail":"sales@dell.com","website":"https://www.dell.com"},"children":[]},{"id":"partner-17","name":"Hewlett Packard Enterprise","type":"partner","data":{"id":17,"name":"hp","displayName":"Hewlett Packard Enterprise","type":"vendor","roles":["hardware-vendor","vendor"],"status":"ACTIVE","contactEmail":"sales@hpe.com","website":"https://www.hpe.com"},"children":[]},{"id":"partner-18","name":"Cisco Systems","type":"partner","data":{"id":18,"name":"cisco","displayName":"Cisco Systems","type":"vendor","roles":["network-vendor","vendor"],"status":"ACTIVE","contactEmail":"sales@cisco.com","website":"https://www.cisco.com"},"children":[]},{"id":"partner-19","name":"Juniper Networks","type":"partner","data":{"id":19,"name":"juniper","displayName":"Juniper Networks","type":"vendor","roles":["network-vendor","vendor"],"status":"ACTIVE","contactEmail":"sales@juniper.net","website":"https://www.juniper.net"},"children":[]},{"id":"partner-20","name":"VMware","type":"partner","data":{"id":20,"name":"vmware","displayName":"VMware","type":"vendor","roles":["software-vendor","vendor"],"status":"ACTIVE","contactEmail":"sales@vmware.com","website":"https://www.vmware.com"},"children":[]},{"id":"partner-21","name":"Red Hat","type":"partner","data":{"id":21,"name":"redhat","displayName":"Red Hat","type":"vendor","roles":["software-vendor","vendor"],"status":"ACTIVE","contactEmail":"sales@redhat.com","website":"https://www.redhat.com"},"children":[]},{"id":"partner-22","name":"Canonical (Ubuntu)","type":"partner","data":{"id":22,"name":"canonical","displayName":"Canonical (Ubuntu)","type":"vendor","roles":["software-vendor","vendor"],"status":"ACTIVE","contactEmail":"sales@canonical.com","website":"https://canonical.com"},"children":[]},{"id":"partner-23","name":"ACME Corporation","type":"partner","data":{"id":23,"name":"acme-corp","displayName":"ACME Corporation","type":"customer","roles":["customer"],"status":"ACTIVE","contactEmail":"contact@acme.com","website":"https://acme.com"},"children":[]},{"id":"partner-24","name":"Telcobright","type":"partner","data":{"id":24,"name":"telcobright","displayName":"Telcobright","type":"service-provider","roles":["self"],"status":"ACTIVE","contactEmail":"admin@telcobright.com","website":"https://telcobright.com"},"children":[]},{"id":"partner-25","name":"Tech Solutions Inc","type":"partner","data":{"id":25,"name":"tech-solutions","displayName":"Tech Solutions Inc","type":"VENDOR","roles":["vendor"],"status":"ACTIVE","contactEmail":"info@techsolutions.com","website":"https://www.techsolutions.com"},"children":[]},{"id":"partner-26","name":"Global Systems Ltd","type":"partner","data":{"id":26,"name":"global-systems","displayName":"Global Systems Ltd","type":"CUSTOMER","roles":["customer"],"status":"ACTIVE","contactEmail":"support@globalsystems.com","website":"https://www.globalsystems.com"},"children":[]},{"id":"partner-27","name":"Cloud Dynamics","type":"partner","data":{"id":27,"name":"cloud-dynamics","displayName":"Cloud Dynamics","type":"VENDOR","roles":["vendor"],"status":"ACTIVE","contactEmail":"hello@clouddynamics.io","website":"https://www.clouddynamics.io"},"children":[]}]],"source":"frontend"},{"timestamp":1758473410482,"isoTimestamp":"2025-09-21T16:50:10.482Z","level":"log","message":"üå≤ Rendering node: partner-1 Amazon Web Services (AWS) partner","args":["üå≤ Rendering node:","partner-1","Amazon Web Services (AWS)","partner"],"source":"frontend"},{"timestamp":1758473410482,"isoTimestamp":"2025-09-21T16:50:10.482Z","level":"log","message":"üå≤ Rendering node: partner-2 Google Cloud Platform partner","args":["üå≤ Rendering node:","partner-2","Google Cloud Platform","partner"],"source":"frontend"},{"timestamp":1758473410483,"isoTimestamp":"2025-09-21T16:50:10.483Z","level":"log","message":"üå≤ Rendering node: partner-3 Microsoft Azure partner","args":["üå≤ Rendering node:","partner-3","Microsoft Azure","partner"],"source":"frontend"},{"timestamp":1758473410483,"isoTimestamp":"2025-09-21T16:50:10.483Z","level":"log","message":"üå≤ Rendering node: partner-4 IBM Cloud partner","args":["üå≤ Rendering node:","partner-4","IBM Cloud","partner"],"source":"frontend"},{"timestamp":1758473410483,"isoTimestamp":"2025-09-21T16:50:10.483Z","level":"log","message":"üå≤ Rendering node: partner-5 Oracle Cloud partner","args":["üå≤ Rendering node:","partner-5","Oracle Cloud","partner"],"source":"frontend"},{"timestamp":1758473410483,"isoTimestamp":"2025-09-21T16:50:10.483Z","level":"log","message":"üå≤ Rendering node: partner-6 Alibaba Cloud partner","args":["üå≤ Rendering node:","partner-6","Alibaba Cloud","partner"],"source":"frontend"},{"timestamp":1758473410483,"isoTimestamp":"2025-09-21T16:50:10.483Z","level":"log","message":"üå≤ Rendering node: partner-7 DigitalOcean partner","args":["üå≤ Rendering node:","partner-7","DigitalOcean","partner"],"source":"frontend"},{"timestamp":1758473410483,"isoTimestamp":"2025-09-21T16:50:10.483Z","level":"log","message":"üå≤ Rendering node: partner-8 Akamai Connected Cloud (Linode) partner","args":["üå≤ Rendering node:","partner-8","Akamai Connected Cloud (Linode)","partner"],"source":"frontend"},{"timestamp":1758473410483,"isoTimestamp":"2025-09-21T16:50:10.483Z","level":"log","message":"üå≤ Rendering node: partner-9 Vultr partner","args":["üå≤ Rendering node:","partner-9","Vultr","partner"],"source":"frontend"},{"timestamp":1758473410484,"isoTimestamp":"2025-09-21T16:50:10.484Z","level":"log","message":"üå≤ Rendering node: partner-10 OVHcloud partner","args":["üå≤ Rendering node:","partner-10","OVHcloud","partner"],"source":"frontend"}],"metadata":{"source":"frontend","sessionId":"unknown"}}
{"timestamp":1758473410492,"isoTimestamp":"2025-09-21T16:50:10.492Z","type":"console","operation":"CONSOLE_LOGS","entity":"frontend","count":20,"messages":[{"timestamp":1758473410485,"isoTimestamp":"2025-09-21T16:50:10.485Z","level":"log","message":"üå≤ Rendering node: partner-11 Hetzner partner","args":["üå≤ Rendering node:","partner-11","Hetzner","partner"],"source":"frontend"},{"timestamp":1758473410485,"isoTimestamp":"2025-09-21T16:50:10.485Z","level":"log","message":"üå≤ Rendering node: partner-12 Equinix Metal partner","args":["üå≤ Rendering node:","partner-12","Equinix Metal","partner"],"source":"frontend"},{"timestamp":1758473410486,"isoTimestamp":"2025-09-21T16:50:10.486Z","level":"log","message":"üå≤ Rendering node: partner-13 Cloudflare partner","args":["üå≤ Rendering node:","partner-13","Cloudflare","partner"],"source":"frontend"},{"timestamp":1758473410486,"isoTimestamp":"2025-09-21T16:50:10.486Z","level":"log","message":"üå≤ Rendering node: partner-14 Contabo partner","args":["üå≤ Rendering node:","partner-14","Contabo","partner"],"source":"frontend"},{"timestamp":1758473410486,"isoTimestamp":"2025-09-21T16:50:10.486Z","level":"log","message":"üå≤ Rendering node: partner-15 Scaleway partner","args":["üå≤ Rendering node:","partner-15","Scaleway","partner"],"source":"frontend"},{"timestamp":1758473410486,"isoTimestamp":"2025-09-21T16:50:10.486Z","level":"log","message":"üå≤ Rendering node: partner-16 Dell Technologies partner","args":["üå≤ Rendering node:","partner-16","Dell Technologies","partner"],"source":"frontend"},{"timestamp":1758473410486,"isoTimestamp":"2025-09-21T16:50:10.486Z","level":"log","message":"üå≤ Rendering node: partner-17 Hewlett Packard Enterprise partner","args":["üå≤ Rendering node:","partner-17","Hewlett Packard Enterprise","partner"],"source":"frontend"},{"timestamp":1758473410486,"isoTimestamp":"2025-09-21T16:50:10.486Z","level":"log","message":"üå≤ Rendering node: partner-18 Cisco Systems partner","args":["üå≤ Rendering node:","partner-18","Cisco Systems","partner"],"source":"frontend"},{"timestamp":1758473410486,"isoTimestamp":"2025-09-21T16:50:10.486Z","level":"log","message":"üå≤ Rendering node: partner-19 Juniper Networks partner","args":["üå≤ Rendering node:","partner-19","Juniper Networks","partner"],"source":"frontend"},{"timestamp":1758473410486,"isoTimestamp":"2025-09-21T16:50:10.486Z","level":"log","message":"üå≤ Rendering node: partner-20 VMware partner","args":["üå≤ Rendering node:","partner-20","VMware","partner"],"source":"frontend"},{"timestamp":1758473410486,"isoTimestamp":"2025-09-21T16:50:10.486Z","level":"log","message":"üå≤ Rendering node: partner-21 Red Hat partner","args":["üå≤ Rendering node:","partner-21","Red Hat","partner"],"source":"frontend"},{"timestamp":1758473410486,"isoTimestamp":"2025-09-21T16:50:10.486Z","level":"log","message":"üå≤ Rendering node: partner-22 Canonical (Ubuntu) partner","args":["üå≤ Rendering node:","partner-22","Canonical (Ubuntu)","partner"],"source":"frontend"},{"timestamp":1758473410486,"isoTimestamp":"2025-09-21T16:50:10.486Z","level":"log","message":"üå≤ Rendering node: partner-23 ACME Corporation partner","args":["üå≤ Rendering node:","partner-23","ACME Corporation","partner"],"source":"frontend"},{"timestamp":1758473410487,"isoTimestamp":"2025-09-21T16:50:10.487Z","level":"log","message":"üå≤ Rendering node: partner-24 Telcobright partner","args":["üå≤ Rendering node:","partner-24","Telcobright","partner"],"source":"frontend"},{"timestamp":1758473410487,"isoTimestamp":"2025-09-21T16:50:10.487Z","level":"log","message":"üå≤ Rendering node: partner-25 Tech Solutions Inc partner","args":["üå≤ Rendering node:","partner-25","Tech Solutions Inc","partner"],"source":"frontend"},{"timestamp":1758473410487,"isoTimestamp":"2025-09-21T16:50:10.487Z","level":"log","message":"üå≤ Rendering node: partner-26 Global Systems Ltd partner","args":["üå≤ Rendering node:","partner-26","Global Systems Ltd","partner"],"source":"frontend"},{"timestamp":1758473410487,"isoTimestamp":"2025-09-21T16:50:10.487Z","level":"log","message":"üå≤ Rendering node: partner-27 Cloud Dynamics partner","args":["üå≤ Rendering node:","partner-27","Cloud Dynamics","partner"],"source":"frontend"},{"timestamp":1758473410489,"isoTimestamp":"2025-09-21T16:50:10.489Z","level":"log","message":"üìä renderTreeItems called with 27 nodes: [\n  {\n    \"id\": \"partner-1\",\n    \"name\": \"Amazon Web Services (AWS)\",\n    \"type\": \"partner\",\n    \"data\": {\n      \"id\": 1,\n      \"name\": \"amazon\",\n      \"displayName\": \"Amazon Web Services (AWS)\",\n      \"type\": \"cloud-provider\",\n      \"roles\": [\n        \"cloud-provider\",\n        \"vendor\"\n      ],\n      \"status\": \"ACTIVE\",\n      \"contactEmail\": \"billing@aws.amazon.com\",\n      \"website\": \"https://aws.amazon.com\"\n    },\n    \"children\": []\n  },\n  {\n    \"id\": \"partner-2\",\n    \"name\": \"Google Cloud Platform\",\n    \"type\": \"partner\",\n    \"data\": {\n      \"id\": 2,\n      \"name\": \"google\",\n      \"displayName\": \"Google Cloud Platform\",\n      \"type\": \"cloud-provider\",\n      \"roles\": [\n        \"cloud-provider\",\n        \"vendor\"\n      ],\n      \"status\": \"ACTIVE\",\n      \"contactEmail\": \"billing@cloud.google.com\",\n      \"website\": \"https://cloud.google.com\"\n    },\n    \"children\": []\n  },\n  {\n    \"id\": \"partner-3\",\n    \"name\": \"Microsoft Azure\",\n    \"type\": \"partner\",\n    \"data\": {\n      \"id\": 3,\n      \"name\": \"microsoft\",\n      \"displayName\": \"Microsoft Azure\",\n      \"type\": \"cloud-provider\",\n      \"roles\": [\n        \"cloud-provider\",\n        \"vendor\"\n      ],\n      \"status\": \"ACTIVE\",\n      \"contactEmail\": \"billing@azure.microsoft.com\",\n      \"website\": \"https://azure.microsoft.com\"\n    },\n    \"children\": []\n  },\n  {\n    \"id\": \"partner-4\",\n    \"name\": \"IBM Cloud\",\n    \"type\": \"partner\",\n    \"data\": {\n      \"id\": 4,\n      \"name\": \"ibm\",\n      \"displayName\": \"IBM Cloud\",\n      \"type\": \"cloud-provider\",\n      \"roles\": [\n        \"cloud-provider\",\n        \"vendor\"\n      ],\n      \"status\": \"ACTIVE\",\n      \"contactEmail\": \"billing@ibm.com\",\n      \"website\": \"https://www.ibm.com/cloud\"\n    },\n    \"children\": []\n  },\n  {\n    \"id\": \"partner-5\",\n    \"name\": \"Oracle Cloud\",\n    \"type\": \"partner\",\n    \"data\": {\n      \"id\": 5,\n      \"name\": \"oracle\",\n      \"displayName\": \"Oracle Cloud\",\n      \"type\": \"cloud-provider\",\n      \"roles\": [\n        \"cloud-provider\",\n        \"vendor\"\n      ],\n      \"status\": \"ACTIVE\",\n      \"contactEmail\": \"billing@oracle.com\",\n      \"website\": \"https://www.oracle.com/cloud\"\n    },\n    \"children\": []\n  },\n  {\n    \"id\": \"partner-6\",\n    \"name\": \"Alibaba Cloud\",\n    \"type\": \"partner\",\n    \"data\": {\n      \"id\": 6,\n      \"name\": \"alibaba\",\n      \"displayName\": \"Alibaba Cloud\",\n      \"type\": \"cloud-provider\",\n      \"roles\": [\n        \"cloud-provider\",\n        \"vendor\"\n      ],\n      \"status\": \"ACTIVE\",\n      \"contactEmail\": \"billing@alibabacloud.com\",\n      \"website\": \"https://www.alibabacloud.com\"\n    },\n    \"children\": []\n  },\n  {\n    \"id\": \"partner-7\",\n    \"name\": \"DigitalOcean\",\n    \"type\": \"partner\",\n    \"data\": {\n      \"id\": 7,\n      \"name\": \"digitalocean\",\n      \"displayName\": \"DigitalOcean\",\n      \"type\": \"cloud-provider\",\n      \"roles\": [\n        \"cloud-provider\",\n        \"vendor\"\n      ],\n      \"status\": \"ACTIVE\",\n      \"contactEmail\": \"billing@digitalocean.com\",\n      \"website\": \"https://www.digitalocean.com\"\n    },\n    \"children\": []\n  },\n  {\n    \"id\": \"partner-8\",\n    \"name\": \"Akamai Connected Cloud (Linode)\",\n    \"type\": \"partner\",\n    \"data\": {\n      \"id\": 8,\n      \"name\": \"linode\",\n      \"displayName\": \"Akamai Connected Cloud (Linode)\",\n      \"type\": \"cloud-provider\",\n      \"roles\": [\n        \"cloud-provider\",\n        \"vendor\"\n      ],\n      \"status\": \"ACTIVE\",\n      \"contactEmail\": \"billing@linode.com\",\n      \"website\": \"https://www.linode.com\"\n    },\n    \"children\": []\n  },\n  {\n    \"id\": \"partner-9\",\n    \"name\": \"Vultr\",\n    \"type\": \"partner\",\n    \"data\": {\n      \"id\": 9,\n      \"name\": \"vultr\",\n      \"displayName\": \"Vultr\",\n      \"type\": \"cloud-provider\",\n      \"roles\": [\n        \"cloud-provider\",\n        \"vendor\"\n      ],\n      \"status\": \"ACTIVE\",\n      \"contactEmail\": \"billing@vultr.com\",\n      \"website\": \"https://www.vultr.com\"\n    },\n    \"children\": []\n  },\n  {\n    \"id\": \"partner-10\",\n    \"name\": \"OVHcloud\",\n    \"type\": \"partner\",\n    \"data\": {\n      \"id\": 10,\n      \"name\": \"ovhcloud\",\n      \"displayName\": \"OVHcloud\",\n      \"type\": \"cloud-provider\",\n      \"roles\": [\n        \"cloud-provider\",\n        \"vendor\"\n      ],\n      \"status\": \"ACTIVE\",\n      \"contactEmail\": \"billing@ovhcloud.com\",\n      \"website\": \"https://www.ovhcloud.com\"\n    },\n    \"children\": []\n  },\n  {\n    \"id\": \"partner-11\",\n    \"name\": \"Hetzner\",\n    \"type\": \"partner\",\n    \"data\": {\n      \"id\": 11,\n      \"name\": \"hetzner\",\n      \"displayName\": \"Hetzner\",\n      \"type\": \"cloud-provider\",\n      \"roles\": [\n        \"cloud-provider\",\n        \"vendor\"\n      ],\n      \"status\": \"ACTIVE\",\n      \"contactEmail\": \"billing@hetzner.com\",\n      \"website\": \"https://www.hetzner.com\"\n    },\n    \"children\": []\n  },\n  {\n    \"id\": \"partner-12\",\n    \"name\": \"Equinix Metal\",\n    \"type\": \"partner\",\n    \"data\": {\n      \"id\": 12,\n      \"name\": \"equinix\",\n      \"displayName\": \"Equinix Metal\",\n      \"type\": \"cloud-provider\",\n      \"roles\": [\n        \"cloud-provider\",\n        \"vendor\"\n      ],\n      \"status\": \"ACTIVE\",\n      \"contactEmail\": \"billing@equinix.com\",\n      \"website\": \"https://metal.equinix.com\"\n    },\n    \"children\": []\n  },\n  {\n    \"id\": \"partner-13\",\n    \"name\": \"Cloudflare\",\n    \"type\": \"partner\",\n    \"data\": {\n      \"id\": 13,\n      \"name\": \"cloudflare\",\n      \"displayName\": \"Cloudflare\",\n      \"type\": \"cloud-provider\",\n      \"roles\": [\n        \"cloud-provider\",\n        \"vendor\"\n      ],\n      \"status\": \"ACTIVE\",\n      \"contactEmail\": \"billing@cloudflare.com\",\n      \"website\": \"https://www.cloudflare.com\"\n    },\n    \"children\": []\n  },\n  {\n    \"id\": \"partner-14\",\n    \"name\": \"Contabo\",\n    \"type\": \"partner\",\n    \"data\": {\n      \"id\": 14,\n      \"name\": \"contabo\",\n      \"displayName\": \"Contabo\",\n      \"type\": \"cloud-provider\",\n      \"roles\": [\n        \"cloud-provider\",\n        \"vendor\"\n      ],\n      \"status\": \"ACTIVE\",\n      \"contactEmail\": \"billing@contabo.com\",\n      \"website\": \"https://contabo.com\"\n    },\n    \"children\": []\n  },\n  {\n    \"id\": \"partner-15\",\n    \"name\": \"Scaleway\",\n    \"type\": \"partner\",\n    \"data\": {\n      \"id\": 15,\n      \"name\": \"scaleway\",\n      \"displayName\": \"Scaleway\",\n      \"type\": \"cloud-provider\",\n      \"roles\": [\n        \"cloud-provider\",\n        \"vendor\"\n      ],\n      \"status\": \"ACTIVE\",\n      \"contactEmail\": \"billing@scaleway.com\",\n      \"website\": \"https://www.scaleway.com\"\n    },\n    \"children\": []\n  },\n  {\n    \"id\": \"partner-16\",\n    \"name\": \"Dell Technologies\",\n    \"type\": \"partner\",\n    \"data\": {\n      \"id\": 16,\n      \"name\": \"dell\",\n      \"displayName\": \"Dell Technologies\",\n      \"type\": \"vendor\",\n      \"roles\": [\n        \"hardware-vendor\",\n        \"vendor\"\n      ],\n      \"status\": \"ACTIVE\",\n      \"contactEmail\": \"sales@dell.com\",\n      \"website\": \"https://www.dell.com\"\n    },\n    \"children\": []\n  },\n  {\n    \"id\": \"partner-17\",\n    \"name\": \"Hewlett Packard Enterprise\",\n    \"type\": \"partner\",\n    \"data\": {\n      \"id\": 17,\n      \"name\": \"hp\",\n      \"displayName\": \"Hewlett Packard Enterprise\",\n      \"type\": \"vendor\",\n      \"roles\": [\n        \"hardware-vendor\",\n        \"vendor\"\n      ],\n      \"status\": \"ACTIVE\",\n      \"contactEmail\": \"sales@hpe.com\",\n      \"website\": \"https://www.hpe.com\"\n    },\n    \"children\": []\n  },\n  {\n    \"id\": \"partner-18\",\n    \"name\": \"Cisco Systems\",\n    \"type\": \"partner\",\n    \"data\": {\n      \"id\": 18,\n      \"name\": \"cisco\",\n      \"displayName\": \"Cisco Systems\",\n      \"type\": \"vendor\",\n      \"roles\": [\n        \"network-vendor\",\n        \"vendor\"\n      ],\n      \"status\": \"ACTIVE\",\n      \"contactEmail\": \"sales@cisco.com\",\n      \"website\": \"https://www.cisco.com\"\n    },\n    \"children\": []\n  },\n  {\n    \"id\": \"partner-19\",\n    \"name\": \"Juniper Networks\",\n    \"type\": \"partner\",\n    \"data\": {\n      \"id\": 19,\n      \"name\": \"juniper\",\n      \"displayName\": \"Juniper Networks\",\n      \"type\": \"vendor\",\n      \"roles\": [\n        \"network-vendor\",\n        \"vendor\"\n      ],\n      \"status\": \"ACTIVE\",\n      \"contactEmail\": \"sales@juniper.net\",\n      \"website\": \"https://www.juniper.net\"\n    },\n    \"children\": []\n  },\n  {\n    \"id\": \"partner-20\",\n    \"name\": \"VMware\",\n    \"type\": \"partner\",\n    \"data\": {\n      \"id\": 20,\n      \"name\": \"vmware\",\n      \"displayName\": \"VMware\",\n      \"type\": \"vendor\",\n      \"roles\": [\n        \"software-vendor\",\n        \"vendor\"\n      ],\n      \"status\": \"ACTIVE\",\n      \"contactEmail\": \"sales@vmware.com\",\n      \"website\": \"https://www.vmware.com\"\n    },\n    \"children\": []\n  },\n  {\n    \"id\": \"partner-21\",\n    \"name\": \"Red Hat\",\n    \"type\": \"partner\",\n    \"data\": {\n      \"id\": 21,\n      \"name\": \"redhat\",\n      \"displayName\": \"Red Hat\",\n      \"type\": \"vendor\",\n      \"roles\": [\n        \"software-vendor\",\n        \"vendor\"\n      ],\n      \"status\": \"ACTIVE\",\n      \"contactEmail\": \"sales@redhat.com\",\n      \"website\": \"https://www.redhat.com\"\n    },\n    \"children\": []\n  },\n  {\n    \"id\": \"partner-22\",\n    \"name\": \"Canonical (Ubuntu)\",\n    \"type\": \"partner\",\n    \"data\": {\n      \"id\": 22,\n      \"name\": \"canonical\",\n      \"displayName\": \"Canonical (Ubuntu)\",\n      \"type\": \"vendor\",\n      \"roles\": [\n        \"software-vendor\",\n        \"vendor\"\n      ],\n      \"status\": \"ACTIVE\",\n      \"contactEmail\": \"sales@canonical.com\",\n      \"website\": \"https://canonical.com\"\n    },\n    \"children\": []\n  },\n  {\n    \"id\": \"partner-23\",\n    \"name\": \"ACME Corporation\",\n    \"type\": \"partner\",\n    \"data\": {\n      \"id\": 23,\n      \"name\": \"acme-corp\",\n      \"displayName\": \"ACME Corporation\",\n      \"type\": \"customer\",\n      \"roles\": [\n        \"customer\"\n      ],\n      \"status\": \"ACTIVE\",\n      \"contactEmail\": \"contact@acme.com\",\n      \"website\": \"https://acme.com\"\n    },\n    \"children\": []\n  },\n  {\n    \"id\": \"partner-24\",\n    \"name\": \"Telcobright\",\n    \"type\": \"partner\",\n    \"data\": {\n      \"id\": 24,\n      \"name\": \"telcobright\",\n      \"displayName\": \"Telcobright\",\n      \"type\": \"service-provider\",\n      \"roles\": [\n        \"self\"\n      ],\n      \"status\": \"ACTIVE\",\n      \"contactEmail\": \"admin@telcobright.com\",\n      \"website\": \"https://telcobright.com\"\n    },\n    \"children\": []\n  },\n  {\n    \"id\": \"partner-25\",\n    \"name\": \"Tech Solutions Inc\",\n    \"type\": \"partner\",\n    \"data\": {\n      \"id\": 25,\n      \"name\": \"tech-solutions\",\n      \"displayName\": \"Tech Solutions Inc\",\n      \"type\": \"VENDOR\",\n      \"roles\": [\n        \"vendor\"\n      ],\n      \"status\": \"ACTIVE\",\n      \"contactEmail\": \"info@techsolutions.com\",\n      \"website\": \"https://www.techsolutions.com\"\n    },\n    \"children\": []\n  },\n  {\n    \"id\": \"partner-26\",\n    \"name\": \"Global Systems Ltd\",\n    \"type\": \"partner\",\n    \"data\": {\n      \"id\": 26,\n      \"name\": \"global-systems\",\n      \"displayName\": \"Global Systems Ltd\",\n      \"type\": \"CUSTOMER\",\n      \"roles\": [\n        \"customer\"\n      ],\n      \"status\": \"ACTIVE\",\n      \"contactEmail\": \"support@globalsystems.com\",\n      \"website\": \"https://www.globalsystems.com\"\n    },\n    \"children\": []\n  },\n  {\n    \"id\": \"partner-27\",\n    \"name\": \"Cloud Dynamics\",\n    \"type\": \"partner\",\n    \"data\": {\n      \"id\": 27,\n      \"name\": \"cloud-dynamics\",\n      \"displayName\": \"Cloud Dynamics\",\n      \"type\": \"VENDOR\",\n      \"roles\": [\n        \"vendor\"\n      ],\n      \"status\": \"ACTIVE\",\n      \"contactEmail\": \"hello@clouddynamics.io\",\n      \"website\": \"https://www.clouddynamics.io\"\n    },\n    \"children\": []\n  }\n]","args":["üìä renderTreeItems called with",27,"nodes:",[{"id":"partner-1","name":"Amazon Web Services (AWS)","type":"partner","data":{"id":1,"name":"amazon","displayName":"Amazon Web Services (AWS)","type":"cloud-provider","roles":["cloud-provider","vendor"],"status":"ACTIVE","contactEmail":"billing@aws.amazon.com","website":"https://aws.amazon.com"},"children":[]},{"id":"partner-2","name":"Google Cloud Platform","type":"partner","data":{"id":2,"name":"google","displayName":"Google Cloud Platform","type":"cloud-provider","roles":["cloud-provider","vendor"],"status":"ACTIVE","contactEmail":"billing@cloud.google.com","website":"https://cloud.google.com"},"children":[]},{"id":"partner-3","name":"Microsoft Azure","type":"partner","data":{"id":3,"name":"microsoft","displayName":"Microsoft Azure","type":"cloud-provider","roles":["cloud-provider","vendor"],"status":"ACTIVE","contactEmail":"billing@azure.microsoft.com","website":"https://azure.microsoft.com"},"children":[]},{"id":"partner-4","name":"IBM Cloud","type":"partner","data":{"id":4,"name":"ibm","displayName":"IBM Cloud","type":"cloud-provider","roles":["cloud-provider","vendor"],"status":"ACTIVE","contactEmail":"billing@ibm.com","website":"https://www.ibm.com/cloud"},"children":[]},{"id":"partner-5","name":"Oracle Cloud","type":"partner","data":{"id":5,"name":"oracle","displayName":"Oracle Cloud","type":"cloud-provider","roles":["cloud-provider","vendor"],"status":"ACTIVE","contactEmail":"billing@oracle.com","website":"https://www.oracle.com/cloud"},"children":[]},{"id":"partner-6","name":"Alibaba Cloud","type":"partner","data":{"id":6,"name":"alibaba","displayName":"Alibaba Cloud","type":"cloud-provider","roles":["cloud-provider","vendor"],"status":"ACTIVE","contactEmail":"billing@alibabacloud.com","website":"https://www.alibabacloud.com"},"children":[]},{"id":"partner-7","name":"DigitalOcean","type":"partner","data":{"id":7,"name":"digitalocean","displayName":"DigitalOcean","type":"cloud-provider","roles":["cloud-provider","vendor"],"status":"ACTIVE","contactEmail":"billing@digitalocean.com","website":"https://www.digitalocean.com"},"children":[]},{"id":"partner-8","name":"Akamai Connected Cloud (Linode)","type":"partner","data":{"id":8,"name":"linode","displayName":"Akamai Connected Cloud (Linode)","type":"cloud-provider","roles":["cloud-provider","vendor"],"status":"ACTIVE","contactEmail":"billing@linode.com","website":"https://www.linode.com"},"children":[]},{"id":"partner-9","name":"Vultr","type":"partner","data":{"id":9,"name":"vultr","displayName":"Vultr","type":"cloud-provider","roles":["cloud-provider","vendor"],"status":"ACTIVE","contactEmail":"billing@vultr.com","website":"https://www.vultr.com"},"children":[]},{"id":"partner-10","name":"OVHcloud","type":"partner","data":{"id":10,"name":"ovhcloud","displayName":"OVHcloud","type":"cloud-provider","roles":["cloud-provider","vendor"],"status":"ACTIVE","contactEmail":"billing@ovhcloud.com","website":"https://www.ovhcloud.com"},"children":[]},{"id":"partner-11","name":"Hetzner","type":"partner","data":{"id":11,"name":"hetzner","displayName":"Hetzner","type":"cloud-provider","roles":["cloud-provider","vendor"],"status":"ACTIVE","contactEmail":"billing@hetzner.com","website":"https://www.hetzner.com"},"children":[]},{"id":"partner-12","name":"Equinix Metal","type":"partner","data":{"id":12,"name":"equinix","displayName":"Equinix Metal","type":"cloud-provider","roles":["cloud-provider","vendor"],"status":"ACTIVE","contactEmail":"billing@equinix.com","website":"https://metal.equinix.com"},"children":[]},{"id":"partner-13","name":"Cloudflare","type":"partner","data":{"id":13,"name":"cloudflare","displayName":"Cloudflare","type":"cloud-provider","roles":["cloud-provider","vendor"],"status":"ACTIVE","contactEmail":"billing@cloudflare.com","website":"https://www.cloudflare.com"},"children":[]},{"id":"partner-14","name":"Contabo","type":"partner","data":{"id":14,"name":"contabo","displayName":"Contabo","type":"cloud-provider","roles":["cloud-provider","vendor"],"status":"ACTIVE","contactEmail":"billing@contabo.com","website":"https://contabo.com"},"children":[]},{"id":"partner-15","name":"Scaleway","type":"partner","data":{"id":15,"name":"scaleway","displayName":"Scaleway","type":"cloud-provider","roles":["cloud-provider","vendor"],"status":"ACTIVE","contactEmail":"billing@scaleway.com","website":"https://www.scaleway.com"},"children":[]},{"id":"partner-16","name":"Dell Technologies","type":"partner","data":{"id":16,"name":"dell","displayName":"Dell Technologies","type":"vendor","roles":["hardware-vendor","vendor"],"status":"ACTIVE","contactEmail":"sales@dell.com","website":"https://www.dell.com"},"children":[]},{"id":"partner-17","name":"Hewlett Packard Enterprise","type":"partner","data":{"id":17,"name":"hp","displayName":"Hewlett Packard Enterprise","type":"vendor","roles":["hardware-vendor","vendor"],"status":"ACTIVE","contactEmail":"sales@hpe.com","website":"https://www.hpe.com"},"children":[]},{"id":"partner-18","name":"Cisco Systems","type":"partner","data":{"id":18,"name":"cisco","displayName":"Cisco Systems","type":"vendor","roles":["network-vendor","vendor"],"status":"ACTIVE","contactEmail":"sales@cisco.com","website":"https://www.cisco.com"},"children":[]},{"id":"partner-19","name":"Juniper Networks","type":"partner","data":{"id":19,"name":"juniper","displayName":"Juniper Networks","type":"vendor","roles":["network-vendor","vendor"],"status":"ACTIVE","contactEmail":"sales@juniper.net","website":"https://www.juniper.net"},"children":[]},{"id":"partner-20","name":"VMware","type":"partner","data":{"id":20,"name":"vmware","displayName":"VMware","type":"vendor","roles":["software-vendor","vendor"],"status":"ACTIVE","contactEmail":"sales@vmware.com","website":"https://www.vmware.com"},"children":[]},{"id":"partner-21","name":"Red Hat","type":"partner","data":{"id":21,"name":"redhat","displayName":"Red Hat","type":"vendor","roles":["software-vendor","vendor"],"status":"ACTIVE","contactEmail":"sales@redhat.com","website":"https://www.redhat.com"},"children":[]},{"id":"partner-22","name":"Canonical (Ubuntu)","type":"partner","data":{"id":22,"name":"canonical","displayName":"Canonical (Ubuntu)","type":"vendor","roles":["software-vendor","vendor"],"status":"ACTIVE","contactEmail":"sales@canonical.com","website":"https://canonical.com"},"children":[]},{"id":"partner-23","name":"ACME Corporation","type":"partner","data":{"id":23,"name":"acme-corp","displayName":"ACME Corporation","type":"customer","roles":["customer"],"status":"ACTIVE","contactEmail":"contact@acme.com","website":"https://acme.com"},"children":[]},{"id":"partner-24","name":"Telcobright","type":"partner","data":{"id":24,"name":"telcobright","displayName":"Telcobright","type":"service-provider","roles":["self"],"status":"ACTIVE","contactEmail":"admin@telcobright.com","website":"https://telcobright.com"},"children":[]},{"id":"partner-25","name":"Tech Solutions Inc","type":"partner","data":{"id":25,"name":"tech-solutions","displayName":"Tech Solutions Inc","type":"VENDOR","roles":["vendor"],"status":"ACTIVE","contactEmail":"info@techsolutions.com","website":"https://www.techsolutions.com"},"children":[]},{"id":"partner-26","name":"Global Systems Ltd","type":"partner","data":{"id":26,"name":"global-systems","displayName":"Global Systems Ltd","type":"CUSTOMER","roles":["customer"],"status":"ACTIVE","contactEmail":"support@globalsystems.com","website":"https://www.globalsystems.com"},"children":[]},{"id":"partner-27","name":"Cloud Dynamics","type":"partner","data":{"id":27,"name":"cloud-dynamics","displayName":"Cloud Dynamics","type":"VENDOR","roles":["vendor"],"status":"ACTIVE","contactEmail":"hello@clouddynamics.io","website":"https://www.clouddynamics.io"},"children":[]}]],"source":"frontend"},{"timestamp":1758473410490,"isoTimestamp":"2025-09-21T16:50:10.490Z","level":"log","message":"üå≤ Rendering node: partner-1 Amazon Web Services (AWS) partner","args":["üå≤ Rendering node:","partner-1","Amazon Web Services (AWS)","partner"],"source":"frontend"},{"timestamp":1758473410490,"isoTimestamp":"2025-09-21T16:50:10.490Z","level":"log","message":"üå≤ Rendering node: partner-2 Google Cloud Platform partner","args":["üå≤ Rendering node:","partner-2","Google Cloud Platform","partner"],"source":"frontend"}],"metadata":{"source":"frontend","sessionId":"unknown"}}
{"timestamp":1758473410493,"isoTimestamp":"2025-09-21T16:50:10.493Z","type":"console","operation":"CONSOLE_LOGS","entity":"frontend","count":20,"messages":[{"timestamp":1758473410491,"isoTimestamp":"2025-09-21T16:50:10.491Z","level":"log","message":"üå≤ Rendering node: partner-3 Microsoft Azure partner","args":["üå≤ Rendering node:","partner-3","Microsoft Azure","partner"],"source":"frontend"},{"timestamp":1758473410491,"isoTimestamp":"2025-09-21T16:50:10.491Z","level":"log","message":"üå≤ Rendering node: partner-4 IBM Cloud partner","args":["üå≤ Rendering node:","partner-4","IBM Cloud","partner"],"source":"frontend"},{"timestamp":1758473410491,"isoTimestamp":"2025-09-21T16:50:10.491Z","level":"log","message":"üå≤ Rendering node: partner-5 Oracle Cloud partner","args":["üå≤ Rendering node:","partner-5","Oracle Cloud","partner"],"source":"frontend"},{"timestamp":1758473410491,"isoTimestamp":"2025-09-21T16:50:10.491Z","level":"log","message":"üå≤ Rendering node: partner-6 Alibaba Cloud partner","args":["üå≤ Rendering node:","partner-6","Alibaba Cloud","partner"],"source":"frontend"},{"timestamp":1758473410491,"isoTimestamp":"2025-09-21T16:50:10.491Z","level":"log","message":"üå≤ Rendering node: partner-7 DigitalOcean partner","args":["üå≤ Rendering node:","partner-7","DigitalOcean","partner"],"source":"frontend"},{"timestamp":1758473410491,"isoTimestamp":"2025-09-21T16:50:10.491Z","level":"log","message":"üå≤ Rendering node: partner-8 Akamai Connected Cloud (Linode) partner","args":["üå≤ Rendering node:","partner-8","Akamai Connected Cloud (Linode)","partner"],"source":"frontend"},{"timestamp":1758473410491,"isoTimestamp":"2025-09-21T16:50:10.491Z","level":"log","message":"üå≤ Rendering node: partner-9 Vultr partner","args":["üå≤ Rendering node:","partner-9","Vultr","partner"],"source":"frontend"},{"timestamp":1758473410491,"isoTimestamp":"2025-09-21T16:50:10.491Z","level":"log","message":"üå≤ Rendering node: partner-10 OVHcloud partner","args":["üå≤ Rendering node:","partner-10","OVHcloud","partner"],"source":"frontend"},{"timestamp":1758473410491,"isoTimestamp":"2025-09-21T16:50:10.491Z","level":"log","message":"üå≤ Rendering node: partner-11 Hetzner partner","args":["üå≤ Rendering node:","partner-11","Hetzner","partner"],"source":"frontend"},{"timestamp":1758473410492,"isoTimestamp":"2025-09-21T16:50:10.492Z","level":"log","message":"üå≤ Rendering node: partner-12 Equinix Metal partner","args":["üå≤ Rendering node:","partner-12","Equinix Metal","partner"],"source":"frontend"},{"timestamp":1758473410492,"isoTimestamp":"2025-09-21T16:50:10.492Z","level":"log","message":"üå≤ Rendering node: partner-13 Cloudflare partner","args":["üå≤ Rendering node:","partner-13","Cloudflare","partner"],"source":"frontend"},{"timestamp":1758473410492,"isoTimestamp":"2025-09-21T16:50:10.492Z","level":"log","message":"üå≤ Rendering node: partner-14 Contabo partner","args":["üå≤ Rendering node:","partner-14","Contabo","partner"],"source":"frontend"},{"timestamp":1758473410492,"isoTimestamp":"2025-09-21T16:50:10.492Z","level":"log","message":"üå≤ Rendering node: partner-15 Scaleway partner","args":["üå≤ Rendering node:","partner-15","Scaleway","partner"],"source":"frontend"},{"timestamp":1758473410492,"isoTimestamp":"2025-09-21T16:50:10.492Z","level":"log","message":"üå≤ Rendering node: partner-16 Dell Technologies partner","args":["üå≤ Rendering node:","partner-16","Dell Technologies","partner"],"source":"frontend"},{"timestamp":1758473410492,"isoTimestamp":"2025-09-21T16:50:10.492Z","level":"log","message":"üå≤ Rendering node: partner-17 Hewlett Packard Enterprise partner","args":["üå≤ Rendering node:","partner-17","Hewlett Packard Enterprise","partner"],"source":"frontend"},{"timestamp":1758473410492,"isoTimestamp":"2025-09-21T16:50:10.492Z","level":"log","message":"üå≤ Rendering node: partner-18 Cisco Systems partner","args":["üå≤ Rendering node:","partner-18","Cisco Systems","partner"],"source":"frontend"},{"timestamp":1758473410492,"isoTimestamp":"2025-09-21T16:50:10.492Z","level":"log","message":"üå≤ Rendering node: partner-19 Juniper Networks partner","args":["üå≤ Rendering node:","partner-19","Juniper Networks","partner"],"source":"frontend"},{"timestamp":1758473410492,"isoTimestamp":"2025-09-21T16:50:10.492Z","level":"log","message":"üå≤ Rendering node: partner-20 VMware partner","args":["üå≤ Rendering node:","partner-20","VMware","partner"],"source":"frontend"},{"timestamp":1758473410492,"isoTimestamp":"2025-09-21T16:50:10.492Z","level":"log","message":"üå≤ Rendering node: partner-21 Red Hat partner","args":["üå≤ Rendering node:","partner-21","Red Hat","partner"],"source":"frontend"},{"timestamp":1758473410492,"isoTimestamp":"2025-09-21T16:50:10.492Z","level":"log","message":"üå≤ Rendering node: partner-22 Canonical (Ubuntu) partner","args":["üå≤ Rendering node:","partner-22","Canonical (Ubuntu)","partner"],"source":"frontend"}],"metadata":{"source":"frontend","sessionId":"unknown"}}
{"timestamp":1758473410614,"isoTimestamp":"2025-09-21T16:50:10.614Z","type":"console","operation":"CONSOLE_LOGS","entity":"frontend","count":20,"messages":[{"timestamp":1758473410492,"isoTimestamp":"2025-09-21T16:50:10.492Z","level":"log","message":"üå≤ Rendering node: partner-23 ACME Corporation partner","args":["üå≤ Rendering node:","partner-23","ACME Corporation","partner"],"source":"frontend"},{"timestamp":1758473410493,"isoTimestamp":"2025-09-21T16:50:10.493Z","level":"log","message":"üå≤ Rendering node: partner-24 Telcobright partner","args":["üå≤ Rendering node:","partner-24","Telcobright","partner"],"source":"frontend"},{"timestamp":1758473410493,"isoTimestamp":"2025-09-21T16:50:10.493Z","level":"log","message":"üå≤ Rendering node: partner-25 Tech Solutions Inc partner","args":["üå≤ Rendering node:","partner-25","Tech Solutions Inc","partner"],"source":"frontend"},{"timestamp":1758473410493,"isoTimestamp":"2025-09-21T16:50:10.493Z","level":"log","message":"üå≤ Rendering node: partner-26 Global Systems Ltd partner","args":["üå≤ Rendering node:","partner-26","Global Systems Ltd","partner"],"source":"frontend"},{"timestamp":1758473410493,"isoTimestamp":"2025-09-21T16:50:10.493Z","level":"log","message":"üå≤ Rendering node: partner-27 Cloud Dynamics partner","args":["üå≤ Rendering node:","partner-27","Cloud Dynamics","partner"],"source":"frontend"},{"timestamp":1758473410610,"isoTimestamp":"2025-09-21T16:50:10.610Z","level":"warn","message":"[EventBusWebSocketHandler] Invalid event received: undefined","args":["[EventBusWebSocketHandler] Invalid event received:","undefined"],"source":"frontend"},{"timestamp":1758473410610,"isoTimestamp":"2025-09-21T16:50:10.610Z","level":"warn","message":"[EventBusWebSocketHandler] Invalid event received: *","args":["[EventBusWebSocketHandler] Invalid event received:","*"],"source":"frontend"},{"timestamp":1758473410610,"isoTimestamp":"2025-09-21T16:50:10.610Z","level":"log","message":"[LocalEventBus] Published: {\n  \"type\": \"ERROR\",\n  \"error\": \"Store not found: environmentassociation\",\n  \"timestamp\": 1758473410468\n}","args":["[LocalEventBus] Published:",{"type":"ERROR","error":"Store not found: environmentassociation","timestamp":1758473410468}],"source":"frontend"},{"timestamp":1758473410610,"isoTimestamp":"2025-09-21T16:50:10.610Z","level":"error","message":"[EventBusWebSocketHandler] Query failed: {}","args":["[EventBusWebSocketHandler] Query failed:",{}],"source":"frontend","stackTrace":"Error: Query timeout\n    at http://localhost:3010/static/js/bundle.js:183049:18"},{"timestamp":1758473410610,"isoTimestamp":"2025-09-21T16:50:10.610Z","level":"warn","message":"[EventBusWebSocketHandler] Invalid event received: 812091e3-ec92-40e5-b1ba-5a0fa1a842b5","args":["[EventBusWebSocketHandler] Invalid event received:","812091e3-ec92-40e5-b1ba-5a0fa1a842b5"],"source":"frontend"},{"timestamp":1758473410610,"isoTimestamp":"2025-09-21T16:50:10.610Z","level":"warn","message":"[EventBusWebSocketHandler] Invalid event received: *","args":["[EventBusWebSocketHandler] Invalid event received:","*"],"source":"frontend"},{"timestamp":1758473410610,"isoTimestamp":"2025-09-21T16:50:10.610Z","level":"log","message":"[LocalEventBus] Published: {\n  \"id\": \"812091e3-ec92-40e5-b1ba-5a0fa1a842b5\",\n  \"timestamp\": 1758473410610,\n  \"type\": \"query\",\n  \"operation\": \"RESPONSE\",\n  \"entity\": \"environmentassociation\",\n  \"payload\": null,\n  \"metadata\": {\n    \"duration\": 30141\n  },\n  \"success\": false,\n  \"error\": \"Query timeout\"\n}","args":["[LocalEventBus] Published:",{"id":"812091e3-ec92-40e5-b1ba-5a0fa1a842b5","timestamp":1758473410610,"type":"query","operation":"RESPONSE","entity":"environmentassociation","payload":null,"metadata":{"duration":30141},"success":false,"error":"Query timeout"}],"source":"frontend"},{"timestamp":1758473410610,"isoTimestamp":"2025-09-21T16:50:10.610Z","level":"error","message":"Query execution error: {}","args":["Query execution error:",{}],"source":"frontend","stackTrace":"Error: Query timeout\n    at responseHandler (http://localhost:3010/static/js/bundle.js:183479:20)\n    at http://localhost:3010/static/js/bundle.js:81809:9\n    at Array.map (<anonymous>)\n    at Object.emit (http://localhost:3010/static/js/bundle.js:81808:22)\n    at LocalEventBus.publish (http://localhost:3010/static/js/bundle.js:183313:18)\n    at WebSocketEventBus.publish (http://localhost:3010/static/js/bundle.js:183445:19)\n    at EventBusWebSocketHandler.handleQueryRequest (http://localhost:3010/static/js/bundle.js:183677:21)\n    at async http://localhost:3010/static/js/bundle.js:183639:9"},{"timestamp":1758473410610,"isoTimestamp":"2025-09-21T16:50:10.610Z","level":"warn","message":"[EventBusWebSocketHandler] Invalid event received: 812091e3-ec92-40e5-b1ba-5a0fa1a842b5","args":["[EventBusWebSocketHandler] Invalid event received:","812091e3-ec92-40e5-b1ba-5a0fa1a842b5"],"source":"frontend"},{"timestamp":1758473410611,"isoTimestamp":"2025-09-21T16:50:10.611Z","level":"warn","message":"[EventBusWebSocketHandler] Invalid event received: *","args":["[EventBusWebSocketHandler] Invalid event received:","*"],"source":"frontend"},{"timestamp":1758473410611,"isoTimestamp":"2025-09-21T16:50:10.611Z","level":"log","message":"[LocalEventBus] Published: {\n  \"id\": \"812091e3-ec92-40e5-b1ba-5a0fa1a842b5\",\n  \"timestamp\": 1758473410610,\n  \"type\": \"query\",\n  \"operation\": \"QUERY_ERROR\",\n  \"entity\": \"environmentassociation\",\n  \"payload\": {},\n  \"metadata\": {\n    \"endpoint\": \"/stellar/query\",\n    \"method\": \"POST\",\n    \"duration\": 30141\n  },\n  \"success\": false,\n  \"error\": \"Query timeout\"\n}","args":["[LocalEventBus] Published:",{"id":"812091e3-ec92-40e5-b1ba-5a0fa1a842b5","timestamp":1758473410610,"type":"query","operation":"QUERY_ERROR","entity":"environmentassociation","payload":{},"metadata":{"endpoint":"/stellar/query","method":"POST","duration":30141},"success":false,"error":"Query timeout"}],"source":"frontend"},{"timestamp":1758473410611,"isoTimestamp":"2025-09-21T16:50:10.611Z","level":"log","message":"üîç StellarStore executeQuery response: {\n  \"success\": false,\n  \"error\": \"Query timeout\"\n}","args":["üîç StellarStore executeQuery response:",{"success":false,"error":"Query timeout"}],"source":"frontend"},{"timestamp":1758473410611,"isoTimestamp":"2025-09-21T16:50:10.611Z","level":"log","message":"üìä Unified data: [\n  {\n    \"id\": 1,\n    \"name\": \"amazon\",\n    \"displayName\": \"Amazon Web Services (AWS)\",\n    \"contactEmail\": \"billing@aws.amazon.com\",\n    \"website\": \"https://aws.amazon.com\",\n    \"type\": \"cloud-provider\",\n    \"roles\": [\n      \"cloud-provider\",\n      \"vendor\"\n    ],\n    \"status\": \"ACTIVE\"\n  },\n  {\n    \"id\": 2,\n    \"name\": \"google\",\n    \"displayName\": \"Google Cloud Platform\",\n    \"contactEmail\": \"billing@cloud.google.com\",\n    \"website\": \"https://cloud.google.com\",\n    \"type\": \"cloud-provider\",\n    \"roles\": [\n      \"cloud-provider\",\n      \"vendor\"\n    ],\n    \"status\": \"ACTIVE\"\n  },\n  {\n    \"id\": 3,\n    \"name\": \"microsoft\",\n    \"displayName\": \"Microsoft Azure\",\n    \"contactEmail\": \"billing@azure.microsoft.com\",\n    \"website\": \"https://azure.microsoft.com\",\n    \"type\": \"cloud-provider\",\n    \"roles\": [\n      \"cloud-provider\",\n      \"vendor\"\n    ],\n    \"status\": \"ACTIVE\"\n  },\n  {\n    \"id\": 4,\n    \"name\": \"ibm\",\n    \"displayName\": \"IBM Cloud\",\n    \"contactEmail\": \"billing@ibm.com\",\n    \"website\": \"https://www.ibm.com/cloud\",\n    \"type\": \"cloud-provider\",\n    \"roles\": [\n      \"cloud-provider\",\n      \"vendor\"\n    ],\n    \"status\": \"ACTIVE\"\n  },\n  {\n    \"id\": 5,\n    \"name\": \"oracle\",\n    \"displayName\": \"Oracle Cloud\",\n    \"contactEmail\": \"billing@oracle.com\",\n    \"website\": \"https://www.oracle.com/cloud\",\n    \"type\": \"cloud-provider\",\n    \"roles\": [\n      \"cloud-provider\",\n      \"vendor\"\n    ],\n    \"status\": \"ACTIVE\"\n  },\n  {\n    \"id\": 6,\n    \"name\": \"alibaba\",\n    \"displayName\": \"Alibaba Cloud\",\n    \"contactEmail\": \"billing@alibabacloud.com\",\n    \"website\": \"https://www.alibabacloud.com\",\n    \"type\": \"cloud-provider\",\n    \"roles\": [\n      \"cloud-provider\",\n      \"vendor\"\n    ],\n    \"status\": \"ACTIVE\"\n  },\n  {\n    \"id\": 7,\n    \"name\": \"digitalocean\",\n    \"displayName\": \"DigitalOcean\",\n    \"contactEmail\": \"billing@digitalocean.com\",\n    \"website\": \"https://www.digitalocean.com\",\n    \"type\": \"cloud-provider\",\n    \"roles\": [\n      \"cloud-provider\",\n      \"vendor\"\n    ],\n    \"status\": \"ACTIVE\"\n  },\n  {\n    \"id\": 8,\n    \"name\": \"linode\",\n    \"displayName\": \"Akamai Connected Cloud (Linode)\",\n    \"contactEmail\": \"billing@linode.com\",\n    \"website\": \"https://www.linode.com\",\n    \"type\": \"cloud-provider\",\n    \"roles\": [\n      \"cloud-provider\",\n      \"vendor\"\n    ],\n    \"status\": \"ACTIVE\"\n  },\n  {\n    \"id\": 9,\n    \"name\": \"vultr\",\n    \"displayName\": \"Vultr\",\n    \"contactEmail\": \"billing@vultr.com\",\n    \"website\": \"https://www.vultr.com\",\n    \"type\": \"cloud-provider\",\n    \"roles\": [\n      \"cloud-provider\",\n      \"vendor\"\n    ],\n    \"status\": \"ACTIVE\"\n  },\n  {\n    \"id\": 10,\n    \"name\": \"ovhcloud\",\n    \"displayName\": \"OVHcloud\",\n    \"contactEmail\": \"billing@ovhcloud.com\",\n    \"website\": \"https://www.ovhcloud.com\",\n    \"type\": \"cloud-provider\",\n    \"roles\": [\n      \"cloud-provider\",\n      \"vendor\"\n    ],\n    \"status\": \"ACTIVE\"\n  },\n  {\n    \"id\": 11,\n    \"name\": \"hetzner\",\n    \"displayName\": \"Hetzner\",\n    \"contactEmail\": \"billing@hetzner.com\",\n    \"website\": \"https://www.hetzner.com\",\n    \"type\": \"cloud-provider\",\n    \"roles\": [\n      \"cloud-provider\",\n      \"vendor\"\n    ],\n    \"status\": \"ACTIVE\"\n  },\n  {\n    \"id\": 12,\n    \"name\": \"equinix\",\n    \"displayName\": \"Equinix Metal\",\n    \"contactEmail\": \"billing@equinix.com\",\n    \"website\": \"https://metal.equinix.com\",\n    \"type\": \"cloud-provider\",\n    \"roles\": [\n      \"cloud-provider\",\n      \"vendor\"\n    ],\n    \"status\": \"ACTIVE\"\n  },\n  {\n    \"id\": 13,\n    \"name\": \"cloudflare\",\n    \"displayName\": \"Cloudflare\",\n    \"contactEmail\": \"billing@cloudflare.com\",\n    \"website\": \"https://www.cloudflare.com\",\n    \"type\": \"cloud-provider\",\n    \"roles\": [\n      \"cloud-provider\",\n      \"vendor\"\n    ],\n    \"status\": \"ACTIVE\"\n  },\n  {\n    \"id\": 14,\n    \"name\": \"contabo\",\n    \"displayName\": \"Contabo\",\n    \"contactEmail\": \"billing@contabo.com\",\n    \"website\": \"https://contabo.com\",\n    \"type\": \"cloud-provider\",\n    \"roles\": [\n      \"cloud-provider\",\n      \"vendor\"\n    ],\n    \"status\": \"ACTIVE\"\n  },\n  {\n    \"id\": 15,\n    \"name\": \"scaleway\",\n    \"displayName\": \"Scaleway\",\n    \"contactEmail\": \"billing@scaleway.com\",\n    \"website\": \"https://www.scaleway.com\",\n    \"type\": \"cloud-provider\",\n    \"roles\": [\n      \"cloud-provider\",\n      \"vendor\"\n    ],\n    \"status\": \"ACTIVE\"\n  },\n  {\n    \"id\": 16,\n    \"name\": \"dell\",\n    \"displayName\": \"Dell Technologies\",\n    \"contactEmail\": \"sales@dell.com\",\n    \"website\": \"https://www.dell.com\",\n    \"type\": \"vendor\",\n    \"roles\": [\n      \"hardware-vendor\",\n      \"vendor\"\n    ],\n    \"status\": \"ACTIVE\"\n  },\n  {\n    \"id\": 17,\n    \"name\": \"hp\",\n    \"displayName\": \"Hewlett Packard Enterprise\",\n    \"contactEmail\": \"sales@hpe.com\",\n    \"website\": \"https://www.hpe.com\",\n    \"type\": \"vendor\",\n    \"roles\": [\n      \"hardware-vendor\",\n      \"vendor\"\n    ],\n    \"status\": \"ACTIVE\"\n  },\n  {\n    \"id\": 18,\n    \"name\": \"cisco\",\n    \"displayName\": \"Cisco Systems\",\n    \"contactEmail\": \"sales@cisco.com\",\n    \"website\": \"https://www.cisco.com\",\n    \"type\": \"vendor\",\n    \"roles\": [\n      \"network-vendor\",\n      \"vendor\"\n    ],\n    \"status\": \"ACTIVE\"\n  },\n  {\n    \"id\": 19,\n    \"name\": \"juniper\",\n    \"displayName\": \"Juniper Networks\",\n    \"contactEmail\": \"sales@juniper.net\",\n    \"website\": \"https://www.juniper.net\",\n    \"type\": \"vendor\",\n    \"roles\": [\n      \"network-vendor\",\n      \"vendor\"\n    ],\n    \"status\": \"ACTIVE\"\n  },\n  {\n    \"id\": 20,\n    \"name\": \"vmware\",\n    \"displayName\": \"VMware\",\n    \"contactEmail\": \"sales@vmware.com\",\n    \"website\": \"https://www.vmware.com\",\n    \"type\": \"vendor\",\n    \"roles\": [\n      \"software-vendor\",\n      \"vendor\"\n    ],\n    \"status\": \"ACTIVE\"\n  },\n  {\n    \"id\": 21,\n    \"name\": \"redhat\",\n    \"displayName\": \"Red Hat\",\n    \"contactEmail\": \"sales@redhat.com\",\n    \"website\": \"https://www.redhat.com\",\n    \"type\": \"vendor\",\n    \"roles\": [\n      \"software-vendor\",\n      \"vendor\"\n    ],\n    \"status\": \"ACTIVE\"\n  },\n  {\n    \"id\": 22,\n    \"name\": \"canonical\",\n    \"displayName\": \"Canonical (Ubuntu)\",\n    \"contactEmail\": \"sales@canonical.com\",\n    \"website\": \"https://canonical.com\",\n    \"type\": \"vendor\",\n    \"roles\": [\n      \"software-vendor\",\n      \"vendor\"\n    ],\n    \"status\": \"ACTIVE\"\n  },\n  {\n    \"id\": 23,\n    \"name\": \"acme-corp\",\n    \"displayName\": \"ACME Corporation\",\n    \"contactEmail\": \"contact@acme.com\",\n    \"website\": \"https://acme.com\",\n    \"type\": \"customer\",\n    \"roles\": [\n      \"customer\"\n    ],\n    \"status\": \"ACTIVE\",\n    \"updatedAt\": \"2025-09-18T19:10:33\"\n  },\n  {\n    \"id\": 24,\n    \"name\": \"telcobright\",\n    \"displayName\": \"Telcobright\",\n    \"contactEmail\": \"admin@telcobright.com\",\n    \"website\": \"https://telcobright.com\",\n    \"type\": \"service-provider\",\n    \"roles\": [\n      \"self\"\n    ],\n    \"status\": \"ACTIVE\"\n  },\n  {\n    \"id\": 25,\n    \"name\": \"tech-solutions\",\n    \"displayName\": \"Tech Solutions Inc\",\n    \"contactEmail\": \"info@techsolutions.com\",\n    \"website\": \"https://www.techsolutions.com\",\n    \"type\": \"VENDOR\",\n    \"roles\": [\n      \"vendor\"\n    ],\n    \"status\": \"ACTIVE\",\n    \"createdAt\": \"2025-09-18T19:09:57\",\n    \"updatedAt\": \"2025-09-18T19:10:33\"\n  },\n  {\n    \"id\": 26,\n    \"name\": \"global-systems\",\n    \"displayName\": \"Global Systems Ltd\",\n    \"contactEmail\": \"support@globalsystems.com\",\n    \"website\": \"https://www.globalsystems.com\",\n    \"type\": \"CUSTOMER\",\n    \"roles\": [\n      \"customer\"\n    ],\n    \"status\": \"ACTIVE\",\n    \"createdAt\": \"2025-09-18T19:09:57\",\n    \"updatedAt\": \"2025-09-18T19:10:33\"\n  },\n  {\n    \"id\": 27,\n    \"name\": \"cloud-dynamics\",\n    \"displayName\": \"Cloud Dynamics\",\n    \"contactEmail\": \"hello@clouddynamics.io\",\n    \"website\": \"https://www.clouddynamics.io\",\n    \"type\": \"VENDOR\",\n    \"roles\": [\n      \"vendor\"\n    ],\n    \"status\": \"ACTIVE\",\n    \"createdAt\": \"2025-09-18T19:09:57\",\n    \"updatedAt\": \"2025-09-18T19:10:33\"\n  }\n]","args":["üìä Unified data:","[\n  {\n    \"id\": 1,\n    \"name\": \"amazon\",\n    \"displayName\": \"Amazon Web Services (AWS)\",\n    \"contactEmail\": \"billing@aws.amazon.com\",\n    \"website\": \"https://aws.amazon.com\",\n    \"type\": \"cloud-provider\",\n    \"roles\": [\n      \"cloud-provider\",\n      \"vendor\"\n    ],\n    \"status\": \"ACTIVE\"\n  },\n  {\n    \"id\": 2,\n    \"name\": \"google\",\n    \"displayName\": \"Google Cloud Platform\",\n    \"contactEmail\": \"billing@cloud.google.com\",\n    \"website\": \"https://cloud.google.com\",\n    \"type\": \"cloud-provider\",\n    \"roles\": [\n      \"cloud-provider\",\n      \"vendor\"\n    ],\n    \"status\": \"ACTIVE\"\n  },\n  {\n    \"id\": 3,\n    \"name\": \"microsoft\",\n    \"displayName\": \"Microsoft Azure\",\n    \"contactEmail\": \"billing@azure.microsoft.com\",\n    \"website\": \"https://azure.microsoft.com\",\n    \"type\": \"cloud-provider\",\n    \"roles\": [\n      \"cloud-provider\",\n      \"vendor\"\n    ],\n    \"status\": \"ACTIVE\"\n  },\n  {\n    \"id\": 4,\n    \"name\": \"ibm\",\n    \"displayName\": \"IBM Cloud\",\n    \"contactEmail\": \"billing@ibm.com\",\n    \"website\": \"https://www.ibm.com/cloud\",\n    \"type\": \"cloud-provider\",\n    \"roles\": [\n      \"cloud-provider\",\n      \"vendor\"\n    ],\n    \"status\": \"ACTIVE\"\n  },\n  {\n    \"id\": 5,\n    \"name\": \"oracle\",\n    \"displayName\": \"Oracle Cloud\",\n    \"contactEmail\": \"billing@oracle.com\",\n    \"website\": \"https://www.oracle.com/cloud\",\n    \"type\": \"cloud-provider\",\n    \"roles\": [\n      \"cloud-provider\",\n      \"vendor\"\n    ],\n    \"status\": \"ACTIVE\"\n  },\n  {\n    \"id\": 6,\n    \"name\": \"alibaba\",\n    \"displayName\": \"Alibaba Cloud\",\n    \"contactEmail\": \"billing@alibabacloud.com\",\n    \"website\": \"https://www.alibabacloud.com\",\n    \"type\": \"cloud-provider\",\n    \"roles\": [\n      \"cloud-provider\",\n      \"vendor\"\n    ],\n    \"status\": \"ACTIVE\"\n  },\n  {\n    \"id\": 7,\n    \"name\": \"digitalocean\",\n    \"displayName\": \"DigitalOcean\",\n    \"contactEmail\": \"billing@digitalocean.com\",\n    \"website\": \"https://www.digitalocean.com\",\n    \"type\": \"cloud-provider\",\n    \"roles\": [\n      \"cloud-provider\",\n      \"vendor\"\n    ],\n    \"status\": \"ACTIVE\"\n  },\n  {\n    \"id\": 8,\n    \"name\": \"linode\",\n    \"displayName\": \"Akamai Connected Cloud (Linode)\",\n    \"contactEmail\": \"billing@linode.com\",\n    \"website\": \"https://www.linode.com\",\n    \"type\": \"cloud-provider\",\n    \"roles\": [\n      \"cloud-provider\",\n      \"vendor\"\n    ],\n    \"status\": \"ACTIVE\"\n  },\n  {\n    \"id\": 9,\n    \"name\": \"vultr\",\n    \"displayName\": \"Vultr\",\n    \"contactEmail\": \"billing@vultr.com\",\n    \"website\": \"https://www.vultr.com\",\n    \"type\": \"cloud-provider\",\n    \"roles\": [\n      \"cloud-provider\",\n      \"vendor\"\n    ],\n    \"status\": \"ACTIVE\"\n  },\n  {\n    \"id\": 10,\n    \"name\": \"ovhcloud\",\n    \"displayName\": \"OVHcloud\",\n    \"contactEmail\": \"billing@ovhcloud.com\",\n    \"website\": \"https://www.ovhcloud.com\",\n    \"type\": \"cloud-provider\",\n    \"roles\": [\n      \"cloud-provider\",\n      \"vendor\"\n    ],\n    \"status\": \"ACTIVE\"\n  },\n  {\n    \"id\": 11,\n    \"name\": \"hetzner\",\n    \"displayName\": \"Hetzner\",\n    \"contactEmail\": \"billing@hetzner.com\",\n    \"website\": \"https://www.hetzner.com\",\n    \"type\": \"cloud-provider\",\n    \"roles\": [\n      \"cloud-provider\",\n      \"vendor\"\n    ],\n    \"status\": \"ACTIVE\"\n  },\n  {\n    \"id\": 12,\n    \"name\": \"equinix\",\n    \"displayName\": \"Equinix Metal\",\n    \"contactEmail\": \"billing@equinix.com\",\n    \"website\": \"https://metal.equinix.com\",\n    \"type\": \"cloud-provider\",\n    \"roles\": [\n      \"cloud-provider\",\n      \"vendor\"\n    ],\n    \"status\": \"ACTIVE\"\n  },\n  {\n    \"id\": 13,\n    \"name\": \"cloudflare\",\n    \"displayName\": \"Cloudflare\",\n    \"contactEmail\": \"billing@cloudflare.com\",\n    \"website\": \"https://www.cloudflare.com\",\n    \"type\": \"cloud-provider\",\n    \"roles\": [\n      \"cloud-provider\",\n      \"vendor\"\n    ],\n    \"status\": \"ACTIVE\"\n  },\n  {\n    \"id\": 14,\n    \"name\": \"contabo\",\n    \"displayName\": \"Contabo\",\n    \"contactEmail\": \"billing@contabo.com\",\n    \"website\": \"https://contabo.com\",\n    \"type\": \"cloud-provider\",\n    \"roles\": [\n      \"cloud-provider\",\n      \"vendor\"\n    ],\n    \"status\": \"ACTIVE\"\n  },\n  {\n    \"id\": 15,\n    \"name\": \"scaleway\",\n    \"displayName\": \"Scaleway\",\n    \"contactEmail\": \"billing@scaleway.com\",\n    \"website\": \"https://www.scaleway.com\",\n    \"type\": \"cloud-provider\",\n    \"roles\": [\n      \"cloud-provider\",\n      \"vendor\"\n    ],\n    \"status\": \"ACTIVE\"\n  },\n  {\n    \"id\": 16,\n    \"name\": \"dell\",\n    \"displayName\": \"Dell Technologies\",\n    \"contactEmail\": \"sales@dell.com\",\n    \"website\": \"https://www.dell.com\",\n    \"type\": \"vendor\",\n    \"roles\": [\n      \"hardware-vendor\",\n      \"vendor\"\n    ],\n    \"status\": \"ACTIVE\"\n  },\n  {\n    \"id\": 17,\n    \"name\": \"hp\",\n    \"displayName\": \"Hewlett Packard Enterprise\",\n    \"contactEmail\": \"sales@hpe.com\",\n    \"website\": \"https://www.hpe.com\",\n    \"type\": \"vendor\",\n    \"roles\": [\n      \"hardware-vendor\",\n      \"vendor\"\n    ],\n    \"status\": \"ACTIVE\"\n  },\n  {\n    \"id\": 18,\n    \"name\": \"cisco\",\n    \"displayName\": \"Cisco Systems\",\n    \"contactEmail\": \"sales@cisco.com\",\n    \"website\": \"https://www.cisco.com\",\n    \"type\": \"vendor\",\n    \"roles\": [\n      \"network-vendor\",\n      \"vendor\"\n    ],\n    \"status\": \"ACTIVE\"\n  },\n  {\n    \"id\": 19,\n    \"name\": \"juniper\",\n    \"displayName\": \"Juniper Networks\",\n    \"contactEmail\": \"sales@juniper.net\",\n    \"website\": \"https://www.juniper.net\",\n    \"type\": \"vendor\",\n    \"roles\": [\n      \"network-vendor\",\n      \"vendor\"\n    ],\n    \"status\": \"ACTIVE\"\n  },\n  {\n    \"id\": 20,\n    \"name\": \"vmware\",\n    \"displayName\": \"VMware\",\n    \"contactEmail\": \"sales@vmware.com\",\n    \"website\": \"https://www.vmware.com\",\n    \"type\": \"vendor\",\n    \"roles\": [\n      \"software-vendor\",\n      \"vendor\"\n    ],\n    \"status\": \"ACTIVE\"\n  },\n  {\n    \"id\": 21,\n    \"name\": \"redhat\",\n    \"displayName\": \"Red Hat\",\n    \"contactEmail\": \"sales@redhat.com\",\n    \"website\": \"https://www.redhat.com\",\n    \"type\": \"vendor\",\n    \"roles\": [\n      \"software-vendor\",\n      \"vendor\"\n    ],\n    \"status\": \"ACTIVE\"\n  },\n  {\n    \"id\": 22,\n    \"name\": \"canonical\",\n    \"displayName\": \"Canonical (Ubuntu)\",\n    \"contactEmail\": \"sales@canonical.com\",\n    \"website\": \"https://canonical.com\",\n    \"type\": \"vendor\",\n    \"roles\": [\n      \"software-vendor\",\n      \"vendor\"\n    ],\n    \"status\": \"ACTIVE\"\n  },\n  {\n    \"id\": 23,\n    \"name\": \"acme-corp\",\n    \"displayName\": \"ACME Corporation\",\n    \"contactEmail\": \"contact@acme.com\",\n    \"website\": \"https://acme.com\",\n    \"type\": \"customer\",\n    \"roles\": [\n      \"customer\"\n    ],\n    \"status\": \"ACTIVE\",\n    \"updatedAt\": \"2025-09-18T19:10:33\"\n  },\n  {\n    \"id\": 24,\n    \"name\": \"telcobright\",\n    \"displayName\": \"Telcobright\",\n    \"contactEmail\": \"admin@telcobright.com\",\n    \"website\": \"https://telcobright.com\",\n    \"type\": \"service-provider\",\n    \"roles\": [\n      \"self\"\n    ],\n    \"status\": \"ACTIVE\"\n  },\n  {\n    \"id\": 25,\n    \"name\": \"tech-solutions\",\n    \"displayName\": \"Tech Solutions Inc\",\n    \"contactEmail\": \"info@techsolutions.com\",\n    \"website\": \"https://www.techsolutions.com\",\n    \"type\": \"VENDOR\",\n    \"roles\": [\n      \"vendor\"\n    ],\n    \"status\": \"ACTIVE\",\n    \"createdAt\": \"2025-09-18T19:09:57\",\n    \"updatedAt\": \"2025-09-18T19:10:33\"\n  },\n  {\n    \"id\": 26,\n    \"name\": \"global-systems\",\n    \"displayName\": \"Global Systems Ltd\",\n    \"contactEmail\": \"support@globalsystems.com\",\n    \"website\": \"https://www.globalsystems.com\",\n    \"type\": \"CUSTOMER\",\n    \"roles\": [\n      \"customer\"\n    ],\n    \"status\": \"ACTIVE\",\n    \"createdAt\": \"2025-09-18T19:09:57\",\n    \"updatedAt\": \"2025-09-18T19:10:33\"\n  },\n  {\n    \"id\": 27,\n    \"name\": \"cloud-dynamics\",\n    \"displayName\": \"Cloud Dynamics\",\n    \"contactEmail\": \"hello@clouddynamics.io\",\n    \"website\": \"https://www.clouddynamics.io\",\n    \"type\": \"VENDOR\",\n    \"roles\": [\n      \"vendor\"\n    ],\n    \"status\": \"ACTIVE\",\n    \"createdAt\": \"2025-09-18T19:09:57\",\n    \"updatedAt\": \"2025-09-18T19:10:33\"\n  }\n]"],"source":"frontend"},{"timestamp":1758473410611,"isoTimestamp":"2025-09-21T16:50:10.611Z","level":"log","message":"üìä Compute associations: []","args":["üìä Compute associations:",[]],"source":"frontend"},{"timestamp":1758473410611,"isoTimestamp":"2025-09-21T16:50:10.611Z","level":"log","message":"üéØ transformStellarToTree called with: [\n  {\n    \"id\": 1,\n    \"name\": \"amazon\",\n    \"displayName\": \"Amazon Web Services (AWS)\",\n    \"contactEmail\": \"billing@aws.amazon.com\",\n    \"website\": \"https://aws.amazon.com\",\n    \"type\": \"cloud-provider\",\n    \"roles\": [\n      \"cloud-provider\",\n      \"vendor\"\n    ],\n    \"status\": \"ACTIVE\"\n  },\n  {\n    \"id\": 2,\n    \"name\": \"google\",\n    \"displayName\": \"Google Cloud Platform\",\n    \"contactEmail\": \"billing@cloud.google.com\",\n    \"website\": \"https://cloud.google.com\",\n    \"type\": \"cloud-provider\",\n    \"roles\": [\n      \"cloud-provider\",\n      \"vendor\"\n    ],\n    \"status\": \"ACTIVE\"\n  },\n  {\n    \"id\": 3,\n    \"name\": \"microsoft\",\n    \"displayName\": \"Microsoft Azure\",\n    \"contactEmail\": \"billing@azure.microsoft.com\",\n    \"website\": \"https://azure.microsoft.com\",\n    \"type\": \"cloud-provider\",\n    \"roles\": [\n      \"cloud-provider\",\n      \"vendor\"\n    ],\n    \"status\": \"ACTIVE\"\n  },\n  {\n    \"id\": 4,\n    \"name\": \"ibm\",\n    \"displayName\": \"IBM Cloud\",\n    \"contactEmail\": \"billing@ibm.com\",\n    \"website\": \"https://www.ibm.com/cloud\",\n    \"type\": \"cloud-provider\",\n    \"roles\": [\n      \"cloud-provider\",\n      \"vendor\"\n    ],\n    \"status\": \"ACTIVE\"\n  },\n  {\n    \"id\": 5,\n    \"name\": \"oracle\",\n    \"displayName\": \"Oracle Cloud\",\n    \"contactEmail\": \"billing@oracle.com\",\n    \"website\": \"https://www.oracle.com/cloud\",\n    \"type\": \"cloud-provider\",\n    \"roles\": [\n      \"cloud-provider\",\n      \"vendor\"\n    ],\n    \"status\": \"ACTIVE\"\n  },\n  {\n    \"id\": 6,\n    \"name\": \"alibaba\",\n    \"displayName\": \"Alibaba Cloud\",\n    \"contactEmail\": \"billing@alibabacloud.com\",\n    \"website\": \"https://www.alibabacloud.com\",\n    \"type\": \"cloud-provider\",\n    \"roles\": [\n      \"cloud-provider\",\n      \"vendor\"\n    ],\n    \"status\": \"ACTIVE\"\n  },\n  {\n    \"id\": 7,\n    \"name\": \"digitalocean\",\n    \"displayName\": \"DigitalOcean\",\n    \"contactEmail\": \"billing@digitalocean.com\",\n    \"website\": \"https://www.digitalocean.com\",\n    \"type\": \"cloud-provider\",\n    \"roles\": [\n      \"cloud-provider\",\n      \"vendor\"\n    ],\n    \"status\": \"ACTIVE\"\n  },\n  {\n    \"id\": 8,\n    \"name\": \"linode\",\n    \"displayName\": \"Akamai Connected Cloud (Linode)\",\n    \"contactEmail\": \"billing@linode.com\",\n    \"website\": \"https://www.linode.com\",\n    \"type\": \"cloud-provider\",\n    \"roles\": [\n      \"cloud-provider\",\n      \"vendor\"\n    ],\n    \"status\": \"ACTIVE\"\n  },\n  {\n    \"id\": 9,\n    \"name\": \"vultr\",\n    \"displayName\": \"Vultr\",\n    \"contactEmail\": \"billing@vultr.com\",\n    \"website\": \"https://www.vultr.com\",\n    \"type\": \"cloud-provider\",\n    \"roles\": [\n      \"cloud-provider\",\n      \"vendor\"\n    ],\n    \"status\": \"ACTIVE\"\n  },\n  {\n    \"id\": 10,\n    \"name\": \"ovhcloud\",\n    \"displayName\": \"OVHcloud\",\n    \"contactEmail\": \"billing@ovhcloud.com\",\n    \"website\": \"https://www.ovhcloud.com\",\n    \"type\": \"cloud-provider\",\n    \"roles\": [\n      \"cloud-provider\",\n      \"vendor\"\n    ],\n    \"status\": \"ACTIVE\"\n  },\n  {\n    \"id\": 11,\n    \"name\": \"hetzner\",\n    \"displayName\": \"Hetzner\",\n    \"contactEmail\": \"billing@hetzner.com\",\n    \"website\": \"https://www.hetzner.com\",\n    \"type\": \"cloud-provider\",\n    \"roles\": [\n      \"cloud-provider\",\n      \"vendor\"\n    ],\n    \"status\": \"ACTIVE\"\n  },\n  {\n    \"id\": 12,\n    \"name\": \"equinix\",\n    \"displayName\": \"Equinix Metal\",\n    \"contactEmail\": \"billing@equinix.com\",\n    \"website\": \"https://metal.equinix.com\",\n    \"type\": \"cloud-provider\",\n    \"roles\": [\n      \"cloud-provider\",\n      \"vendor\"\n    ],\n    \"status\": \"ACTIVE\"\n  },\n  {\n    \"id\": 13,\n    \"name\": \"cloudflare\",\n    \"displayName\": \"Cloudflare\",\n    \"contactEmail\": \"billing@cloudflare.com\",\n    \"website\": \"https://www.cloudflare.com\",\n    \"type\": \"cloud-provider\",\n    \"roles\": [\n      \"cloud-provider\",\n      \"vendor\"\n    ],\n    \"status\": \"ACTIVE\"\n  },\n  {\n    \"id\": 14,\n    \"name\": \"contabo\",\n    \"displayName\": \"Contabo\",\n    \"contactEmail\": \"billing@contabo.com\",\n    \"website\": \"https://contabo.com\",\n    \"type\": \"cloud-provider\",\n    \"roles\": [\n      \"cloud-provider\",\n      \"vendor\"\n    ],\n    \"status\": \"ACTIVE\"\n  },\n  {\n    \"id\": 15,\n    \"name\": \"scaleway\",\n    \"displayName\": \"Scaleway\",\n    \"contactEmail\": \"billing@scaleway.com\",\n    \"website\": \"https://www.scaleway.com\",\n    \"type\": \"cloud-provider\",\n    \"roles\": [\n      \"cloud-provider\",\n      \"vendor\"\n    ],\n    \"status\": \"ACTIVE\"\n  },\n  {\n    \"id\": 16,\n    \"name\": \"dell\",\n    \"displayName\": \"Dell Technologies\",\n    \"contactEmail\": \"sales@dell.com\",\n    \"website\": \"https://www.dell.com\",\n    \"type\": \"vendor\",\n    \"roles\": [\n      \"hardware-vendor\",\n      \"vendor\"\n    ],\n    \"status\": \"ACTIVE\"\n  },\n  {\n    \"id\": 17,\n    \"name\": \"hp\",\n    \"displayName\": \"Hewlett Packard Enterprise\",\n    \"contactEmail\": \"sales@hpe.com\",\n    \"website\": \"https://www.hpe.com\",\n    \"type\": \"vendor\",\n    \"roles\": [\n      \"hardware-vendor\",\n      \"vendor\"\n    ],\n    \"status\": \"ACTIVE\"\n  },\n  {\n    \"id\": 18,\n    \"name\": \"cisco\",\n    \"displayName\": \"Cisco Systems\",\n    \"contactEmail\": \"sales@cisco.com\",\n    \"website\": \"https://www.cisco.com\",\n    \"type\": \"vendor\",\n    \"roles\": [\n      \"network-vendor\",\n      \"vendor\"\n    ],\n    \"status\": \"ACTIVE\"\n  },\n  {\n    \"id\": 19,\n    \"name\": \"juniper\",\n    \"displayName\": \"Juniper Networks\",\n    \"contactEmail\": \"sales@juniper.net\",\n    \"website\": \"https://www.juniper.net\",\n    \"type\": \"vendor\",\n    \"roles\": [\n      \"network-vendor\",\n      \"vendor\"\n    ],\n    \"status\": \"ACTIVE\"\n  },\n  {\n    \"id\": 20,\n    \"name\": \"vmware\",\n    \"displayName\": \"VMware\",\n    \"contactEmail\": \"sales@vmware.com\",\n    \"website\": \"https://www.vmware.com\",\n    \"type\": \"vendor\",\n    \"roles\": [\n      \"software-vendor\",\n      \"vendor\"\n    ],\n    \"status\": \"ACTIVE\"\n  },\n  {\n    \"id\": 21,\n    \"name\": \"redhat\",\n    \"displayName\": \"Red Hat\",\n    \"contactEmail\": \"sales@redhat.com\",\n    \"website\": \"https://www.redhat.com\",\n    \"type\": \"vendor\",\n    \"roles\": [\n      \"software-vendor\",\n      \"vendor\"\n    ],\n    \"status\": \"ACTIVE\"\n  },\n  {\n    \"id\": 22,\n    \"name\": \"canonical\",\n    \"displayName\": \"Canonical (Ubuntu)\",\n    \"contactEmail\": \"sales@canonical.com\",\n    \"website\": \"https://canonical.com\",\n    \"type\": \"vendor\",\n    \"roles\": [\n      \"software-vendor\",\n      \"vendor\"\n    ],\n    \"status\": \"ACTIVE\"\n  },\n  {\n    \"id\": 23,\n    \"name\": \"acme-corp\",\n    \"displayName\": \"ACME Corporation\",\n    \"contactEmail\": \"contact@acme.com\",\n    \"website\": \"https://acme.com\",\n    \"type\": \"customer\",\n    \"roles\": [\n      \"customer\"\n    ],\n    \"status\": \"ACTIVE\",\n    \"updatedAt\": \"2025-09-18T19:10:33\"\n  },\n  {\n    \"id\": 24,\n    \"name\": \"telcobright\",\n    \"displayName\": \"Telcobright\",\n    \"contactEmail\": \"admin@telcobright.com\",\n    \"website\": \"https://telcobright.com\",\n    \"type\": \"service-provider\",\n    \"roles\": [\n      \"self\"\n    ],\n    \"status\": \"ACTIVE\"\n  },\n  {\n    \"id\": 25,\n    \"name\": \"tech-solutions\",\n    \"displayName\": \"Tech Solutions Inc\",\n    \"contactEmail\": \"info@techsolutions.com\",\n    \"website\": \"https://www.techsolutions.com\",\n    \"type\": \"VENDOR\",\n    \"roles\": [\n      \"vendor\"\n    ],\n    \"status\": \"ACTIVE\",\n    \"createdAt\": \"2025-09-18T19:09:57\",\n    \"updatedAt\": \"2025-09-18T19:10:33\"\n  },\n  {\n    \"id\": 26,\n    \"name\": \"global-systems\",\n    \"displayName\": \"Global Systems Ltd\",\n    \"contactEmail\": \"support@globalsystems.com\",\n    \"website\": \"https://www.globalsystems.com\",\n    \"type\": \"CUSTOMER\",\n    \"roles\": [\n      \"customer\"\n    ],\n    \"status\": \"ACTIVE\",\n    \"createdAt\": \"2025-09-18T19:09:57\",\n    \"updatedAt\": \"2025-09-18T19:10:33\"\n  },\n  {\n    \"id\": 27,\n    \"name\": \"cloud-dynamics\",\n    \"displayName\": \"Cloud Dynamics\",\n    \"contactEmail\": \"hello@clouddynamics.io\",\n    \"website\": \"https://www.clouddynamics.io\",\n    \"type\": \"VENDOR\",\n    \"roles\": [\n      \"vendor\"\n    ],\n    \"status\": \"ACTIVE\",\n    \"createdAt\": \"2025-09-18T19:09:57\",\n    \"updatedAt\": \"2025-09-18T19:10:33\"\n  }\n] environments: []","args":["üéØ transformStellarToTree called with:",[{"id":1,"name":"amazon","displayName":"Amazon Web Services (AWS)","contactEmail":"billing@aws.amazon.com","website":"https://aws.amazon.com","type":"cloud-provider","roles":["cloud-provider","vendor"],"status":"ACTIVE"},{"id":2,"name":"google","displayName":"Google Cloud Platform","contactEmail":"billing@cloud.google.com","website":"https://cloud.google.com","type":"cloud-provider","roles":["cloud-provider","vendor"],"status":"ACTIVE"},{"id":3,"name":"microsoft","displayName":"Microsoft Azure","contactEmail":"billing@azure.microsoft.com","website":"https://azure.microsoft.com","type":"cloud-provider","roles":["cloud-provider","vendor"],"status":"ACTIVE"},{"id":4,"name":"ibm","displayName":"IBM Cloud","contactEmail":"billing@ibm.com","website":"https://www.ibm.com/cloud","type":"cloud-provider","roles":["cloud-provider","vendor"],"status":"ACTIVE"},{"id":5,"name":"oracle","displayName":"Oracle Cloud","contactEmail":"billing@oracle.com","website":"https://www.oracle.com/cloud","type":"cloud-provider","roles":["cloud-provider","vendor"],"status":"ACTIVE"},{"id":6,"name":"alibaba","displayName":"Alibaba Cloud","contactEmail":"billing@alibabacloud.com","website":"https://www.alibabacloud.com","type":"cloud-provider","roles":["cloud-provider","vendor"],"status":"ACTIVE"},{"id":7,"name":"digitalocean","displayName":"DigitalOcean","contactEmail":"billing@digitalocean.com","website":"https://www.digitalocean.com","type":"cloud-provider","roles":["cloud-provider","vendor"],"status":"ACTIVE"},{"id":8,"name":"linode","displayName":"Akamai Connected Cloud (Linode)","contactEmail":"billing@linode.com","website":"https://www.linode.com","type":"cloud-provider","roles":["cloud-provider","vendor"],"status":"ACTIVE"},{"id":9,"name":"vultr","displayName":"Vultr","contactEmail":"billing@vultr.com","website":"https://www.vultr.com","type":"cloud-provider","roles":["cloud-provider","vendor"],"status":"ACTIVE"},{"id":10,"name":"ovhcloud","displayName":"OVHcloud","contactEmail":"billing@ovhcloud.com","website":"https://www.ovhcloud.com","type":"cloud-provider","roles":["cloud-provider","vendor"],"status":"ACTIVE"},{"id":11,"name":"hetzner","displayName":"Hetzner","contactEmail":"billing@hetzner.com","website":"https://www.hetzner.com","type":"cloud-provider","roles":["cloud-provider","vendor"],"status":"ACTIVE"},{"id":12,"name":"equinix","displayName":"Equinix Metal","contactEmail":"billing@equinix.com","website":"https://metal.equinix.com","type":"cloud-provider","roles":["cloud-provider","vendor"],"status":"ACTIVE"},{"id":13,"name":"cloudflare","displayName":"Cloudflare","contactEmail":"billing@cloudflare.com","website":"https://www.cloudflare.com","type":"cloud-provider","roles":["cloud-provider","vendor"],"status":"ACTIVE"},{"id":14,"name":"contabo","displayName":"Contabo","contactEmail":"billing@contabo.com","website":"https://contabo.com","type":"cloud-provider","roles":["cloud-provider","vendor"],"status":"ACTIVE"},{"id":15,"name":"scaleway","displayName":"Scaleway","contactEmail":"billing@scaleway.com","website":"https://www.scaleway.com","type":"cloud-provider","roles":["cloud-provider","vendor"],"status":"ACTIVE"},{"id":16,"name":"dell","displayName":"Dell Technologies","contactEmail":"sales@dell.com","website":"https://www.dell.com","type":"vendor","roles":["hardware-vendor","vendor"],"status":"ACTIVE"},{"id":17,"name":"hp","displayName":"Hewlett Packard Enterprise","contactEmail":"sales@hpe.com","website":"https://www.hpe.com","type":"vendor","roles":["hardware-vendor","vendor"],"status":"ACTIVE"},{"id":18,"name":"cisco","displayName":"Cisco Systems","contactEmail":"sales@cisco.com","website":"https://www.cisco.com","type":"vendor","roles":["network-vendor","vendor"],"status":"ACTIVE"},{"id":19,"name":"juniper","displayName":"Juniper Networks","contactEmail":"sales@juniper.net","website":"https://www.juniper.net","type":"vendor","roles":["network-vendor","vendor"],"status":"ACTIVE"},{"id":20,"name":"vmware","displayName":"VMware","contactEmail":"sales@vmware.com","website":"https://www.vmware.com","type":"vendor","roles":["software-vendor","vendor"],"status":"ACTIVE"},{"id":21,"name":"redhat","displayName":"Red Hat","contactEmail":"sales@redhat.com","website":"https://www.redhat.com","type":"vendor","roles":["software-vendor","vendor"],"status":"ACTIVE"},{"id":22,"name":"canonical","displayName":"Canonical (Ubuntu)","contactEmail":"sales@canonical.com","website":"https://canonical.com","type":"vendor","roles":["software-vendor","vendor"],"status":"ACTIVE"},{"id":23,"name":"acme-corp","displayName":"ACME Corporation","contactEmail":"contact@acme.com","website":"https://acme.com","type":"customer","roles":["customer"],"status":"ACTIVE","updatedAt":"2025-09-18T19:10:33"},{"id":24,"name":"telcobright","displayName":"Telcobright","contactEmail":"admin@telcobright.com","website":"https://telcobright.com","type":"service-provider","roles":["self"],"status":"ACTIVE"},{"id":25,"name":"tech-solutions","displayName":"Tech Solutions Inc","contactEmail":"info@techsolutions.com","website":"https://www.techsolutions.com","type":"VENDOR","roles":["vendor"],"status":"ACTIVE","createdAt":"2025-09-18T19:09:57","updatedAt":"2025-09-18T19:10:33"},{"id":26,"name":"global-systems","displayName":"Global Systems Ltd","contactEmail":"support@globalsystems.com","website":"https://www.globalsystems.com","type":"CUSTOMER","roles":["customer"],"status":"ACTIVE","createdAt":"2025-09-18T19:09:57","updatedAt":"2025-09-18T19:10:33"},{"id":27,"name":"cloud-dynamics","displayName":"Cloud Dynamics","contactEmail":"hello@clouddynamics.io","website":"https://www.clouddynamics.io","type":"VENDOR","roles":["vendor"],"status":"ACTIVE","createdAt":"2025-09-18T19:09:57","updatedAt":"2025-09-18T19:10:33"}],"environments:",[]],"source":"frontend"}],"metadata":{"source":"frontend","sessionId":"unknown"}}
{"timestamp":1758473410614,"isoTimestamp":"2025-09-21T16:50:10.614Z","type":"console","operation":"CONSOLE_LOGS","entity":"frontend","count":20,"messages":[{"timestamp":1758473410612,"isoTimestamp":"2025-09-21T16:50:10.612Z","level":"log","message":"üìä transformStellarToTree: Processing 27 partners","args":["üìä transformStellarToTree: Processing 27 partners"],"source":"frontend"},{"timestamp":1758473410612,"isoTimestamp":"2025-09-21T16:50:10.612Z","level":"log","message":"  üè¢ Processing partner 1: amazon","args":["  üè¢ Processing partner 1:","amazon"],"source":"frontend"},{"timestamp":1758473410612,"isoTimestamp":"2025-09-21T16:50:10.612Z","level":"log","message":"  üè¢ Processing partner 2: google","args":["  üè¢ Processing partner 2:","google"],"source":"frontend"},{"timestamp":1758473410612,"isoTimestamp":"2025-09-21T16:50:10.612Z","level":"log","message":"  üè¢ Processing partner 3: microsoft","args":["  üè¢ Processing partner 3:","microsoft"],"source":"frontend"},{"timestamp":1758473410612,"isoTimestamp":"2025-09-21T16:50:10.612Z","level":"log","message":"  üè¢ Processing partner 4: ibm","args":["  üè¢ Processing partner 4:","ibm"],"source":"frontend"},{"timestamp":1758473410612,"isoTimestamp":"2025-09-21T16:50:10.612Z","level":"log","message":"  üè¢ Processing partner 5: oracle","args":["  üè¢ Processing partner 5:","oracle"],"source":"frontend"},{"timestamp":1758473410612,"isoTimestamp":"2025-09-21T16:50:10.612Z","level":"log","message":"  üè¢ Processing partner 6: alibaba","args":["  üè¢ Processing partner 6:","alibaba"],"source":"frontend"},{"timestamp":1758473410612,"isoTimestamp":"2025-09-21T16:50:10.612Z","level":"log","message":"  üè¢ Processing partner 7: digitalocean","args":["  üè¢ Processing partner 7:","digitalocean"],"source":"frontend"},{"timestamp":1758473410612,"isoTimestamp":"2025-09-21T16:50:10.612Z","level":"log","message":"  üè¢ Processing partner 8: linode","args":["  üè¢ Processing partner 8:","linode"],"source":"frontend"},{"timestamp":1758473410612,"isoTimestamp":"2025-09-21T16:50:10.612Z","level":"log","message":"  üè¢ Processing partner 9: vultr","args":["  üè¢ Processing partner 9:","vultr"],"source":"frontend"},{"timestamp":1758473410612,"isoTimestamp":"2025-09-21T16:50:10.612Z","level":"log","message":"  üè¢ Processing partner 10: ovhcloud","args":["  üè¢ Processing partner 10:","ovhcloud"],"source":"frontend"},{"timestamp":1758473410612,"isoTimestamp":"2025-09-21T16:50:10.612Z","level":"log","message":"  üè¢ Processing partner 11: hetzner","args":["  üè¢ Processing partner 11:","hetzner"],"source":"frontend"},{"timestamp":1758473410612,"isoTimestamp":"2025-09-21T16:50:10.612Z","level":"log","message":"  üè¢ Processing partner 12: equinix","args":["  üè¢ Processing partner 12:","equinix"],"source":"frontend"},{"timestamp":1758473410612,"isoTimestamp":"2025-09-21T16:50:10.612Z","level":"log","message":"  üè¢ Processing partner 13: cloudflare","args":["  üè¢ Processing partner 13:","cloudflare"],"source":"frontend"},{"timestamp":1758473410612,"isoTimestamp":"2025-09-21T16:50:10.612Z","level":"log","message":"  üè¢ Processing partner 14: contabo","args":["  üè¢ Processing partner 14:","contabo"],"source":"frontend"},{"timestamp":1758473410612,"isoTimestamp":"2025-09-21T16:50:10.612Z","level":"log","message":"  üè¢ Processing partner 15: scaleway","args":["  üè¢ Processing partner 15:","scaleway"],"source":"frontend"},{"timestamp":1758473410612,"isoTimestamp":"2025-09-21T16:50:10.612Z","level":"log","message":"  üè¢ Processing partner 16: dell","args":["  üè¢ Processing partner 16:","dell"],"source":"frontend"},{"timestamp":1758473410612,"isoTimestamp":"2025-09-21T16:50:10.612Z","level":"log","message":"  üè¢ Processing partner 17: hp","args":["  üè¢ Processing partner 17:","hp"],"source":"frontend"},{"timestamp":1758473410612,"isoTimestamp":"2025-09-21T16:50:10.612Z","level":"log","message":"  üè¢ Processing partner 18: cisco","args":["  üè¢ Processing partner 18:","cisco"],"source":"frontend"},{"timestamp":1758473410612,"isoTimestamp":"2025-09-21T16:50:10.612Z","level":"log","message":"  üè¢ Processing partner 19: juniper","args":["  üè¢ Processing partner 19:","juniper"],"source":"frontend"}],"metadata":{"source":"frontend","sessionId":"unknown"}}
{"timestamp":1758473410625,"isoTimestamp":"2025-09-21T16:50:10.625Z","type":"console","operation":"CONSOLE_LOGS","entity":"frontend","count":20,"messages":[{"timestamp":1758473410612,"isoTimestamp":"2025-09-21T16:50:10.612Z","level":"log","message":"  üè¢ Processing partner 20: vmware","args":["  üè¢ Processing partner 20:","vmware"],"source":"frontend"},{"timestamp":1758473410612,"isoTimestamp":"2025-09-21T16:50:10.612Z","level":"log","message":"  üè¢ Processing partner 21: redhat","args":["  üè¢ Processing partner 21:","redhat"],"source":"frontend"},{"timestamp":1758473410612,"isoTimestamp":"2025-09-21T16:50:10.612Z","level":"log","message":"  üè¢ Processing partner 22: canonical","args":["  üè¢ Processing partner 22:","canonical"],"source":"frontend"},{"timestamp":1758473410612,"isoTimestamp":"2025-09-21T16:50:10.612Z","level":"log","message":"  üè¢ Processing partner 23: acme-corp","args":["  üè¢ Processing partner 23:","acme-corp"],"source":"frontend"},{"timestamp":1758473410612,"isoTimestamp":"2025-09-21T16:50:10.612Z","level":"log","message":"  üè¢ Processing partner 24: telcobright","args":["  üè¢ Processing partner 24:","telcobright"],"source":"frontend"},{"timestamp":1758473410612,"isoTimestamp":"2025-09-21T16:50:10.612Z","level":"log","message":"  üè¢ Processing partner 25: tech-solutions","args":["  üè¢ Processing partner 25:","tech-solutions"],"source":"frontend"},{"timestamp":1758473410612,"isoTimestamp":"2025-09-21T16:50:10.612Z","level":"log","message":"  üè¢ Processing partner 26: global-systems","args":["  üè¢ Processing partner 26:","global-systems"],"source":"frontend"},{"timestamp":1758473410612,"isoTimestamp":"2025-09-21T16:50:10.612Z","level":"log","message":"  üè¢ Processing partner 27: cloud-dynamics","args":["  üè¢ Processing partner 27:","cloud-dynamics"],"source":"frontend"},{"timestamp":1758473410612,"isoTimestamp":"2025-09-21T16:50:10.612Z","level":"log","message":"‚úÖ transformStellarToTree result: [\n  {\n    \"id\": \"partner-1\",\n    \"name\": \"Amazon Web Services (AWS)\",\n    \"type\": \"partner\",\n    \"data\": {\n      \"id\": 1,\n      \"name\": \"amazon\",\n      \"displayName\": \"Amazon Web Services (AWS)\",\n      \"type\": \"cloud-provider\",\n      \"roles\": [\n        \"cloud-provider\",\n        \"vendor\"\n      ],\n      \"status\": \"ACTIVE\",\n      \"contactEmail\": \"billing@aws.amazon.com\",\n      \"website\": \"https://aws.amazon.com\"\n    },\n    \"children\": []\n  },\n  {\n    \"id\": \"partner-2\",\n    \"name\": \"Google Cloud Platform\",\n    \"type\": \"partner\",\n    \"data\": {\n      \"id\": 2,\n      \"name\": \"google\",\n      \"displayName\": \"Google Cloud Platform\",\n      \"type\": \"cloud-provider\",\n      \"roles\": [\n        \"cloud-provider\",\n        \"vendor\"\n      ],\n      \"status\": \"ACTIVE\",\n      \"contactEmail\": \"billing@cloud.google.com\",\n      \"website\": \"https://cloud.google.com\"\n    },\n    \"children\": []\n  },\n  {\n    \"id\": \"partner-3\",\n    \"name\": \"Microsoft Azure\",\n    \"type\": \"partner\",\n    \"data\": {\n      \"id\": 3,\n      \"name\": \"microsoft\",\n      \"displayName\": \"Microsoft Azure\",\n      \"type\": \"cloud-provider\",\n      \"roles\": [\n        \"cloud-provider\",\n        \"vendor\"\n      ],\n      \"status\": \"ACTIVE\",\n      \"contactEmail\": \"billing@azure.microsoft.com\",\n      \"website\": \"https://azure.microsoft.com\"\n    },\n    \"children\": []\n  },\n  {\n    \"id\": \"partner-4\",\n    \"name\": \"IBM Cloud\",\n    \"type\": \"partner\",\n    \"data\": {\n      \"id\": 4,\n      \"name\": \"ibm\",\n      \"displayName\": \"IBM Cloud\",\n      \"type\": \"cloud-provider\",\n      \"roles\": [\n        \"cloud-provider\",\n        \"vendor\"\n      ],\n      \"status\": \"ACTIVE\",\n      \"contactEmail\": \"billing@ibm.com\",\n      \"website\": \"https://www.ibm.com/cloud\"\n    },\n    \"children\": []\n  },\n  {\n    \"id\": \"partner-5\",\n    \"name\": \"Oracle Cloud\",\n    \"type\": \"partner\",\n    \"data\": {\n      \"id\": 5,\n      \"name\": \"oracle\",\n      \"displayName\": \"Oracle Cloud\",\n      \"type\": \"cloud-provider\",\n      \"roles\": [\n        \"cloud-provider\",\n        \"vendor\"\n      ],\n      \"status\": \"ACTIVE\",\n      \"contactEmail\": \"billing@oracle.com\",\n      \"website\": \"https://www.oracle.com/cloud\"\n    },\n    \"children\": []\n  },\n  {\n    \"id\": \"partner-6\",\n    \"name\": \"Alibaba Cloud\",\n    \"type\": \"partner\",\n    \"data\": {\n      \"id\": 6,\n      \"name\": \"alibaba\",\n      \"displayName\": \"Alibaba Cloud\",\n      \"type\": \"cloud-provider\",\n      \"roles\": [\n        \"cloud-provider\",\n        \"vendor\"\n      ],\n      \"status\": \"ACTIVE\",\n      \"contactEmail\": \"billing@alibabacloud.com\",\n      \"website\": \"https://www.alibabacloud.com\"\n    },\n    \"children\": []\n  },\n  {\n    \"id\": \"partner-7\",\n    \"name\": \"DigitalOcean\",\n    \"type\": \"partner\",\n    \"data\": {\n      \"id\": 7,\n      \"name\": \"digitalocean\",\n      \"displayName\": \"DigitalOcean\",\n      \"type\": \"cloud-provider\",\n      \"roles\": [\n        \"cloud-provider\",\n        \"vendor\"\n      ],\n      \"status\": \"ACTIVE\",\n      \"contactEmail\": \"billing@digitalocean.com\",\n      \"website\": \"https://www.digitalocean.com\"\n    },\n    \"children\": []\n  },\n  {\n    \"id\": \"partner-8\",\n    \"name\": \"Akamai Connected Cloud (Linode)\",\n    \"type\": \"partner\",\n    \"data\": {\n      \"id\": 8,\n      \"name\": \"linode\",\n      \"displayName\": \"Akamai Connected Cloud (Linode)\",\n      \"type\": \"cloud-provider\",\n      \"roles\": [\n        \"cloud-provider\",\n        \"vendor\"\n      ],\n      \"status\": \"ACTIVE\",\n      \"contactEmail\": \"billing@linode.com\",\n      \"website\": \"https://www.linode.com\"\n    },\n    \"children\": []\n  },\n  {\n    \"id\": \"partner-9\",\n    \"name\": \"Vultr\",\n    \"type\": \"partner\",\n    \"data\": {\n      \"id\": 9,\n      \"name\": \"vultr\",\n      \"displayName\": \"Vultr\",\n      \"type\": \"cloud-provider\",\n      \"roles\": [\n        \"cloud-provider\",\n        \"vendor\"\n      ],\n      \"status\": \"ACTIVE\",\n      \"contactEmail\": \"billing@vultr.com\",\n      \"website\": \"https://www.vultr.com\"\n    },\n    \"children\": []\n  },\n  {\n    \"id\": \"partner-10\",\n    \"name\": \"OVHcloud\",\n    \"type\": \"partner\",\n    \"data\": {\n      \"id\": 10,\n      \"name\": \"ovhcloud\",\n      \"displayName\": \"OVHcloud\",\n      \"type\": \"cloud-provider\",\n      \"roles\": [\n        \"cloud-provider\",\n        \"vendor\"\n      ],\n      \"status\": \"ACTIVE\",\n      \"contactEmail\": \"billing@ovhcloud.com\",\n      \"website\": \"https://www.ovhcloud.com\"\n    },\n    \"children\": []\n  },\n  {\n    \"id\": \"partner-11\",\n    \"name\": \"Hetzner\",\n    \"type\": \"partner\",\n    \"data\": {\n      \"id\": 11,\n      \"name\": \"hetzner\",\n      \"displayName\": \"Hetzner\",\n      \"type\": \"cloud-provider\",\n      \"roles\": [\n        \"cloud-provider\",\n        \"vendor\"\n      ],\n      \"status\": \"ACTIVE\",\n      \"contactEmail\": \"billing@hetzner.com\",\n      \"website\": \"https://www.hetzner.com\"\n    },\n    \"children\": []\n  },\n  {\n    \"id\": \"partner-12\",\n    \"name\": \"Equinix Metal\",\n    \"type\": \"partner\",\n    \"data\": {\n      \"id\": 12,\n      \"name\": \"equinix\",\n      \"displayName\": \"Equinix Metal\",\n      \"type\": \"cloud-provider\",\n      \"roles\": [\n        \"cloud-provider\",\n        \"vendor\"\n      ],\n      \"status\": \"ACTIVE\",\n      \"contactEmail\": \"billing@equinix.com\",\n      \"website\": \"https://metal.equinix.com\"\n    },\n    \"children\": []\n  },\n  {\n    \"id\": \"partner-13\",\n    \"name\": \"Cloudflare\",\n    \"type\": \"partner\",\n    \"data\": {\n      \"id\": 13,\n      \"name\": \"cloudflare\",\n      \"displayName\": \"Cloudflare\",\n      \"type\": \"cloud-provider\",\n      \"roles\": [\n        \"cloud-provider\",\n        \"vendor\"\n      ],\n      \"status\": \"ACTIVE\",\n      \"contactEmail\": \"billing@cloudflare.com\",\n      \"website\": \"https://www.cloudflare.com\"\n    },\n    \"children\": []\n  },\n  {\n    \"id\": \"partner-14\",\n    \"name\": \"Contabo\",\n    \"type\": \"partner\",\n    \"data\": {\n      \"id\": 14,\n      \"name\": \"contabo\",\n      \"displayName\": \"Contabo\",\n      \"type\": \"cloud-provider\",\n      \"roles\": [\n        \"cloud-provider\",\n        \"vendor\"\n      ],\n      \"status\": \"ACTIVE\",\n      \"contactEmail\": \"billing@contabo.com\",\n      \"website\": \"https://contabo.com\"\n    },\n    \"children\": []\n  },\n  {\n    \"id\": \"partner-15\",\n    \"name\": \"Scaleway\",\n    \"type\": \"partner\",\n    \"data\": {\n      \"id\": 15,\n      \"name\": \"scaleway\",\n      \"displayName\": \"Scaleway\",\n      \"type\": \"cloud-provider\",\n      \"roles\": [\n        \"cloud-provider\",\n        \"vendor\"\n      ],\n      \"status\": \"ACTIVE\",\n      \"contactEmail\": \"billing@scaleway.com\",\n      \"website\": \"https://www.scaleway.com\"\n    },\n    \"children\": []\n  },\n  {\n    \"id\": \"partner-16\",\n    \"name\": \"Dell Technologies\",\n    \"type\": \"partner\",\n    \"data\": {\n      \"id\": 16,\n      \"name\": \"dell\",\n      \"displayName\": \"Dell Technologies\",\n      \"type\": \"vendor\",\n      \"roles\": [\n        \"hardware-vendor\",\n        \"vendor\"\n      ],\n      \"status\": \"ACTIVE\",\n      \"contactEmail\": \"sales@dell.com\",\n      \"website\": \"https://www.dell.com\"\n    },\n    \"children\": []\n  },\n  {\n    \"id\": \"partner-17\",\n    \"name\": \"Hewlett Packard Enterprise\",\n    \"type\": \"partner\",\n    \"data\": {\n      \"id\": 17,\n      \"name\": \"hp\",\n      \"displayName\": \"Hewlett Packard Enterprise\",\n      \"type\": \"vendor\",\n      \"roles\": [\n        \"hardware-vendor\",\n        \"vendor\"\n      ],\n      \"status\": \"ACTIVE\",\n      \"contactEmail\": \"sales@hpe.com\",\n      \"website\": \"https://www.hpe.com\"\n    },\n    \"children\": []\n  },\n  {\n    \"id\": \"partner-18\",\n    \"name\": \"Cisco Systems\",\n    \"type\": \"partner\",\n    \"data\": {\n      \"id\": 18,\n      \"name\": \"cisco\",\n      \"displayName\": \"Cisco Systems\",\n      \"type\": \"vendor\",\n      \"roles\": [\n        \"network-vendor\",\n        \"vendor\"\n      ],\n      \"status\": \"ACTIVE\",\n      \"contactEmail\": \"sales@cisco.com\",\n      \"website\": \"https://www.cisco.com\"\n    },\n    \"children\": []\n  },\n  {\n    \"id\": \"partner-19\",\n    \"name\": \"Juniper Networks\",\n    \"type\": \"partner\",\n    \"data\": {\n      \"id\": 19,\n      \"name\": \"juniper\",\n      \"displayName\": \"Juniper Networks\",\n      \"type\": \"vendor\",\n      \"roles\": [\n        \"network-vendor\",\n        \"vendor\"\n      ],\n      \"status\": \"ACTIVE\",\n      \"contactEmail\": \"sales@juniper.net\",\n      \"website\": \"https://www.juniper.net\"\n    },\n    \"children\": []\n  },\n  {\n    \"id\": \"partner-20\",\n    \"name\": \"VMware\",\n    \"type\": \"partner\",\n    \"data\": {\n      \"id\": 20,\n      \"name\": \"vmware\",\n      \"displayName\": \"VMware\",\n      \"type\": \"vendor\",\n      \"roles\": [\n        \"software-vendor\",\n        \"vendor\"\n      ],\n      \"status\": \"ACTIVE\",\n      \"contactEmail\": \"sales@vmware.com\",\n      \"website\": \"https://www.vmware.com\"\n    },\n    \"children\": []\n  },\n  {\n    \"id\": \"partner-21\",\n    \"name\": \"Red Hat\",\n    \"type\": \"partner\",\n    \"data\": {\n      \"id\": 21,\n      \"name\": \"redhat\",\n      \"displayName\": \"Red Hat\",\n      \"type\": \"vendor\",\n      \"roles\": [\n        \"software-vendor\",\n        \"vendor\"\n      ],\n      \"status\": \"ACTIVE\",\n      \"contactEmail\": \"sales@redhat.com\",\n      \"website\": \"https://www.redhat.com\"\n    },\n    \"children\": []\n  },\n  {\n    \"id\": \"partner-22\",\n    \"name\": \"Canonical (Ubuntu)\",\n    \"type\": \"partner\",\n    \"data\": {\n      \"id\": 22,\n      \"name\": \"canonical\",\n      \"displayName\": \"Canonical (Ubuntu)\",\n      \"type\": \"vendor\",\n      \"roles\": [\n        \"software-vendor\",\n        \"vendor\"\n      ],\n      \"status\": \"ACTIVE\",\n      \"contactEmail\": \"sales@canonical.com\",\n      \"website\": \"https://canonical.com\"\n    },\n    \"children\": []\n  },\n  {\n    \"id\": \"partner-23\",\n    \"name\": \"ACME Corporation\",\n    \"type\": \"partner\",\n    \"data\": {\n      \"id\": 23,\n      \"name\": \"acme-corp\",\n      \"displayName\": \"ACME Corporation\",\n      \"type\": \"customer\",\n      \"roles\": [\n        \"customer\"\n      ],\n      \"status\": \"ACTIVE\",\n      \"contactEmail\": \"contact@acme.com\",\n      \"website\": \"https://acme.com\"\n    },\n    \"children\": []\n  },\n  {\n    \"id\": \"partner-24\",\n    \"name\": \"Telcobright\",\n    \"type\": \"partner\",\n    \"data\": {\n      \"id\": 24,\n      \"name\": \"telcobright\",\n      \"displayName\": \"Telcobright\",\n      \"type\": \"service-provider\",\n      \"roles\": [\n        \"self\"\n      ],\n      \"status\": \"ACTIVE\",\n      \"contactEmail\": \"admin@telcobright.com\",\n      \"website\": \"https://telcobright.com\"\n    },\n    \"children\": []\n  },\n  {\n    \"id\": \"partner-25\",\n    \"name\": \"Tech Solutions Inc\",\n    \"type\": \"partner\",\n    \"data\": {\n      \"id\": 25,\n      \"name\": \"tech-solutions\",\n      \"displayName\": \"Tech Solutions Inc\",\n      \"type\": \"VENDOR\",\n      \"roles\": [\n        \"vendor\"\n      ],\n      \"status\": \"ACTIVE\",\n      \"contactEmail\": \"info@techsolutions.com\",\n      \"website\": \"https://www.techsolutions.com\"\n    },\n    \"children\": []\n  },\n  {\n    \"id\": \"partner-26\",\n    \"name\": \"Global Systems Ltd\",\n    \"type\": \"partner\",\n    \"data\": {\n      \"id\": 26,\n      \"name\": \"global-systems\",\n      \"displayName\": \"Global Systems Ltd\",\n      \"type\": \"CUSTOMER\",\n      \"roles\": [\n        \"customer\"\n      ],\n      \"status\": \"ACTIVE\",\n      \"contactEmail\": \"support@globalsystems.com\",\n      \"website\": \"https://www.globalsystems.com\"\n    },\n    \"children\": []\n  },\n  {\n    \"id\": \"partner-27\",\n    \"name\": \"Cloud Dynamics\",\n    \"type\": \"partner\",\n    \"data\": {\n      \"id\": 27,\n      \"name\": \"cloud-dynamics\",\n      \"displayName\": \"Cloud Dynamics\",\n      \"type\": \"VENDOR\",\n      \"roles\": [\n        \"vendor\"\n      ],\n      \"status\": \"ACTIVE\",\n      \"contactEmail\": \"hello@clouddynamics.io\",\n      \"website\": \"https://www.clouddynamics.io\"\n    },\n    \"children\": []\n  }\n]","args":["‚úÖ transformStellarToTree result:","[\n  {\n    \"id\": \"partner-1\",\n    \"name\": \"Amazon Web Services (AWS)\",\n    \"type\": \"partner\",\n    \"data\": {\n      \"id\": 1,\n      \"name\": \"amazon\",\n      \"displayName\": \"Amazon Web Services (AWS)\",\n      \"type\": \"cloud-provider\",\n      \"roles\": [\n        \"cloud-provider\",\n        \"vendor\"\n      ],\n      \"status\": \"ACTIVE\",\n      \"contactEmail\": \"billing@aws.amazon.com\",\n      \"website\": \"https://aws.amazon.com\"\n    },\n    \"children\": []\n  },\n  {\n    \"id\": \"partner-2\",\n    \"name\": \"Google Cloud Platform\",\n    \"type\": \"partner\",\n    \"data\": {\n      \"id\": 2,\n      \"name\": \"google\",\n      \"displayName\": \"Google Cloud Platform\",\n      \"type\": \"cloud-provider\",\n      \"roles\": [\n        \"cloud-provider\",\n        \"vendor\"\n      ],\n      \"status\": \"ACTIVE\",\n      \"contactEmail\": \"billing@cloud.google.com\",\n      \"website\": \"https://cloud.google.com\"\n    },\n    \"children\": []\n  },\n  {\n    \"id\": \"partner-3\",\n    \"name\": \"Microsoft Azure\",\n    \"type\": \"partner\",\n    \"data\": {\n      \"id\": 3,\n      \"name\": \"microsoft\",\n      \"displayName\": \"Microsoft Azure\",\n      \"type\": \"cloud-provider\",\n      \"roles\": [\n        \"cloud-provider\",\n        \"vendor\"\n      ],\n      \"status\": \"ACTIVE\",\n      \"contactEmail\": \"billing@azure.microsoft.com\",\n      \"website\": \"https://azure.microsoft.com\"\n    },\n    \"children\": []\n  },\n  {\n    \"id\": \"partner-4\",\n    \"name\": \"IBM Cloud\",\n    \"type\": \"partner\",\n    \"data\": {\n      \"id\": 4,\n      \"name\": \"ibm\",\n      \"displayName\": \"IBM Cloud\",\n      \"type\": \"cloud-provider\",\n      \"roles\": [\n        \"cloud-provider\",\n        \"vendor\"\n      ],\n      \"status\": \"ACTIVE\",\n      \"contactEmail\": \"billing@ibm.com\",\n      \"website\": \"https://www.ibm.com/cloud\"\n    },\n    \"children\": []\n  },\n  {\n    \"id\": \"partner-5\",\n    \"name\": \"Oracle Cloud\",\n    \"type\": \"partner\",\n    \"data\": {\n      \"id\": 5,\n      \"name\": \"oracle\",\n      \"displayName\": \"Oracle Cloud\",\n      \"type\": \"cloud-provider\",\n      \"roles\": [\n        \"cloud-provider\",\n        \"vendor\"\n      ],\n      \"status\": \"ACTIVE\",\n      \"contactEmail\": \"billing@oracle.com\",\n      \"website\": \"https://www.oracle.com/cloud\"\n    },\n    \"children\": []\n  },\n  {\n    \"id\": \"partner-6\",\n    \"name\": \"Alibaba Cloud\",\n    \"type\": \"partner\",\n    \"data\": {\n      \"id\": 6,\n      \"name\": \"alibaba\",\n      \"displayName\": \"Alibaba Cloud\",\n      \"type\": \"cloud-provider\",\n      \"roles\": [\n        \"cloud-provider\",\n        \"vendor\"\n      ],\n      \"status\": \"ACTIVE\",\n      \"contactEmail\": \"billing@alibabacloud.com\",\n      \"website\": \"https://www.alibabacloud.com\"\n    },\n    \"children\": []\n  },\n  {\n    \"id\": \"partner-7\",\n    \"name\": \"DigitalOcean\",\n    \"type\": \"partner\",\n    \"data\": {\n      \"id\": 7,\n      \"name\": \"digitalocean\",\n      \"displayName\": \"DigitalOcean\",\n      \"type\": \"cloud-provider\",\n      \"roles\": [\n        \"cloud-provider\",\n        \"vendor\"\n      ],\n      \"status\": \"ACTIVE\",\n      \"contactEmail\": \"billing@digitalocean.com\",\n      \"website\": \"https://www.digitalocean.com\"\n    },\n    \"children\": []\n  },\n  {\n    \"id\": \"partner-8\",\n    \"name\": \"Akamai Connected Cloud (Linode)\",\n    \"type\": \"partner\",\n    \"data\": {\n      \"id\": 8,\n      \"name\": \"linode\",\n      \"displayName\": \"Akamai Connected Cloud (Linode)\",\n      \"type\": \"cloud-provider\",\n      \"roles\": [\n        \"cloud-provider\",\n        \"vendor\"\n      ],\n      \"status\": \"ACTIVE\",\n      \"contactEmail\": \"billing@linode.com\",\n      \"website\": \"https://www.linode.com\"\n    },\n    \"children\": []\n  },\n  {\n    \"id\": \"partner-9\",\n    \"name\": \"Vultr\",\n    \"type\": \"partner\",\n    \"data\": {\n      \"id\": 9,\n      \"name\": \"vultr\",\n      \"displayName\": \"Vultr\",\n      \"type\": \"cloud-provider\",\n      \"roles\": [\n        \"cloud-provider\",\n        \"vendor\"\n      ],\n      \"status\": \"ACTIVE\",\n      \"contactEmail\": \"billing@vultr.com\",\n      \"website\": \"https://www.vultr.com\"\n    },\n    \"children\": []\n  },\n  {\n    \"id\": \"partner-10\",\n    \"name\": \"OVHcloud\",\n    \"type\": \"partner\",\n    \"data\": {\n      \"id\": 10,\n      \"name\": \"ovhcloud\",\n      \"displayName\": \"OVHcloud\",\n      \"type\": \"cloud-provider\",\n      \"roles\": [\n        \"cloud-provider\",\n        \"vendor\"\n      ],\n      \"status\": \"ACTIVE\",\n      \"contactEmail\": \"billing@ovhcloud.com\",\n      \"website\": \"https://www.ovhcloud.com\"\n    },\n    \"children\": []\n  },\n  {\n    \"id\": \"partner-11\",\n    \"name\": \"Hetzner\",\n    \"type\": \"partner\",\n    \"data\": {\n      \"id\": 11,\n      \"name\": \"hetzner\",\n      \"displayName\": \"Hetzner\",\n      \"type\": \"cloud-provider\",\n      \"roles\": [\n        \"cloud-provider\",\n        \"vendor\"\n      ],\n      \"status\": \"ACTIVE\",\n      \"contactEmail\": \"billing@hetzner.com\",\n      \"website\": \"https://www.hetzner.com\"\n    },\n    \"children\": []\n  },\n  {\n    \"id\": \"partner-12\",\n    \"name\": \"Equinix Metal\",\n    \"type\": \"partner\",\n    \"data\": {\n      \"id\": 12,\n      \"name\": \"equinix\",\n      \"displayName\": \"Equinix Metal\",\n      \"type\": \"cloud-provider\",\n      \"roles\": [\n        \"cloud-provider\",\n        \"vendor\"\n      ],\n      \"status\": \"ACTIVE\",\n      \"contactEmail\": \"billing@equinix.com\",\n      \"website\": \"https://metal.equinix.com\"\n    },\n    \"children\": []\n  },\n  {\n    \"id\": \"partner-13\",\n    \"name\": \"Cloudflare\",\n    \"type\": \"partner\",\n    \"data\": {\n      \"id\": 13,\n      \"name\": \"cloudflare\",\n      \"displayName\": \"Cloudflare\",\n      \"type\": \"cloud-provider\",\n      \"roles\": [\n        \"cloud-provider\",\n        \"vendor\"\n      ],\n      \"status\": \"ACTIVE\",\n      \"contactEmail\": \"billing@cloudflare.com\",\n      \"website\": \"https://www.cloudflare.com\"\n    },\n    \"children\": []\n  },\n  {\n    \"id\": \"partner-14\",\n    \"name\": \"Contabo\",\n    \"type\": \"partner\",\n    \"data\": {\n      \"id\": 14,\n      \"name\": \"contabo\",\n      \"displayName\": \"Contabo\",\n      \"type\": \"cloud-provider\",\n      \"roles\": [\n        \"cloud-provider\",\n        \"vendor\"\n      ],\n      \"status\": \"ACTIVE\",\n      \"contactEmail\": \"billing@contabo.com\",\n      \"website\": \"https://contabo.com\"\n    },\n    \"children\": []\n  },\n  {\n    \"id\": \"partner-15\",\n    \"name\": \"Scaleway\",\n    \"type\": \"partner\",\n    \"data\": {\n      \"id\": 15,\n      \"name\": \"scaleway\",\n      \"displayName\": \"Scaleway\",\n      \"type\": \"cloud-provider\",\n      \"roles\": [\n        \"cloud-provider\",\n        \"vendor\"\n      ],\n      \"status\": \"ACTIVE\",\n      \"contactEmail\": \"billing@scaleway.com\",\n      \"website\": \"https://www.scaleway.com\"\n    },\n    \"children\": []\n  },\n  {\n    \"id\": \"partner-16\",\n    \"name\": \"Dell Technologies\",\n    \"type\": \"partner\",\n    \"data\": {\n      \"id\": 16,\n      \"name\": \"dell\",\n      \"displayName\": \"Dell Technologies\",\n      \"type\": \"vendor\",\n      \"roles\": [\n        \"hardware-vendor\",\n        \"vendor\"\n      ],\n      \"status\": \"ACTIVE\",\n      \"contactEmail\": \"sales@dell.com\",\n      \"website\": \"https://www.dell.com\"\n    },\n    \"children\": []\n  },\n  {\n    \"id\": \"partner-17\",\n    \"name\": \"Hewlett Packard Enterprise\",\n    \"type\": \"partner\",\n    \"data\": {\n      \"id\": 17,\n      \"name\": \"hp\",\n      \"displayName\": \"Hewlett Packard Enterprise\",\n      \"type\": \"vendor\",\n      \"roles\": [\n        \"hardware-vendor\",\n        \"vendor\"\n      ],\n      \"status\": \"ACTIVE\",\n      \"contactEmail\": \"sales@hpe.com\",\n      \"website\": \"https://www.hpe.com\"\n    },\n    \"children\": []\n  },\n  {\n    \"id\": \"partner-18\",\n    \"name\": \"Cisco Systems\",\n    \"type\": \"partner\",\n    \"data\": {\n      \"id\": 18,\n      \"name\": \"cisco\",\n      \"displayName\": \"Cisco Systems\",\n      \"type\": \"vendor\",\n      \"roles\": [\n        \"network-vendor\",\n        \"vendor\"\n      ],\n      \"status\": \"ACTIVE\",\n      \"contactEmail\": \"sales@cisco.com\",\n      \"website\": \"https://www.cisco.com\"\n    },\n    \"children\": []\n  },\n  {\n    \"id\": \"partner-19\",\n    \"name\": \"Juniper Networks\",\n    \"type\": \"partner\",\n    \"data\": {\n      \"id\": 19,\n      \"name\": \"juniper\",\n      \"displayName\": \"Juniper Networks\",\n      \"type\": \"vendor\",\n      \"roles\": [\n        \"network-vendor\",\n        \"vendor\"\n      ],\n      \"status\": \"ACTIVE\",\n      \"contactEmail\": \"sales@juniper.net\",\n      \"website\": \"https://www.juniper.net\"\n    },\n    \"children\": []\n  },\n  {\n    \"id\": \"partner-20\",\n    \"name\": \"VMware\",\n    \"type\": \"partner\",\n    \"data\": {\n      \"id\": 20,\n      \"name\": \"vmware\",\n      \"displayName\": \"VMware\",\n      \"type\": \"vendor\",\n      \"roles\": [\n        \"software-vendor\",\n        \"vendor\"\n      ],\n      \"status\": \"ACTIVE\",\n      \"contactEmail\": \"sales@vmware.com\",\n      \"website\": \"https://www.vmware.com\"\n    },\n    \"children\": []\n  },\n  {\n    \"id\": \"partner-21\",\n    \"name\": \"Red Hat\",\n    \"type\": \"partner\",\n    \"data\": {\n      \"id\": 21,\n      \"name\": \"redhat\",\n      \"displayName\": \"Red Hat\",\n      \"type\": \"vendor\",\n      \"roles\": [\n        \"software-vendor\",\n        \"vendor\"\n      ],\n      \"status\": \"ACTIVE\",\n      \"contactEmail\": \"sales@redhat.com\",\n      \"website\": \"https://www.redhat.com\"\n    },\n    \"children\": []\n  },\n  {\n    \"id\": \"partner-22\",\n    \"name\": \"Canonical (Ubuntu)\",\n    \"type\": \"partner\",\n    \"data\": {\n      \"id\": 22,\n      \"name\": \"canonical\",\n      \"displayName\": \"Canonical (Ubuntu)\",\n      \"type\": \"vendor\",\n      \"roles\": [\n        \"software-vendor\",\n        \"vendor\"\n      ],\n      \"status\": \"ACTIVE\",\n      \"contactEmail\": \"sales@canonical.com\",\n      \"website\": \"https://canonical.com\"\n    },\n    \"children\": []\n  },\n  {\n    \"id\": \"partner-23\",\n    \"name\": \"ACME Corporation\",\n    \"type\": \"partner\",\n    \"data\": {\n      \"id\": 23,\n      \"name\": \"acme-corp\",\n      \"displayName\": \"ACME Corporation\",\n      \"type\": \"customer\",\n      \"roles\": [\n        \"customer\"\n      ],\n      \"status\": \"ACTIVE\",\n      \"contactEmail\": \"contact@acme.com\",\n      \"website\": \"https://acme.com\"\n    },\n    \"children\": []\n  },\n  {\n    \"id\": \"partner-24\",\n    \"name\": \"Telcobright\",\n    \"type\": \"partner\",\n    \"data\": {\n      \"id\": 24,\n      \"name\": \"telcobright\",\n      \"displayName\": \"Telcobright\",\n      \"type\": \"service-provider\",\n      \"roles\": [\n        \"self\"\n      ],\n      \"status\": \"ACTIVE\",\n      \"contactEmail\": \"admin@telcobright.com\",\n      \"website\": \"https://telcobright.com\"\n    },\n    \"children\": []\n  },\n  {\n    \"id\": \"partner-25\",\n    \"name\": \"Tech Solutions Inc\",\n    \"type\": \"partner\",\n    \"data\": {\n      \"id\": 25,\n      \"name\": \"tech-solutions\",\n      \"displayName\": \"Tech Solutions Inc\",\n      \"type\": \"VENDOR\",\n      \"roles\": [\n        \"vendor\"\n      ],\n      \"status\": \"ACTIVE\",\n      \"contactEmail\": \"info@techsolutions.com\",\n      \"website\": \"https://www.techsolutions.com\"\n    },\n    \"children\": []\n  },\n  {\n    \"id\": \"partner-26\",\n    \"name\": \"Global Systems Ltd\",\n    \"type\": \"partner\",\n    \"data\": {\n      \"id\": 26,\n      \"name\": \"global-systems\",\n      \"displayName\": \"Global Systems Ltd\",\n      \"type\": \"CUSTOMER\",\n      \"roles\": [\n        \"customer\"\n      ],\n      \"status\": \"ACTIVE\",\n      \"contactEmail\": \"support@globalsystems.com\",\n      \"website\": \"https://www.globalsystems.com\"\n    },\n    \"children\": []\n  },\n  {\n    \"id\": \"partner-27\",\n    \"name\": \"Cloud Dynamics\",\n    \"type\": \"partner\",\n    \"data\": {\n      \"id\": 27,\n      \"name\": \"cloud-dynamics\",\n      \"displayName\": \"Cloud Dynamics\",\n      \"type\": \"VENDOR\",\n      \"roles\": [\n        \"vendor\"\n      ],\n      \"status\": \"ACTIVE\",\n      \"contactEmail\": \"hello@clouddynamics.io\",\n      \"website\": \"https://www.clouddynamics.io\"\n    },\n    \"children\": []\n  }\n]"],"source":"frontend"},{"timestamp":1758473410616,"isoTimestamp":"2025-09-21T16:50:10.616Z","level":"log","message":"üå≤ Unified tree: [\n  {\n    \"id\": \"partner-1\",\n    \"name\": \"Amazon Web Services (AWS)\",\n    \"type\": \"partner\",\n    \"data\": {\n      \"id\": 1,\n      \"name\": \"amazon\",\n      \"displayName\": \"Amazon Web Services (AWS)\",\n      \"type\": \"cloud-provider\",\n      \"roles\": [\n        \"cloud-provider\",\n        \"vendor\"\n      ],\n      \"status\": \"ACTIVE\",\n      \"contactEmail\": \"billing@aws.amazon.com\",\n      \"website\": \"https://aws.amazon.com\"\n    },\n    \"children\": []\n  },\n  {\n    \"id\": \"partner-2\",\n    \"name\": \"Google Cloud Platform\",\n    \"type\": \"partner\",\n    \"data\": {\n      \"id\": 2,\n      \"name\": \"google\",\n      \"displayName\": \"Google Cloud Platform\",\n      \"type\": \"cloud-provider\",\n      \"roles\": [\n        \"cloud-provider\",\n        \"vendor\"\n      ],\n      \"status\": \"ACTIVE\",\n      \"contactEmail\": \"billing@cloud.google.com\",\n      \"website\": \"https://cloud.google.com\"\n    },\n    \"children\": []\n  },\n  {\n    \"id\": \"partner-3\",\n    \"name\": \"Microsoft Azure\",\n    \"type\": \"partner\",\n    \"data\": {\n      \"id\": 3,\n      \"name\": \"microsoft\",\n      \"displayName\": \"Microsoft Azure\",\n      \"type\": \"cloud-provider\",\n      \"roles\": [\n        \"cloud-provider\",\n        \"vendor\"\n      ],\n      \"status\": \"ACTIVE\",\n      \"contactEmail\": \"billing@azure.microsoft.com\",\n      \"website\": \"https://azure.microsoft.com\"\n    },\n    \"children\": []\n  },\n  {\n    \"id\": \"partner-4\",\n    \"name\": \"IBM Cloud\",\n    \"type\": \"partner\",\n    \"data\": {\n      \"id\": 4,\n      \"name\": \"ibm\",\n      \"displayName\": \"IBM Cloud\",\n      \"type\": \"cloud-provider\",\n      \"roles\": [\n        \"cloud-provider\",\n        \"vendor\"\n      ],\n      \"status\": \"ACTIVE\",\n      \"contactEmail\": \"billing@ibm.com\",\n      \"website\": \"https://www.ibm.com/cloud\"\n    },\n    \"children\": []\n  },\n  {\n    \"id\": \"partner-5\",\n    \"name\": \"Oracle Cloud\",\n    \"type\": \"partner\",\n    \"data\": {\n      \"id\": 5,\n      \"name\": \"oracle\",\n      \"displayName\": \"Oracle Cloud\",\n      \"type\": \"cloud-provider\",\n      \"roles\": [\n        \"cloud-provider\",\n        \"vendor\"\n      ],\n      \"status\": \"ACTIVE\",\n      \"contactEmail\": \"billing@oracle.com\",\n      \"website\": \"https://www.oracle.com/cloud\"\n    },\n    \"children\": []\n  },\n  {\n    \"id\": \"partner-6\",\n    \"name\": \"Alibaba Cloud\",\n    \"type\": \"partner\",\n    \"data\": {\n      \"id\": 6,\n      \"name\": \"alibaba\",\n      \"displayName\": \"Alibaba Cloud\",\n      \"type\": \"cloud-provider\",\n      \"roles\": [\n        \"cloud-provider\",\n        \"vendor\"\n      ],\n      \"status\": \"ACTIVE\",\n      \"contactEmail\": \"billing@alibabacloud.com\",\n      \"website\": \"https://www.alibabacloud.com\"\n    },\n    \"children\": []\n  },\n  {\n    \"id\": \"partner-7\",\n    \"name\": \"DigitalOcean\",\n    \"type\": \"partner\",\n    \"data\": {\n      \"id\": 7,\n      \"name\": \"digitalocean\",\n      \"displayName\": \"DigitalOcean\",\n      \"type\": \"cloud-provider\",\n      \"roles\": [\n        \"cloud-provider\",\n        \"vendor\"\n      ],\n      \"status\": \"ACTIVE\",\n      \"contactEmail\": \"billing@digitalocean.com\",\n      \"website\": \"https://www.digitalocean.com\"\n    },\n    \"children\": []\n  },\n  {\n    \"id\": \"partner-8\",\n    \"name\": \"Akamai Connected Cloud (Linode)\",\n    \"type\": \"partner\",\n    \"data\": {\n      \"id\": 8,\n      \"name\": \"linode\",\n      \"displayName\": \"Akamai Connected Cloud (Linode)\",\n      \"type\": \"cloud-provider\",\n      \"roles\": [\n        \"cloud-provider\",\n        \"vendor\"\n      ],\n      \"status\": \"ACTIVE\",\n      \"contactEmail\": \"billing@linode.com\",\n      \"website\": \"https://www.linode.com\"\n    },\n    \"children\": []\n  },\n  {\n    \"id\": \"partner-9\",\n    \"name\": \"Vultr\",\n    \"type\": \"partner\",\n    \"data\": {\n      \"id\": 9,\n      \"name\": \"vultr\",\n      \"displayName\": \"Vultr\",\n      \"type\": \"cloud-provider\",\n      \"roles\": [\n        \"cloud-provider\",\n        \"vendor\"\n      ],\n      \"status\": \"ACTIVE\",\n      \"contactEmail\": \"billing@vultr.com\",\n      \"website\": \"https://www.vultr.com\"\n    },\n    \"children\": []\n  },\n  {\n    \"id\": \"partner-10\",\n    \"name\": \"OVHcloud\",\n    \"type\": \"partner\",\n    \"data\": {\n      \"id\": 10,\n      \"name\": \"ovhcloud\",\n      \"displayName\": \"OVHcloud\",\n      \"type\": \"cloud-provider\",\n      \"roles\": [\n        \"cloud-provider\",\n        \"vendor\"\n      ],\n      \"status\": \"ACTIVE\",\n      \"contactEmail\": \"billing@ovhcloud.com\",\n      \"website\": \"https://www.ovhcloud.com\"\n    },\n    \"children\": []\n  },\n  {\n    \"id\": \"partner-11\",\n    \"name\": \"Hetzner\",\n    \"type\": \"partner\",\n    \"data\": {\n      \"id\": 11,\n      \"name\": \"hetzner\",\n      \"displayName\": \"Hetzner\",\n      \"type\": \"cloud-provider\",\n      \"roles\": [\n        \"cloud-provider\",\n        \"vendor\"\n      ],\n      \"status\": \"ACTIVE\",\n      \"contactEmail\": \"billing@hetzner.com\",\n      \"website\": \"https://www.hetzner.com\"\n    },\n    \"children\": []\n  },\n  {\n    \"id\": \"partner-12\",\n    \"name\": \"Equinix Metal\",\n    \"type\": \"partner\",\n    \"data\": {\n      \"id\": 12,\n      \"name\": \"equinix\",\n      \"displayName\": \"Equinix Metal\",\n      \"type\": \"cloud-provider\",\n      \"roles\": [\n        \"cloud-provider\",\n        \"vendor\"\n      ],\n      \"status\": \"ACTIVE\",\n      \"contactEmail\": \"billing@equinix.com\",\n      \"website\": \"https://metal.equinix.com\"\n    },\n    \"children\": []\n  },\n  {\n    \"id\": \"partner-13\",\n    \"name\": \"Cloudflare\",\n    \"type\": \"partner\",\n    \"data\": {\n      \"id\": 13,\n      \"name\": \"cloudflare\",\n      \"displayName\": \"Cloudflare\",\n      \"type\": \"cloud-provider\",\n      \"roles\": [\n        \"cloud-provider\",\n        \"vendor\"\n      ],\n      \"status\": \"ACTIVE\",\n      \"contactEmail\": \"billing@cloudflare.com\",\n      \"website\": \"https://www.cloudflare.com\"\n    },\n    \"children\": []\n  },\n  {\n    \"id\": \"partner-14\",\n    \"name\": \"Contabo\",\n    \"type\": \"partner\",\n    \"data\": {\n      \"id\": 14,\n      \"name\": \"contabo\",\n      \"displayName\": \"Contabo\",\n      \"type\": \"cloud-provider\",\n      \"roles\": [\n        \"cloud-provider\",\n        \"vendor\"\n      ],\n      \"status\": \"ACTIVE\",\n      \"contactEmail\": \"billing@contabo.com\",\n      \"website\": \"https://contabo.com\"\n    },\n    \"children\": []\n  },\n  {\n    \"id\": \"partner-15\",\n    \"name\": \"Scaleway\",\n    \"type\": \"partner\",\n    \"data\": {\n      \"id\": 15,\n      \"name\": \"scaleway\",\n      \"displayName\": \"Scaleway\",\n      \"type\": \"cloud-provider\",\n      \"roles\": [\n        \"cloud-provider\",\n        \"vendor\"\n      ],\n      \"status\": \"ACTIVE\",\n      \"contactEmail\": \"billing@scaleway.com\",\n      \"website\": \"https://www.scaleway.com\"\n    },\n    \"children\": []\n  },\n  {\n    \"id\": \"partner-16\",\n    \"name\": \"Dell Technologies\",\n    \"type\": \"partner\",\n    \"data\": {\n      \"id\": 16,\n      \"name\": \"dell\",\n      \"displayName\": \"Dell Technologies\",\n      \"type\": \"vendor\",\n      \"roles\": [\n        \"hardware-vendor\",\n        \"vendor\"\n      ],\n      \"status\": \"ACTIVE\",\n      \"contactEmail\": \"sales@dell.com\",\n      \"website\": \"https://www.dell.com\"\n    },\n    \"children\": []\n  },\n  {\n    \"id\": \"partner-17\",\n    \"name\": \"Hewlett Packard Enterprise\",\n    \"type\": \"partner\",\n    \"data\": {\n      \"id\": 17,\n      \"name\": \"hp\",\n      \"displayName\": \"Hewlett Packard Enterprise\",\n      \"type\": \"vendor\",\n      \"roles\": [\n        \"hardware-vendor\",\n        \"vendor\"\n      ],\n      \"status\": \"ACTIVE\",\n      \"contactEmail\": \"sales@hpe.com\",\n      \"website\": \"https://www.hpe.com\"\n    },\n    \"children\": []\n  },\n  {\n    \"id\": \"partner-18\",\n    \"name\": \"Cisco Systems\",\n    \"type\": \"partner\",\n    \"data\": {\n      \"id\": 18,\n      \"name\": \"cisco\",\n      \"displayName\": \"Cisco Systems\",\n      \"type\": \"vendor\",\n      \"roles\": [\n        \"network-vendor\",\n        \"vendor\"\n      ],\n      \"status\": \"ACTIVE\",\n      \"contactEmail\": \"sales@cisco.com\",\n      \"website\": \"https://www.cisco.com\"\n    },\n    \"children\": []\n  },\n  {\n    \"id\": \"partner-19\",\n    \"name\": \"Juniper Networks\",\n    \"type\": \"partner\",\n    \"data\": {\n      \"id\": 19,\n      \"name\": \"juniper\",\n      \"displayName\": \"Juniper Networks\",\n      \"type\": \"vendor\",\n      \"roles\": [\n        \"network-vendor\",\n        \"vendor\"\n      ],\n      \"status\": \"ACTIVE\",\n      \"contactEmail\": \"sales@juniper.net\",\n      \"website\": \"https://www.juniper.net\"\n    },\n    \"children\": []\n  },\n  {\n    \"id\": \"partner-20\",\n    \"name\": \"VMware\",\n    \"type\": \"partner\",\n    \"data\": {\n      \"id\": 20,\n      \"name\": \"vmware\",\n      \"displayName\": \"VMware\",\n      \"type\": \"vendor\",\n      \"roles\": [\n        \"software-vendor\",\n        \"vendor\"\n      ],\n      \"status\": \"ACTIVE\",\n      \"contactEmail\": \"sales@vmware.com\",\n      \"website\": \"https://www.vmware.com\"\n    },\n    \"children\": []\n  },\n  {\n    \"id\": \"partner-21\",\n    \"name\": \"Red Hat\",\n    \"type\": \"partner\",\n    \"data\": {\n      \"id\": 21,\n      \"name\": \"redhat\",\n      \"displayName\": \"Red Hat\",\n      \"type\": \"vendor\",\n      \"roles\": [\n        \"software-vendor\",\n        \"vendor\"\n      ],\n      \"status\": \"ACTIVE\",\n      \"contactEmail\": \"sales@redhat.com\",\n      \"website\": \"https://www.redhat.com\"\n    },\n    \"children\": []\n  },\n  {\n    \"id\": \"partner-22\",\n    \"name\": \"Canonical (Ubuntu)\",\n    \"type\": \"partner\",\n    \"data\": {\n      \"id\": 22,\n      \"name\": \"canonical\",\n      \"displayName\": \"Canonical (Ubuntu)\",\n      \"type\": \"vendor\",\n      \"roles\": [\n        \"software-vendor\",\n        \"vendor\"\n      ],\n      \"status\": \"ACTIVE\",\n      \"contactEmail\": \"sales@canonical.com\",\n      \"website\": \"https://canonical.com\"\n    },\n    \"children\": []\n  },\n  {\n    \"id\": \"partner-23\",\n    \"name\": \"ACME Corporation\",\n    \"type\": \"partner\",\n    \"data\": {\n      \"id\": 23,\n      \"name\": \"acme-corp\",\n      \"displayName\": \"ACME Corporation\",\n      \"type\": \"customer\",\n      \"roles\": [\n        \"customer\"\n      ],\n      \"status\": \"ACTIVE\",\n      \"contactEmail\": \"contact@acme.com\",\n      \"website\": \"https://acme.com\"\n    },\n    \"children\": []\n  },\n  {\n    \"id\": \"partner-24\",\n    \"name\": \"Telcobright\",\n    \"type\": \"partner\",\n    \"data\": {\n      \"id\": 24,\n      \"name\": \"telcobright\",\n      \"displayName\": \"Telcobright\",\n      \"type\": \"service-provider\",\n      \"roles\": [\n        \"self\"\n      ],\n      \"status\": \"ACTIVE\",\n      \"contactEmail\": \"admin@telcobright.com\",\n      \"website\": \"https://telcobright.com\"\n    },\n    \"children\": []\n  },\n  {\n    \"id\": \"partner-25\",\n    \"name\": \"Tech Solutions Inc\",\n    \"type\": \"partner\",\n    \"data\": {\n      \"id\": 25,\n      \"name\": \"tech-solutions\",\n      \"displayName\": \"Tech Solutions Inc\",\n      \"type\": \"VENDOR\",\n      \"roles\": [\n        \"vendor\"\n      ],\n      \"status\": \"ACTIVE\",\n      \"contactEmail\": \"info@techsolutions.com\",\n      \"website\": \"https://www.techsolutions.com\"\n    },\n    \"children\": []\n  },\n  {\n    \"id\": \"partner-26\",\n    \"name\": \"Global Systems Ltd\",\n    \"type\": \"partner\",\n    \"data\": {\n      \"id\": 26,\n      \"name\": \"global-systems\",\n      \"displayName\": \"Global Systems Ltd\",\n      \"type\": \"CUSTOMER\",\n      \"roles\": [\n        \"customer\"\n      ],\n      \"status\": \"ACTIVE\",\n      \"contactEmail\": \"support@globalsystems.com\",\n      \"website\": \"https://www.globalsystems.com\"\n    },\n    \"children\": []\n  },\n  {\n    \"id\": \"partner-27\",\n    \"name\": \"Cloud Dynamics\",\n    \"type\": \"partner\",\n    \"data\": {\n      \"id\": 27,\n      \"name\": \"cloud-dynamics\",\n      \"displayName\": \"Cloud Dynamics\",\n      \"type\": \"VENDOR\",\n      \"roles\": [\n        \"vendor\"\n      ],\n      \"status\": \"ACTIVE\",\n      \"contactEmail\": \"hello@clouddynamics.io\",\n      \"website\": \"https://www.clouddynamics.io\"\n    },\n    \"children\": []\n  }\n]","args":["üå≤ Unified tree:","[\n  {\n    \"id\": \"partner-1\",\n    \"name\": \"Amazon Web Services (AWS)\",\n    \"type\": \"partner\",\n    \"data\": {\n      \"id\": 1,\n      \"name\": \"amazon\",\n      \"displayName\": \"Amazon Web Services (AWS)\",\n      \"type\": \"cloud-provider\",\n      \"roles\": [\n        \"cloud-provider\",\n        \"vendor\"\n      ],\n      \"status\": \"ACTIVE\",\n      \"contactEmail\": \"billing@aws.amazon.com\",\n      \"website\": \"https://aws.amazon.com\"\n    },\n    \"children\": []\n  },\n  {\n    \"id\": \"partner-2\",\n    \"name\": \"Google Cloud Platform\",\n    \"type\": \"partner\",\n    \"data\": {\n      \"id\": 2,\n      \"name\": \"google\",\n      \"displayName\": \"Google Cloud Platform\",\n      \"type\": \"cloud-provider\",\n      \"roles\": [\n        \"cloud-provider\",\n        \"vendor\"\n      ],\n      \"status\": \"ACTIVE\",\n      \"contactEmail\": \"billing@cloud.google.com\",\n      \"website\": \"https://cloud.google.com\"\n    },\n    \"children\": []\n  },\n  {\n    \"id\": \"partner-3\",\n    \"name\": \"Microsoft Azure\",\n    \"type\": \"partner\",\n    \"data\": {\n      \"id\": 3,\n      \"name\": \"microsoft\",\n      \"displayName\": \"Microsoft Azure\",\n      \"type\": \"cloud-provider\",\n      \"roles\": [\n        \"cloud-provider\",\n        \"vendor\"\n      ],\n      \"status\": \"ACTIVE\",\n      \"contactEmail\": \"billing@azure.microsoft.com\",\n      \"website\": \"https://azure.microsoft.com\"\n    },\n    \"children\": []\n  },\n  {\n    \"id\": \"partner-4\",\n    \"name\": \"IBM Cloud\",\n    \"type\": \"partner\",\n    \"data\": {\n      \"id\": 4,\n      \"name\": \"ibm\",\n      \"displayName\": \"IBM Cloud\",\n      \"type\": \"cloud-provider\",\n      \"roles\": [\n        \"cloud-provider\",\n        \"vendor\"\n      ],\n      \"status\": \"ACTIVE\",\n      \"contactEmail\": \"billing@ibm.com\",\n      \"website\": \"https://www.ibm.com/cloud\"\n    },\n    \"children\": []\n  },\n  {\n    \"id\": \"partner-5\",\n    \"name\": \"Oracle Cloud\",\n    \"type\": \"partner\",\n    \"data\": {\n      \"id\": 5,\n      \"name\": \"oracle\",\n      \"displayName\": \"Oracle Cloud\",\n      \"type\": \"cloud-provider\",\n      \"roles\": [\n        \"cloud-provider\",\n        \"vendor\"\n      ],\n      \"status\": \"ACTIVE\",\n      \"contactEmail\": \"billing@oracle.com\",\n      \"website\": \"https://www.oracle.com/cloud\"\n    },\n    \"children\": []\n  },\n  {\n    \"id\": \"partner-6\",\n    \"name\": \"Alibaba Cloud\",\n    \"type\": \"partner\",\n    \"data\": {\n      \"id\": 6,\n      \"name\": \"alibaba\",\n      \"displayName\": \"Alibaba Cloud\",\n      \"type\": \"cloud-provider\",\n      \"roles\": [\n        \"cloud-provider\",\n        \"vendor\"\n      ],\n      \"status\": \"ACTIVE\",\n      \"contactEmail\": \"billing@alibabacloud.com\",\n      \"website\": \"https://www.alibabacloud.com\"\n    },\n    \"children\": []\n  },\n  {\n    \"id\": \"partner-7\",\n    \"name\": \"DigitalOcean\",\n    \"type\": \"partner\",\n    \"data\": {\n      \"id\": 7,\n      \"name\": \"digitalocean\",\n      \"displayName\": \"DigitalOcean\",\n      \"type\": \"cloud-provider\",\n      \"roles\": [\n        \"cloud-provider\",\n        \"vendor\"\n      ],\n      \"status\": \"ACTIVE\",\n      \"contactEmail\": \"billing@digitalocean.com\",\n      \"website\": \"https://www.digitalocean.com\"\n    },\n    \"children\": []\n  },\n  {\n    \"id\": \"partner-8\",\n    \"name\": \"Akamai Connected Cloud (Linode)\",\n    \"type\": \"partner\",\n    \"data\": {\n      \"id\": 8,\n      \"name\": \"linode\",\n      \"displayName\": \"Akamai Connected Cloud (Linode)\",\n      \"type\": \"cloud-provider\",\n      \"roles\": [\n        \"cloud-provider\",\n        \"vendor\"\n      ],\n      \"status\": \"ACTIVE\",\n      \"contactEmail\": \"billing@linode.com\",\n      \"website\": \"https://www.linode.com\"\n    },\n    \"children\": []\n  },\n  {\n    \"id\": \"partner-9\",\n    \"name\": \"Vultr\",\n    \"type\": \"partner\",\n    \"data\": {\n      \"id\": 9,\n      \"name\": \"vultr\",\n      \"displayName\": \"Vultr\",\n      \"type\": \"cloud-provider\",\n      \"roles\": [\n        \"cloud-provider\",\n        \"vendor\"\n      ],\n      \"status\": \"ACTIVE\",\n      \"contactEmail\": \"billing@vultr.com\",\n      \"website\": \"https://www.vultr.com\"\n    },\n    \"children\": []\n  },\n  {\n    \"id\": \"partner-10\",\n    \"name\": \"OVHcloud\",\n    \"type\": \"partner\",\n    \"data\": {\n      \"id\": 10,\n      \"name\": \"ovhcloud\",\n      \"displayName\": \"OVHcloud\",\n      \"type\": \"cloud-provider\",\n      \"roles\": [\n        \"cloud-provider\",\n        \"vendor\"\n      ],\n      \"status\": \"ACTIVE\",\n      \"contactEmail\": \"billing@ovhcloud.com\",\n      \"website\": \"https://www.ovhcloud.com\"\n    },\n    \"children\": []\n  },\n  {\n    \"id\": \"partner-11\",\n    \"name\": \"Hetzner\",\n    \"type\": \"partner\",\n    \"data\": {\n      \"id\": 11,\n      \"name\": \"hetzner\",\n      \"displayName\": \"Hetzner\",\n      \"type\": \"cloud-provider\",\n      \"roles\": [\n        \"cloud-provider\",\n        \"vendor\"\n      ],\n      \"status\": \"ACTIVE\",\n      \"contactEmail\": \"billing@hetzner.com\",\n      \"website\": \"https://www.hetzner.com\"\n    },\n    \"children\": []\n  },\n  {\n    \"id\": \"partner-12\",\n    \"name\": \"Equinix Metal\",\n    \"type\": \"partner\",\n    \"data\": {\n      \"id\": 12,\n      \"name\": \"equinix\",\n      \"displayName\": \"Equinix Metal\",\n      \"type\": \"cloud-provider\",\n      \"roles\": [\n        \"cloud-provider\",\n        \"vendor\"\n      ],\n      \"status\": \"ACTIVE\",\n      \"contactEmail\": \"billing@equinix.com\",\n      \"website\": \"https://metal.equinix.com\"\n    },\n    \"children\": []\n  },\n  {\n    \"id\": \"partner-13\",\n    \"name\": \"Cloudflare\",\n    \"type\": \"partner\",\n    \"data\": {\n      \"id\": 13,\n      \"name\": \"cloudflare\",\n      \"displayName\": \"Cloudflare\",\n      \"type\": \"cloud-provider\",\n      \"roles\": [\n        \"cloud-provider\",\n        \"vendor\"\n      ],\n      \"status\": \"ACTIVE\",\n      \"contactEmail\": \"billing@cloudflare.com\",\n      \"website\": \"https://www.cloudflare.com\"\n    },\n    \"children\": []\n  },\n  {\n    \"id\": \"partner-14\",\n    \"name\": \"Contabo\",\n    \"type\": \"partner\",\n    \"data\": {\n      \"id\": 14,\n      \"name\": \"contabo\",\n      \"displayName\": \"Contabo\",\n      \"type\": \"cloud-provider\",\n      \"roles\": [\n        \"cloud-provider\",\n        \"vendor\"\n      ],\n      \"status\": \"ACTIVE\",\n      \"contactEmail\": \"billing@contabo.com\",\n      \"website\": \"https://contabo.com\"\n    },\n    \"children\": []\n  },\n  {\n    \"id\": \"partner-15\",\n    \"name\": \"Scaleway\",\n    \"type\": \"partner\",\n    \"data\": {\n      \"id\": 15,\n      \"name\": \"scaleway\",\n      \"displayName\": \"Scaleway\",\n      \"type\": \"cloud-provider\",\n      \"roles\": [\n        \"cloud-provider\",\n        \"vendor\"\n      ],\n      \"status\": \"ACTIVE\",\n      \"contactEmail\": \"billing@scaleway.com\",\n      \"website\": \"https://www.scaleway.com\"\n    },\n    \"children\": []\n  },\n  {\n    \"id\": \"partner-16\",\n    \"name\": \"Dell Technologies\",\n    \"type\": \"partner\",\n    \"data\": {\n      \"id\": 16,\n      \"name\": \"dell\",\n      \"displayName\": \"Dell Technologies\",\n      \"type\": \"vendor\",\n      \"roles\": [\n        \"hardware-vendor\",\n        \"vendor\"\n      ],\n      \"status\": \"ACTIVE\",\n      \"contactEmail\": \"sales@dell.com\",\n      \"website\": \"https://www.dell.com\"\n    },\n    \"children\": []\n  },\n  {\n    \"id\": \"partner-17\",\n    \"name\": \"Hewlett Packard Enterprise\",\n    \"type\": \"partner\",\n    \"data\": {\n      \"id\": 17,\n      \"name\": \"hp\",\n      \"displayName\": \"Hewlett Packard Enterprise\",\n      \"type\": \"vendor\",\n      \"roles\": [\n        \"hardware-vendor\",\n        \"vendor\"\n      ],\n      \"status\": \"ACTIVE\",\n      \"contactEmail\": \"sales@hpe.com\",\n      \"website\": \"https://www.hpe.com\"\n    },\n    \"children\": []\n  },\n  {\n    \"id\": \"partner-18\",\n    \"name\": \"Cisco Systems\",\n    \"type\": \"partner\",\n    \"data\": {\n      \"id\": 18,\n      \"name\": \"cisco\",\n      \"displayName\": \"Cisco Systems\",\n      \"type\": \"vendor\",\n      \"roles\": [\n        \"network-vendor\",\n        \"vendor\"\n      ],\n      \"status\": \"ACTIVE\",\n      \"contactEmail\": \"sales@cisco.com\",\n      \"website\": \"https://www.cisco.com\"\n    },\n    \"children\": []\n  },\n  {\n    \"id\": \"partner-19\",\n    \"name\": \"Juniper Networks\",\n    \"type\": \"partner\",\n    \"data\": {\n      \"id\": 19,\n      \"name\": \"juniper\",\n      \"displayName\": \"Juniper Networks\",\n      \"type\": \"vendor\",\n      \"roles\": [\n        \"network-vendor\",\n        \"vendor\"\n      ],\n      \"status\": \"ACTIVE\",\n      \"contactEmail\": \"sales@juniper.net\",\n      \"website\": \"https://www.juniper.net\"\n    },\n    \"children\": []\n  },\n  {\n    \"id\": \"partner-20\",\n    \"name\": \"VMware\",\n    \"type\": \"partner\",\n    \"data\": {\n      \"id\": 20,\n      \"name\": \"vmware\",\n      \"displayName\": \"VMware\",\n      \"type\": \"vendor\",\n      \"roles\": [\n        \"software-vendor\",\n        \"vendor\"\n      ],\n      \"status\": \"ACTIVE\",\n      \"contactEmail\": \"sales@vmware.com\",\n      \"website\": \"https://www.vmware.com\"\n    },\n    \"children\": []\n  },\n  {\n    \"id\": \"partner-21\",\n    \"name\": \"Red Hat\",\n    \"type\": \"partner\",\n    \"data\": {\n      \"id\": 21,\n      \"name\": \"redhat\",\n      \"displayName\": \"Red Hat\",\n      \"type\": \"vendor\",\n      \"roles\": [\n        \"software-vendor\",\n        \"vendor\"\n      ],\n      \"status\": \"ACTIVE\",\n      \"contactEmail\": \"sales@redhat.com\",\n      \"website\": \"https://www.redhat.com\"\n    },\n    \"children\": []\n  },\n  {\n    \"id\": \"partner-22\",\n    \"name\": \"Canonical (Ubuntu)\",\n    \"type\": \"partner\",\n    \"data\": {\n      \"id\": 22,\n      \"name\": \"canonical\",\n      \"displayName\": \"Canonical (Ubuntu)\",\n      \"type\": \"vendor\",\n      \"roles\": [\n        \"software-vendor\",\n        \"vendor\"\n      ],\n      \"status\": \"ACTIVE\",\n      \"contactEmail\": \"sales@canonical.com\",\n      \"website\": \"https://canonical.com\"\n    },\n    \"children\": []\n  },\n  {\n    \"id\": \"partner-23\",\n    \"name\": \"ACME Corporation\",\n    \"type\": \"partner\",\n    \"data\": {\n      \"id\": 23,\n      \"name\": \"acme-corp\",\n      \"displayName\": \"ACME Corporation\",\n      \"type\": \"customer\",\n      \"roles\": [\n        \"customer\"\n      ],\n      \"status\": \"ACTIVE\",\n      \"contactEmail\": \"contact@acme.com\",\n      \"website\": \"https://acme.com\"\n    },\n    \"children\": []\n  },\n  {\n    \"id\": \"partner-24\",\n    \"name\": \"Telcobright\",\n    \"type\": \"partner\",\n    \"data\": {\n      \"id\": 24,\n      \"name\": \"telcobright\",\n      \"displayName\": \"Telcobright\",\n      \"type\": \"service-provider\",\n      \"roles\": [\n        \"self\"\n      ],\n      \"status\": \"ACTIVE\",\n      \"contactEmail\": \"admin@telcobright.com\",\n      \"website\": \"https://telcobright.com\"\n    },\n    \"children\": []\n  },\n  {\n    \"id\": \"partner-25\",\n    \"name\": \"Tech Solutions Inc\",\n    \"type\": \"partner\",\n    \"data\": {\n      \"id\": 25,\n      \"name\": \"tech-solutions\",\n      \"displayName\": \"Tech Solutions Inc\",\n      \"type\": \"VENDOR\",\n      \"roles\": [\n        \"vendor\"\n      ],\n      \"status\": \"ACTIVE\",\n      \"contactEmail\": \"info@techsolutions.com\",\n      \"website\": \"https://www.techsolutions.com\"\n    },\n    \"children\": []\n  },\n  {\n    \"id\": \"partner-26\",\n    \"name\": \"Global Systems Ltd\",\n    \"type\": \"partner\",\n    \"data\": {\n      \"id\": 26,\n      \"name\": \"global-systems\",\n      \"displayName\": \"Global Systems Ltd\",\n      \"type\": \"CUSTOMER\",\n      \"roles\": [\n        \"customer\"\n      ],\n      \"status\": \"ACTIVE\",\n      \"contactEmail\": \"support@globalsystems.com\",\n      \"website\": \"https://www.globalsystems.com\"\n    },\n    \"children\": []\n  },\n  {\n    \"id\": \"partner-27\",\n    \"name\": \"Cloud Dynamics\",\n    \"type\": \"partner\",\n    \"data\": {\n      \"id\": 27,\n      \"name\": \"cloud-dynamics\",\n      \"displayName\": \"Cloud Dynamics\",\n      \"type\": \"VENDOR\",\n      \"roles\": [\n        \"vendor\"\n      ],\n      \"status\": \"ACTIVE\",\n      \"contactEmail\": \"hello@clouddynamics.io\",\n      \"website\": \"https://www.clouddynamics.io\"\n    },\n    \"children\": []\n  }\n]"],"source":"frontend"},{"timestamp":1758473410617,"isoTimestamp":"2025-09-21T16:50:10.617Z","level":"log","message":"üîç fetchInfrastructureData - tree from store: [\n  {\n    \"id\": \"partner-1\",\n    \"name\": \"Amazon Web Services (AWS)\",\n    \"type\": \"partner\",\n    \"data\": {\n      \"id\": 1,\n      \"name\": \"amazon\",\n      \"displayName\": \"Amazon Web Services (AWS)\",\n      \"type\": \"cloud-provider\",\n      \"roles\": [\n        \"cloud-provider\",\n        \"vendor\"\n      ],\n      \"status\": \"ACTIVE\",\n      \"contactEmail\": \"billing@aws.amazon.com\",\n      \"website\": \"https://aws.amazon.com\"\n    },\n    \"children\": []\n  },\n  {\n    \"id\": \"partner-2\",\n    \"name\": \"Google Cloud Platform\",\n    \"type\": \"partner\",\n    \"data\": {\n      \"id\": 2,\n      \"name\": \"google\",\n      \"displayName\": \"Google Cloud Platform\",\n      \"type\": \"cloud-provider\",\n      \"roles\": [\n        \"cloud-provider\",\n        \"vendor\"\n      ],\n      \"status\": \"ACTIVE\",\n      \"contactEmail\": \"billing@cloud.google.com\",\n      \"website\": \"https://cloud.google.com\"\n    },\n    \"children\": []\n  },\n  {\n    \"id\": \"partner-3\",\n    \"name\": \"Microsoft Azure\",\n    \"type\": \"partner\",\n    \"data\": {\n      \"id\": 3,\n      \"name\": \"microsoft\",\n      \"displayName\": \"Microsoft Azure\",\n      \"type\": \"cloud-provider\",\n      \"roles\": [\n        \"cloud-provider\",\n        \"vendor\"\n      ],\n      \"status\": \"ACTIVE\",\n      \"contactEmail\": \"billing@azure.microsoft.com\",\n      \"website\": \"https://azure.microsoft.com\"\n    },\n    \"children\": []\n  },\n  {\n    \"id\": \"partner-4\",\n    \"name\": \"IBM Cloud\",\n    \"type\": \"partner\",\n    \"data\": {\n      \"id\": 4,\n      \"name\": \"ibm\",\n      \"displayName\": \"IBM Cloud\",\n      \"type\": \"cloud-provider\",\n      \"roles\": [\n        \"cloud-provider\",\n        \"vendor\"\n      ],\n      \"status\": \"ACTIVE\",\n      \"contactEmail\": \"billing@ibm.com\",\n      \"website\": \"https://www.ibm.com/cloud\"\n    },\n    \"children\": []\n  },\n  {\n    \"id\": \"partner-5\",\n    \"name\": \"Oracle Cloud\",\n    \"type\": \"partner\",\n    \"data\": {\n      \"id\": 5,\n      \"name\": \"oracle\",\n      \"displayName\": \"Oracle Cloud\",\n      \"type\": \"cloud-provider\",\n      \"roles\": [\n        \"cloud-provider\",\n        \"vendor\"\n      ],\n      \"status\": \"ACTIVE\",\n      \"contactEmail\": \"billing@oracle.com\",\n      \"website\": \"https://www.oracle.com/cloud\"\n    },\n    \"children\": []\n  },\n  {\n    \"id\": \"partner-6\",\n    \"name\": \"Alibaba Cloud\",\n    \"type\": \"partner\",\n    \"data\": {\n      \"id\": 6,\n      \"name\": \"alibaba\",\n      \"displayName\": \"Alibaba Cloud\",\n      \"type\": \"cloud-provider\",\n      \"roles\": [\n        \"cloud-provider\",\n        \"vendor\"\n      ],\n      \"status\": \"ACTIVE\",\n      \"contactEmail\": \"billing@alibabacloud.com\",\n      \"website\": \"https://www.alibabacloud.com\"\n    },\n    \"children\": []\n  },\n  {\n    \"id\": \"partner-7\",\n    \"name\": \"DigitalOcean\",\n    \"type\": \"partner\",\n    \"data\": {\n      \"id\": 7,\n      \"name\": \"digitalocean\",\n      \"displayName\": \"DigitalOcean\",\n      \"type\": \"cloud-provider\",\n      \"roles\": [\n        \"cloud-provider\",\n        \"vendor\"\n      ],\n      \"status\": \"ACTIVE\",\n      \"contactEmail\": \"billing@digitalocean.com\",\n      \"website\": \"https://www.digitalocean.com\"\n    },\n    \"children\": []\n  },\n  {\n    \"id\": \"partner-8\",\n    \"name\": \"Akamai Connected Cloud (Linode)\",\n    \"type\": \"partner\",\n    \"data\": {\n      \"id\": 8,\n      \"name\": \"linode\",\n      \"displayName\": \"Akamai Connected Cloud (Linode)\",\n      \"type\": \"cloud-provider\",\n      \"roles\": [\n        \"cloud-provider\",\n        \"vendor\"\n      ],\n      \"status\": \"ACTIVE\",\n      \"contactEmail\": \"billing@linode.com\",\n      \"website\": \"https://www.linode.com\"\n    },\n    \"children\": []\n  },\n  {\n    \"id\": \"partner-9\",\n    \"name\": \"Vultr\",\n    \"type\": \"partner\",\n    \"data\": {\n      \"id\": 9,\n      \"name\": \"vultr\",\n      \"displayName\": \"Vultr\",\n      \"type\": \"cloud-provider\",\n      \"roles\": [\n        \"cloud-provider\",\n        \"vendor\"\n      ],\n      \"status\": \"ACTIVE\",\n      \"contactEmail\": \"billing@vultr.com\",\n      \"website\": \"https://www.vultr.com\"\n    },\n    \"children\": []\n  },\n  {\n    \"id\": \"partner-10\",\n    \"name\": \"OVHcloud\",\n    \"type\": \"partner\",\n    \"data\": {\n      \"id\": 10,\n      \"name\": \"ovhcloud\",\n      \"displayName\": \"OVHcloud\",\n      \"type\": \"cloud-provider\",\n      \"roles\": [\n        \"cloud-provider\",\n        \"vendor\"\n      ],\n      \"status\": \"ACTIVE\",\n      \"contactEmail\": \"billing@ovhcloud.com\",\n      \"website\": \"https://www.ovhcloud.com\"\n    },\n    \"children\": []\n  },\n  {\n    \"id\": \"partner-11\",\n    \"name\": \"Hetzner\",\n    \"type\": \"partner\",\n    \"data\": {\n      \"id\": 11,\n      \"name\": \"hetzner\",\n      \"displayName\": \"Hetzner\",\n      \"type\": \"cloud-provider\",\n      \"roles\": [\n        \"cloud-provider\",\n        \"vendor\"\n      ],\n      \"status\": \"ACTIVE\",\n      \"contactEmail\": \"billing@hetzner.com\",\n      \"website\": \"https://www.hetzner.com\"\n    },\n    \"children\": []\n  },\n  {\n    \"id\": \"partner-12\",\n    \"name\": \"Equinix Metal\",\n    \"type\": \"partner\",\n    \"data\": {\n      \"id\": 12,\n      \"name\": \"equinix\",\n      \"displayName\": \"Equinix Metal\",\n      \"type\": \"cloud-provider\",\n      \"roles\": [\n        \"cloud-provider\",\n        \"vendor\"\n      ],\n      \"status\": \"ACTIVE\",\n      \"contactEmail\": \"billing@equinix.com\",\n      \"website\": \"https://metal.equinix.com\"\n    },\n    \"children\": []\n  },\n  {\n    \"id\": \"partner-13\",\n    \"name\": \"Cloudflare\",\n    \"type\": \"partner\",\n    \"data\": {\n      \"id\": 13,\n      \"name\": \"cloudflare\",\n      \"displayName\": \"Cloudflare\",\n      \"type\": \"cloud-provider\",\n      \"roles\": [\n        \"cloud-provider\",\n        \"vendor\"\n      ],\n      \"status\": \"ACTIVE\",\n      \"contactEmail\": \"billing@cloudflare.com\",\n      \"website\": \"https://www.cloudflare.com\"\n    },\n    \"children\": []\n  },\n  {\n    \"id\": \"partner-14\",\n    \"name\": \"Contabo\",\n    \"type\": \"partner\",\n    \"data\": {\n      \"id\": 14,\n      \"name\": \"contabo\",\n      \"displayName\": \"Contabo\",\n      \"type\": \"cloud-provider\",\n      \"roles\": [\n        \"cloud-provider\",\n        \"vendor\"\n      ],\n      \"status\": \"ACTIVE\",\n      \"contactEmail\": \"billing@contabo.com\",\n      \"website\": \"https://contabo.com\"\n    },\n    \"children\": []\n  },\n  {\n    \"id\": \"partner-15\",\n    \"name\": \"Scaleway\",\n    \"type\": \"partner\",\n    \"data\": {\n      \"id\": 15,\n      \"name\": \"scaleway\",\n      \"displayName\": \"Scaleway\",\n      \"type\": \"cloud-provider\",\n      \"roles\": [\n        \"cloud-provider\",\n        \"vendor\"\n      ],\n      \"status\": \"ACTIVE\",\n      \"contactEmail\": \"billing@scaleway.com\",\n      \"website\": \"https://www.scaleway.com\"\n    },\n    \"children\": []\n  },\n  {\n    \"id\": \"partner-16\",\n    \"name\": \"Dell Technologies\",\n    \"type\": \"partner\",\n    \"data\": {\n      \"id\": 16,\n      \"name\": \"dell\",\n      \"displayName\": \"Dell Technologies\",\n      \"type\": \"vendor\",\n      \"roles\": [\n        \"hardware-vendor\",\n        \"vendor\"\n      ],\n      \"status\": \"ACTIVE\",\n      \"contactEmail\": \"sales@dell.com\",\n      \"website\": \"https://www.dell.com\"\n    },\n    \"children\": []\n  },\n  {\n    \"id\": \"partner-17\",\n    \"name\": \"Hewlett Packard Enterprise\",\n    \"type\": \"partner\",\n    \"data\": {\n      \"id\": 17,\n      \"name\": \"hp\",\n      \"displayName\": \"Hewlett Packard Enterprise\",\n      \"type\": \"vendor\",\n      \"roles\": [\n        \"hardware-vendor\",\n        \"vendor\"\n      ],\n      \"status\": \"ACTIVE\",\n      \"contactEmail\": \"sales@hpe.com\",\n      \"website\": \"https://www.hpe.com\"\n    },\n    \"children\": []\n  },\n  {\n    \"id\": \"partner-18\",\n    \"name\": \"Cisco Systems\",\n    \"type\": \"partner\",\n    \"data\": {\n      \"id\": 18,\n      \"name\": \"cisco\",\n      \"displayName\": \"Cisco Systems\",\n      \"type\": \"vendor\",\n      \"roles\": [\n        \"network-vendor\",\n        \"vendor\"\n      ],\n      \"status\": \"ACTIVE\",\n      \"contactEmail\": \"sales@cisco.com\",\n      \"website\": \"https://www.cisco.com\"\n    },\n    \"children\": []\n  },\n  {\n    \"id\": \"partner-19\",\n    \"name\": \"Juniper Networks\",\n    \"type\": \"partner\",\n    \"data\": {\n      \"id\": 19,\n      \"name\": \"juniper\",\n      \"displayName\": \"Juniper Networks\",\n      \"type\": \"vendor\",\n      \"roles\": [\n        \"network-vendor\",\n        \"vendor\"\n      ],\n      \"status\": \"ACTIVE\",\n      \"contactEmail\": \"sales@juniper.net\",\n      \"website\": \"https://www.juniper.net\"\n    },\n    \"children\": []\n  },\n  {\n    \"id\": \"partner-20\",\n    \"name\": \"VMware\",\n    \"type\": \"partner\",\n    \"data\": {\n      \"id\": 20,\n      \"name\": \"vmware\",\n      \"displayName\": \"VMware\",\n      \"type\": \"vendor\",\n      \"roles\": [\n        \"software-vendor\",\n        \"vendor\"\n      ],\n      \"status\": \"ACTIVE\",\n      \"contactEmail\": \"sales@vmware.com\",\n      \"website\": \"https://www.vmware.com\"\n    },\n    \"children\": []\n  },\n  {\n    \"id\": \"partner-21\",\n    \"name\": \"Red Hat\",\n    \"type\": \"partner\",\n    \"data\": {\n      \"id\": 21,\n      \"name\": \"redhat\",\n      \"displayName\": \"Red Hat\",\n      \"type\": \"vendor\",\n      \"roles\": [\n        \"software-vendor\",\n        \"vendor\"\n      ],\n      \"status\": \"ACTIVE\",\n      \"contactEmail\": \"sales@redhat.com\",\n      \"website\": \"https://www.redhat.com\"\n    },\n    \"children\": []\n  },\n  {\n    \"id\": \"partner-22\",\n    \"name\": \"Canonical (Ubuntu)\",\n    \"type\": \"partner\",\n    \"data\": {\n      \"id\": 22,\n      \"name\": \"canonical\",\n      \"displayName\": \"Canonical (Ubuntu)\",\n      \"type\": \"vendor\",\n      \"roles\": [\n        \"software-vendor\",\n        \"vendor\"\n      ],\n      \"status\": \"ACTIVE\",\n      \"contactEmail\": \"sales@canonical.com\",\n      \"website\": \"https://canonical.com\"\n    },\n    \"children\": []\n  },\n  {\n    \"id\": \"partner-23\",\n    \"name\": \"ACME Corporation\",\n    \"type\": \"partner\",\n    \"data\": {\n      \"id\": 23,\n      \"name\": \"acme-corp\",\n      \"displayName\": \"ACME Corporation\",\n      \"type\": \"customer\",\n      \"roles\": [\n        \"customer\"\n      ],\n      \"status\": \"ACTIVE\",\n      \"contactEmail\": \"contact@acme.com\",\n      \"website\": \"https://acme.com\"\n    },\n    \"children\": []\n  },\n  {\n    \"id\": \"partner-24\",\n    \"name\": \"Telcobright\",\n    \"type\": \"partner\",\n    \"data\": {\n      \"id\": 24,\n      \"name\": \"telcobright\",\n      \"displayName\": \"Telcobright\",\n      \"type\": \"service-provider\",\n      \"roles\": [\n        \"self\"\n      ],\n      \"status\": \"ACTIVE\",\n      \"contactEmail\": \"admin@telcobright.com\",\n      \"website\": \"https://telcobright.com\"\n    },\n    \"children\": []\n  },\n  {\n    \"id\": \"partner-25\",\n    \"name\": \"Tech Solutions Inc\",\n    \"type\": \"partner\",\n    \"data\": {\n      \"id\": 25,\n      \"name\": \"tech-solutions\",\n      \"displayName\": \"Tech Solutions Inc\",\n      \"type\": \"VENDOR\",\n      \"roles\": [\n        \"vendor\"\n      ],\n      \"status\": \"ACTIVE\",\n      \"contactEmail\": \"info@techsolutions.com\",\n      \"website\": \"https://www.techsolutions.com\"\n    },\n    \"children\": []\n  },\n  {\n    \"id\": \"partner-26\",\n    \"name\": \"Global Systems Ltd\",\n    \"type\": \"partner\",\n    \"data\": {\n      \"id\": 26,\n      \"name\": \"global-systems\",\n      \"displayName\": \"Global Systems Ltd\",\n      \"type\": \"CUSTOMER\",\n      \"roles\": [\n        \"customer\"\n      ],\n      \"status\": \"ACTIVE\",\n      \"contactEmail\": \"support@globalsystems.com\",\n      \"website\": \"https://www.globalsystems.com\"\n    },\n    \"children\": []\n  },\n  {\n    \"id\": \"partner-27\",\n    \"name\": \"Cloud Dynamics\",\n    \"type\": \"partner\",\n    \"data\": {\n      \"id\": 27,\n      \"name\": \"cloud-dynamics\",\n      \"displayName\": \"Cloud Dynamics\",\n      \"type\": \"VENDOR\",\n      \"roles\": [\n        \"vendor\"\n      ],\n      \"status\": \"ACTIVE\",\n      \"contactEmail\": \"hello@clouddynamics.io\",\n      \"website\": \"https://www.clouddynamics.io\"\n    },\n    \"children\": []\n  }\n]","args":["üîç fetchInfrastructureData - tree from store:",[{"id":"partner-1","name":"Amazon Web Services (AWS)","type":"partner","data":{"id":1,"name":"amazon","displayName":"Amazon Web Services (AWS)","type":"cloud-provider","roles":["cloud-provider","vendor"],"status":"ACTIVE","contactEmail":"billing@aws.amazon.com","website":"https://aws.amazon.com"},"children":[]},{"id":"partner-2","name":"Google Cloud Platform","type":"partner","data":{"id":2,"name":"google","displayName":"Google Cloud Platform","type":"cloud-provider","roles":["cloud-provider","vendor"],"status":"ACTIVE","contactEmail":"billing@cloud.google.com","website":"https://cloud.google.com"},"children":[]},{"id":"partner-3","name":"Microsoft Azure","type":"partner","data":{"id":3,"name":"microsoft","displayName":"Microsoft Azure","type":"cloud-provider","roles":["cloud-provider","vendor"],"status":"ACTIVE","contactEmail":"billing@azure.microsoft.com","website":"https://azure.microsoft.com"},"children":[]},{"id":"partner-4","name":"IBM Cloud","type":"partner","data":{"id":4,"name":"ibm","displayName":"IBM Cloud","type":"cloud-provider","roles":["cloud-provider","vendor"],"status":"ACTIVE","contactEmail":"billing@ibm.com","website":"https://www.ibm.com/cloud"},"children":[]},{"id":"partner-5","name":"Oracle Cloud","type":"partner","data":{"id":5,"name":"oracle","displayName":"Oracle Cloud","type":"cloud-provider","roles":["cloud-provider","vendor"],"status":"ACTIVE","contactEmail":"billing@oracle.com","website":"https://www.oracle.com/cloud"},"children":[]},{"id":"partner-6","name":"Alibaba Cloud","type":"partner","data":{"id":6,"name":"alibaba","displayName":"Alibaba Cloud","type":"cloud-provider","roles":["cloud-provider","vendor"],"status":"ACTIVE","contactEmail":"billing@alibabacloud.com","website":"https://www.alibabacloud.com"},"children":[]},{"id":"partner-7","name":"DigitalOcean","type":"partner","data":{"id":7,"name":"digitalocean","displayName":"DigitalOcean","type":"cloud-provider","roles":["cloud-provider","vendor"],"status":"ACTIVE","contactEmail":"billing@digitalocean.com","website":"https://www.digitalocean.com"},"children":[]},{"id":"partner-8","name":"Akamai Connected Cloud (Linode)","type":"partner","data":{"id":8,"name":"linode","displayName":"Akamai Connected Cloud (Linode)","type":"cloud-provider","roles":["cloud-provider","vendor"],"status":"ACTIVE","contactEmail":"billing@linode.com","website":"https://www.linode.com"},"children":[]},{"id":"partner-9","name":"Vultr","type":"partner","data":{"id":9,"name":"vultr","displayName":"Vultr","type":"cloud-provider","roles":["cloud-provider","vendor"],"status":"ACTIVE","contactEmail":"billing@vultr.com","website":"https://www.vultr.com"},"children":[]},{"id":"partner-10","name":"OVHcloud","type":"partner","data":{"id":10,"name":"ovhcloud","displayName":"OVHcloud","type":"cloud-provider","roles":["cloud-provider","vendor"],"status":"ACTIVE","contactEmail":"billing@ovhcloud.com","website":"https://www.ovhcloud.com"},"children":[]},{"id":"partner-11","name":"Hetzner","type":"partner","data":{"id":11,"name":"hetzner","displayName":"Hetzner","type":"cloud-provider","roles":["cloud-provider","vendor"],"status":"ACTIVE","contactEmail":"billing@hetzner.com","website":"https://www.hetzner.com"},"children":[]},{"id":"partner-12","name":"Equinix Metal","type":"partner","data":{"id":12,"name":"equinix","displayName":"Equinix Metal","type":"cloud-provider","roles":["cloud-provider","vendor"],"status":"ACTIVE","contactEmail":"billing@equinix.com","website":"https://metal.equinix.com"},"children":[]},{"id":"partner-13","name":"Cloudflare","type":"partner","data":{"id":13,"name":"cloudflare","displayName":"Cloudflare","type":"cloud-provider","roles":["cloud-provider","vendor"],"status":"ACTIVE","contactEmail":"billing@cloudflare.com","website":"https://www.cloudflare.com"},"children":[]},{"id":"partner-14","name":"Contabo","type":"partner","data":{"id":14,"name":"contabo","displayName":"Contabo","type":"cloud-provider","roles":["cloud-provider","vendor"],"status":"ACTIVE","contactEmail":"billing@contabo.com","website":"https://contabo.com"},"children":[]},{"id":"partner-15","name":"Scaleway","type":"partner","data":{"id":15,"name":"scaleway","displayName":"Scaleway","type":"cloud-provider","roles":["cloud-provider","vendor"],"status":"ACTIVE","contactEmail":"billing@scaleway.com","website":"https://www.scaleway.com"},"children":[]},{"id":"partner-16","name":"Dell Technologies","type":"partner","data":{"id":16,"name":"dell","displayName":"Dell Technologies","type":"vendor","roles":["hardware-vendor","vendor"],"status":"ACTIVE","contactEmail":"sales@dell.com","website":"https://www.dell.com"},"children":[]},{"id":"partner-17","name":"Hewlett Packard Enterprise","type":"partner","data":{"id":17,"name":"hp","displayName":"Hewlett Packard Enterprise","type":"vendor","roles":["hardware-vendor","vendor"],"status":"ACTIVE","contactEmail":"sales@hpe.com","website":"https://www.hpe.com"},"children":[]},{"id":"partner-18","name":"Cisco Systems","type":"partner","data":{"id":18,"name":"cisco","displayName":"Cisco Systems","type":"vendor","roles":["network-vendor","vendor"],"status":"ACTIVE","contactEmail":"sales@cisco.com","website":"https://www.cisco.com"},"children":[]},{"id":"partner-19","name":"Juniper Networks","type":"partner","data":{"id":19,"name":"juniper","displayName":"Juniper Networks","type":"vendor","roles":["network-vendor","vendor"],"status":"ACTIVE","contactEmail":"sales@juniper.net","website":"https://www.juniper.net"},"children":[]},{"id":"partner-20","name":"VMware","type":"partner","data":{"id":20,"name":"vmware","displayName":"VMware","type":"vendor","roles":["software-vendor","vendor"],"status":"ACTIVE","contactEmail":"sales@vmware.com","website":"https://www.vmware.com"},"children":[]},{"id":"partner-21","name":"Red Hat","type":"partner","data":{"id":21,"name":"redhat","displayName":"Red Hat","type":"vendor","roles":["software-vendor","vendor"],"status":"ACTIVE","contactEmail":"sales@redhat.com","website":"https://www.redhat.com"},"children":[]},{"id":"partner-22","name":"Canonical (Ubuntu)","type":"partner","data":{"id":22,"name":"canonical","displayName":"Canonical (Ubuntu)","type":"vendor","roles":["software-vendor","vendor"],"status":"ACTIVE","contactEmail":"sales@canonical.com","website":"https://canonical.com"},"children":[]},{"id":"partner-23","name":"ACME Corporation","type":"partner","data":{"id":23,"name":"acme-corp","displayName":"ACME Corporation","type":"customer","roles":["customer"],"status":"ACTIVE","contactEmail":"contact@acme.com","website":"https://acme.com"},"children":[]},{"id":"partner-24","name":"Telcobright","type":"partner","data":{"id":24,"name":"telcobright","displayName":"Telcobright","type":"service-provider","roles":["self"],"status":"ACTIVE","contactEmail":"admin@telcobright.com","website":"https://telcobright.com"},"children":[]},{"id":"partner-25","name":"Tech Solutions Inc","type":"partner","data":{"id":25,"name":"tech-solutions","displayName":"Tech Solutions Inc","type":"VENDOR","roles":["vendor"],"status":"ACTIVE","contactEmail":"info@techsolutions.com","website":"https://www.techsolutions.com"},"children":[]},{"id":"partner-26","name":"Global Systems Ltd","type":"partner","data":{"id":26,"name":"global-systems","displayName":"Global Systems Ltd","type":"CUSTOMER","roles":["customer"],"status":"ACTIVE","contactEmail":"support@globalsystems.com","website":"https://www.globalsystems.com"},"children":[]},{"id":"partner-27","name":"Cloud Dynamics","type":"partner","data":{"id":27,"name":"cloud-dynamics","displayName":"Cloud Dynamics","type":"VENDOR","roles":["vendor"],"status":"ACTIVE","contactEmail":"hello@clouddynamics.io","website":"https://www.clouddynamics.io"},"children":[]}]],"source":"frontend"},{"timestamp":1758473410618,"isoTimestamp":"2025-09-21T16:50:10.618Z","level":"log","message":"üîç fetchInfrastructureData - partners from store: []","args":["üîç fetchInfrastructureData - partners from store:",[]],"source":"frontend"},{"timestamp":1758473410619,"isoTimestamp":"2025-09-21T16:50:10.619Z","level":"log","message":"üìä renderTreeItems called with 27 nodes: [\n  {\n    \"id\": \"partner-1\",\n    \"name\": \"Amazon Web Services (AWS)\",\n    \"type\": \"partner\",\n    \"data\": {\n      \"id\": 1,\n      \"name\": \"amazon\",\n      \"displayName\": \"Amazon Web Services (AWS)\",\n      \"type\": \"cloud-provider\",\n      \"roles\": [\n        \"cloud-provider\",\n        \"vendor\"\n      ],\n      \"status\": \"ACTIVE\",\n      \"contactEmail\": \"billing@aws.amazon.com\",\n      \"website\": \"https://aws.amazon.com\"\n    },\n    \"children\": []\n  },\n  {\n    \"id\": \"partner-2\",\n    \"name\": \"Google Cloud Platform\",\n    \"type\": \"partner\",\n    \"data\": {\n      \"id\": 2,\n      \"name\": \"google\",\n      \"displayName\": \"Google Cloud Platform\",\n      \"type\": \"cloud-provider\",\n      \"roles\": [\n        \"cloud-provider\",\n        \"vendor\"\n      ],\n      \"status\": \"ACTIVE\",\n      \"contactEmail\": \"billing@cloud.google.com\",\n      \"website\": \"https://cloud.google.com\"\n    },\n    \"children\": []\n  },\n  {\n    \"id\": \"partner-3\",\n    \"name\": \"Microsoft Azure\",\n    \"type\": \"partner\",\n    \"data\": {\n      \"id\": 3,\n      \"name\": \"microsoft\",\n      \"displayName\": \"Microsoft Azure\",\n      \"type\": \"cloud-provider\",\n      \"roles\": [\n        \"cloud-provider\",\n        \"vendor\"\n      ],\n      \"status\": \"ACTIVE\",\n      \"contactEmail\": \"billing@azure.microsoft.com\",\n      \"website\": \"https://azure.microsoft.com\"\n    },\n    \"children\": []\n  },\n  {\n    \"id\": \"partner-4\",\n    \"name\": \"IBM Cloud\",\n    \"type\": \"partner\",\n    \"data\": {\n      \"id\": 4,\n      \"name\": \"ibm\",\n      \"displayName\": \"IBM Cloud\",\n      \"type\": \"cloud-provider\",\n      \"roles\": [\n        \"cloud-provider\",\n        \"vendor\"\n      ],\n      \"status\": \"ACTIVE\",\n      \"contactEmail\": \"billing@ibm.com\",\n      \"website\": \"https://www.ibm.com/cloud\"\n    },\n    \"children\": []\n  },\n  {\n    \"id\": \"partner-5\",\n    \"name\": \"Oracle Cloud\",\n    \"type\": \"partner\",\n    \"data\": {\n      \"id\": 5,\n      \"name\": \"oracle\",\n      \"displayName\": \"Oracle Cloud\",\n      \"type\": \"cloud-provider\",\n      \"roles\": [\n        \"cloud-provider\",\n        \"vendor\"\n      ],\n      \"status\": \"ACTIVE\",\n      \"contactEmail\": \"billing@oracle.com\",\n      \"website\": \"https://www.oracle.com/cloud\"\n    },\n    \"children\": []\n  },\n  {\n    \"id\": \"partner-6\",\n    \"name\": \"Alibaba Cloud\",\n    \"type\": \"partner\",\n    \"data\": {\n      \"id\": 6,\n      \"name\": \"alibaba\",\n      \"displayName\": \"Alibaba Cloud\",\n      \"type\": \"cloud-provider\",\n      \"roles\": [\n        \"cloud-provider\",\n        \"vendor\"\n      ],\n      \"status\": \"ACTIVE\",\n      \"contactEmail\": \"billing@alibabacloud.com\",\n      \"website\": \"https://www.alibabacloud.com\"\n    },\n    \"children\": []\n  },\n  {\n    \"id\": \"partner-7\",\n    \"name\": \"DigitalOcean\",\n    \"type\": \"partner\",\n    \"data\": {\n      \"id\": 7,\n      \"name\": \"digitalocean\",\n      \"displayName\": \"DigitalOcean\",\n      \"type\": \"cloud-provider\",\n      \"roles\": [\n        \"cloud-provider\",\n        \"vendor\"\n      ],\n      \"status\": \"ACTIVE\",\n      \"contactEmail\": \"billing@digitalocean.com\",\n      \"website\": \"https://www.digitalocean.com\"\n    },\n    \"children\": []\n  },\n  {\n    \"id\": \"partner-8\",\n    \"name\": \"Akamai Connected Cloud (Linode)\",\n    \"type\": \"partner\",\n    \"data\": {\n      \"id\": 8,\n      \"name\": \"linode\",\n      \"displayName\": \"Akamai Connected Cloud (Linode)\",\n      \"type\": \"cloud-provider\",\n      \"roles\": [\n        \"cloud-provider\",\n        \"vendor\"\n      ],\n      \"status\": \"ACTIVE\",\n      \"contactEmail\": \"billing@linode.com\",\n      \"website\": \"https://www.linode.com\"\n    },\n    \"children\": []\n  },\n  {\n    \"id\": \"partner-9\",\n    \"name\": \"Vultr\",\n    \"type\": \"partner\",\n    \"data\": {\n      \"id\": 9,\n      \"name\": \"vultr\",\n      \"displayName\": \"Vultr\",\n      \"type\": \"cloud-provider\",\n      \"roles\": [\n        \"cloud-provider\",\n        \"vendor\"\n      ],\n      \"status\": \"ACTIVE\",\n      \"contactEmail\": \"billing@vultr.com\",\n      \"website\": \"https://www.vultr.com\"\n    },\n    \"children\": []\n  },\n  {\n    \"id\": \"partner-10\",\n    \"name\": \"OVHcloud\",\n    \"type\": \"partner\",\n    \"data\": {\n      \"id\": 10,\n      \"name\": \"ovhcloud\",\n      \"displayName\": \"OVHcloud\",\n      \"type\": \"cloud-provider\",\n      \"roles\": [\n        \"cloud-provider\",\n        \"vendor\"\n      ],\n      \"status\": \"ACTIVE\",\n      \"contactEmail\": \"billing@ovhcloud.com\",\n      \"website\": \"https://www.ovhcloud.com\"\n    },\n    \"children\": []\n  },\n  {\n    \"id\": \"partner-11\",\n    \"name\": \"Hetzner\",\n    \"type\": \"partner\",\n    \"data\": {\n      \"id\": 11,\n      \"name\": \"hetzner\",\n      \"displayName\": \"Hetzner\",\n      \"type\": \"cloud-provider\",\n      \"roles\": [\n        \"cloud-provider\",\n        \"vendor\"\n      ],\n      \"status\": \"ACTIVE\",\n      \"contactEmail\": \"billing@hetzner.com\",\n      \"website\": \"https://www.hetzner.com\"\n    },\n    \"children\": []\n  },\n  {\n    \"id\": \"partner-12\",\n    \"name\": \"Equinix Metal\",\n    \"type\": \"partner\",\n    \"data\": {\n      \"id\": 12,\n      \"name\": \"equinix\",\n      \"displayName\": \"Equinix Metal\",\n      \"type\": \"cloud-provider\",\n      \"roles\": [\n        \"cloud-provider\",\n        \"vendor\"\n      ],\n      \"status\": \"ACTIVE\",\n      \"contactEmail\": \"billing@equinix.com\",\n      \"website\": \"https://metal.equinix.com\"\n    },\n    \"children\": []\n  },\n  {\n    \"id\": \"partner-13\",\n    \"name\": \"Cloudflare\",\n    \"type\": \"partner\",\n    \"data\": {\n      \"id\": 13,\n      \"name\": \"cloudflare\",\n      \"displayName\": \"Cloudflare\",\n      \"type\": \"cloud-provider\",\n      \"roles\": [\n        \"cloud-provider\",\n        \"vendor\"\n      ],\n      \"status\": \"ACTIVE\",\n      \"contactEmail\": \"billing@cloudflare.com\",\n      \"website\": \"https://www.cloudflare.com\"\n    },\n    \"children\": []\n  },\n  {\n    \"id\": \"partner-14\",\n    \"name\": \"Contabo\",\n    \"type\": \"partner\",\n    \"data\": {\n      \"id\": 14,\n      \"name\": \"contabo\",\n      \"displayName\": \"Contabo\",\n      \"type\": \"cloud-provider\",\n      \"roles\": [\n        \"cloud-provider\",\n        \"vendor\"\n      ],\n      \"status\": \"ACTIVE\",\n      \"contactEmail\": \"billing@contabo.com\",\n      \"website\": \"https://contabo.com\"\n    },\n    \"children\": []\n  },\n  {\n    \"id\": \"partner-15\",\n    \"name\": \"Scaleway\",\n    \"type\": \"partner\",\n    \"data\": {\n      \"id\": 15,\n      \"name\": \"scaleway\",\n      \"displayName\": \"Scaleway\",\n      \"type\": \"cloud-provider\",\n      \"roles\": [\n        \"cloud-provider\",\n        \"vendor\"\n      ],\n      \"status\": \"ACTIVE\",\n      \"contactEmail\": \"billing@scaleway.com\",\n      \"website\": \"https://www.scaleway.com\"\n    },\n    \"children\": []\n  },\n  {\n    \"id\": \"partner-16\",\n    \"name\": \"Dell Technologies\",\n    \"type\": \"partner\",\n    \"data\": {\n      \"id\": 16,\n      \"name\": \"dell\",\n      \"displayName\": \"Dell Technologies\",\n      \"type\": \"vendor\",\n      \"roles\": [\n        \"hardware-vendor\",\n        \"vendor\"\n      ],\n      \"status\": \"ACTIVE\",\n      \"contactEmail\": \"sales@dell.com\",\n      \"website\": \"https://www.dell.com\"\n    },\n    \"children\": []\n  },\n  {\n    \"id\": \"partner-17\",\n    \"name\": \"Hewlett Packard Enterprise\",\n    \"type\": \"partner\",\n    \"data\": {\n      \"id\": 17,\n      \"name\": \"hp\",\n      \"displayName\": \"Hewlett Packard Enterprise\",\n      \"type\": \"vendor\",\n      \"roles\": [\n        \"hardware-vendor\",\n        \"vendor\"\n      ],\n      \"status\": \"ACTIVE\",\n      \"contactEmail\": \"sales@hpe.com\",\n      \"website\": \"https://www.hpe.com\"\n    },\n    \"children\": []\n  },\n  {\n    \"id\": \"partner-18\",\n    \"name\": \"Cisco Systems\",\n    \"type\": \"partner\",\n    \"data\": {\n      \"id\": 18,\n      \"name\": \"cisco\",\n      \"displayName\": \"Cisco Systems\",\n      \"type\": \"vendor\",\n      \"roles\": [\n        \"network-vendor\",\n        \"vendor\"\n      ],\n      \"status\": \"ACTIVE\",\n      \"contactEmail\": \"sales@cisco.com\",\n      \"website\": \"https://www.cisco.com\"\n    },\n    \"children\": []\n  },\n  {\n    \"id\": \"partner-19\",\n    \"name\": \"Juniper Networks\",\n    \"type\": \"partner\",\n    \"data\": {\n      \"id\": 19,\n      \"name\": \"juniper\",\n      \"displayName\": \"Juniper Networks\",\n      \"type\": \"vendor\",\n      \"roles\": [\n        \"network-vendor\",\n        \"vendor\"\n      ],\n      \"status\": \"ACTIVE\",\n      \"contactEmail\": \"sales@juniper.net\",\n      \"website\": \"https://www.juniper.net\"\n    },\n    \"children\": []\n  },\n  {\n    \"id\": \"partner-20\",\n    \"name\": \"VMware\",\n    \"type\": \"partner\",\n    \"data\": {\n      \"id\": 20,\n      \"name\": \"vmware\",\n      \"displayName\": \"VMware\",\n      \"type\": \"vendor\",\n      \"roles\": [\n        \"software-vendor\",\n        \"vendor\"\n      ],\n      \"status\": \"ACTIVE\",\n      \"contactEmail\": \"sales@vmware.com\",\n      \"website\": \"https://www.vmware.com\"\n    },\n    \"children\": []\n  },\n  {\n    \"id\": \"partner-21\",\n    \"name\": \"Red Hat\",\n    \"type\": \"partner\",\n    \"data\": {\n      \"id\": 21,\n      \"name\": \"redhat\",\n      \"displayName\": \"Red Hat\",\n      \"type\": \"vendor\",\n      \"roles\": [\n        \"software-vendor\",\n        \"vendor\"\n      ],\n      \"status\": \"ACTIVE\",\n      \"contactEmail\": \"sales@redhat.com\",\n      \"website\": \"https://www.redhat.com\"\n    },\n    \"children\": []\n  },\n  {\n    \"id\": \"partner-22\",\n    \"name\": \"Canonical (Ubuntu)\",\n    \"type\": \"partner\",\n    \"data\": {\n      \"id\": 22,\n      \"name\": \"canonical\",\n      \"displayName\": \"Canonical (Ubuntu)\",\n      \"type\": \"vendor\",\n      \"roles\": [\n        \"software-vendor\",\n        \"vendor\"\n      ],\n      \"status\": \"ACTIVE\",\n      \"contactEmail\": \"sales@canonical.com\",\n      \"website\": \"https://canonical.com\"\n    },\n    \"children\": []\n  },\n  {\n    \"id\": \"partner-23\",\n    \"name\": \"ACME Corporation\",\n    \"type\": \"partner\",\n    \"data\": {\n      \"id\": 23,\n      \"name\": \"acme-corp\",\n      \"displayName\": \"ACME Corporation\",\n      \"type\": \"customer\",\n      \"roles\": [\n        \"customer\"\n      ],\n      \"status\": \"ACTIVE\",\n      \"contactEmail\": \"contact@acme.com\",\n      \"website\": \"https://acme.com\"\n    },\n    \"children\": []\n  },\n  {\n    \"id\": \"partner-24\",\n    \"name\": \"Telcobright\",\n    \"type\": \"partner\",\n    \"data\": {\n      \"id\": 24,\n      \"name\": \"telcobright\",\n      \"displayName\": \"Telcobright\",\n      \"type\": \"service-provider\",\n      \"roles\": [\n        \"self\"\n      ],\n      \"status\": \"ACTIVE\",\n      \"contactEmail\": \"admin@telcobright.com\",\n      \"website\": \"https://telcobright.com\"\n    },\n    \"children\": []\n  },\n  {\n    \"id\": \"partner-25\",\n    \"name\": \"Tech Solutions Inc\",\n    \"type\": \"partner\",\n    \"data\": {\n      \"id\": 25,\n      \"name\": \"tech-solutions\",\n      \"displayName\": \"Tech Solutions Inc\",\n      \"type\": \"VENDOR\",\n      \"roles\": [\n        \"vendor\"\n      ],\n      \"status\": \"ACTIVE\",\n      \"contactEmail\": \"info@techsolutions.com\",\n      \"website\": \"https://www.techsolutions.com\"\n    },\n    \"children\": []\n  },\n  {\n    \"id\": \"partner-26\",\n    \"name\": \"Global Systems Ltd\",\n    \"type\": \"partner\",\n    \"data\": {\n      \"id\": 26,\n      \"name\": \"global-systems\",\n      \"displayName\": \"Global Systems Ltd\",\n      \"type\": \"CUSTOMER\",\n      \"roles\": [\n        \"customer\"\n      ],\n      \"status\": \"ACTIVE\",\n      \"contactEmail\": \"support@globalsystems.com\",\n      \"website\": \"https://www.globalsystems.com\"\n    },\n    \"children\": []\n  },\n  {\n    \"id\": \"partner-27\",\n    \"name\": \"Cloud Dynamics\",\n    \"type\": \"partner\",\n    \"data\": {\n      \"id\": 27,\n      \"name\": \"cloud-dynamics\",\n      \"displayName\": \"Cloud Dynamics\",\n      \"type\": \"VENDOR\",\n      \"roles\": [\n        \"vendor\"\n      ],\n      \"status\": \"ACTIVE\",\n      \"contactEmail\": \"hello@clouddynamics.io\",\n      \"website\": \"https://www.clouddynamics.io\"\n    },\n    \"children\": []\n  }\n]","args":["üìä renderTreeItems called with",27,"nodes:",[{"id":"partner-1","name":"Amazon Web Services (AWS)","type":"partner","data":{"id":1,"name":"amazon","displayName":"Amazon Web Services (AWS)","type":"cloud-provider","roles":["cloud-provider","vendor"],"status":"ACTIVE","contactEmail":"billing@aws.amazon.com","website":"https://aws.amazon.com"},"children":[]},{"id":"partner-2","name":"Google Cloud Platform","type":"partner","data":{"id":2,"name":"google","displayName":"Google Cloud Platform","type":"cloud-provider","roles":["cloud-provider","vendor"],"status":"ACTIVE","contactEmail":"billing@cloud.google.com","website":"https://cloud.google.com"},"children":[]},{"id":"partner-3","name":"Microsoft Azure","type":"partner","data":{"id":3,"name":"microsoft","displayName":"Microsoft Azure","type":"cloud-provider","roles":["cloud-provider","vendor"],"status":"ACTIVE","contactEmail":"billing@azure.microsoft.com","website":"https://azure.microsoft.com"},"children":[]},{"id":"partner-4","name":"IBM Cloud","type":"partner","data":{"id":4,"name":"ibm","displayName":"IBM Cloud","type":"cloud-provider","roles":["cloud-provider","vendor"],"status":"ACTIVE","contactEmail":"billing@ibm.com","website":"https://www.ibm.com/cloud"},"children":[]},{"id":"partner-5","name":"Oracle Cloud","type":"partner","data":{"id":5,"name":"oracle","displayName":"Oracle Cloud","type":"cloud-provider","roles":["cloud-provider","vendor"],"status":"ACTIVE","contactEmail":"billing@oracle.com","website":"https://www.oracle.com/cloud"},"children":[]},{"id":"partner-6","name":"Alibaba Cloud","type":"partner","data":{"id":6,"name":"alibaba","displayName":"Alibaba Cloud","type":"cloud-provider","roles":["cloud-provider","vendor"],"status":"ACTIVE","contactEmail":"billing@alibabacloud.com","website":"https://www.alibabacloud.com"},"children":[]},{"id":"partner-7","name":"DigitalOcean","type":"partner","data":{"id":7,"name":"digitalocean","displayName":"DigitalOcean","type":"cloud-provider","roles":["cloud-provider","vendor"],"status":"ACTIVE","contactEmail":"billing@digitalocean.com","website":"https://www.digitalocean.com"},"children":[]},{"id":"partner-8","name":"Akamai Connected Cloud (Linode)","type":"partner","data":{"id":8,"name":"linode","displayName":"Akamai Connected Cloud (Linode)","type":"cloud-provider","roles":["cloud-provider","vendor"],"status":"ACTIVE","contactEmail":"billing@linode.com","website":"https://www.linode.com"},"children":[]},{"id":"partner-9","name":"Vultr","type":"partner","data":{"id":9,"name":"vultr","displayName":"Vultr","type":"cloud-provider","roles":["cloud-provider","vendor"],"status":"ACTIVE","contactEmail":"billing@vultr.com","website":"https://www.vultr.com"},"children":[]},{"id":"partner-10","name":"OVHcloud","type":"partner","data":{"id":10,"name":"ovhcloud","displayName":"OVHcloud","type":"cloud-provider","roles":["cloud-provider","vendor"],"status":"ACTIVE","contactEmail":"billing@ovhcloud.com","website":"https://www.ovhcloud.com"},"children":[]},{"id":"partner-11","name":"Hetzner","type":"partner","data":{"id":11,"name":"hetzner","displayName":"Hetzner","type":"cloud-provider","roles":["cloud-provider","vendor"],"status":"ACTIVE","contactEmail":"billing@hetzner.com","website":"https://www.hetzner.com"},"children":[]},{"id":"partner-12","name":"Equinix Metal","type":"partner","data":{"id":12,"name":"equinix","displayName":"Equinix Metal","type":"cloud-provider","roles":["cloud-provider","vendor"],"status":"ACTIVE","contactEmail":"billing@equinix.com","website":"https://metal.equinix.com"},"children":[]},{"id":"partner-13","name":"Cloudflare","type":"partner","data":{"id":13,"name":"cloudflare","displayName":"Cloudflare","type":"cloud-provider","roles":["cloud-provider","vendor"],"status":"ACTIVE","contactEmail":"billing@cloudflare.com","website":"https://www.cloudflare.com"},"children":[]},{"id":"partner-14","name":"Contabo","type":"partner","data":{"id":14,"name":"contabo","displayName":"Contabo","type":"cloud-provider","roles":["cloud-provider","vendor"],"status":"ACTIVE","contactEmail":"billing@contabo.com","website":"https://contabo.com"},"children":[]},{"id":"partner-15","name":"Scaleway","type":"partner","data":{"id":15,"name":"scaleway","displayName":"Scaleway","type":"cloud-provider","roles":["cloud-provider","vendor"],"status":"ACTIVE","contactEmail":"billing@scaleway.com","website":"https://www.scaleway.com"},"children":[]},{"id":"partner-16","name":"Dell Technologies","type":"partner","data":{"id":16,"name":"dell","displayName":"Dell Technologies","type":"vendor","roles":["hardware-vendor","vendor"],"status":"ACTIVE","contactEmail":"sales@dell.com","website":"https://www.dell.com"},"children":[]},{"id":"partner-17","name":"Hewlett Packard Enterprise","type":"partner","data":{"id":17,"name":"hp","displayName":"Hewlett Packard Enterprise","type":"vendor","roles":["hardware-vendor","vendor"],"status":"ACTIVE","contactEmail":"sales@hpe.com","website":"https://www.hpe.com"},"children":[]},{"id":"partner-18","name":"Cisco Systems","type":"partner","data":{"id":18,"name":"cisco","displayName":"Cisco Systems","type":"vendor","roles":["network-vendor","vendor"],"status":"ACTIVE","contactEmail":"sales@cisco.com","website":"https://www.cisco.com"},"children":[]},{"id":"partner-19","name":"Juniper Networks","type":"partner","data":{"id":19,"name":"juniper","displayName":"Juniper Networks","type":"vendor","roles":["network-vendor","vendor"],"status":"ACTIVE","contactEmail":"sales@juniper.net","website":"https://www.juniper.net"},"children":[]},{"id":"partner-20","name":"VMware","type":"partner","data":{"id":20,"name":"vmware","displayName":"VMware","type":"vendor","roles":["software-vendor","vendor"],"status":"ACTIVE","contactEmail":"sales@vmware.com","website":"https://www.vmware.com"},"children":[]},{"id":"partner-21","name":"Red Hat","type":"partner","data":{"id":21,"name":"redhat","displayName":"Red Hat","type":"vendor","roles":["software-vendor","vendor"],"status":"ACTIVE","contactEmail":"sales@redhat.com","website":"https://www.redhat.com"},"children":[]},{"id":"partner-22","name":"Canonical (Ubuntu)","type":"partner","data":{"id":22,"name":"canonical","displayName":"Canonical (Ubuntu)","type":"vendor","roles":["software-vendor","vendor"],"status":"ACTIVE","contactEmail":"sales@canonical.com","website":"https://canonical.com"},"children":[]},{"id":"partner-23","name":"ACME Corporation","type":"partner","data":{"id":23,"name":"acme-corp","displayName":"ACME Corporation","type":"customer","roles":["customer"],"status":"ACTIVE","contactEmail":"contact@acme.com","website":"https://acme.com"},"children":[]},{"id":"partner-24","name":"Telcobright","type":"partner","data":{"id":24,"name":"telcobright","displayName":"Telcobright","type":"service-provider","roles":["self"],"status":"ACTIVE","contactEmail":"admin@telcobright.com","website":"https://telcobright.com"},"children":[]},{"id":"partner-25","name":"Tech Solutions Inc","type":"partner","data":{"id":25,"name":"tech-solutions","displayName":"Tech Solutions Inc","type":"VENDOR","roles":["vendor"],"status":"ACTIVE","contactEmail":"info@techsolutions.com","website":"https://www.techsolutions.com"},"children":[]},{"id":"partner-26","name":"Global Systems Ltd","type":"partner","data":{"id":26,"name":"global-systems","displayName":"Global Systems Ltd","type":"CUSTOMER","roles":["customer"],"status":"ACTIVE","contactEmail":"support@globalsystems.com","website":"https://www.globalsystems.com"},"children":[]},{"id":"partner-27","name":"Cloud Dynamics","type":"partner","data":{"id":27,"name":"cloud-dynamics","displayName":"Cloud Dynamics","type":"VENDOR","roles":["vendor"],"status":"ACTIVE","contactEmail":"hello@clouddynamics.io","website":"https://www.clouddynamics.io"},"children":[]}]],"source":"frontend"},{"timestamp":1758473410620,"isoTimestamp":"2025-09-21T16:50:10.620Z","level":"log","message":"üå≤ Rendering node: partner-1 Amazon Web Services (AWS) partner","args":["üå≤ Rendering node:","partner-1","Amazon Web Services (AWS)","partner"],"source":"frontend"},{"timestamp":1758473410620,"isoTimestamp":"2025-09-21T16:50:10.620Z","level":"log","message":"üå≤ Rendering node: partner-2 Google Cloud Platform partner","args":["üå≤ Rendering node:","partner-2","Google Cloud Platform","partner"],"source":"frontend"},{"timestamp":1758473410620,"isoTimestamp":"2025-09-21T16:50:10.620Z","level":"log","message":"üå≤ Rendering node: partner-3 Microsoft Azure partner","args":["üå≤ Rendering node:","partner-3","Microsoft Azure","partner"],"source":"frontend"},{"timestamp":1758473410620,"isoTimestamp":"2025-09-21T16:50:10.620Z","level":"log","message":"üå≤ Rendering node: partner-4 IBM Cloud partner","args":["üå≤ Rendering node:","partner-4","IBM Cloud","partner"],"source":"frontend"},{"timestamp":1758473410620,"isoTimestamp":"2025-09-21T16:50:10.620Z","level":"log","message":"üå≤ Rendering node: partner-5 Oracle Cloud partner","args":["üå≤ Rendering node:","partner-5","Oracle Cloud","partner"],"source":"frontend"},{"timestamp":1758473410620,"isoTimestamp":"2025-09-21T16:50:10.620Z","level":"log","message":"üå≤ Rendering node: partner-6 Alibaba Cloud partner","args":["üå≤ Rendering node:","partner-6","Alibaba Cloud","partner"],"source":"frontend"},{"timestamp":1758473410620,"isoTimestamp":"2025-09-21T16:50:10.620Z","level":"log","message":"üå≤ Rendering node: partner-7 DigitalOcean partner","args":["üå≤ Rendering node:","partner-7","DigitalOcean","partner"],"source":"frontend"}],"metadata":{"source":"frontend","sessionId":"unknown"}}
{"timestamp":1758473410626,"isoTimestamp":"2025-09-21T16:50:10.626Z","type":"console","operation":"CONSOLE_LOGS","entity":"frontend","count":20,"messages":[{"timestamp":1758473410621,"isoTimestamp":"2025-09-21T16:50:10.621Z","level":"log","message":"üå≤ Rendering node: partner-8 Akamai Connected Cloud (Linode) partner","args":["üå≤ Rendering node:","partner-8","Akamai Connected Cloud (Linode)","partner"],"source":"frontend"},{"timestamp":1758473410622,"isoTimestamp":"2025-09-21T16:50:10.622Z","level":"log","message":"üå≤ Rendering node: partner-9 Vultr partner","args":["üå≤ Rendering node:","partner-9","Vultr","partner"],"source":"frontend"},{"timestamp":1758473410622,"isoTimestamp":"2025-09-21T16:50:10.622Z","level":"log","message":"üå≤ Rendering node: partner-10 OVHcloud partner","args":["üå≤ Rendering node:","partner-10","OVHcloud","partner"],"source":"frontend"},{"timestamp":1758473410622,"isoTimestamp":"2025-09-21T16:50:10.622Z","level":"log","message":"üå≤ Rendering node: partner-11 Hetzner partner","args":["üå≤ Rendering node:","partner-11","Hetzner","partner"],"source":"frontend"},{"timestamp":1758473410622,"isoTimestamp":"2025-09-21T16:50:10.622Z","level":"log","message":"üå≤ Rendering node: partner-12 Equinix Metal partner","args":["üå≤ Rendering node:","partner-12","Equinix Metal","partner"],"source":"frontend"},{"timestamp":1758473410622,"isoTimestamp":"2025-09-21T16:50:10.622Z","level":"log","message":"üå≤ Rendering node: partner-13 Cloudflare partner","args":["üå≤ Rendering node:","partner-13","Cloudflare","partner"],"source":"frontend"},{"timestamp":1758473410622,"isoTimestamp":"2025-09-21T16:50:10.622Z","level":"log","message":"üå≤ Rendering node: partner-14 Contabo partner","args":["üå≤ Rendering node:","partner-14","Contabo","partner"],"source":"frontend"},{"timestamp":1758473410622,"isoTimestamp":"2025-09-21T16:50:10.622Z","level":"log","message":"üå≤ Rendering node: partner-15 Scaleway partner","args":["üå≤ Rendering node:","partner-15","Scaleway","partner"],"source":"frontend"},{"timestamp":1758473410622,"isoTimestamp":"2025-09-21T16:50:10.622Z","level":"log","message":"üå≤ Rendering node: partner-16 Dell Technologies partner","args":["üå≤ Rendering node:","partner-16","Dell Technologies","partner"],"source":"frontend"},{"timestamp":1758473410622,"isoTimestamp":"2025-09-21T16:50:10.622Z","level":"log","message":"üå≤ Rendering node: partner-17 Hewlett Packard Enterprise partner","args":["üå≤ Rendering node:","partner-17","Hewlett Packard Enterprise","partner"],"source":"frontend"},{"timestamp":1758473410622,"isoTimestamp":"2025-09-21T16:50:10.622Z","level":"log","message":"üå≤ Rendering node: partner-18 Cisco Systems partner","args":["üå≤ Rendering node:","partner-18","Cisco Systems","partner"],"source":"frontend"},{"timestamp":1758473410623,"isoTimestamp":"2025-09-21T16:50:10.623Z","level":"log","message":"üå≤ Rendering node: partner-19 Juniper Networks partner","args":["üå≤ Rendering node:","partner-19","Juniper Networks","partner"],"source":"frontend"},{"timestamp":1758473410623,"isoTimestamp":"2025-09-21T16:50:10.623Z","level":"log","message":"üå≤ Rendering node: partner-20 VMware partner","args":["üå≤ Rendering node:","partner-20","VMware","partner"],"source":"frontend"},{"timestamp":1758473410623,"isoTimestamp":"2025-09-21T16:50:10.623Z","level":"log","message":"üå≤ Rendering node: partner-21 Red Hat partner","args":["üå≤ Rendering node:","partner-21","Red Hat","partner"],"source":"frontend"},{"timestamp":1758473410623,"isoTimestamp":"2025-09-21T16:50:10.623Z","level":"log","message":"üå≤ Rendering node: partner-22 Canonical (Ubuntu) partner","args":["üå≤ Rendering node:","partner-22","Canonical (Ubuntu)","partner"],"source":"frontend"},{"timestamp":1758473410623,"isoTimestamp":"2025-09-21T16:50:10.623Z","level":"log","message":"üå≤ Rendering node: partner-23 ACME Corporation partner","args":["üå≤ Rendering node:","partner-23","ACME Corporation","partner"],"source":"frontend"},{"timestamp":1758473410623,"isoTimestamp":"2025-09-21T16:50:10.623Z","level":"log","message":"üå≤ Rendering node: partner-24 Telcobright partner","args":["üå≤ Rendering node:","partner-24","Telcobright","partner"],"source":"frontend"},{"timestamp":1758473410623,"isoTimestamp":"2025-09-21T16:50:10.623Z","level":"log","message":"üå≤ Rendering node: partner-25 Tech Solutions Inc partner","args":["üå≤ Rendering node:","partner-25","Tech Solutions Inc","partner"],"source":"frontend"},{"timestamp":1758473410623,"isoTimestamp":"2025-09-21T16:50:10.623Z","level":"log","message":"üå≤ Rendering node: partner-26 Global Systems Ltd partner","args":["üå≤ Rendering node:","partner-26","Global Systems Ltd","partner"],"source":"frontend"},{"timestamp":1758473410623,"isoTimestamp":"2025-09-21T16:50:10.623Z","level":"log","message":"üå≤ Rendering node: partner-27 Cloud Dynamics partner","args":["üå≤ Rendering node:","partner-27","Cloud Dynamics","partner"],"source":"frontend"}],"metadata":{"source":"frontend","sessionId":"unknown"}}
{"timestamp":1758473410631,"isoTimestamp":"2025-09-21T16:50:10.631Z","type":"console","operation":"CONSOLE_LOGS","entity":"frontend","count":20,"messages":[{"timestamp":1758473410625,"isoTimestamp":"2025-09-21T16:50:10.625Z","level":"log","message":"üìä renderTreeItems called with 27 nodes: [\n  {\n    \"id\": \"partner-1\",\n    \"name\": \"Amazon Web Services (AWS)\",\n    \"type\": \"partner\",\n    \"data\": {\n      \"id\": 1,\n      \"name\": \"amazon\",\n      \"displayName\": \"Amazon Web Services (AWS)\",\n      \"type\": \"cloud-provider\",\n      \"roles\": [\n        \"cloud-provider\",\n        \"vendor\"\n      ],\n      \"status\": \"ACTIVE\",\n      \"contactEmail\": \"billing@aws.amazon.com\",\n      \"website\": \"https://aws.amazon.com\"\n    },\n    \"children\": []\n  },\n  {\n    \"id\": \"partner-2\",\n    \"name\": \"Google Cloud Platform\",\n    \"type\": \"partner\",\n    \"data\": {\n      \"id\": 2,\n      \"name\": \"google\",\n      \"displayName\": \"Google Cloud Platform\",\n      \"type\": \"cloud-provider\",\n      \"roles\": [\n        \"cloud-provider\",\n        \"vendor\"\n      ],\n      \"status\": \"ACTIVE\",\n      \"contactEmail\": \"billing@cloud.google.com\",\n      \"website\": \"https://cloud.google.com\"\n    },\n    \"children\": []\n  },\n  {\n    \"id\": \"partner-3\",\n    \"name\": \"Microsoft Azure\",\n    \"type\": \"partner\",\n    \"data\": {\n      \"id\": 3,\n      \"name\": \"microsoft\",\n      \"displayName\": \"Microsoft Azure\",\n      \"type\": \"cloud-provider\",\n      \"roles\": [\n        \"cloud-provider\",\n        \"vendor\"\n      ],\n      \"status\": \"ACTIVE\",\n      \"contactEmail\": \"billing@azure.microsoft.com\",\n      \"website\": \"https://azure.microsoft.com\"\n    },\n    \"children\": []\n  },\n  {\n    \"id\": \"partner-4\",\n    \"name\": \"IBM Cloud\",\n    \"type\": \"partner\",\n    \"data\": {\n      \"id\": 4,\n      \"name\": \"ibm\",\n      \"displayName\": \"IBM Cloud\",\n      \"type\": \"cloud-provider\",\n      \"roles\": [\n        \"cloud-provider\",\n        \"vendor\"\n      ],\n      \"status\": \"ACTIVE\",\n      \"contactEmail\": \"billing@ibm.com\",\n      \"website\": \"https://www.ibm.com/cloud\"\n    },\n    \"children\": []\n  },\n  {\n    \"id\": \"partner-5\",\n    \"name\": \"Oracle Cloud\",\n    \"type\": \"partner\",\n    \"data\": {\n      \"id\": 5,\n      \"name\": \"oracle\",\n      \"displayName\": \"Oracle Cloud\",\n      \"type\": \"cloud-provider\",\n      \"roles\": [\n        \"cloud-provider\",\n        \"vendor\"\n      ],\n      \"status\": \"ACTIVE\",\n      \"contactEmail\": \"billing@oracle.com\",\n      \"website\": \"https://www.oracle.com/cloud\"\n    },\n    \"children\": []\n  },\n  {\n    \"id\": \"partner-6\",\n    \"name\": \"Alibaba Cloud\",\n    \"type\": \"partner\",\n    \"data\": {\n      \"id\": 6,\n      \"name\": \"alibaba\",\n      \"displayName\": \"Alibaba Cloud\",\n      \"type\": \"cloud-provider\",\n      \"roles\": [\n        \"cloud-provider\",\n        \"vendor\"\n      ],\n      \"status\": \"ACTIVE\",\n      \"contactEmail\": \"billing@alibabacloud.com\",\n      \"website\": \"https://www.alibabacloud.com\"\n    },\n    \"children\": []\n  },\n  {\n    \"id\": \"partner-7\",\n    \"name\": \"DigitalOcean\",\n    \"type\": \"partner\",\n    \"data\": {\n      \"id\": 7,\n      \"name\": \"digitalocean\",\n      \"displayName\": \"DigitalOcean\",\n      \"type\": \"cloud-provider\",\n      \"roles\": [\n        \"cloud-provider\",\n        \"vendor\"\n      ],\n      \"status\": \"ACTIVE\",\n      \"contactEmail\": \"billing@digitalocean.com\",\n      \"website\": \"https://www.digitalocean.com\"\n    },\n    \"children\": []\n  },\n  {\n    \"id\": \"partner-8\",\n    \"name\": \"Akamai Connected Cloud (Linode)\",\n    \"type\": \"partner\",\n    \"data\": {\n      \"id\": 8,\n      \"name\": \"linode\",\n      \"displayName\": \"Akamai Connected Cloud (Linode)\",\n      \"type\": \"cloud-provider\",\n      \"roles\": [\n        \"cloud-provider\",\n        \"vendor\"\n      ],\n      \"status\": \"ACTIVE\",\n      \"contactEmail\": \"billing@linode.com\",\n      \"website\": \"https://www.linode.com\"\n    },\n    \"children\": []\n  },\n  {\n    \"id\": \"partner-9\",\n    \"name\": \"Vultr\",\n    \"type\": \"partner\",\n    \"data\": {\n      \"id\": 9,\n      \"name\": \"vultr\",\n      \"displayName\": \"Vultr\",\n      \"type\": \"cloud-provider\",\n      \"roles\": [\n        \"cloud-provider\",\n        \"vendor\"\n      ],\n      \"status\": \"ACTIVE\",\n      \"contactEmail\": \"billing@vultr.com\",\n      \"website\": \"https://www.vultr.com\"\n    },\n    \"children\": []\n  },\n  {\n    \"id\": \"partner-10\",\n    \"name\": \"OVHcloud\",\n    \"type\": \"partner\",\n    \"data\": {\n      \"id\": 10,\n      \"name\": \"ovhcloud\",\n      \"displayName\": \"OVHcloud\",\n      \"type\": \"cloud-provider\",\n      \"roles\": [\n        \"cloud-provider\",\n        \"vendor\"\n      ],\n      \"status\": \"ACTIVE\",\n      \"contactEmail\": \"billing@ovhcloud.com\",\n      \"website\": \"https://www.ovhcloud.com\"\n    },\n    \"children\": []\n  },\n  {\n    \"id\": \"partner-11\",\n    \"name\": \"Hetzner\",\n    \"type\": \"partner\",\n    \"data\": {\n      \"id\": 11,\n      \"name\": \"hetzner\",\n      \"displayName\": \"Hetzner\",\n      \"type\": \"cloud-provider\",\n      \"roles\": [\n        \"cloud-provider\",\n        \"vendor\"\n      ],\n      \"status\": \"ACTIVE\",\n      \"contactEmail\": \"billing@hetzner.com\",\n      \"website\": \"https://www.hetzner.com\"\n    },\n    \"children\": []\n  },\n  {\n    \"id\": \"partner-12\",\n    \"name\": \"Equinix Metal\",\n    \"type\": \"partner\",\n    \"data\": {\n      \"id\": 12,\n      \"name\": \"equinix\",\n      \"displayName\": \"Equinix Metal\",\n      \"type\": \"cloud-provider\",\n      \"roles\": [\n        \"cloud-provider\",\n        \"vendor\"\n      ],\n      \"status\": \"ACTIVE\",\n      \"contactEmail\": \"billing@equinix.com\",\n      \"website\": \"https://metal.equinix.com\"\n    },\n    \"children\": []\n  },\n  {\n    \"id\": \"partner-13\",\n    \"name\": \"Cloudflare\",\n    \"type\": \"partner\",\n    \"data\": {\n      \"id\": 13,\n      \"name\": \"cloudflare\",\n      \"displayName\": \"Cloudflare\",\n      \"type\": \"cloud-provider\",\n      \"roles\": [\n        \"cloud-provider\",\n        \"vendor\"\n      ],\n      \"status\": \"ACTIVE\",\n      \"contactEmail\": \"billing@cloudflare.com\",\n      \"website\": \"https://www.cloudflare.com\"\n    },\n    \"children\": []\n  },\n  {\n    \"id\": \"partner-14\",\n    \"name\": \"Contabo\",\n    \"type\": \"partner\",\n    \"data\": {\n      \"id\": 14,\n      \"name\": \"contabo\",\n      \"displayName\": \"Contabo\",\n      \"type\": \"cloud-provider\",\n      \"roles\": [\n        \"cloud-provider\",\n        \"vendor\"\n      ],\n      \"status\": \"ACTIVE\",\n      \"contactEmail\": \"billing@contabo.com\",\n      \"website\": \"https://contabo.com\"\n    },\n    \"children\": []\n  },\n  {\n    \"id\": \"partner-15\",\n    \"name\": \"Scaleway\",\n    \"type\": \"partner\",\n    \"data\": {\n      \"id\": 15,\n      \"name\": \"scaleway\",\n      \"displayName\": \"Scaleway\",\n      \"type\": \"cloud-provider\",\n      \"roles\": [\n        \"cloud-provider\",\n        \"vendor\"\n      ],\n      \"status\": \"ACTIVE\",\n      \"contactEmail\": \"billing@scaleway.com\",\n      \"website\": \"https://www.scaleway.com\"\n    },\n    \"children\": []\n  },\n  {\n    \"id\": \"partner-16\",\n    \"name\": \"Dell Technologies\",\n    \"type\": \"partner\",\n    \"data\": {\n      \"id\": 16,\n      \"name\": \"dell\",\n      \"displayName\": \"Dell Technologies\",\n      \"type\": \"vendor\",\n      \"roles\": [\n        \"hardware-vendor\",\n        \"vendor\"\n      ],\n      \"status\": \"ACTIVE\",\n      \"contactEmail\": \"sales@dell.com\",\n      \"website\": \"https://www.dell.com\"\n    },\n    \"children\": []\n  },\n  {\n    \"id\": \"partner-17\",\n    \"name\": \"Hewlett Packard Enterprise\",\n    \"type\": \"partner\",\n    \"data\": {\n      \"id\": 17,\n      \"name\": \"hp\",\n      \"displayName\": \"Hewlett Packard Enterprise\",\n      \"type\": \"vendor\",\n      \"roles\": [\n        \"hardware-vendor\",\n        \"vendor\"\n      ],\n      \"status\": \"ACTIVE\",\n      \"contactEmail\": \"sales@hpe.com\",\n      \"website\": \"https://www.hpe.com\"\n    },\n    \"children\": []\n  },\n  {\n    \"id\": \"partner-18\",\n    \"name\": \"Cisco Systems\",\n    \"type\": \"partner\",\n    \"data\": {\n      \"id\": 18,\n      \"name\": \"cisco\",\n      \"displayName\": \"Cisco Systems\",\n      \"type\": \"vendor\",\n      \"roles\": [\n        \"network-vendor\",\n        \"vendor\"\n      ],\n      \"status\": \"ACTIVE\",\n      \"contactEmail\": \"sales@cisco.com\",\n      \"website\": \"https://www.cisco.com\"\n    },\n    \"children\": []\n  },\n  {\n    \"id\": \"partner-19\",\n    \"name\": \"Juniper Networks\",\n    \"type\": \"partner\",\n    \"data\": {\n      \"id\": 19,\n      \"name\": \"juniper\",\n      \"displayName\": \"Juniper Networks\",\n      \"type\": \"vendor\",\n      \"roles\": [\n        \"network-vendor\",\n        \"vendor\"\n      ],\n      \"status\": \"ACTIVE\",\n      \"contactEmail\": \"sales@juniper.net\",\n      \"website\": \"https://www.juniper.net\"\n    },\n    \"children\": []\n  },\n  {\n    \"id\": \"partner-20\",\n    \"name\": \"VMware\",\n    \"type\": \"partner\",\n    \"data\": {\n      \"id\": 20,\n      \"name\": \"vmware\",\n      \"displayName\": \"VMware\",\n      \"type\": \"vendor\",\n      \"roles\": [\n        \"software-vendor\",\n        \"vendor\"\n      ],\n      \"status\": \"ACTIVE\",\n      \"contactEmail\": \"sales@vmware.com\",\n      \"website\": \"https://www.vmware.com\"\n    },\n    \"children\": []\n  },\n  {\n    \"id\": \"partner-21\",\n    \"name\": \"Red Hat\",\n    \"type\": \"partner\",\n    \"data\": {\n      \"id\": 21,\n      \"name\": \"redhat\",\n      \"displayName\": \"Red Hat\",\n      \"type\": \"vendor\",\n      \"roles\": [\n        \"software-vendor\",\n        \"vendor\"\n      ],\n      \"status\": \"ACTIVE\",\n      \"contactEmail\": \"sales@redhat.com\",\n      \"website\": \"https://www.redhat.com\"\n    },\n    \"children\": []\n  },\n  {\n    \"id\": \"partner-22\",\n    \"name\": \"Canonical (Ubuntu)\",\n    \"type\": \"partner\",\n    \"data\": {\n      \"id\": 22,\n      \"name\": \"canonical\",\n      \"displayName\": \"Canonical (Ubuntu)\",\n      \"type\": \"vendor\",\n      \"roles\": [\n        \"software-vendor\",\n        \"vendor\"\n      ],\n      \"status\": \"ACTIVE\",\n      \"contactEmail\": \"sales@canonical.com\",\n      \"website\": \"https://canonical.com\"\n    },\n    \"children\": []\n  },\n  {\n    \"id\": \"partner-23\",\n    \"name\": \"ACME Corporation\",\n    \"type\": \"partner\",\n    \"data\": {\n      \"id\": 23,\n      \"name\": \"acme-corp\",\n      \"displayName\": \"ACME Corporation\",\n      \"type\": \"customer\",\n      \"roles\": [\n        \"customer\"\n      ],\n      \"status\": \"ACTIVE\",\n      \"contactEmail\": \"contact@acme.com\",\n      \"website\": \"https://acme.com\"\n    },\n    \"children\": []\n  },\n  {\n    \"id\": \"partner-24\",\n    \"name\": \"Telcobright\",\n    \"type\": \"partner\",\n    \"data\": {\n      \"id\": 24,\n      \"name\": \"telcobright\",\n      \"displayName\": \"Telcobright\",\n      \"type\": \"service-provider\",\n      \"roles\": [\n        \"self\"\n      ],\n      \"status\": \"ACTIVE\",\n      \"contactEmail\": \"admin@telcobright.com\",\n      \"website\": \"https://telcobright.com\"\n    },\n    \"children\": []\n  },\n  {\n    \"id\": \"partner-25\",\n    \"name\": \"Tech Solutions Inc\",\n    \"type\": \"partner\",\n    \"data\": {\n      \"id\": 25,\n      \"name\": \"tech-solutions\",\n      \"displayName\": \"Tech Solutions Inc\",\n      \"type\": \"VENDOR\",\n      \"roles\": [\n        \"vendor\"\n      ],\n      \"status\": \"ACTIVE\",\n      \"contactEmail\": \"info@techsolutions.com\",\n      \"website\": \"https://www.techsolutions.com\"\n    },\n    \"children\": []\n  },\n  {\n    \"id\": \"partner-26\",\n    \"name\": \"Global Systems Ltd\",\n    \"type\": \"partner\",\n    \"data\": {\n      \"id\": 26,\n      \"name\": \"global-systems\",\n      \"displayName\": \"Global Systems Ltd\",\n      \"type\": \"CUSTOMER\",\n      \"roles\": [\n        \"customer\"\n      ],\n      \"status\": \"ACTIVE\",\n      \"contactEmail\": \"support@globalsystems.com\",\n      \"website\": \"https://www.globalsystems.com\"\n    },\n    \"children\": []\n  },\n  {\n    \"id\": \"partner-27\",\n    \"name\": \"Cloud Dynamics\",\n    \"type\": \"partner\",\n    \"data\": {\n      \"id\": 27,\n      \"name\": \"cloud-dynamics\",\n      \"displayName\": \"Cloud Dynamics\",\n      \"type\": \"VENDOR\",\n      \"roles\": [\n        \"vendor\"\n      ],\n      \"status\": \"ACTIVE\",\n      \"contactEmail\": \"hello@clouddynamics.io\",\n      \"website\": \"https://www.clouddynamics.io\"\n    },\n    \"children\": []\n  }\n]","args":["üìä renderTreeItems called with",27,"nodes:",[{"id":"partner-1","name":"Amazon Web Services (AWS)","type":"partner","data":{"id":1,"name":"amazon","displayName":"Amazon Web Services (AWS)","type":"cloud-provider","roles":["cloud-provider","vendor"],"status":"ACTIVE","contactEmail":"billing@aws.amazon.com","website":"https://aws.amazon.com"},"children":[]},{"id":"partner-2","name":"Google Cloud Platform","type":"partner","data":{"id":2,"name":"google","displayName":"Google Cloud Platform","type":"cloud-provider","roles":["cloud-provider","vendor"],"status":"ACTIVE","contactEmail":"billing@cloud.google.com","website":"https://cloud.google.com"},"children":[]},{"id":"partner-3","name":"Microsoft Azure","type":"partner","data":{"id":3,"name":"microsoft","displayName":"Microsoft Azure","type":"cloud-provider","roles":["cloud-provider","vendor"],"status":"ACTIVE","contactEmail":"billing@azure.microsoft.com","website":"https://azure.microsoft.com"},"children":[]},{"id":"partner-4","name":"IBM Cloud","type":"partner","data":{"id":4,"name":"ibm","displayName":"IBM Cloud","type":"cloud-provider","roles":["cloud-provider","vendor"],"status":"ACTIVE","contactEmail":"billing@ibm.com","website":"https://www.ibm.com/cloud"},"children":[]},{"id":"partner-5","name":"Oracle Cloud","type":"partner","data":{"id":5,"name":"oracle","displayName":"Oracle Cloud","type":"cloud-provider","roles":["cloud-provider","vendor"],"status":"ACTIVE","contactEmail":"billing@oracle.com","website":"https://www.oracle.com/cloud"},"children":[]},{"id":"partner-6","name":"Alibaba Cloud","type":"partner","data":{"id":6,"name":"alibaba","displayName":"Alibaba Cloud","type":"cloud-provider","roles":["cloud-provider","vendor"],"status":"ACTIVE","contactEmail":"billing@alibabacloud.com","website":"https://www.alibabacloud.com"},"children":[]},{"id":"partner-7","name":"DigitalOcean","type":"partner","data":{"id":7,"name":"digitalocean","displayName":"DigitalOcean","type":"cloud-provider","roles":["cloud-provider","vendor"],"status":"ACTIVE","contactEmail":"billing@digitalocean.com","website":"https://www.digitalocean.com"},"children":[]},{"id":"partner-8","name":"Akamai Connected Cloud (Linode)","type":"partner","data":{"id":8,"name":"linode","displayName":"Akamai Connected Cloud (Linode)","type":"cloud-provider","roles":["cloud-provider","vendor"],"status":"ACTIVE","contactEmail":"billing@linode.com","website":"https://www.linode.com"},"children":[]},{"id":"partner-9","name":"Vultr","type":"partner","data":{"id":9,"name":"vultr","displayName":"Vultr","type":"cloud-provider","roles":["cloud-provider","vendor"],"status":"ACTIVE","contactEmail":"billing@vultr.com","website":"https://www.vultr.com"},"children":[]},{"id":"partner-10","name":"OVHcloud","type":"partner","data":{"id":10,"name":"ovhcloud","displayName":"OVHcloud","type":"cloud-provider","roles":["cloud-provider","vendor"],"status":"ACTIVE","contactEmail":"billing@ovhcloud.com","website":"https://www.ovhcloud.com"},"children":[]},{"id":"partner-11","name":"Hetzner","type":"partner","data":{"id":11,"name":"hetzner","displayName":"Hetzner","type":"cloud-provider","roles":["cloud-provider","vendor"],"status":"ACTIVE","contactEmail":"billing@hetzner.com","website":"https://www.hetzner.com"},"children":[]},{"id":"partner-12","name":"Equinix Metal","type":"partner","data":{"id":12,"name":"equinix","displayName":"Equinix Metal","type":"cloud-provider","roles":["cloud-provider","vendor"],"status":"ACTIVE","contactEmail":"billing@equinix.com","website":"https://metal.equinix.com"},"children":[]},{"id":"partner-13","name":"Cloudflare","type":"partner","data":{"id":13,"name":"cloudflare","displayName":"Cloudflare","type":"cloud-provider","roles":["cloud-provider","vendor"],"status":"ACTIVE","contactEmail":"billing@cloudflare.com","website":"https://www.cloudflare.com"},"children":[]},{"id":"partner-14","name":"Contabo","type":"partner","data":{"id":14,"name":"contabo","displayName":"Contabo","type":"cloud-provider","roles":["cloud-provider","vendor"],"status":"ACTIVE","contactEmail":"billing@contabo.com","website":"https://contabo.com"},"children":[]},{"id":"partner-15","name":"Scaleway","type":"partner","data":{"id":15,"name":"scaleway","displayName":"Scaleway","type":"cloud-provider","roles":["cloud-provider","vendor"],"status":"ACTIVE","contactEmail":"billing@scaleway.com","website":"https://www.scaleway.com"},"children":[]},{"id":"partner-16","name":"Dell Technologies","type":"partner","data":{"id":16,"name":"dell","displayName":"Dell Technologies","type":"vendor","roles":["hardware-vendor","vendor"],"status":"ACTIVE","contactEmail":"sales@dell.com","website":"https://www.dell.com"},"children":[]},{"id":"partner-17","name":"Hewlett Packard Enterprise","type":"partner","data":{"id":17,"name":"hp","displayName":"Hewlett Packard Enterprise","type":"vendor","roles":["hardware-vendor","vendor"],"status":"ACTIVE","contactEmail":"sales@hpe.com","website":"https://www.hpe.com"},"children":[]},{"id":"partner-18","name":"Cisco Systems","type":"partner","data":{"id":18,"name":"cisco","displayName":"Cisco Systems","type":"vendor","roles":["network-vendor","vendor"],"status":"ACTIVE","contactEmail":"sales@cisco.com","website":"https://www.cisco.com"},"children":[]},{"id":"partner-19","name":"Juniper Networks","type":"partner","data":{"id":19,"name":"juniper","displayName":"Juniper Networks","type":"vendor","roles":["network-vendor","vendor"],"status":"ACTIVE","contactEmail":"sales@juniper.net","website":"https://www.juniper.net"},"children":[]},{"id":"partner-20","name":"VMware","type":"partner","data":{"id":20,"name":"vmware","displayName":"VMware","type":"vendor","roles":["software-vendor","vendor"],"status":"ACTIVE","contactEmail":"sales@vmware.com","website":"https://www.vmware.com"},"children":[]},{"id":"partner-21","name":"Red Hat","type":"partner","data":{"id":21,"name":"redhat","displayName":"Red Hat","type":"vendor","roles":["software-vendor","vendor"],"status":"ACTIVE","contactEmail":"sales@redhat.com","website":"https://www.redhat.com"},"children":[]},{"id":"partner-22","name":"Canonical (Ubuntu)","type":"partner","data":{"id":22,"name":"canonical","displayName":"Canonical (Ubuntu)","type":"vendor","roles":["software-vendor","vendor"],"status":"ACTIVE","contactEmail":"sales@canonical.com","website":"https://canonical.com"},"children":[]},{"id":"partner-23","name":"ACME Corporation","type":"partner","data":{"id":23,"name":"acme-corp","displayName":"ACME Corporation","type":"customer","roles":["customer"],"status":"ACTIVE","contactEmail":"contact@acme.com","website":"https://acme.com"},"children":[]},{"id":"partner-24","name":"Telcobright","type":"partner","data":{"id":24,"name":"telcobright","displayName":"Telcobright","type":"service-provider","roles":["self"],"status":"ACTIVE","contactEmail":"admin@telcobright.com","website":"https://telcobright.com"},"children":[]},{"id":"partner-25","name":"Tech Solutions Inc","type":"partner","data":{"id":25,"name":"tech-solutions","displayName":"Tech Solutions Inc","type":"VENDOR","roles":["vendor"],"status":"ACTIVE","contactEmail":"info@techsolutions.com","website":"https://www.techsolutions.com"},"children":[]},{"id":"partner-26","name":"Global Systems Ltd","type":"partner","data":{"id":26,"name":"global-systems","displayName":"Global Systems Ltd","type":"CUSTOMER","roles":["customer"],"status":"ACTIVE","contactEmail":"support@globalsystems.com","website":"https://www.globalsystems.com"},"children":[]},{"id":"partner-27","name":"Cloud Dynamics","type":"partner","data":{"id":27,"name":"cloud-dynamics","displayName":"Cloud Dynamics","type":"VENDOR","roles":["vendor"],"status":"ACTIVE","contactEmail":"hello@clouddynamics.io","website":"https://www.clouddynamics.io"},"children":[]}]],"source":"frontend"},{"timestamp":1758473410626,"isoTimestamp":"2025-09-21T16:50:10.626Z","level":"log","message":"üå≤ Rendering node: partner-1 Amazon Web Services (AWS) partner","args":["üå≤ Rendering node:","partner-1","Amazon Web Services (AWS)","partner"],"source":"frontend"},{"timestamp":1758473410626,"isoTimestamp":"2025-09-21T16:50:10.626Z","level":"log","message":"üå≤ Rendering node: partner-2 Google Cloud Platform partner","args":["üå≤ Rendering node:","partner-2","Google Cloud Platform","partner"],"source":"frontend"},{"timestamp":1758473410626,"isoTimestamp":"2025-09-21T16:50:10.626Z","level":"log","message":"üå≤ Rendering node: partner-3 Microsoft Azure partner","args":["üå≤ Rendering node:","partner-3","Microsoft Azure","partner"],"source":"frontend"},{"timestamp":1758473410626,"isoTimestamp":"2025-09-21T16:50:10.626Z","level":"log","message":"üå≤ Rendering node: partner-4 IBM Cloud partner","args":["üå≤ Rendering node:","partner-4","IBM Cloud","partner"],"source":"frontend"},{"timestamp":1758473410626,"isoTimestamp":"2025-09-21T16:50:10.626Z","level":"log","message":"üå≤ Rendering node: partner-5 Oracle Cloud partner","args":["üå≤ Rendering node:","partner-5","Oracle Cloud","partner"],"source":"frontend"},{"timestamp":1758473410626,"isoTimestamp":"2025-09-21T16:50:10.626Z","level":"log","message":"üå≤ Rendering node: partner-6 Alibaba Cloud partner","args":["üå≤ Rendering node:","partner-6","Alibaba Cloud","partner"],"source":"frontend"},{"timestamp":1758473410626,"isoTimestamp":"2025-09-21T16:50:10.626Z","level":"log","message":"üå≤ Rendering node: partner-7 DigitalOcean partner","args":["üå≤ Rendering node:","partner-7","DigitalOcean","partner"],"source":"frontend"},{"timestamp":1758473410626,"isoTimestamp":"2025-09-21T16:50:10.626Z","level":"log","message":"üå≤ Rendering node: partner-8 Akamai Connected Cloud (Linode) partner","args":["üå≤ Rendering node:","partner-8","Akamai Connected Cloud (Linode)","partner"],"source":"frontend"},{"timestamp":1758473410627,"isoTimestamp":"2025-09-21T16:50:10.627Z","level":"log","message":"üå≤ Rendering node: partner-9 Vultr partner","args":["üå≤ Rendering node:","partner-9","Vultr","partner"],"source":"frontend"},{"timestamp":1758473410627,"isoTimestamp":"2025-09-21T16:50:10.627Z","level":"log","message":"üå≤ Rendering node: partner-10 OVHcloud partner","args":["üå≤ Rendering node:","partner-10","OVHcloud","partner"],"source":"frontend"},{"timestamp":1758473410627,"isoTimestamp":"2025-09-21T16:50:10.627Z","level":"log","message":"üå≤ Rendering node: partner-11 Hetzner partner","args":["üå≤ Rendering node:","partner-11","Hetzner","partner"],"source":"frontend"},{"timestamp":1758473410627,"isoTimestamp":"2025-09-21T16:50:10.627Z","level":"log","message":"üå≤ Rendering node: partner-12 Equinix Metal partner","args":["üå≤ Rendering node:","partner-12","Equinix Metal","partner"],"source":"frontend"},{"timestamp":1758473410627,"isoTimestamp":"2025-09-21T16:50:10.627Z","level":"log","message":"üå≤ Rendering node: partner-13 Cloudflare partner","args":["üå≤ Rendering node:","partner-13","Cloudflare","partner"],"source":"frontend"},{"timestamp":1758473410627,"isoTimestamp":"2025-09-21T16:50:10.627Z","level":"log","message":"üå≤ Rendering node: partner-14 Contabo partner","args":["üå≤ Rendering node:","partner-14","Contabo","partner"],"source":"frontend"},{"timestamp":1758473410627,"isoTimestamp":"2025-09-21T16:50:10.627Z","level":"log","message":"üå≤ Rendering node: partner-15 Scaleway partner","args":["üå≤ Rendering node:","partner-15","Scaleway","partner"],"source":"frontend"},{"timestamp":1758473410627,"isoTimestamp":"2025-09-21T16:50:10.627Z","level":"log","message":"üå≤ Rendering node: partner-16 Dell Technologies partner","args":["üå≤ Rendering node:","partner-16","Dell Technologies","partner"],"source":"frontend"},{"timestamp":1758473410628,"isoTimestamp":"2025-09-21T16:50:10.628Z","level":"log","message":"üå≤ Rendering node: partner-17 Hewlett Packard Enterprise partner","args":["üå≤ Rendering node:","partner-17","Hewlett Packard Enterprise","partner"],"source":"frontend"},{"timestamp":1758473410628,"isoTimestamp":"2025-09-21T16:50:10.628Z","level":"log","message":"üå≤ Rendering node: partner-18 Cisco Systems partner","args":["üå≤ Rendering node:","partner-18","Cisco Systems","partner"],"source":"frontend"},{"timestamp":1758473410628,"isoTimestamp":"2025-09-21T16:50:10.628Z","level":"log","message":"üå≤ Rendering node: partner-19 Juniper Networks partner","args":["üå≤ Rendering node:","partner-19","Juniper Networks","partner"],"source":"frontend"}],"metadata":{"source":"frontend","sessionId":"unknown"}}
